district_label_post,report_year,title,fund_source,award_date,start_date,completion_date,,,district_label_post_agg,award_date_txt,start_date_txt,completion_date_txt
Abura/Asebu/Kwamankese District Assembly,2010,,,,,,,,Abura/Asebu/Kwamankese District Assembly,,,
Accra Metropolitan Assembly,2010,,,,,,,,Accra Metropolitan Assembly,,,
Adaklu-Anyigbe District Assembly,2010,,,,,,,,Adaklu-Anyigbe District Assembly,,,
Adansi North District Assembly,2010,,,,,,,,Adansi North District Assembly,,,
Adansi South District Assembly,2010,,,,,,,,Adansi South District Assembly,,,
Adenta Municipal Assembly,2010,,,,,,,,Adenta Municipal Assembly,,,
Afigya-Kwabre District Assembly,2010,,,,,,,,Afigya-Kwabre District Assembly,,,
Agona East District Assembly,2010,,,,,,,,Agona East District Assembly,,,
Agona West Municipal Assembly,2010,,,,,,,,Agona West Municipal Assembly,,,
Ahafo Ano North District Assembly,2010,,,,,,,,Ahafo Ano North District Assembly,,,
Ahafo Ano South District Assembly,2010,,,,,,,,Ahafo Ano South District Assembly,,,
Ahanta West District Assembly,2010,,,,,,,,Ahanta West District Assembly,,,
Ajumako/Enyan/Essiam District Assembly,2010,,,,,,,,Ajumako/Enyan/Essiam District Assembly,,,
Akatsi District Assembly,2010,,,,,,,,Akatsi District Assembly,,,
Akuapim North Municipal Assembly,2010,,,,,,,,Akuapim North Municipal Assembly,,,
Akuapim South Municipal Assembly,2010,,,,,,,,Akuapim South Municipal Assembly,,,
Akyemansa District Assembly,2010,,,,,,,,Akyemansa District Assembly,,,
Amansie Central District Assembly,2010,,,,,,,,Amansie Central District Assembly,,,
Amansie West District Assembly,2010,,,,,,,,Amansie West District Assembly,,,
Amenfi West District Assembly,2010,,,,,,,,Amenfi West District Assembly,,,
Aowin/Suaman District Assembly,2010,,,,,,,,Aowin/Suaman District Assembly,,,
Asante Akim North Municipal Assembly,2010,,,,,,,,Asante Akim North Municipal Assembly,,,
Asante Akim South District Assembly,2010,,,,,,,,Asante Akim South District Assembly,,,
Ashaiman Municipal Assembly,2010,,,,,,,,Ashaiman Municipal Assembly,,,
Asikuma/Odoben/Brakwa District Assembly,2010,,,,,,,,Asikuma/Odoben/Brakwa District Assembly,,,
Assin North Municipal Assembly,2010,,,,,,,,Assin North Municipal Assembly,,,
Assin South District Assembly,2010,,,,,,,,Assin South District Assembly,,,
Asunafo North Municipal Assembly,2010,,,,,,,,Asunafo North Municipal Assembly,,,
Asunafo South District Assembly,2010,,,,,,,,Asunafo South District Assembly,,,
Asunafo South District Assembly,2010,,,,,,,,Asunafo South District Assembly,,,
Asuogyaman District Assembly,2010,,,,,,,,Asuogyaman District Assembly,,,
Asutifi North District Assembly,2010,,,,,,,,Asutifi North District Assembly,,,
Atebubu-Amantin District Assembly,2010,,,,,,,,Atebubu-Amantin District Assembly,,,
Atiwa District Assembly,2010,,,,,,,,Atiwa District Assembly,,,
Atwima Kwanwoma District Assembly,2010,,,,,,,,Atwima Kwanwoma District Assembly,,,
Atwima Mponua District Assembly,2010,,,,,,,,Atwima Mponua District Assembly,,,
Atwima Nwabiagya District Assembly,2010,,,,,,,,Atwima Nwabiagya District Assembly,,,
Awutu Senya District Assembly,2010,,,,,,,,Awutu Senya District Assembly,,,
Bawku Municipal Assembly,2010,,,,,,,,Bawku Municipal Assembly,,,
Bawku West District Assembly,2010,,,,,,,,Bawku West District Assembly,,,
Bekwai Municipal Assembly,2010,,,,,,,,Bekwai Municipal Assembly,,,
Berekum Municipal Assembly,2010,,,,,,,,Berekum Municipal Assembly,,,
Bia District Assembly,2010,,,,,,,,Bia District Assembly,,,
Biakoye District Assembly,2010,,,,,,,,Biakoye District Assembly,,,
Bibiani/Ahwiaso/Bekwai District Assembly,2010,,,,,,,,Bibiani/Ahwiaso/Bekwai District Assembly,,,
Birim Central Municipal Assembly,2010,,,,,,,,Birim Central Municipal Assembly,,,
Birim North District Assembly,2010,,,,,,,,Birim North District Assembly,,,
Birim South District Assembly,2010,,,,,,,,Birim South District Assembly,,,
Bole District Assembly,2010,,,,,,,,Bole District Assembly,,,
Bolgatanga Municipal Assembly,2010,,,,,,,,Bolgatanga Municipal Assembly,,,
Bongo District Assembly,2010,,,,,,,,Bongo District Assembly,,,
Bosome Freho District Assembly,2010,,,,,,,,Bosome Freho District Assembly,,,
Bosomtwe District Assembly,2010,,,,,,,,Bosomtwe District Assembly,,,
Builsa District Assembly,2010,,,,,,,,Builsa District Assembly,,,
Bunkprugu-Yunyoo District Assembly,2010,,,,,,,,Bunkprugu-Yunyoo District Assembly,,,
Cape Coast Metropolitan Assembly,2010,,,,,,,,Cape Coast Metropolitan Assembly,,,
Central Gonja District Assembly,2010,,,,,,,,Central Gonja District Assembly,,,
Chereponi District Assembly,2010,,,,,,,,Chereponi District Assembly,,,
Dangme East District Assembly,2010,,,,,,,,Dangme East District Assembly,,,
Dangme West District Assembly,2010,,,,,,,,Dangme West District Assembly,,,
Dangme West District Assembly,2010,,,,,,,,Dangme West District Assembly,,,
Dormaa East District Assembly,2010,,,,,,,,Dormaa East District Assembly,,,
Dormaa Municipal Assembly,2010,,,,,,,,Dormaa Municipal Assembly,,,
East Akim Municipal Assembly,2010,,,,,,,,East Akim Municipal Assembly,,,
East Gonja District Assembly,2010,,,,,,,,East Gonja District Assembly,,,
East Mamprusi District Assembly,2010,,,,,,,,East Mamprusi District Assembly,,,
Effutu Municipal Assembly,2010,,,,,,,,Effutu Municipal Assembly,,,
Ejisu Juaben  Municipal Assembly,2010,,,,,,,,Ejisu Juaben  Municipal Assembly,,,
Ejura Sekyedumase Municipal Assembly,2010,,,,,,,,Ejura Sekyedumase Municipal Assembly,,,
Ellembele District Assembly,2010,,,,,,,,Ellembele District Assembly,,,
Fanteakwa District Assembly,2010,,,,,,,,Fanteakwa District Assembly,,,
Ga East Municipal Assembly,2010,,,,,,,,Ga East Municipal Assembly,,,
Ga South Municipal Assembly,2010,,,,,,,,Ga South Municipal Assembly,,,
Ga West Municipal Assembly,2010,,,,,,,,Ga West Municipal Assembly,,,
Garu-Tempane District Assembly,2010,,,,,,,,Garu-Tempane District Assembly,,,
Gomoa East District Assembly,2010,,,,,,,,Gomoa East District Assembly,,,
Gomoa West District Assembly,2010,,,,,,,,Gomoa West District Assembly,,,
Gushegu District Assembly,2010,,,,,,,,Gushegu District Assembly,,,
Ho Municipal Assembly,2010,,,,,,,,Ho Municipal Assembly,,,
Hohoe Municipal Assembly,2010,,,,,,,,Hohoe Municipal Assembly,,,
Jaman North District Assembly,2010,,,,,,,,Jaman North District Assembly,,,
Jaman South District Assembly,2010,,,,,,,,Jaman South District Assembly,,,
Jasikan District Assembly,2010,,,,,,,,Jasikan District Assembly,,,
Jirapa District Assembly,2010,,,,,,,,Jirapa District Assembly,,,
Jomoro District Assembly,2010,,,,,,,,Jomoro District Assembly,,,
Juaboso District Assembly,2010,,,,,,,,Juaboso District Assembly,,,
Kadjebi District Assembly,2010,,,,,,,,Kadjebi District Assembly,,,
Karaga District Assembly,2010,,,,,,,,Karaga District Assembly,,,
Kassena Nankana East Municipal Assembly,2010,,,,,,,,Kassena Nankana East Municipal Assembly,,,
Kassena Nankana West District Assembly,2010,,,,,,,,Kassena Nankana West District Assembly,,,
Keta Municipal Assembly,2010,,,,,,,,Keta Municipal Assembly,,,
Ketu North District Assembly,2010,,,,,,,,Ketu North District Assembly,,,
Ketu South Municipal Assembly,2010,,,,,,,,Ketu South Municipal Assembly,,,
Kintampo North Municipal Assembly,2010,,,,,,,,Kintampo North Municipal Assembly,,,
Kintampo South District Assembly,2010,,,,,,,,Kintampo South District Assembly,,,
Komenda/Edina/Eguafo/ Abirem Municipal Assembly,2010,,,,,,,,Komenda/Edina/Eguafo/ Abirem Municipal Assembly,,,
Kpandai District Assembly,2010,,,,,,,,Kpandai District Assembly,,,
Kpando Municipal Assembly,2010,,,,,,,,Kpando Municipal Assembly,,,
Krachi East District Assembly,2010,,,,,,,,Krachi East District Assembly,,,
Krachi West District Assembly,2010,,,,,,,,Krachi West District Assembly,,,
Kumasi Metropolitan Assembly,2010,,,,,,,,Kumasi Metropolitan Assembly,,,
Kwabre East District Assembly,2010,,,,,,,,Kwabre East District Assembly,,,
Kwaebibirem District Assembly,2010,,,,,,,,Kwaebibirem District Assembly,,,
Kwahu East District Assembly,2010,,,,,,,,Kwahu East District Assembly,,,
Kwahu North District Assembly,2010,,,,,,,,Kwahu North District Assembly,,,
Kwahu South District Assembly,2010,,,,,,,,Kwahu South District Assembly,,,
Kwahu West Municipal Assembly,2010,,,,,,,,Kwahu West Municipal Assembly,,,
Lambussie Karni  District Assembly,2010,,,,,,,,Lambussie Karni  District Assembly,,,
Lawra  District Assembly,2010,,,,,,,,Lawra  District Assembly,,,
Ledzekuku-Krowor Municipal Assembly,2010,,,,,,,,Ledzekuku-Krowor Municipal Assembly,,,
Lower Manya Krobo Municipal Assembly,2010,,,,,,,,Lower Manya Krobo Municipal Assembly,,,
Mampong  Municipal Assembly,2010,,,,,,,,Mampong  Municipal Assembly,,,
Mfantsiman Municipal Assembly,2010,,,,,,,,Mfantsiman Municipal Assembly,,,
Mpohor Wassa District Assembly,2010,,,,,,,,Mpohor Wassa District Assembly,,,
Nadowli  District Assembly,2010,,,,,,,,Nadowli  District Assembly,,,
Nanumba North District Assembly,2010,,,,,,,,Nanumba North District Assembly,,,
Nanumba South District Assembly,2010,,,,,,,,Nanumba South District Assembly,,,
New Juaben Municipal Assembly,2010,,,,,,,,New Juaben Municipal Assembly,,,
Nkoranza North District Assembly,2010,,,,,,,,Nkoranza North District Assembly,,,
Nkoranza South District Assembly,2010,,,,,,,,Nkoranza South District Assembly,,,
Nkwanta North District Assembly,2010,,,,,,,,Nkwanta North District Assembly,,,
Nkwanta South District Assembly,2010,,,,,,,,Nkwanta South District Assembly,,,
North Tongu District Assembly,2010,,,,,,,,North Tongu District Assembly,,,
Nzema East Municipal Assembly,2010,,,,,,,,Nzema East Municipal Assembly,,,
Obuasi  Municipal Assembly,2010,,,,,,,,Obuasi  Municipal Assembly,,,
Offinso  Municipal Assembly,2010,,,,,,,,Offinso  Municipal Assembly,,,
Offinso North District Assembly,2010,,,,,,,,Offinso North District Assembly,,,
Prestea-Huni Valley District Assembly,2010,,,,,,,,Prestea-Huni Valley District Assembly,,,
Pru District Assembly,2010,,,,,,,,Pru District Assembly,,,
Saboba District Assembly,2010,,,,,,,,Saboba District Assembly,,,
Savelugu-Nanton Municipal Assembly,2010,,,,,,,,Savelugu-Nanton Municipal Assembly,,,
Sawla-Tuna-Kalba District Assembly,2010,,,,,,,,Sawla-Tuna-Kalba District Assembly,,,
Sefwi-Wiawso District Assembly,2010,,,,,,,,Sefwi-Wiawso District Assembly,,,
Sefwi Akontombra District Assembly,2010,,,,,,,,Sefwi Akontombra District Assembly,,,
Sekondi-Takoradi Metropolitan Assembly,2010,,,,,,,,Sekondi-Takoradi Metropolitan Assembly,,,
Sekyere Afram Plains District Assembly,2010,,,,,,,,Sekyere Afram Plains District Assembly,,,
Sekyere Central District Assembly,2010,,,,,,,,Sekyere Central District Assembly,,,
Sekyere East District Assembly,2010,,,,,,,,Sekyere East District Assembly,,,
Sekyere South District Assembly,2010,,,,,,,,Sekyere South District Assembly,,,
Sene District Assembly,2010,,,,,,,,Sene District Assembly,,,
Shama District Assembly,2010,,,,,,,,Shama District Assembly,,,
Sissala East  District Assembly,2010,,,,,,,,Sissala East  District Assembly,,,
Sissala West  District Assembly,2010,,,,,,,,Sissala West  District Assembly,,,
South Dayi District Assembly,2010,,,,,,,,South Dayi District Assembly,,,
South Tongu District Assembly,2010,,,,,,,,South Tongu District Assembly,,,
Suhum-Kraboa-Coaltar Municipal Assembly,2010,,,,,,,,Suhum-Kraboa-Coaltar Municipal Assembly,,,
Sunyani Municipal Assembly,2010,,,,,,,,Sunyani Municipal Assembly,,,
Sunyani West District Assembly,2010,,,,,,,,Sunyani West District Assembly,,,
Tain District Assembly,2010,,,,,,,,Tain District Assembly,,,
Talensi-Nabdam District Assembly,2010,,,,,,,,Talensi-Nabdam District Assembly,,,
Tamale Metropolitan Assembly,2010,,,,,,,,Tamale Metropolitan Assembly,,,
Tano North District Assembly,2010,,,,,,,,Tano North District Assembly,,,
Tano South District Assembly,2010,,,,,,,,Tano South District Assembly,,,
Tarkwa Nsuaem Municipal Assembly,2010,,,,,,,,Tarkwa Nsuaem Municipal Assembly,,,
Techiman Muncipal Assembly,2010,,,,,,,,Techiman Muncipal Assembly,,,
Tema Metropolitan Assembly,2010,,,,,,,,Tema Metropolitan Assembly,,,
Tolon/Kumbungu District Assembly,2010,,,,,,,,Tolon/Kumbungu District Assembly,,,
Twifo Heman-Lower-Denkyira  District Assembly,2010,,,,,,,,Twifo Heman-Lower-Denkyira  District Assembly,,,
Upper Dekyira East Municipal Assembly,2010,,,,,,,,Upper Dekyira East Municipal Assembly,,,
Upper Dekyira East Municipal Assembly,2010,,,,,,,,Upper Dekyira East Municipal Assembly,,,
Upper Denkyira West District Assembly,2010,,,,,,,,Upper Denkyira West District Assembly,,,
Upper Manya Krobo District Assembly,2010,,,,,,,,Upper Manya Krobo District Assembly,,,
Wa East  District Assembly,2010,,,,,,,,Wa East  District Assembly,,,
Wa Municipal Assembly,2010,,,,,,,,Wa Municipal Assembly,,,
Wa West  District Assembly,2010,,,,,,,,Wa West  District Assembly,,,
Wassa Amenfi East District Assembly,2010,,,,,,,,Wassa Amenfi East District Assembly,,,
Wenchi Municipal Assembly,2010,,,,,,,,Wenchi Municipal Assembly,,,
West Akim Municipal Assembly,2010,,,,,,,,West Akim Municipal Assembly,,,
West Gonja District Assembly,2010,,,,,,,,West Gonja District Assembly,,,
West Mamprusi District Assembly,2010,,,,,,,,West Mamprusi District Assembly,,,
Yendi Municipal Assembly,2010,,,,,,,,Yendi Municipal Assembly,,,
Yilo Krobo Municipal Assembly,2010,,,,,,,,Yilo Krobo Municipal Assembly,,,
Zabzugu/Tatale District Assembly,2010,,,,,,,,Zabzugu/Tatale District Assembly,,,
Abura/Asebu/Kwamankese District Assembly,2011,,,,,,,,Abura/Asebu/Kwamankese District Assembly,,,
Accra Metropolitan Assembly,2011,"SALVATION ARMY, CONSTRUCTION OF 3-STOREY 18 UNIT CLASSROOM BLOCK FOR SALVATION COMPOUND",igf,8/27/2010,,,,,Accra Metropolitan Assembly,2010-08-27,,
Accra Metropolitan Assembly,2011,"MAMPROBI, CONSTRUCTION OF 3-STOREY 18 UNIT CLASSROOM BLOCK FOR SOCCO AT M1",igf,8/27/2010,,,,,Accra Metropolitan Assembly,2010-08-27,,
Accra Metropolitan Assembly,2011,"IT CLUSTER, MATAHEKO, 3-STOREY 28-UNIT CLASSROOM BLOCK (PHASE 1- 6 CLASSROOM BLOCK)",igf,1/21/2011,,,,,Accra Metropolitan Assembly,2011-01-21,,
Accra Metropolitan Assembly,2011,"ANUMLE BASIC, CONSTRUCTION OF 3-STOREY 12-CLASSROOM BLOCK (GROUND FLOOR OF 4-UNIT CLASSROOM)",igf,2/3/2011,,,,,Accra Metropolitan Assembly,2011-02-03,,
Accra Metropolitan Assembly,2011,"AKWEIBU BASIC SCHOOL, MATAHEKO 3-STOREY 9-UNIT CLASSROOM",igf,1/21/2011,,,,,Accra Metropolitan Assembly,2011-01-21,,
Accra Metropolitan Assembly,2011,"NANKA BRUCE, KORLE GONNO, 2-STOREY 12-UNIT CLASSROOM BLOCK",igf,1/27/2011,,,,,Accra Metropolitan Assembly,2011-01-27,,
Accra Metropolitan Assembly,2011,"CHORKOR PRESBY PRIMARY, 2-STOREY 6-UNIT CLASSROOM BLOCK (PHASE 1-3 CLASSROOM BLOCK)",igf,1/21/2011,,,,,Accra Metropolitan Assembly,2011-01-21,,
Accra Metropolitan Assembly,2011,"PRIVATE ODARTEY LAMPTEY, HIGH STREET, 3-STOREY 12-UNIT CLASSROOM BLOCK WITH ANCILLARY FACILITIES",igf,3/30/2011,,,,,Accra Metropolitan Assembly,2011-03-30,,
Accra Metropolitan Assembly,2011,"INDEPENDENCE AVENUE BASIC, MAKOLA, 3-STOREY 18-UNIT CLASSROOM BLOCK (PHASE 1-6 CLASSROOM BLOCK)",igf,1/21/2011,,,,,Accra Metropolitan Assembly,2011-01-21,,
Accra Metropolitan Assembly,2011,"PIG FARM 1&2 PRIMARY, 3-STOREY 9-UNIT CLASSROOM BLOCK",igf,1/21/2011,,,,,Accra Metropolitan Assembly,2011-01-21,,
Accra Metropolitan Assembly,2011,"ANT EXPERIMENTAL, 3-STOREY 18-UNIT CLASSROOM BLOCK WITH ANCILLARY FACILITIES",igf,3/3/2011,,,,,Accra Metropolitan Assembly,2011-03-03,,
Accra Metropolitan Assembly,2011,"ABAVANA DOWN CLUSTER, KOTOBABI, 3-STOREY 18-UNIT CLASSROOM BLOCK WITH ANCILLARY FACILITIES",igf,4/11/2011,,,,,Accra Metropolitan Assembly,2011-04-11,,
Accra Metropolitan Assembly,2011,"MAAMOBI UNITY CLUSTER, KOTOBABI, 3-STOREY 9-UNIT CLASSROOM BLOCK (PHASE 1-6 CLASSROOM BLOCK)",igf,4/21/2011,,,,,Accra Metropolitan Assembly,2011-04-21,,
Accra Metropolitan Assembly,2011,"KANDA COMMUNITY SCHOOL, 2-STOREY 12-UNIT CLASSROOM BLOCK (PHASE 1-6 CLASSROOM BLOCK)",igf,1/21/2011,,,,,Accra Metropolitan Assembly,2011-01-21,,
Accra Metropolitan Assembly,2011,"SHIAYENNOH CLUSTER OF SCHOOLS, 3-STOREY 18-CLASSROOM BLOCK WITH ANCILLARY FACILITIES",igf,3/3/2011,,,,,Accra Metropolitan Assembly,2011-03-03,,
Accra Metropolitan Assembly,2011,"LABONE PRESBY PRIMARY, LA, 3-STOREY 18-CLASSROOM BLOCK (PHASE 1-6 CLASSROOM BLOCK",igf,1/21/2011,,,,,Accra Metropolitan Assembly,2011-01-21,,
Accra Metropolitan Assembly,2011,"TENASHI PRIMARY RELOCATED LA ADIEMBRA PRESBY PRIMARY SCHOOL AT DEGAUL PARK, LA 3-STOREY 18-CLASSROOM BLOCK (PHASE 1-6 CLASSROOM BLOCK)",igf,1/27/2011,,,,,Accra Metropolitan Assembly,2011-01-27,,
Accra Metropolitan Assembly,2011,"ACHIMOTA ANGLICAN, ACHIMOTA, 2-STOREY 9-UNIT CLASSROOM BLOCK WITH ANCILLARY FACILITIES",igf,2/3/2011,,,,,Accra Metropolitan Assembly,2011-02-03,,
Accra Metropolitan Assembly,2011,"KING TACHIE CLUSTER,  FARISCO, 3-STOREY 18 CLASSROOM BLOCK (PHASE 1-2 STOREY 6 CLASSROOM BLOCK",igf,1/21/2011,,,,,Accra Metropolitan Assembly,2011-01-21,,
Accra Metropolitan Assembly,2011,"FADAMA CLUSTER OF SCHOOLS, FADAMA, 3-STOREY 9-UNIT CLASSROOM BLOCK WITH ANCILLARY FACILITY (PHASE 1,2-STOREY 6-UNIT CLASSROOM BLOCK)",igf,1/21/2011,,,,,Accra Metropolitan Assembly,2011-01-21,,
Accra Metropolitan Assembly,2011,"AYALOLO CLUSTER SCHOOLS, 3-UNIT CLASSROOM BLOCK (PHASE 1-6 CLASSROOM BLOCK)",igf,7/23/2010,,,,,Accra Metropolitan Assembly,2010-07-23,,
Accra Metropolitan Assembly,2011,CONSTRUCTION OF 3-UNIT CLASSROOM BLOCK FOR LA BAWALESHIE PRESBY,igf,11/2/2010,,,,,Accra Metropolitan Assembly,2010-11-02,,
Accra Metropolitan Assembly,2011,CONSTRUCTION OF 6-UNIT CLASSROOM BLOCK FOR DZORWULU PRIMARY B SCHOOL,igf,1/3/2010,,,,,Accra Metropolitan Assembly,2010-01-03,,
Accra Metropolitan Assembly,2011,"PROVIDE THE CHILD PANEL OFFICE WITH A LAPTOP, COMPUTER AND ACCESSORIES",igf,Jan-11,,,,,Accra Metropolitan Assembly,2011-01-01,,
Accra Metropolitan Assembly,2011,REHABILITATE 5 NO. SCHOOL IN LA SUB-METRO,igf,Apr-11,,,,,Accra Metropolitan Assembly,2011-04-01,,
Accra Metropolitan Assembly,2011,CONSTRUCT 10 EDUCATIONAL INFRASTRUCTURE,igf,Jan-11,,,,,Accra Metropolitan Assembly,2011-01-01,,
Accra Metropolitan Assembly,2011,CONSTRUCT 7 NO EDUCATIONAL FACILITIES IN ABLEKUMA NORTH SUB-METRO,igf,Jan-11,,,,,Accra Metropolitan Assembly,2011-01-01,,
Accra Metropolitan Assembly,2011,CONTINUE AND COMPLETE EDUCATIONAL FACILITIES IN ABLEKUMA CENTRAL SUB-METRO,igf,,,,,,Accra Metropolitan Assembly,,,
Accra Metropolitan Assembly,2011,REHABILITATE AND CONSTRUCT EDUCATIONAL FACILITIES,igf,Jan-11,,,,,Accra Metropolitan Assembly,2011-01-01,,
Accra Metropolitan Assembly,2011,COMPLETE 6 ELECTORAL AREA PROJECTS IN OKAIKOI NORTH SUB-METRO,igf,Jan-11,,,,,Accra Metropolitan Assembly,2011-01-01,,
Accra Metropolitan Assembly,2011,FUMIGATE OFFICE ONCE IN A YEAR,igf,May-11,,,,,Accra Metropolitan Assembly,2011-05-01,,
Accra Metropolitan Assembly,2011,REHABILITATE THE NON-FORMAL EDUCATION OFFICE,igf,Apr-11,,,,,Accra Metropolitan Assembly,2011-04-01,,
Accra Metropolitan Assembly,2011,"CONSTRUCTION OF 3-STOREY 18-UNIT CLASSROOM BLOCK WITH FACILITIES FOR SEMPE CLUSTER OF SCHOOLS AT JAMES TOWN, ACCRA",multiple,yet to be awarded,,,,,Accra Metropolitan Assembly,yet to be awarded,,
Accra Metropolitan Assembly,2011,CONSTRUCTION OF 3-STOREY 18-UNIT CLASSROOM BLOCK WITH ANCILLARY FACILITIES FOR ACHIMOTA PRIMARY SCHOOL AT ACHIMOTA,multiple,yet to be awarded,,,,,Accra Metropolitan Assembly,yet to be awarded,,
Accra Metropolitan Assembly,2011,CONSTRUCTION OF 3-STOREY 18-UNIT CLASSROOM BLOCK WITH ANCILLARY FACILITIES FOR LA WIRELESS 4 PRIMARY SCHOOLS AT LA ACCRA,multiple,yet to be awarded,,,,,Accra Metropolitan Assembly,yet to be awarded,,
Accra Metropolitan Assembly,2011,CONSTRUCTION OF 3-STOREY 18-UNIT CLASSROOM BLOCK WITH FACILITIES FOR AVENOR BASIC SCHOOL AT ACCRA,multiple,yet to be awarded,,,,,Accra Metropolitan Assembly,yet to be awarded,,
Accra Metropolitan Assembly,2011,CONSTRUCTION OF 3-STOREY 18-UNIT CLASSROOM BLOCK WITH ANCILLARY FACILITIES FOR CABLE AND WIRELESS BASIC SCHOOL AT BUBUASHIE,other gog,yet to be awarded,,,,,Accra Metropolitan Assembly,yet to be awarded,,
Accra Metropolitan Assembly,2011,"CONSTRUCTION OF 3-STOREY 18-UNIT CLASSROOM BLOCK WITH ANCILLARY FACILITIES FOR KWASHIEMAN BASIC SCHOOL AT KWASHIEMAN, ACCRA",other gog,yet to be awarded,,,,,Accra Metropolitan Assembly,yet to be awarded,,
Accra Metropolitan Assembly,2011,"CONSTRUCTION OF 2-STOREY 12-UNIT CLASSROOM BLOCK(PHASE 1:6-UNIT CLASSROOM) WITH ANCILLARY FACILITIES FOR ABEKA 3B JHS AT FADAMA CLUSTER, ACCRA",getfund,,,,,,Accra Metropolitan Assembly,,,
Accra Metropolitan Assembly,2011,"CONSTRUCTION OF 2-STOREY 12-UNIT CLASSROOM BLOCK(PHASE 1:6-UNIT CLASSROOM) WITH ANCILLARY FACILITIES FOR TESANO 2 PRIMARY AT TESANO, ACCRA",getfund,,,,,,Accra Metropolitan Assembly,,,
Accra Metropolitan Assembly,2011,"CONSTRUCTION OF 2-STOREY 12-UNIT CLASSROOM BLOCK(PHASE 1:6-UNIT CLASSROOM) WITH ANCILLARY FACILITIES FOR MAMPROBI SEMPE PRIMARY AT MAMPROBI, ACCRA",getfund,,,,,,Accra Metropolitan Assembly,,,
Accra Metropolitan Assembly,2011,CONSTRUCTION OF 2-STOREY 12-UNIT CLASSROOM BLOCK(PHASE 1:6-UNIT CLASSROOM) WITH ANCILLARY FACILITIES FOR OSU SALEM NO.1 PRIMARY,getfund,,,,,,Accra Metropolitan Assembly,,,
Accra Metropolitan Assembly,2011,"SEMPE SCHOOL TOILET, 20-SEATER WC PUBLIC TOILETS",igf,8/2/2010,,,,,Accra Metropolitan Assembly,2010-08-02,,
Accra Metropolitan Assembly,2011,"MAMPROBI SEMPE SANITARY SITE, ADJACENT TO SEMPE 1 SCHOOL, 20-SEATER WC PUBLIC TOILETS",igf,8/2/2010,,,,,Accra Metropolitan Assembly,2010-08-02,,
Accra Metropolitan Assembly,2011,"MATAHEKO, DANSOMAN TROTRO STATION, 20-SEATER WC PUBLIC TOILETS",igf,8/5/2010,,,,,Accra Metropolitan Assembly,2010-08-05,,
Accra Metropolitan Assembly,2011,"LATERBIOKORSHIE CLUSTER OF SCHOOLS, 20-SEATER WC PUBLIC TOILETS",igf,8/2/2010,,,,,Accra Metropolitan Assembly,2010-08-02,,
Accra Metropolitan Assembly,2011,"MAMPROBI SITE 15, 20-SEATER WC PUBLIC TOILETS",igf,8/2/2010,,,,,Accra Metropolitan Assembly,2010-08-02,,
Accra Metropolitan Assembly,2011,"CHORKOR (TOILET NO.2) SITE RETAINED, 20-SEATER WC PUBLIC TOILETS",igf,8/2/2010,,,,,Accra Metropolitan Assembly,2010-08-02,,
Accra Metropolitan Assembly,2011,"MAMPROBI SITE 13, 20-SEATER WC PUBLIC TOILETS",igf,8/2/2010,,,,,Accra Metropolitan Assembly,2010-08-02,,
Accra Metropolitan Assembly,2011,"SANITARY SITE OPPOSITE KORLE GONNO RC SCHOOL, 20-SEATER WC PUBLIC TOILETS",igf,8/2/2010,,,,,Accra Metropolitan Assembly,2010-08-02,,
Accra Metropolitan Assembly,2011,"SOCCO PRIMARY SCHOOL (M1), 20-SEATER WC PUBLIC TOILETS",igf,8/2/2010,,,,,Accra Metropolitan Assembly,2010-08-02,,
Accra Metropolitan Assembly,2011,"CHORKOR-ALOMO JUNCTION-CLIENT TO REPLACE SITE, 20-SEATER WC PUBLIC TOILETS",igf,8/2/2010,,,,,Accra Metropolitan Assembly,2010-08-02,,
Accra Metropolitan Assembly,2011,"SALVATION ARMY SCHOOL, 20-SEATER WC PUBLIC TOILETS",igf,8/2/2010,,,,,Accra Metropolitan Assembly,2010-08-02,,
Accra Metropolitan Assembly,2011,"MAAMOBI PRISON SCHOOL (BOSTER INSTITUTE), 20-SEATER WC PUBLIC TOILETS",igf,10/25/2010,,,,,Accra Metropolitan Assembly,2010-10-25,,
Accra Metropolitan Assembly,2011,SITE OPP. KORLE BU TEACHING HOSPITAL,igf,9/9/2010,,,,,Accra Metropolitan Assembly,2010-09-09,,
Accra Metropolitan Assembly,2011,"BRO LAWSON, 20-SEATER WC PUBLIC TOILETS",igf,10/1/2010,,,,,Accra Metropolitan Assembly,2010-10-01,,
Accra Metropolitan Assembly,2011,"OBEDRU, 20-SEATER WC PUBLIC TOILETS",igf,10/9/2010,,,,,Accra Metropolitan Assembly,2010-10-09,,
Accra Metropolitan Assembly,2011,"ALAJO, BEHIND THE PRESBY, 20-SEATER WC PUBLIC TOILETS",igf,9/15/2010,,,,,Accra Metropolitan Assembly,2010-09-15,,
Accra Metropolitan Assembly,2011,"ALAJO, BEHIND THE CLUSTER OF SCHOOLS, 20-SEATER WC PUBLIC TOILETS",igf,9/15/2010,,,,,Accra Metropolitan Assembly,2010-09-15,,
Accra Metropolitan Assembly,2011,"KOTOBABI, 20-SEATER WC PUBLIC TOILETS",igf,1/8/2010,,,,,Accra Metropolitan Assembly,2010-01-08,,
Accra Metropolitan Assembly,2011,"PIGFARM, 20-SEATER WC PUBLIC TOILETS",igf,1/8/2010,,,,,Accra Metropolitan Assembly,2010-01-08,,
Accra Metropolitan Assembly,2011,"KWAOTSURU (INITIAL SITE AT AYIDIKI REPLACED DUE TO LITIGATION), 20 SEATER WC PUBLIC TOILETS",igf,8/15/2010,,,,,Accra Metropolitan Assembly,2010-08-15,,
Accra Metropolitan Assembly,2011,"KAAJAANO, 20-SEATER WC PUBLIC TOILETS",igf,8/5/2010,,,,,Accra Metropolitan Assembly,2010-08-05,,
Accra Metropolitan Assembly,2011,"LA CLUSTER OF SCHOOLS (WIRELESS), 20-SEATER WC PUBLIC TOILETS",igf,8/15/2010,,,,,Accra Metropolitan Assembly,2010-08-15,,
Accra Metropolitan Assembly,2011,"JOMO (SOULA EST), 20-SEATER WC PUBLIC TOILETS",igf,8/5/2010,,,,,Accra Metropolitan Assembly,2010-08-05,,
Accra Metropolitan Assembly,2011,CONTRACT FOR THE REPLACEMENT OF SEPTIC TANK FOR THE LA BAWALESHIE PUBLIC TOILET IN AYAWASO WEST WUOGON CONSTITUENCY,igf,7/14/2010,,,,,Accra Metropolitan Assembly,2010-07-14,,
Accra Metropolitan Assembly,2011,"CONSTRACT FOR THE INSTALLATION OF LIGHTS AT ABOTSIMAN, LA BAWALESHIE AND MMEMPEASEM PUBLIC TOILETS IN AYAWASO WEST WUOGON CONSTITUENCY",igf,7/14/2010,,,,,Accra Metropolitan Assembly,2010-07-14,,
Accra Metropolitan Assembly,2011,"RIDGE HOSPITAL, 20-SEATER WC PUBLIC TOILETS",igf,1/28/2011,,,,,Accra Metropolitan Assembly,2011-01-28,,
Accra Metropolitan Assembly,2011,SUPPLY WATER TO COMMUNITIES FACING ACUTE WATER SHORTAGE,igf,Jan-11,,,,,Accra Metropolitan Assembly,2011-01-01,,
Accra Metropolitan Assembly,2011,CONSTRUCT 4NO. CONCRETE PLATFORM FOR POLY TANKS AT LA-SUB METRO,igf,Jan-11,,,,,Accra Metropolitan Assembly,2011-01-01,,
Accra Metropolitan Assembly,2011,CONSTRUCT 14 SEATER WC TOILET FACILITY AT LA,igf,Apr-11,,,,,Accra Metropolitan Assembly,2011-04-01,,
Accra Metropolitan Assembly,2011,CONSTRUCT 4 UNIT SOLID WASTE COLLECTION SITES AT OSU KLOTTEY,igf,Mar-11,,,,,Accra Metropolitan Assembly,2011-03-01,,
Accra Metropolitan Assembly,2011,REHABILITATE TOILET AND MARKET FACILITY,igf,Jan-11,,,,,Accra Metropolitan Assembly,2011-01-01,,
Accra Metropolitan Assembly,2011,REHABILITATE 3NO. PUBLIC TOILET FACILITY,igf,May-11,,,,,Accra Metropolitan Assembly,2011-05-01,,
Accra Metropolitan Assembly,2011,REHABILITATE PUBLIC TOILET FACILITY,igf,Aug-11,,,,,Accra Metropolitan Assembly,2011-08-01,,
Accra Metropolitan Assembly,2011,IMPROVE 1 TOILET FACILITY,igf,Oct-11,,,,,Accra Metropolitan Assembly,2011-10-01,,
Accra Metropolitan Assembly,2011,IMPROVE ONE TOILET FACILITY,igf,Apr-11,,,,,Accra Metropolitan Assembly,2011-04-01,,
Accra Metropolitan Assembly,2011,REHABILITATE AND CONSTRUCT 2 PUBLIC TOILETS,igf,Mar-11,,,,,Accra Metropolitan Assembly,2011-03-01,,
Accra Metropolitan Assembly,2011,ACQUIRE AND MANAGE LANDFILL SITE,igf,Feb-11,,,,,Accra Metropolitan Assembly,2011-02-01,,
Accra Metropolitan Assembly,2011,COLLECT SOLID WASTE,igf,Jan-11,,,,,Accra Metropolitan Assembly,2011-01-01,,
Accra Metropolitan Assembly,2011,UNDERTAKE WASTE TO ENERGY PROJECT,igf,Jan-11,,,,,Accra Metropolitan Assembly,2011-01-01,,
Accra Metropolitan Assembly,2011,MAINTAIN AND DISTIL 23.30KM OF DRAINS,igf,Jul-11,,,,,Accra Metropolitan Assembly,2011-07-01,,
Accra Metropolitan Assembly,2011,MAINTAIN AND DISTIL 10KM OF DRAINS,igf,Apr-11,,,,,Accra Metropolitan Assembly,2011-04-01,,
Accra Metropolitan Assembly,2011,MAINTAIN AND DISILT 12.17KM OF DRAINS,igf,Jul-11,,,,,Accra Metropolitan Assembly,2011-07-01,,
Accra Metropolitan Assembly,2011,MAMINTAIN AND DISTILT 65.50KM DRAINS,igf,Jan-11,,,,,Accra Metropolitan Assembly,2011-01-01,,
Accra Metropolitan Assembly,2011,DEMOLISH A 10NO. OLD TOILET,igf,Jul-11,,,,,Accra Metropolitan Assembly,2011-07-01,,
Accra Metropolitan Assembly,2011,REHABILITATE 10NO. TOILET,igf,Jan-11,,,,,Accra Metropolitan Assembly,2011-01-01,,
Accra Metropolitan Assembly,2011,DRILLING OF 5NO. BOREHOLE FOR PROVIDE WATER FOR TOILET FACILITIES,igf,Jan-11,,,,,Accra Metropolitan Assembly,2011-01-01,,
Accra Metropolitan Assembly,2011,GRAVELLING WORKS NEW ABOSSEY OKAI STREET,road fund,1/4/2011,,,,,Accra Metropolitan Assembly,2011-01-04,,
Accra Metropolitan Assembly,2011,GRAVELLING WORKS DZAGBELE STREET,road fund,,,,,,Accra Metropolitan Assembly,,,
Accra Metropolitan Assembly,2011,GRAVELLING OF OLD CEMETARY ROAD (CHD+ 400-0+650),road fund,1/4/2011,,,,,Accra Metropolitan Assembly,2011-01-04,,
Accra Metropolitan Assembly,2011,GRAVELLING OLD CEMETARY ROAD,road fund,1/4/2011,,,,,Accra Metropolitan Assembly,2011-01-04,,
Accra Metropolitan Assembly,2011,GRAVELLING OF CULVERT APPLICATION ON KAE BLIE KIAER,road fund,7/12/2011,,,,,Accra Metropolitan Assembly,2011-07-12,,
Accra Metropolitan Assembly,2011,FINAL COMPLETION INSPECTION GRAVELLING OF ODORNA MARKET,road fund,7/12/2011,,,,,Accra Metropolitan Assembly,2011-07-12,,
Accra Metropolitan Assembly,2011,PAVING WORKS AT ZONGO LANEB PHASE 1,road fund,7/12/2011,,,,,Accra Metropolitan Assembly,2011-07-12,,
Accra Metropolitan Assembly,2011,GRAVELLING OF PORT NOVO STREET (0.50KM) EAST LEGON,road fund,7/12/2011,,,,,Accra Metropolitan Assembly,2011-07-12,,
Accra Metropolitan Assembly,2011,GRAVELLING OF NII ARYEE STREET SAKAMAN (560M),road fund,0712/2011,,,,,Accra Metropolitan Assembly,0712/2011,,
Accra Metropolitan Assembly,2011,PAVING WORKS ON KOFI OKU STEET,road fund,7/12/2011,,,,,Accra Metropolitan Assembly,2011-07-12,,
Accra Metropolitan Assembly,2011,GRAVELLING WORKS ON LIBERTY ROAD AND KOJO ASHONG ROAD ALAJO,road fund,7/12/2011,,,,,Accra Metropolitan Assembly,2011-07-12,,
Accra Metropolitan Assembly,2011,CONSTRUCTION OF 0.60 M U DRAINS ALONG MALLAM ABASS STREET (RHS) FADAMA,road fund,1/4/2011,,,,,Accra Metropolitan Assembly,2011-01-04,,
Accra Metropolitan Assembly,2011,RESURFACING OF KOTIE STREET (GH:0+300-0+600) DARKUMAN,road fund,1/4/2011,,,,,Accra Metropolitan Assembly,2011-01-04,,
Accra Metropolitan Assembly,2011,GRAVELLING OF PRESBY SCHOOL ROAD-ABOFU AND GRAVELLING OF OVER STREET-NII BOIMAN,road fund,1/4/2011,,,,,Accra Metropolitan Assembly,2011-01-04,,
Accra Metropolitan Assembly,2011,FINAL INSPECTION GRAVELLING OF ONYANKOE STREET-ABOFU LAPAZ TROTRO STATION ROAD-NII BOIMAN,road fund,3/18/2011,,,,,Accra Metropolitan Assembly,2011-03-18,,
Accra Metropolitan Assembly,2011,GRAVELLING OF AKOTO STREET FINAL COMPLITION INSPECTION,road fund,3/18/2011,,,,,Accra Metropolitan Assembly,2011-03-18,,
Accra Metropolitan Assembly,2011,ROADLINE MARKING AND RUMBLESTRIPS ON SELECETED ROADS IN ACCRA,road fund,3/18/2011,,,,,Accra Metropolitan Assembly,2011-03-18,,
Accra Metropolitan Assembly,2011,PAVING WORKS ON LAGOON STREET,road fund,3/16/2011,,,,,Accra Metropolitan Assembly,2011-03-16,,
Accra Metropolitan Assembly,2011,GRAVELLING OF OBUTU STREET NEW TOWN,road fund,3/20/2011,,,,,Accra Metropolitan Assembly,2011-03-20,,
Accra Metropolitan Assembly,2011,GRAVELLING OF ABOTRE STREET LAPAZ (032 KM),road fund,3/31/2011,,,,,Accra Metropolitan Assembly,2011-03-31,,
Accra Metropolitan Assembly,2011,CONSTRUCTION OF ACCESS ROADS TO SABAH DUMP SITE OBLOGO,road fund,3/20/2011,,,,,Accra Metropolitan Assembly,2011-03-20,,
Accra Metropolitan Assembly,2011,GRAVELLING OF WOOD STREET SABON ZONGO (0.5KM),road fund,3/15/2011,,,,,Accra Metropolitan Assembly,2011-03-15,,
Accra Metropolitan Assembly,2011,RESURFACING OF APRATRANUM STREEET (CH 0+300-0+600),road fund,3/10/2011,,,,,Accra Metropolitan Assembly,2011-03-10,,
Accra Metropolitan Assembly,2011,PAVING WORKS AROUND ASAFOATSE NETTEY STREET PHI,road fund,7/12/2011,,,,,Accra Metropolitan Assembly,2011-07-12,,
Accra Metropolitan Assembly,2011,GRAVELLING WORKS ON GBENE STREET-KOTOBABI (CHAINAGE 0+000-0+500),road fund,7/15/2011,,,,,Accra Metropolitan Assembly,2011-07-15,,
Accra Metropolitan Assembly,2011,GRAVELLING WORKS ON 4TH STREET EXTENSION MEMPEASEM (0.80KM),road fund,7/19/2011,,,,,Accra Metropolitan Assembly,2011-07-19,,
Accra Metropolitan Assembly,2011,GRAVELLING OF SELECTED ROADS IN EAST LAGOON,road fund,7/22/2011,,,,,Accra Metropolitan Assembly,2011-07-22,,
Accra Metropolitan Assembly,2011,CONSTRUCTION OF (2X1.6) M BOX CULVERT AND (23X2) STORM DRAIN ON DADEBAN ROAD,road fund,7/4/2011,,,,,Accra Metropolitan Assembly,2011-07-04,,
Accra Metropolitan Assembly,2011,GRAVELLING OF 2ND AND 3RD KWABEI STREET AND YARBOI CRSENT MAAMOBI,road fund,7/8/2011,,,,,Accra Metropolitan Assembly,2011-07-08,,
Accra Metropolitan Assembly,2011,GRAVELLING OF MARCUS STREET NEW TOWN,road fund,7/4/2011,,,,,Accra Metropolitan Assembly,2011-07-04,,
Accra Metropolitan Assembly,2011,RESURFACING OF APRATRANUM STREET (CH0+0000+300),road fund,7/4/2011,,,,,Accra Metropolitan Assembly,2011-07-04,,
Accra Metropolitan Assembly,2011,RESURFACING OF APRATRANUM STREET (CH0+900-1+200),road fund,7/4/2011,,,,,Accra Metropolitan Assembly,2011-07-04,,
Accra Metropolitan Assembly,2011,GRAVELLING WORKS ON 4TH STREET EXTENTION-MEPEASEM (0.53KM),road fund,7/30/2011,,,,,Accra Metropolitan Assembly,2011-07-30,,
Accra Metropolitan Assembly,2011,RESURFACING OF APRATRANUM STREET (CH:0+600-0+900),road fund,Oct-11,,,,,Accra Metropolitan Assembly,2011-10-01,,
Accra Metropolitan Assembly,2011,"CONSTRUCTION OF 17 NO. SPEED HUMPS AT LA, OSU & ASHEIDU KETEKE",road fund,Oct-11,,,,,Accra Metropolitan Assembly,2011-10-01,,
Accra Metropolitan Assembly,2011,GRAVELLING OF NOER STREET-NII BOIMAN (0.95KM) RELEASE OF RETENTION,road fund,Oct-11,,,,,Accra Metropolitan Assembly,2011-10-01,,
Accra Metropolitan Assembly,2011,GRAVELLING OF LAPAZ TROTRO STATION AREA ROADS-NII BOIMAN RELEASE OF RETENTION,road fund,Sep-11,,,,,Accra Metropolitan Assembly,2011-09-01,,
Accra Metropolitan Assembly,2011,GRAVELLING OF PRESBY AREA ROAD-ABOFU RELEASE OF RETENTION,road fund,Sep-11,,,,,Accra Metropolitan Assembly,2011-09-01,,
Accra Metropolitan Assembly,2011,GRAVELLING OF BAMBOOSA STREET-ABLEKUMA SOUTH (0.5KM),road fund,Sep-11,,,,,Accra Metropolitan Assembly,2011-09-01,,
Accra Metropolitan Assembly,2011,GRAVELLING WORKS ON PALACE LINKS (0.60KM,road fund,Sep-11,,,,,Accra Metropolitan Assembly,2011-09-01,,
Accra Metropolitan Assembly,2011,GRAVELLING OF BILL COSE AND NII OCQUAYE STREET EAST LEGON,road fund,Sep-11,,,,,Accra Metropolitan Assembly,2011-09-01,,
Accra Metropolitan Assembly,2011,GRAVELLING WORK ON OPINTINSE AVENUE (0.6KM),road fund,Sep-11,,,,,Accra Metropolitan Assembly,2011-09-01,,
Accra Metropolitan Assembly,2011,GRAVELLING OF OBLOGO ROAD-OBLOGO,road fund,Sep-11,,,,,Accra Metropolitan Assembly,2011-09-01,,
Accra Metropolitan Assembly,2011,"JUNCTION IMPROVEMENTS, SPEED HUMPS & WALWAY AT LA",road fund,Sep-11,,,,,Accra Metropolitan Assembly,2011-09-01,,
Accra Metropolitan Assembly,2011,GRAVELLING WORKS ON 4TH STREET EXTENSION MEMPEASEM (0.25KM),road fund,Sep-11,,,,,Accra Metropolitan Assembly,2011-09-01,,
Accra Metropolitan Assembly,2011,GRAVELLING OF WORKS ON OGBOJO ROAD-EAST LEGON,road fund,Sep-11,,,,,Accra Metropolitan Assembly,2011-09-01,,
Accra Metropolitan Assembly,2011,GRAVELLING WORKS ON 3RD STREET EXTENTION MEMPEASEM (036KM),road fund,Sep-11,,,,,Accra Metropolitan Assembly,2011-09-01,,
Accra Metropolitan Assembly,2011,REGRAVELLING OF ALUGUITUGUI LINK ROAD-EAST LEGON (0.4KM),road fund,Oct-11,,,,,Accra Metropolitan Assembly,2011-10-01,,
Accra Metropolitan Assembly,2011,GRAVELLING WORK ON AKOTO STREET-ALAJO,road fund,Oct-11,,,,,Accra Metropolitan Assembly,2011-10-01,,
Accra Metropolitan Assembly,2011,GRAVELLING WORK AROUND GOOD SHEPHERD CHURCH (0.57KM)-BUBUASHIE,road fund,Oct-11,,,,,Accra Metropolitan Assembly,2011-10-01,,
Accra Metropolitan Assembly,2011,MECHANICAL SWEEPING OF SELECTED CEREMONIAL ROADS IN ACCRA-FEB 2011,road fund,11/2/2010,,,,,Accra Metropolitan Assembly,2010-11-02,,
Accra Metropolitan Assembly,2011,GRAVELLING WORKS ON OTATEN STREET-ODORKOR,road fund,6/23/2010,,,,,Accra Metropolitan Assembly,2010-06-23,,
Accra Metropolitan Assembly,2011,RESURFACING OF KINSHASHA ROAD (0+000-+250),road fund,4/29/2011,,,,,Accra Metropolitan Assembly,2011-04-29,,
Accra Metropolitan Assembly,2011,RESURFACING OF KINSHASHA ROAD (0+100-0+500),road fund,4/29/2011,,,,,Accra Metropolitan Assembly,2011-04-29,,
Accra Metropolitan Assembly,2011,RESURFACING OF KINSHASHA ROAD (0+500-0+750),road fund,4/29/2011,,,,,Accra Metropolitan Assembly,2011-04-29,,
Accra Metropolitan Assembly,2011,PAVEMENT WORKS AT LATERBIOKORSHIE,road fund,11/2/2010,,,,,Accra Metropolitan Assembly,2010-11-02,,
Accra Metropolitan Assembly,2011,PAVING OF MANDJAANO DURBAN GROUNDS AT LA,road fund,3/30/2010,,,,,Accra Metropolitan Assembly,2010-03-30,,
Accra Metropolitan Assembly,2011,CONSTRUCTION OF 20 NO SPEED HUMPS ON SELECTED LOCATIONS IN ACCRA METROPOLIS,road fund,3/30/2010,,,,,Accra Metropolitan Assembly,2010-03-30,,
Accra Metropolitan Assembly,2011,RESURFACING OF ASAFOATSE YARTEY STREET-SAKAMAN,road fund,11/2/2010,,,,,Accra Metropolitan Assembly,2010-11-02,,
Accra Metropolitan Assembly,2011,RESURFACING OF ALUGUNTUGUI STREET-EAST LEGON (0+000-0+300),road fund,11/25/2010,,,,,Accra Metropolitan Assembly,2010-11-25,,
Accra Metropolitan Assembly,2011,RESURFACING OF ALUGUNTUGUI STREET-EAST LEGON (0+000-0+600),road fund,11/25/2010,,,,,Accra Metropolitan Assembly,2010-11-25,,
Accra Metropolitan Assembly,2011,CONSTRUCTION OF WALKWAY ALONG OSAKUMAN ROAD,road fund,4/14/2011,,,,,Accra Metropolitan Assembly,2011-04-14,,
Accra Metropolitan Assembly,2011,CONSTRUCTION OF 5 NO SPEED HUMPS ON OSTSAHELI STREET-BUBUASHIE,road fund,4/14/2011,,,,,Accra Metropolitan Assembly,2011-04-14,,
Accra Metropolitan Assembly,2011,SUPPLY OF DURABLOCK ON LIBERATION ROAD NEAR AIRPORT,road fund,7/22/2011,,,,,Accra Metropolitan Assembly,2011-07-22,,
Accra Metropolitan Assembly,2011,GRAVELLING WORKS ON NMLENMLETE STREET AND LINK-LARTEBIOKOSHIE,road fund,6/23/2010,,,,,Accra Metropolitan Assembly,2010-06-23,,
Accra Metropolitan Assembly,2011,CONSTRUCTION OF 5NO. SPEED HUMPS AT ODORKOR STREET NEAR WASS SCHOOL,road fund,Aug-11,,,,,Accra Metropolitan Assembly,2011-08-01,,
Accra Metropolitan Assembly,2011,GRAVELLING WORKS ON ASOYELI CRESENT EAST LEGON (0.50KM),road fund,Apr-11,,,,,Accra Metropolitan Assembly,2011-04-01,,
Accra Metropolitan Assembly,2011,GRAVELLING WORKS ON LIBERTY ROAD AND KOJO ASHONG ROAD-ALAJO,road fund,Apr-11,,,,,Accra Metropolitan Assembly,2011-04-01,,
Accra Metropolitan Assembly,2011,GRAVELLING OF OLD CEMETARY ROAD (CH. 0+400-0+650),road fund,Apr-11,,,,,Accra Metropolitan Assembly,2011-04-01,,
Accra Metropolitan Assembly,2011,CONSTRUCTION OF WALKWAY ALONG OSAKUMAN ROAD (OFFICIAL TOWN) 0+125-0+259.6,road fund,Apr-11,,,,,Accra Metropolitan Assembly,2011-04-01,,
Accra Metropolitan Assembly,2011,PAVING WORKS AT AKOTO LANTEY,road fund,Jul-11,,,,,Accra Metropolitan Assembly,2011-07-01,,
Accra Metropolitan Assembly,2011,GRAVELLING WORKS ON 4TH STREET-DARKUMAN,road fund,Apr-11,,,,,Accra Metropolitan Assembly,2011-04-01,,
Accra Metropolitan Assembly,2011,ROADLINE MARKING AND RUMBLE STRIPS ON SELECTED ROADS IN ACCRA,road fund,Jul-11,,,,,Accra Metropolitan Assembly,2011-07-01,,
Accra Metropolitan Assembly,2011,PRUNNING OF TREES ON SELECTED ROADS IN ACCRA,road fund,Apr-11,,,,,Accra Metropolitan Assembly,2011-04-01,,
Accra Metropolitan Assembly,2011,GRAVELLING OF AMA BADUA ROAD (0+00-0+500),road fund,4/14/2011,,,,,Accra Metropolitan Assembly,2011-04-14,,
Accra Metropolitan Assembly,2011,CONSTRUCTION OF 1 NO. LAY BY ON GIFFARD ROAD (TRADE FAIR),road fund,9/27/2011,,,,,Accra Metropolitan Assembly,2011-09-27,,
Accra Metropolitan Assembly,2011,GRAVELLING WORKS AT KINSHASHA AVENUE AND CLOSE,road fund,6/28/2011,,,,,Accra Metropolitan Assembly,2011-06-28,,
Accra Metropolitan Assembly,2011,GRAVELLING WORKS AT DR. TAGOE ROAD-EAST LEGON,road fund,6/28/2011,,,,,Accra Metropolitan Assembly,2011-06-28,,
Accra Metropolitan Assembly,2011,GRAVELLING WORKS AT LUSAKA AVENUE,road fund,6/28/2011,,,,,Accra Metropolitan Assembly,2011-06-28,,
Accra Metropolitan Assembly,2011,RESURFACING OF BINTIN CLOSE (0.27KM),road fund,4/12/2011,,,,,Accra Metropolitan Assembly,2011-04-12,,
Accra Metropolitan Assembly,2011,GRAVELLING WORKS ON BINTIN CLOSE (0.27KM),road fund,10/17/2011,,,,,Accra Metropolitan Assembly,2011-10-17,,
Accra Metropolitan Assembly,2011,GRAVELLING WORKS ON LA BAKERY ROAD-LA (0.55KM),road fund,5/23/2011,,,,,Accra Metropolitan Assembly,2011-05-23,,
Accra Metropolitan Assembly,2011,IMPROVEMENT OF SPEED HUMPS & WALKWAY AT LA,road fund,Apr-11,,,,,Accra Metropolitan Assembly,2011-04-01,,
Accra Metropolitan Assembly,2011,CONSTRUCTION OF 17 NO. SPEED HUMPS AT AYAWASO SUB METRO,road fund,Aug-11,,,,,Accra Metropolitan Assembly,2011-08-01,,
Accra Metropolitan Assembly,2011,CONSTRUCTION OF 17 NO. SPEED HUMPS AT ABLEKUMA SOUTH,road fund,Oct-11,,,,,Accra Metropolitan Assembly,2011-10-01,,
Accra Metropolitan Assembly,2011,PAVING WORKS AT ALL NATIONS PHASE II,road fund,7/13/2011,,,,,Accra Metropolitan Assembly,2011-07-13,,
Accra Metropolitan Assembly,2011,PAVING WORKS OF SHIASHIE DURBAR GROUND-LA,road fund,11/21/2010,,,,,Accra Metropolitan Assembly,2010-11-21,,
Accra Metropolitan Assembly,2011,PROVISION OF PEDESTRIAN HANDRAILS ON LIBERATION ROAD,road fund,11/19/2011,,,,,Accra Metropolitan Assembly,2011-11-19,,
Accra Metropolitan Assembly,2011,GRAVELLING WORKS ON OPINTINSE LINK (0.50)-KOTOBABI,road fund,Oct-11,,,,,Accra Metropolitan Assembly,2011-10-01,,
Accra Metropolitan Assembly,2011,SEAL 31.32 KM OF SELECTED ROADS IN THE METROPOLIS THROUGH PERIODIC MAINTENANCE,igf,Jan-11,,,,,Accra Metropolitan Assembly,2011-01-01,,
Accra Metropolitan Assembly,2011,REPAIR 3.7KM ASPHALTIC OVERLAY OF SELECTED ROADS IN THE METROPOLIS,igf,Jan-11,,,,,Accra Metropolitan Assembly,2011-01-01,,
Accra Metropolitan Assembly,2011,COMPLETE ON-GOING DRAINAGE CONSTRUCTION,igf,Jan-11,,,,,Accra Metropolitan Assembly,2011-01-01,,
Accra Metropolitan Assembly,2011,CLEAN 188 82KM OF KERBS AND DRAINS CLEANED THROUGH ROUTINE MAINTENANCE,igf,Jan-11,,,,,Accra Metropolitan Assembly,2011-01-01,,
Accra Metropolitan Assembly,2011,REHABILITATION OF ABOSSEY OKAI ROADS PH II,igf,10/15/2011,,,,,Accra Metropolitan Assembly,2011-10-15,,
Accra Metropolitan Assembly,2011,REHABILITATION OF ABOSSEY OKAI ROAD PHI,igf,10/15/2011,,,,,Accra Metropolitan Assembly,2011-10-15,,
Accra Metropolitan Assembly,2011,"CONSTRUCTION OF 0.6M U DRAIN ON 2ND, 3RD AVENUE NII AWULEY LARTEY STREET ETC",road fund,Oct-11,,,,,Accra Metropolitan Assembly,2011-10-01,,
Accra Metropolitan Assembly,2011,CONSTRUCTION OF 0.6 M U DRAINS ALONG ZONGO JUNCTION LHS FAITH EVANGELICAL CHURCH,road fund,Oct-11,,,,,Accra Metropolitan Assembly,2011-10-01,,
Accra Metropolitan Assembly,2011,CONSTRUCTION OF 0.6 M U DRAINS ALONG 6TH BUSIA LANE,road fund,Oct-11,,,,,Accra Metropolitan Assembly,2011-10-01,,
Accra Metropolitan Assembly,2011,CONSTRUCTION OF 0.6M U DRAIN AT PENTECOST CHURCH PAWPAW STREET RHS,road fund,Oct-11,,,,,Accra Metropolitan Assembly,2011-10-01,,
Accra Metropolitan Assembly,2011,CONSTRUCTION OF 0.9M U DRAIN 2ND BUSIA LINK,road fund,Oct-11,,,,,Accra Metropolitan Assembly,2011-10-01,,
Accra Metropolitan Assembly,2011,CONSTRUCTION OF U AND 0.9 M U DRAIN ASAMEMTWI STREET,road fund,Oct-11,,,,,Accra Metropolitan Assembly,2011-10-01,,
Accra Metropolitan Assembly,2011,CONSTRUCTION OF 0.6M U LANE SAKAMAN,road fund,Oct-11,,,,,Accra Metropolitan Assembly,2011-10-01,,
Accra Metropolitan Assembly,2011,CONSTRUCTION OF 0.6M U DRAINS ON KWASHIE BEDZRO STREET,road fund,Oct-11,,,,,Accra Metropolitan Assembly,2011-10-01,,
Accra Metropolitan Assembly,2011,CONSTRUCTION OF 0.6M U DRAINS ON 2ND ORGLE LINK,road fund,Oct-11,,,,,Accra Metropolitan Assembly,2011-10-01,,
Accra Metropolitan Assembly,2011,CONSTRUCTION OF 0.6M U DRAINS ALONG ALAJO LINK 9TH RHS,road fund,Nov-10,,,,,Accra Metropolitan Assembly,2010-11-01,,
Accra Metropolitan Assembly,2011,CONSTRUCTION OF 0.6M U DRAIN ON 8TH ADOTEY OBOUR STREET,road fund,Oct-11,,,,,Accra Metropolitan Assembly,2011-10-01,,
Accra Metropolitan Assembly,2011,CONSTRUCTION OF 0.6M U DRAIN ON 8TH ADOTEY OBOUR STREET LHS,road fund,Oct-11,,,,,Accra Metropolitan Assembly,2011-10-01,,
Accra Metropolitan Assembly,2011,CONSTRUCTION OF 0.6M U DRAINS ALONG RHS 2ND AVENUE ABLEKUMA NORTH,road fund,Oct-11,,,,,Accra Metropolitan Assembly,2011-10-01,,
Accra Metropolitan Assembly,2011,CONSTRUCTION OF 0.6M U DRAINS ON 4TH STREET MEMPEASEM,road fund,Jan-11,,,,,Accra Metropolitan Assembly,2011-01-01,,
Accra Metropolitan Assembly,2011,CONSTRUCTION OF 0.6M U DRAINS ON OPLEN STREET,road fund,Jan-11,,,,,Accra Metropolitan Assembly,2011-01-01,,
Accra Metropolitan Assembly,2011,MINOR DRAINAGE REPAIRS WORKS IN OSU CLOTTEY SUB METRO,road fund,Jan-11,,,,,Accra Metropolitan Assembly,2011-01-01,,
Accra Metropolitan Assembly,2011,CONTRUCTION OF 0.6M U DRAINS ALONG YAIBOI LINK RHS,road fund,Jan-11,,,,,Accra Metropolitan Assembly,2011-01-01,,
Accra Metropolitan Assembly,2011,MINOR DRAINAGE REPAIRS WORK IN ABLEKUMA NORTH SUB METRO,road fund,Jan-11,,,,,Accra Metropolitan Assembly,2011-01-01,,
Accra Metropolitan Assembly,2011,CONSTRUCTION OF 0.6 MU DRAIN AT BLUE LAGOON-SAKAMAN,road fund,Jan-11,,,,,Accra Metropolitan Assembly,2011-01-01,,
Accra Metropolitan Assembly,2011,CONSTRUCTION OF 0.6M U DRAIN ON ASAFOSTE KOJO STREET,road fund,Jan-11,,,,,Accra Metropolitan Assembly,2011-01-01,,
Accra Metropolitan Assembly,2011,CONSTRUCTION OF 0.6M  U DRAIN AT AGLOGLOSHIE LHS,road fund,Jan-11,,,,,Accra Metropolitan Assembly,2011-01-01,,
Accra Metropolitan Assembly,2011,CONSTRUCTION OF 0.6 M U DRAIN ALONG GIMPA ROAD OKAIKOI-NORTH,road fund,Jan-11,,,,,Accra Metropolitan Assembly,2011-01-01,,
Accra Metropolitan Assembly,2011,CONSTRUCTION OF 0.9 M U DRAINS ALONG GIMPA ROADS OKAIKOI NORTH,road fund,Jan-11,,,,,Accra Metropolitan Assembly,2011-01-01,,
Accra Metropolitan Assembly,2011,CONSTRUCTION OF 0.60 M U DRAINS ALONG DZABLEKA DTREET (CH-+250-0+500),road fund,Apr-11,,,,,Accra Metropolitan Assembly,2011-04-01,,
Accra Metropolitan Assembly,2011,CONSTRUCTION OF 0.60 M U DRAINS ALONG DZABLEKA DTREET (CH-+250-0+000),road fund,Apr-11,,,,,Accra Metropolitan Assembly,2011-04-01,,
Accra Metropolitan Assembly,2011,CONSTRUCTION OF 0.9 M U DRAINS ALONG KWAME STREET PHS ABEKA,road fund,Apr-11,,,,,Accra Metropolitan Assembly,2011-04-01,,
Accra Metropolitan Assembly,2011,CONSTRUCTION OF (2.5 X 2M) BOX CULVERT AT PREMPE LIND,road fund,Apr-11,,,,,Accra Metropolitan Assembly,2011-04-01,,
Accra Metropolitan Assembly,2011,CONTRUCTION OF 0.6 M U DRAINS ON 23RD DANBA ROAD RHS DANSOMAN,road fund,Apr-11,,,,,Accra Metropolitan Assembly,2011-04-01,,
Accra Metropolitan Assembly,2011,CONSTRUCTION OF 0.45M U DRAIN ON BAMBOOSA STREET LHS-DANSOMAN,road fund,Apr-11,,,,,Accra Metropolitan Assembly,2011-04-01,,
Accra Metropolitan Assembly,2011,CONSTRUCTION OF 0.6 U DRAIN ON JONKOBRI LOOP RHS,road fund,Apr-11,,,,,Accra Metropolitan Assembly,2011-04-01,,
Accra Metropolitan Assembly,2011,CONSTRUCTION OF 0.6M U DRAINS ON JONKOBRI STREET RHS MATAHEKO,road fund,Apr-11,,,,,Accra Metropolitan Assembly,2011-04-01,,
Accra Metropolitan Assembly,2011,CONSTRUCTION OF 0.6M U DRAINS ON FAANA CRESECENT MAMPROBI,road fund,Apr-11,,,,,Accra Metropolitan Assembly,2011-04-01,,
Accra Metropolitan Assembly,2011,CONSTRUCTION OF 0.6 M U DRAIN ON 6TH ADOTEY OBOUR STREET LHS,road fund,Apr-11,,,,,Accra Metropolitan Assembly,2011-04-01,,
Accra Metropolitan Assembly,2011,MINOR DRAINAGE REPAIRS WORK IN OSU CLOTTEY SUB METRO-FOREST AVENUE DZORWULU,road fund,Apr-11,,,,,Accra Metropolitan Assembly,2011-04-01,,
Accra Metropolitan Assembly,2011,CONSTRUCTION OF 0.6M U DRAIN ON 7TH ADOTEY OBOUR STREET RHS,road fund,Apr-11,,,,,Accra Metropolitan Assembly,2011-04-01,,
Accra Metropolitan Assembly,2011,CONSTRUCTION 0.6M AND 0.9M U DRAIN AROUND BOSTER INSTITUTE-ROMAN RIDGE,road fund,Apr-11,,,,,Accra Metropolitan Assembly,2011-04-01,,
Accra Metropolitan Assembly,2011,CONSTRUCTION OF SELECTED LOCATION IN ACCRA METROPOLIS,road fund,Jul-11,,,,,Accra Metropolitan Assembly,2011-07-01,,
Accra Metropolitan Assembly,2011,CLEARING AND FILLING OF ODORNA MARKET RELEASE OF RETETION,road fund,Jul-11,,,,,Accra Metropolitan Assembly,2011-07-01,,
Accra Metropolitan Assembly,2011,CONSTRUCTION OF 2.5M X 1.5M STORM DRAIN ON ASAMATWI PHASE 1,road fund,Jul-11,,,,,Accra Metropolitan Assembly,2011-07-01,,
Accra Metropolitan Assembly,2011,CONSTRUCTION OF 0.6M U DRAIN ON 7TH ADOTEY OBOUR STREET LHS,road fund,Jul-11,,,,,Accra Metropolitan Assembly,2011-07-01,,
Accra Metropolitan Assembly,2011,CONSTRUCTION OF 0.6M U DRAIN ALONG BRUCE STREET ACCRA,road fund,Jul-11,,,,,Accra Metropolitan Assembly,2011-07-01,,
Accra Metropolitan Assembly,2011,CONSTRUCTION OF 0.6M U DRAINS ON 4TH STREET (0+300-0+600)-DARKUMAN,road fund,Jul-11,,,,,Accra Metropolitan Assembly,2011-07-01,,
Accra Metropolitan Assembly,2011,CONSTRUCTION OF DRAINS ALONG WENT LINK ROAD & 7TH DAMBA STREET-DANSOMAN TUNGA PH II,road fund,Jul-11,,,,,Accra Metropolitan Assembly,2011-07-01,,
Accra Metropolitan Assembly,2011,CONSTRUCTION OF 0.6M U DRAIN ON 4TH STREET (CHAINAGE 0+600-0+900) DARKUMAN,road fund,Jul-11,,,,,Accra Metropolitan Assembly,2011-07-01,,
Accra Metropolitan Assembly,2011,CONSTRUCTION OF 0.6M U DRAINS ALONG 2ND DAMBA LINK 1-DANSOMAN,road fund,Jul-11,,,,,Accra Metropolitan Assembly,2011-07-01,,
Accra Metropolitan Assembly,2011,CONSTRUCTION OF 0.6M AND 0.45M U DRAIN AROUND EQUARIAL GUINEA AMBASSDOR'S REWSIDENCE-EAST LEGON,road fund,Jul-11,,,,,Accra Metropolitan Assembly,2011-07-01,,
Accra Metropolitan Assembly,2011,CONSTRUCTION OF 0.6M U DRAIN ON PAWPAW STREET EAST LEGON,road fund,Jul-11,,,,,Accra Metropolitan Assembly,2011-07-01,,
Accra Metropolitan Assembly,2011,CONSTRUCTION OF 0.6M U DRAINS 3RD CIRCULAR ROAD CANTONMENT,road fund,Jul-11,,,,,Accra Metropolitan Assembly,2011-07-01,,
Accra Metropolitan Assembly,2011,PEDESTRAIN CROSSING MARKING IN SOME SELECTED ROADS IN ACCRA,road fund,Jul-11,,,,,Accra Metropolitan Assembly,2011-07-01,,
Accra Metropolitan Assembly,2011,CONSTRUCTION 0.6M U DRAIN ON JONKOBRI LOOP LHS (CH0+300-0+600),road fund,Jul-11,,,,,Accra Metropolitan Assembly,2011-07-01,,
Accra Metropolitan Assembly,2011,CONSTRUCTION OF 0.6 U DRAIN ON 3RD DAMBA LINK-DANSOMAN,road fund,Jul-11,,,,,Accra Metropolitan Assembly,2011-07-01,,
Accra Metropolitan Assembly,2011,MINIOR DRAINAGE REPAIR WORKS IN LA DADEKOTOON SUB METRO,road fund,Jul-11,,,,,Accra Metropolitan Assembly,2011-07-01,,
Accra Metropolitan Assembly,2011,ROUTINE AINTENANCE CONSTRUCTION OF DRAINS ALONG LAGOS AVENUE-EAST LEGON,road fund,Jul-11,,,,,Accra Metropolitan Assembly,2011-07-01,,
Accra Metropolitan Assembly,2011,CONSTRUCTION OF 0.6M U DRAINS ON WOOD STREET RHS ZONGO,road fund,Jul-11,,,,,Accra Metropolitan Assembly,2011-07-01,,
Accra Metropolitan Assembly,2011,CONSTRUCTION OF 0.6M U DRAINS ON TACKIE YABIO STREET ABLEKUMA NORTH,road fund,Jul-11,,,,,Accra Metropolitan Assembly,2011-07-01,,
Accra Metropolitan Assembly,2011,CONSTRUCTION OF 0.6M U DRAIN ON JONKOBRI LOOP LHS (CH0+300-0+600) LARTEBIOKOSHIE,road fund,Oct-11,,,,,Accra Metropolitan Assembly,2011-10-01,,
Accra Metropolitan Assembly,2011,CONSTRUCTION OF 0.6M U DRAIN ALONG ONYANKLE/ABOFU UNDERBRIDGE,road fund,Oct-11,,,,,Accra Metropolitan Assembly,2011-10-01,,
Accra Metropolitan Assembly,2011,CONSTRUCTION OF 0.6M U DRAIN ON JUNGLE LINK 2 EAST LEGON RHS,road fund,11/25/2010,,,,,Accra Metropolitan Assembly,2010-11-25,,
Accra Metropolitan Assembly,2011,CONSTRUCTION OF 0.6 U DRAIN ON AMUANAA STREET-DARKUMA WEST,road fund,Oct-11,,,,,Accra Metropolitan Assembly,2011-10-01,,
Accra Metropolitan Assembly,2011,CONSTRUCTION OF 0.6M U DRAIN JUNGLE LINK EAST LEGON,road fund,Nov-11,,,,,Accra Metropolitan Assembly,2011-11-01,,
Accra Metropolitan Assembly,2011,CONSTRUCTION OF 0.6M U DRAIN ALONG ALAJO,road fund,Oct-11,,,,,Accra Metropolitan Assembly,2011-10-01,,
Accra Metropolitan Assembly,2011,CONSTRUCTION OF 0.6M U DRAIN ALONG ACCESS ROAD TO JUBILEE HOUSE BURMA CAMP,road fund,Oct-11,,,,,Accra Metropolitan Assembly,2011-10-01,,
Accra Metropolitan Assembly,2011,CONSTRUCTION OF U DRAIN ON CANDLE STREET (CH0+00-0+200) EAST LEGON,road fund,Jan-11,,,,,Accra Metropolitan Assembly,2011-01-01,,
Accra Metropolitan Assembly,2011,CONSTRUCTION OF 0.6M U DRAIN ALONG 2ND DAMBA LINK,road fund,Jan-11,,,,,Accra Metropolitan Assembly,2011-01-01,,
Accra Metropolitan Assembly,2011,CONSTRUCTION OF VEHICULAR ACCESS ON NIMA STREAM NEW TOWN,road fund,Jan-11,,,,,Accra Metropolitan Assembly,2011-01-01,,
Accra Metropolitan Assembly,2011,CONSTRUCTION OF 17 NO. SPEED HUMPS AT AYAWASO SUB METRO,road fund,Jan-11,,,,,Accra Metropolitan Assembly,2011-01-01,,
Accra Metropolitan Assembly,2011,CONSTRUCTION OF 0.6M UDRAINS ALONG ALAJO LINK 9TH RHS-ALAJO,road fund,Jan-11,,,,,Accra Metropolitan Assembly,2011-01-01,,
Accra Metropolitan Assembly,2011,CONSTRUCTION OF 0.6M U DRAIN ON 1ST EXHIBITION STREET DANSOMAN,road fund,11/2/2010,,,,,Accra Metropolitan Assembly,2010-11-02,,
Accra Metropolitan Assembly,2011,GRAVELLING ON NIM BROKEN CRESENT-ABOFU (0.5KM),road fund,Jan-11,,,,,Accra Metropolitan Assembly,2011-01-01,,
Accra Metropolitan Assembly,2011,GRAVELLING OF APATRATWUM STREET (070KM)-OKAIKOI STREET,road fund,Apr-10,,,,,Accra Metropolitan Assembly,2010-04-01,,
Accra Metropolitan Assembly,2011,CONSTRUCTION OF STORM DRAINS ON ASAMANTWI STREET,road fund,Apr-10,,,,,Accra Metropolitan Assembly,2010-04-01,,
Accra Metropolitan Assembly,2011,CONSTRUCTION OF STROM DRAINS AND REFENCING WALL AROUND BOX CULVERT ON 4TH STREET,road fund,11/2/2010,,,,,Accra Metropolitan Assembly,2010-11-02,,
Accra Metropolitan Assembly,2011,CONSTRUCTION OF 0.6M U DRAIN ON KOLWULU STREET RHS,road fund,11/2/2010,,,,,Accra Metropolitan Assembly,2010-11-02,,
Accra Metropolitan Assembly,2011,CONSTRUCTION 0.6M U DRAINS ALONG GOOD SHEPERD ROAD RHS AND KERB WORKS,road fund,Apr-10,,,,,Accra Metropolitan Assembly,2010-04-01,,
Accra Metropolitan Assembly,2011,CONSTRUCTION OF 0.45KM U DRAINS ALONG NIMA LINK 2,road fund,Apr-10,,,,,Accra Metropolitan Assembly,2010-04-01,,
Accra Metropolitan Assembly,2011,CONSTRUCTION OF 0.6M U DRAINS ALONG AKROMA LOOP-BUBUASHIE,road fund,Jul-11,,,,,Accra Metropolitan Assembly,2011-07-01,,
Accra Metropolitan Assembly,2011,CONSTRUCTION OF 0.6M U DRAIN ON WIRELESS LINK LHS-LA,road fund,Nov-10,,,,,Accra Metropolitan Assembly,2010-11-01,,
Accra Metropolitan Assembly,2011,MINOR DRAINAGE REPAIR WORKS IN THE OSU CLOTTEY SUB METRO,road fund,Apr-10,,,,,Accra Metropolitan Assembly,2010-04-01,,
Accra Metropolitan Assembly,2011,CONSTRUCTION OF 0.6M U DRAINS 70TH DAMBA CLOSE,road fund,Apr-10,,,,,Accra Metropolitan Assembly,2010-04-01,,
Accra Metropolitan Assembly,2011,CONSTRUCTION OF DRAIN ALONG STIWTCH BACK LINK ROAD,road fund,Apr-10,,,,,Accra Metropolitan Assembly,2010-04-01,,
Accra Metropolitan Assembly,2011,CONSTRUCTION OF 17 NO. SPEED HUMPS AT OKAIKOI SUB METRO,road fund,Nov-10,,,,,Accra Metropolitan Assembly,2010-11-01,,
Accra Metropolitan Assembly,2011,CONSTRUCTION OF 0.6M U DRAINS ALONG ARS ROAD (CH0+000-0+220),road fund,Apr-10,,,,,Accra Metropolitan Assembly,2010-04-01,,
Accra Metropolitan Assembly,2011,CONSTRUCTION OF 0.6M U DRAIN ALONG ARS ROAD RHS,road fund,Apr-10,,,,,Accra Metropolitan Assembly,2010-04-01,,
Accra Metropolitan Assembly,2011,CONSTRUCTION OF 0.6M UDRAIN ALONG AMU WRIST BERG ROAD (0+300-0+600),road fund,Apr-10,,,,,Accra Metropolitan Assembly,2010-04-01,,
Accra Metropolitan Assembly,2011,CONSTRUCTION OF 0.6M U DRAIN ALONG ACCESS ROAD TO AMERICAN PEACE CORPS,road fund,Apr-10,,,,,Accra Metropolitan Assembly,2010-04-01,,
Accra Metropolitan Assembly,2011,CONSTRUCTION OF 0.6M U DRAIN 70TH DAMABA CLOSE,road fund,Apr-10,,,,,Accra Metropolitan Assembly,2010-04-01,,
Accra Metropolitan Assembly,2011,CONSTRUCTION OF 17 NO. SPEED HUMPS AT ABLEKUM SUB METRO,road fund,Jul-11,,,,,Accra Metropolitan Assembly,2011-07-01,,
Accra Metropolitan Assembly,2011,MINIOR DRAINAGE REPAIR WORK IN THE LA DADEKOTOPON SUB METRO,road fund,Jul-11,,,,,Accra Metropolitan Assembly,2011-07-01,,
Accra Metropolitan Assembly,2011,CONSTRUCTION OF 0.6M UDRAINS ON JUNGLE LINK,road fund,Jul-11,,,,,Accra Metropolitan Assembly,2011-07-01,,
Accra Metropolitan Assembly,2011,CONSTRUCTION OF DRAINS ON JONKOBRI STREET RHS,road fund,Jul-11,,,,,Accra Metropolitan Assembly,2011-07-01,,
Accra Metropolitan Assembly,2011,CONSTRUCTION OF 0.6M U DRAISN AT EBENEZER CRESENT (CH0+900-1+200-),road fund,Jul-11,,,,,Accra Metropolitan Assembly,2011-07-01,,
Accra Metropolitan Assembly,2011,CONSTRUCTION OF 0.6M U DRAINS ON WUO STREET RHS-RHS SAKAMAN,road fund,Jul-11,,,,,Accra Metropolitan Assembly,2011-07-01,,
Accra Metropolitan Assembly,2011,CONSTRUCTON OF 0.6M U DRAIN AROUND LANDS COMMISSION OFFICE-CANTONMENT,road fund,Jan-11,,,,,Accra Metropolitan Assembly,2011-01-01,,
Accra Metropolitan Assembly,2011,CONSTRUCTION OF 0.6M U DRAINS ALONG MARCUS STREET AYAWASO EAST,road fund,Jul-11,,,,,Accra Metropolitan Assembly,2011-07-01,,
Accra Metropolitan Assembly,2011,CONSTRUCTION OF 0.6M U DRAINS AT EBENEZER CRESENT (GH 0+000-+300)-ABLEKUMA SOUTH,road fund,Nov-10,,,,,Accra Metropolitan Assembly,2010-11-01,,
Accra Metropolitan Assembly,2011,CONSTRUCTION OF 0 6M UDRAIN ON JONKOBRI STREET RHS ON JONKOBRI STREET RHS,road fund,10/2/2011,,,,,Accra Metropolitan Assembly,2011-10-02,,
Accra Metropolitan Assembly,2011,CONSTRUCTION OF 0.6M U DRAINS ON 4TH STREET-MEMPEASSEM (CHAINAGE 0+000-0+220),road fund,1/8/2011,,,,,Accra Metropolitan Assembly,2011-01-08,,
Accra Metropolitan Assembly,2011,CONSSRUCTION OF 0.6M U DRAINS ON BOSSMAN STREET (L.H.S)-NORTH,road fund,1/7/2011,,,,,Accra Metropolitan Assembly,2011-01-07,,
Accra Metropolitan Assembly,2011,CONSTRUCTION OF 0.6M U DRAINS AROUND LANDS SCOMMISSION OFFICE-CANTONMENT. RELOCATED TO LARTE BU ROAD AROUND PENTECOST HEAD QUARTERS,road fund,1/4/2011,,,,,Accra Metropolitan Assembly,2011-01-04,,
Accra Metropolitan Assembly,2011,CONSTRUCTION OF 0.6M U DRAIN ON CANDLE STREET LHS-ZONGO,road fund,7/23/2011,,,,,Accra Metropolitan Assembly,2011-07-23,,
Accra Metropolitan Assembly,2011,CONSTRUCTION OF 0.6M UDRAIN ON ODAI AKLI ROAD LHS-LA. RELOCATED: CONSTRUCTION OF 0.9M U DRAI ALONG LOMO ADAMU STREET,road fund,12/23/2010,,,,,Accra Metropolitan Assembly,2010-12-23,,
Accra Metropolitan Assembly,2011,GRAVELLING WORKS ON TCHACHA STREET-LATERBIOKOSHIE,road fund,7/23/2011,,,,,Accra Metropolitan Assembly,2011-07-23,,
Accra Metropolitan Assembly,2011,CONSTRUCTION OF 0.6M U DRAIN ALONG GIMPA ROAD-OKAIKOI NORTH,road fund,12/3/2010,,,,,Accra Metropolitan Assembly,2010-12-03,,
Accra Metropolitan Assembly,2011,CONSTRUCTION OF 0.6M U DRAINS ALONG 7TH CLOSE RIDGE (0+000-0+220),road fund,4/21/2011,,,,,Accra Metropolitan Assembly,2011-04-21,,
Accra Metropolitan Assembly,2011,CONSTRUCTION OF 0.6M U DRAIN ALONG ALAJO LINK 9TH LHS-ALAJO,road fund,9/15/2010,,,,,Accra Metropolitan Assembly,2010-09-15,,
Accra Metropolitan Assembly,2011,CONSTRUCTION OF 0.6M U DRAIN ON LOMO ADAMU CRESCENT LHS (0+000-0+250),road fund,2/15/2011,,,,,Accra Metropolitan Assembly,2011-02-15,,
Accra Metropolitan Assembly,2011,"MINOR DRAINAGE REPAIR WORKS IN ABLEKUMA CENTRAL SUB METRO MAY, 2011",road fund,1/7/2011,,,,,Accra Metropolitan Assembly,2011-01-07,,
Accra Metropolitan Assembly,2011,RESURFACING OF ALUGUNTUGUI STREET-EAST LEGON (0+000-0+300),road fund,11/25/2010,,,,,Accra Metropolitan Assembly,2010-11-25,,
Accra Metropolitan Assembly,2011,CONSTRUCTION OF 0.6M U DRAIN ON LOMO ADAMU CRESCENT LHS (0+000-0+250) LA,road fund,2/1/2011,,,,,Accra Metropolitan Assembly,2011-02-01,,
Accra Metropolitan Assembly,2011,CONSTRUCTION OF 0.6M U DRAIN ALONG THE ROCK HOSPITAL ROAD-ODORKOR OFFICIAL TOWN,road fund,2/1/2011,,,,,Accra Metropolitan Assembly,2011-02-01,,
Accra Metropolitan Assembly,2011,CONSTRUCTION OF 0.6M U DRAIN ALONG KUM HOTEL ROAD-(CH: 0+750-1+000),road fund,2/1/2011,,,,,Accra Metropolitan Assembly,2011-02-01,,
Accra Metropolitan Assembly,2011,CONSTRUCTION OF 0.6M U DRAIN ALONG NEW TOWN ROAD,road fund,6/10/2011,,,,,Accra Metropolitan Assembly,2011-06-10,,
Accra Metropolitan Assembly,2011,CONSTRUCTION OF 0.6M U DRAIN ALONG OWUO STREET LHS-SAKAMAN,road fund,11/2/2010,,,,,Accra Metropolitan Assembly,2010-11-02,,
Accra Metropolitan Assembly,2011,CONSTRUCTION OF 0.6M UDRAIN ON DANSO STREET RHS-CHAINAGE 0+2500+500-LARTEBIOKOSHIE,road fund,11/2/2010,,,,,Accra Metropolitan Assembly,2010-11-02,,
Accra Metropolitan Assembly,2011,CONSTRUCTION OF 0.6M U DRAIN ON 4TH STREET-MEMPEASEM (CHAINGE 0+085-0+335),road fund,6/10/2011,,,,,Accra Metropolitan Assembly,2011-06-10,,
Accra Metropolitan Assembly,2011,CONSTRUCTION OF 0.6M U DRAIN ON NII ABBEY STREET RHS-DARKUMAN,road fund,7/23/2011,,,,,Accra Metropolitan Assembly,2011-07-23,,
Accra Metropolitan Assembly,2011,CONSTRUCTION OF 0.6M U DRAIN AND 0.9M U DRAINS AROUND BOSTER INSTITUTE-ROMAN RIDGE,road fund,9/22/2011,,,,,Accra Metropolitan Assembly,2011-09-22,,
Accra Metropolitan Assembly,2011,CONSTRUCTION OF 0.6M U-DRAINS ON 4TH STREET-MEMPEASEM,road fund,9/22/2011,,,,,Accra Metropolitan Assembly,2011-09-22,,
Accra Metropolitan Assembly,2011,CONSTRUCTION OF 0.6M U-DRAIN ON WUO STREET LHS-SAKAMAN,road fund,9/22/2011,,,,,Accra Metropolitan Assembly,2011-09-22,,
Accra Metropolitan Assembly,2011,CONSTRUCTION OF 0.9M U-DRAIN ON WUO LANE-SAKAMAN,road fund,9/22/2011,,,,,Accra Metropolitan Assembly,2011-09-22,,
Accra Metropolitan Assembly,2011,"CONSTRUCTION OF 0.9M, 0.6M, 0.45M U-DRAIN AT LA VETINARY",road fund,9/22/2011,,,,,Accra Metropolitan Assembly,2011-09-22,,
Accra Metropolitan Assembly,2011,CONSTRUCTION OF 0.6M U DRAINS ON 1ST AVENUE LHS-DARKUMAN,road fund,2/1/2011,,,,,Accra Metropolitan Assembly,2011-02-01,,
Accra Metropolitan Assembly,2011,CONSTRUCTION OF 0.6M U DRAIN ALONG PRENTA LINK RHS-MAMPROBI,road fund,7/6/2011,,,,,Accra Metropolitan Assembly,2011-07-06,,
Accra Metropolitan Assembly,2011,CONSTRUCTION OF 0.6M U DRAIN ALONG MALLAM ABASS STREET LHS,road fund,7/6/2011,,,,,Accra Metropolitan Assembly,2011-07-06,,
Accra Metropolitan Assembly,2011,CONSTRUCTION OF 0.6M U DRAIN ON FANAA LANE-MAMPROBI,road fund,7/6/2011,,,,,Accra Metropolitan Assembly,2011-07-06,,
Accra Metropolitan Assembly,2011,CONSTRUCTION OF 0.6M U DRAIN ON ALONG 3RD STREET MEMPEASEM LHS,road fund,5/3/2011,,,,,Accra Metropolitan Assembly,2011-05-03,,
Accra Metropolitan Assembly,2011,CONSTRUCTION OF 0.6M U DRAIN ON ABLAMNO ROAD,road fund,Jun-11,,,,,Accra Metropolitan Assembly,2011-06-01,,
Accra Metropolitan Assembly,2011,CONSTRUCTION OF 0.9M U DRAINS ALONG ARS ROAD-EAST LEGON (CH 0+000-0+150),road fund,4/19/2011,,,,,Accra Metropolitan Assembly,2011-04-19,,
Accra Metropolitan Assembly,2011,CONSTRUCTION OF 0.6M U DRAINS ALONG ARS ROAD RHS-EAST LEGON(CHAINGE 0+440-0+660,road fund,4/19/2011,,,,,Accra Metropolitan Assembly,2011-04-19,,
Accra Metropolitan Assembly,2011,CONSTRUCTION OF 0.9M PIPE CULVERT ON RING ROAD WEST (TOTAL FILING STATION) RHS CHAINAGE 0+000-0,road fund,4/14/2011,,,,,Accra Metropolitan Assembly,2011-04-14,,
Accra Metropolitan Assembly,2011,CONSTRUCTION OF 0.6M U DRAIN AT GNTC BAKERY,road fund,9/14/2011,,,,,Accra Metropolitan Assembly,2011-09-14,,
Accra Metropolitan Assembly,2011,CONSTRUCTION OF 0.6M U DRAIN ALONG EMMASUE CRESENT LINK ROAD-LAE BAKERY,road fund,5/23/2011,,,,,Accra Metropolitan Assembly,2011-05-23,,
Accra Metropolitan Assembly,2011,CONSTRUCTION OF 0.6M U DRAIN ALONG DANSO STREET,road fund,4/14/2011,,,,,Accra Metropolitan Assembly,2011-04-14,,
Accra Metropolitan Assembly,2011,CONSTRUCTION OF 0.6M U DRAIN ON DANSO STREET RHS,road fund,5/12/2011,,,,,Accra Metropolitan Assembly,2011-05-12,,
Accra Metropolitan Assembly,2011,CONSTRUCTION OF 0.9M U DRAINS ON TWUM STREET-ABEKA,road fund,5/31/2011,,,,,Accra Metropolitan Assembly,2011-05-31,,
Accra Metropolitan Assembly,2011,CONSTRUCTION OF 0.9M U DRAIN ALONG EMMANSE CRESENT LINK ROAD-LA BAKERY,road fund,5/23/2011,,,,,Accra Metropolitan Assembly,2011-05-23,,
Accra Metropolitan Assembly,2011,REHABILITATON OF KOTEI STREET (0+000+0+30) AND (0+300+0+600),road fund,4/28/2011,,,,,Accra Metropolitan Assembly,2011-04-28,,
Accra Metropolitan Assembly,2011,CONSTRUCTION OF 0.6M U DRAINS ALONGTREMA ST. (LHS)-NII BOI TOWN,road fund,5/31/2011,,,,,Accra Metropolitan Assembly,2011-05-31,,
Accra Metropolitan Assembly,2011,CONSTRUCTION OF 0.6M U DRAIN ON WOOD STREET LHS ZONGO,road fund,5/31/2011,,,,,Accra Metropolitan Assembly,2011-05-31,,
Accra Metropolitan Assembly,2011,CONSTRUCTION OF 0.6M UDRAIN ON REV. HESSE ROAD OSU,road fund,5/31/2011,,,,,Accra Metropolitan Assembly,2011-05-31,,
Accra Metropolitan Assembly,2011,CONSTRUCTION OF 0.6M U DRAIN ON ALONG 1ST MAHOGANY LINK (CH.0+220-0+440)-DZORWULU,road fund,4/28/2011,,,,,Accra Metropolitan Assembly,2011-04-28,,
Accra Metropolitan Assembly,2011,CONSTRUCTION OF 1 NO. LAY BY ON GUGUGISBER AVENUE (PAPILON),road fund,4/14/2011,,,,,Accra Metropolitan Assembly,2011-04-14,,
Accra Metropolitan Assembly,2011,CONSTRUCTION OF 0.6M U DRAIN ON ALONG 3RD STREET MEMPEASEM RHS,road fund,5/3/2011,,,,,Accra Metropolitan Assembly,2011-05-03,,
Accra Metropolitan Assembly,2011,CONSTRUCTION OF 0.6M U DRAIN ALONG KWASHIE BEDZRO EXTENTION AND KOKOR LINK-AKWETEMAN,road fund,5/12/2011,,,,,Accra Metropolitan Assembly,2011-05-12,,
Accra Metropolitan Assembly,2011,CONSTRUCTION OF 0.9M U DRAIN ALONG KORKOR STREET-LHS (CH:0+140-0+310) AKWETEMAN,road fund,5/12/2011,,,,,Accra Metropolitan Assembly,2011-05-12,,
Accra Metropolitan Assembly,2011,CONSTRUCTION OF 0.6M U DRAIN ALONG 2ND DAMBA LINK 2-DANSOMAN,road fund,11/2/2011,,,,,Accra Metropolitan Assembly,2011-11-02,,
Accra Metropolitan Assembly,2011,CONSTRUCTION OF 0.6U M DRAINS ON LANTE GEORGE LINK ROAD RHS LA,road fund,4/20/2011,,,,,Accra Metropolitan Assembly,2011-04-20,,
Accra Metropolitan Assembly,2011,CONSTRUCTION OF 0.6M U DRAINS ON FANAA LINK-MAMPROBI,road fund,11/2/2010,,,,,Accra Metropolitan Assembly,2010-11-02,,
Accra Metropolitan Assembly,2011,CONSTRUCTION OF 0.9M & 0.6M U DRAIN AND ALONG ODUM STREET AND LINKS-NORTH-DZORWULU,road fund,4/3/2011,,,,,Accra Metropolitan Assembly,2011-04-03,,
Accra Metropolitan Assembly,2011,CONSTRUCTION OF 0.6M U DRAIN ALONG KUM HOTEL ROAD-(CH:0+000-0+250),road fund,5/12/2011,,,,,Accra Metropolitan Assembly,2011-05-12,,
Accra Metropolitan Assembly,2011,CONSTRUCTION OF 0.6M U DRAIN ALONG MAMPONG OKAI STREET-RHS DANSOMAN,road fund,4/12/2011,,,,,Accra Metropolitan Assembly,2011-04-12,,
Accra Metropolitan Assembly,2011,CONSTRUCTION OF 0.45M U DRAINS ALONG GHANA LINK LHS-EAST LEGON,road fund,4/28/2011,,,,,Accra Metropolitan Assembly,2011-04-28,,
Accra Metropolitan Assembly,2011,CONSTRUCTION OF 0.6M U DRAIN ON ALONG 1ST MAHOGANY LINK (CH.0000-0+220),road fund,6/9/2011,,,,,Accra Metropolitan Assembly,2011-06-09,,
Accra Metropolitan Assembly,2011,DRAINAGE WORKS ALONG KOTEY STREET LINK-BUBUASHIE (RELEASE OF FULL RETENTION),road fund,4/4/2011,,,,,Accra Metropolitan Assembly,2011-04-04,,
Accra Metropolitan Assembly,2011,CONSTRUCTION OF 0.6M U DRAIN ALONG-TREMA ST. (LHS)-NII BOI TOWN,road fund,4/4/2011,,,,,Accra Metropolitan Assembly,2011-04-04,,
Accra Metropolitan Assembly,2011,CONSTRUCTION OF 0.6M U DRAIN ALONG TREMA STREET (LHS) RELEASE OF FULL RETENTION,road fund,4/4/2011,,,,,Accra Metropolitan Assembly,2011-04-04,,
Accra Metropolitan Assembly,2011,CONSTRUCTION OF 0.6M U DRAIN ALONG NANKA BRUCE ROAD,road fund,4/4/2011,,,,,Accra Metropolitan Assembly,2011-04-04,,
Accra Metropolitan Assembly,2011,CONSTRUCTION OF 0.6M U DRAIN ON ALONG DANSO RHS (CHAINAGE 0+500-0+75)-LARTEBIOKOSHIE,road fund,11/2/2010,,,,,Accra Metropolitan Assembly,2010-11-02,,
Accra Metropolitan Assembly,2011,CONSTRUCTION OF 0.6M U DRAINS ALONG KAY BELLIE KLAER,road fund,5/23/2011,,,,,Accra Metropolitan Assembly,2011-05-23,,
Accra Metropolitan Assembly,2011,CONSTRUCTION OF 0.6M U DRAIN AT ABERBRESE LINK-OSU,road fund,7/21/2011,,,,,Accra Metropolitan Assembly,2011-07-21,,
Accra Metropolitan Assembly,2011,CONSTRUCTION OF 0.9M PIPE CULBERTTS ON RING ROAD WEST (TOTAL FILLING STATION) RHS-CHAINAGE 0+060-0+120,road fund,4/14/2011,,,,,Accra Metropolitan Assembly,2011-04-14,,
Accra Metropolitan Assembly,2011,CONSTRUCTION OF 0.6M U DRAIN ON GBEGBE ROAD-DANSOMAN,road fund,7/3/2011,,,,,Accra Metropolitan Assembly,2011-07-03,,
Accra Metropolitan Assembly,2011,CONSTRUCTION OF 0.6M U DRAINS ALONG KWAME STREET (RHS) RLEASE OF FULL RETENTION,road fund,5/11/2010,,,,,Accra Metropolitan Assembly,2010-05-11,,
Accra Metropolitan Assembly,2011,CONSTRUCTION OF 0.6M U DRAIN ALONG APPAPA LINK LHS (CHAINAGE 0+440-0+660,road fund,5/23/2011,,,,,Accra Metropolitan Assembly,2011-05-23,,
Accra Metropolitan Assembly,2011,CONSTRUCTION OF 0.6M U DRAIN ALONG SUNFLOWER STREET CHAINAGE 0+000-0+250) LHS-DARKUMAN,road fund,4/14/2011,,,,,Accra Metropolitan Assembly,2011-04-14,,
Accra Metropolitan Assembly,2011,MINOR DRAINAGE REPAIR IN ABLEKUMA CENTRAL SUB-METRO,road fund,5/11/2010,,,,,Accra Metropolitan Assembly,2010-05-11,,
Accra Metropolitan Assembly,2011,CONSTRUCTION OF 0.6M U DRAIN ON DANSO LHS CHAINAGE 0+500-0+750 LARTEBIOKOSHIE,road fund,11/20/2010,,,,,Accra Metropolitan Assembly,2010-11-20,,
Accra Metropolitan Assembly,2011,CONSTRUCTION OF 0.6M U DRAINS ON KWAME STREET - ABEKA (CH:0+110-0+330),road fund,8/1/2011,,,,,Accra Metropolitan Assembly,2011-08-01,,
Accra Metropolitan Assembly,2011,GRAVELLING WORKS ON ASOYELI CRESENT-EAST LEGON,road fund,5/11/2010,,,,,Accra Metropolitan Assembly,2010-05-11,,
Accra Metropolitan Assembly,2011,CONSTRUCTION OF 0.6M U DRAIN ON DUGUMA LINK (ANIGYEKROM)-DARKUMAN AND 0.9M U DRANS ON WUO LANE-SAKAMAN,road fund,11/2/2010,,,,,Accra Metropolitan Assembly,2010-11-02,,
Accra Metropolitan Assembly,2011,CONSTRUCTION OF 2.5M X 1.7M STORM DRAIN ON DADEBAN (CH: 0+075-0+100),road fund,3/18/2011,,,,,Accra Metropolitan Assembly,2011-03-18,,
Accra Metropolitan Assembly,2011,CONSTRUCTION OF 2.5M X 1.7M STORM DRAIN ON DADEBAN ROAD-(CH:0+025-0+050),road fund,3/18/2011,,,,,Accra Metropolitan Assembly,2011-03-18,,
Accra Metropolitan Assembly,2011,CONSTRUCITON OF 2.5M U STORM DRAIN ON DADEBAN ROAD-(CH:0+000-0+250),road fund,5/3/2011,,,,,Accra Metropolitan Assembly,2011-05-03,,
Accra Metropolitan Assembly,2011,CONSTRUCTION OF 0.6M U DRAINALONG JONKOBRI ROAD MATAHEKO,road fund,4/14/2011,,,,,Accra Metropolitan Assembly,2011-04-14,,
Accra Metropolitan Assembly,2011,CONSTRUCTION OF 0.6M U DRAINS ON MANGO LINK-BUBUASHIE,road fund,2/2/2011,,,,,Accra Metropolitan Assembly,2011-02-02,,
Accra Metropolitan Assembly,2011,CONSTRUCTION OF 0.6M U DRAIN ON DANSO RHS (CHAINAGE:0+500+0+750),road fund,11/2/2010,,,,,Accra Metropolitan Assembly,2010-11-02,,
Accra Metropolitan Assembly,2011,CONSTRUCTION OF 0.6M U DRAIN ALONG SUNFLOWER STREET (CHAINAGE0+250-0+500) LKHS-DARKUMAN,road fund,4/14/2011,,,,,Accra Metropolitan Assembly,2011-04-14,,
Accra Metropolitan Assembly,2011,CONSTRUCTION OF 0.6M U DRAIN ALONG SUNFLOWER STREET (CHAINAGE 0+250-0+500) RHSS-DRAKUMAN,road fund,4/14/2011,,,,,Accra Metropolitan Assembly,2011-04-14,,
Accra Metropolitan Assembly,2011,CONSTRUCTION OF 0.6M U DRAINS AT TWUMASIWAA LINK-EAST LEGON,road fund,9/15/2011,,,,,Accra Metropolitan Assembly,2011-09-15,,
Accra Metropolitan Assembly,2011,CONSTRUCTION OF 0.9M U DRAINS ALONG LANKAI ROAD-NORTH KANESHIE,road fund,9/15/2011,,,,,Accra Metropolitan Assembly,2011-09-15,,
Accra Metropolitan Assembly,2011,CONSTRUCTION OF 2.5M U X 1.7M STORM DRAIN ON DADEBAN ROAD (CH:0+025-0+050),road fund,5/20/2011,,,,,Accra Metropolitan Assembly,2011-05-20,,
Accra Metropolitan Assembly,2011,CONSTRUCTION OF 0.60M UDRAINS ON ENGAA LINK (CH:0+200-0+400),road fund,2/1/2011,,,,,Accra Metropolitan Assembly,2011-02-01,,
Accra Metropolitan Assembly,2011,CONSTRUCTION OF 2.5M X 1.5M STORM DRAIN AT ASAMANTWI-ODORKOR,road fund,4/11/2011,,,,,Accra Metropolitan Assembly,2011-04-11,,
Accra Metropolitan Assembly,2011,CONSTRUCTION OF 0.6M U DRAINS ON ENGAA LINK (CH:0+000-0+200)-NII BOI TOWN,road fund,2/1/2011,,,,,Accra Metropolitan Assembly,2011-02-01,,
Accra Metropolitan Assembly,2011,CONSTRUCTION OF 0.6M U DRAINS ON 1ST AVUNE RHS-DARKUMAN,road fund,4/14/2011,,,,,Accra Metropolitan Assembly,2011-04-14,,
Accra Metropolitan Assembly,2011,MINOR DRAINAGE REPAIR WORKS IN LA DADEKOTOPON SUB METRO,road fund,7/17/2011,,,,,Accra Metropolitan Assembly,2011-07-17,,
Accra Metropolitan Assembly,2011,CONSTRUCTION OF 0.6M U DRAIN ALONG ANUMANSA STREET (CH:0+000-0+220),road fund,7/17/2011,,,,,Accra Metropolitan Assembly,2011-07-17,,
Accra Metropolitan Assembly,2011,MINOR DRAINAGE REPAIR WORK IN ABLEKUMA CENTRAL SUB METRO,road fund,10/25/2011,,,,,Accra Metropolitan Assembly,2011-10-25,,
Accra Metropolitan Assembly,2011,CONSTRUCTION OF DOUBLE CELL 2M X 1.5M BOX CULVERT ON KLA BLI KLAER ROAD EAST LEGON,road fund,7/13/2011,,,,,Accra Metropolitan Assembly,2011-07-13,,
Accra Metropolitan Assembly,2011,CONSTRUCTION 0.6M U DRAIN ALONG MAMPONG OKAI STREET LHS-DANSOMAN,road fund,4/14/2011,,,,,Accra Metropolitan Assembly,2011-04-14,,
Accra Metropolitan Assembly,2011,CONSTRUCTION OF 0.6M UDRA IN ALONG BLACKBERRY STREET,road fund,7/28/2011,,,,,Accra Metropolitan Assembly,2011-07-28,,
Accra Metropolitan Assembly,2011,CONSTRUCTION OF 0.6M U DRAIN ALONG EMMAUSE (CH:0+220-0+440),road fund,4/5/2011,,,,,Accra Metropolitan Assembly,2011-04-05,,
Accra Metropolitan Assembly,2011,CONSTRUCTION OF 0.6M U DRAIN ALONG BLACK BERRY STREET-EAST LEGON,road fund,7/28/2011,,,,,Accra Metropolitan Assembly,2011-07-28,,
Accra Metropolitan Assembly,2011,DRAINAGE WORKS AROUND CMB FLATS MUKOSE,road fund,9/27/2011,,,,,Accra Metropolitan Assembly,2011-09-27,,
Accra Metropolitan Assembly,2011,CONSTRUCTION OF 0.6M U DRAIN ALONG LAGOS AVENUE LINK-EAST LEGON (CH:0+090-0+300),road fund,9/7/2011,,,,,Accra Metropolitan Assembly,2011-09-07,,
Accra Metropolitan Assembly,2011,MINOR DRAINAGE WORKS IN ABLEKUMA NORTH SUB METRO,road fund,4/14/2011,,,,,Accra Metropolitan Assembly,2011-04-14,,
Accra Metropolitan Assembly,2011,CONSTRUCTION OF M U DRAIN ALONG TROA STREET (CH:0+000-0+220) OSU,road fund,4/14/2011,,,,,Accra Metropolitan Assembly,2011-04-14,,
Accra Metropolitan Assembly,2011,CONSTRUCTION OF 0.45M U DRAIN ALONG SAGS HOTEL ROAD (CH:0+330-0+660),road fund,5/12/2011,,,,,Accra Metropolitan Assembly,2011-05-12,,
Accra Metropolitan Assembly,2011,CONSTRUCTION OF 0.6M U DRAINS ON NAA ATOBIA STREET,road fund,8/6/2011,,,,,Accra Metropolitan Assembly,2011-08-06,,
Accra Metropolitan Assembly,2011,CONSTRUCTION 06M DRAIN ALONG EMMAUSE CRESENT (CH:0+440-660) LHS-LA,road fund,4/28/2011,,,,,Accra Metropolitan Assembly,2011-04-28,,
Accra Metropolitan Assembly,2011,CONSTRUCTION OF 0.6M U DRAINS AT AGBOGLOSHIE RHS,road fund,11/25/2010,,,,,Accra Metropolitan Assembly,2010-11-25,,
Accra Metropolitan Assembly,2011,CONSTRUCTION OF 0.6M U DRAIN ALONG SUNFLOWER STREET RHS (CH.0+000-0+250)-EAST LEGON,road fund,9/27/2011,,,,,Accra Metropolitan Assembly,2011-09-27,,
Accra Metropolitan Assembly,2011,CONSTRUCTION OF 0.6M U DRAIN ALONG ACROPOLIS ROAD (CHAINAGE 0+220-0,road fund,7/14/2011,,,,,Accra Metropolitan Assembly,2011-07-14,,
Accra Metropolitan Assembly,2011,CONSTRUCTION OF 0.6M U DRAIN ON TROSS SYTREE RHS (CH:0+440-660),road fund,11/27/2011,,,,,Accra Metropolitan Assembly,2011-11-27,,
Accra Metropolitan Assembly,2011,CONSTRUCTION OF 2.5M X 1.5M STORM DRAIN AT ASAMANTWI PHASE 11,road fund,11/2/2010,,,,,Accra Metropolitan Assembly,2010-11-02,,
Accra Metropolitan Assembly,2011,CONSTRUCTION OF 0.6M U DRAIN ALONG WUO STREET JUNCTIONS-SAKAMAN,road fund,11/2/2010,,,,,Accra Metropolitan Assembly,2010-11-02,,
Accra Metropolitan Assembly,2011,CONSTRUCTION OF 0.6M U DRAIN ALONG BLOHUM STREET AND LINK-DZORWULU,road fund,9/5/2011,,,,,Accra Metropolitan Assembly,2011-09-05,,
Accra Metropolitan Assembly,2011,CONSTRUCTION OF 0.6M U DRAIN ALONG PREMIA LINK LHS,road fund,4/14/2011,,,,,Accra Metropolitan Assembly,2011-04-14,,
Accra Metropolitan Assembly,2011,CONSTRUCTION OF 0.6M U DRAIN ALONG KORKOR STREET RHS-(CH.0+000-240)-AKWETEMAN,road fund,8/6/2011,,,,,Accra Metropolitan Assembly,2011-08-06,,
Accra Metropolitan Assembly,2011,CONSTRUCTION OF 0.6M U DRAIN ALONG GARDEN LINK -EAST LEGON,road fund,8/5/2011,,,,,Accra Metropolitan Assembly,2011-08-05,,
Accra Metropolitan Assembly,2011,CONSTRUCTION OF 0.6M U DRAINS ON CARROT STREET (CH:0+000-0+200) EAST LEGON,road fund,1/30/2011,,,,,Accra Metropolitan Assembly,2011-01-30,,
Accra Metropolitan Assembly,2011,CONSTRUCTION OF 0.6M U DRAIN ALONG KOFI PORTOPHY STREET (CHAINAGE 0+00-0+240),road fund,8/6/2011,,,,,Accra Metropolitan Assembly,2011-08-06,,
Accra Metropolitan Assembly,2011,CONSTRUCTION OF 0.6M U DRAIN ON OPLEN STREET - FADAMA,road fund,7/15/2011,,,,,Accra Metropolitan Assembly,2011-07-15,,
Accra Metropolitan Assembly,2011,CONSTRUCTION OF 0.45M U DRAIN ALONG KOFI PORTOPHY LINK (CHAINAGE 0+000-0+275),road fund,8/6/2011,,,,,Accra Metropolitan Assembly,2011-08-06,,
Accra Metropolitan Assembly,2011,CONSTRUCTION OF 0.6M U DRAIN ALONG KORKOR STREET -RHS (CHAINAGE 0+240-0+480),road fund,8/3/2011,,,,,Accra Metropolitan Assembly,2011-08-03,,
Accra Metropolitan Assembly,2011,CONSTRUCTION OF 0.6M U DRAIN ALONG BRUCE STREET -ACCRA CENTRAL,road fund,7/15/2011,,,,,Accra Metropolitan Assembly,2011-07-15,,
Accra Metropolitan Assembly,2011,"CONSTRUCTION OF 0.6M U DRAIN ALONG ADO STREET, EAST LEGON",road fund,7/15/2011,,,,,Accra Metropolitan Assembly,2011-07-15,,
Accra Metropolitan Assembly,2011,"CONSTRUCTION OF 0.6M U DRAIN ALONG HOLY STREET, EAST LEGON",road fund,7/15/2011,,,,,Accra Metropolitan Assembly,2011-07-15,,
Accra Metropolitan Assembly,2011,CONSTRUCTION OF 0.6M U DRAIN ALONG AMANNTRA LINK LHS- KOTOBABI,road fund,10/7/2010,,,,,Accra Metropolitan Assembly,2010-10-07,,
Accra Metropolitan Assembly,2011,CONSTRUCTION OF 0.9M U DRAIN ALONG KORKOR STREET -LHS (CH:0+310-480)-AKWETEMAN,road fund,5/12/2011,,,,,Accra Metropolitan Assembly,2011-05-12,,
Accra Metropolitan Assembly,2011,CONSTRUCTION OF 0.6M U DRAIN ALONG 22ND DAMBA CLOSE-DANSOMAN,road fund,11/2/2010,,,,,Accra Metropolitan Assembly,2010-11-02,,
Accra Metropolitan Assembly,2011,"CONSTRUCTION OF KOJOTSO STREET-DARKUMAN,AN (CHAINAGE 0+000-0+3000",road fund,11/2/2010,,,,,Accra Metropolitan Assembly,2010-11-02,,
Accra Metropolitan Assembly,2011,CONSTRUCTION OF 0.6M U DRAIN ALONG 1ST LINK TO OUTER RING ROAD,road fund,4/14/2011,,,,,Accra Metropolitan Assembly,2011-04-14,,
Accra Metropolitan Assembly,2011,CONSTRUCTION OF 0.6M U DRAIN ALONG ACROPOLIS ROAD (CHAINGE:0+000-0+220),road fund,7/4/2011,,,,,Accra Metropolitan Assembly,2011-07-04,,
Accra Metropolitan Assembly,2011,CONSTRUCTION OF 0.6M U DRAIN ON LANTE GEORGE LINK RAOD LHS-LA,road fund,12/10/2010,,,,,Accra Metropolitan Assembly,2010-12-10,,
Accra Metropolitan Assembly,2011,CONSTRUCTION OF 0.45M U DRAIN ON 3RD DADEWALK (0+150-0+480) RHS,road fund,7/25/2011,,,,,Accra Metropolitan Assembly,2011-07-25,,
Accra Metropolitan Assembly,2011,CONSTRUCTION OF 0.6M U DRAIN ON 4TH STREET (0+000-300),road fund,6/23/2011,,,,,Accra Metropolitan Assembly,2011-06-23,,
Accra Metropolitan Assembly,2011,CONSTRUCTION OF 0.6M U DRAIN AT AGBOGBLOSHIE LHS,road fund,4/14/2011,,,,,Accra Metropolitan Assembly,2011-04-14,,
Accra Metropolitan Assembly,2011,CONSTRUCTION OF 0.6M U DRAIN ALONG ST. JOSEPH STREET,road fund,4/14/2011,,,,,Accra Metropolitan Assembly,2011-04-14,,
Accra Metropolitan Assembly,2011,CONSTRUCTION OF 0.9M U DRAINS ON TWUM STREET - ABEKA,road fund,4/12/2011,,,,,Accra Metropolitan Assembly,2011-04-12,,
Accra Metropolitan Assembly,2011,CONSTRUCTION OF 0.6M U DRAIN ALONG SUN FLOWER STREET RHS,road fund,9/27/2011,,,,,Accra Metropolitan Assembly,2011-09-27,,
Accra Metropolitan Assembly,2011,CONSTRUCTION OF 0.6M U DRAIN ALONG NANKA BRUCE LINK ROAD LHS (CHAINGE 0+000-0+240),road fund,4/14/2011,,,,,Accra Metropolitan Assembly,2011-04-14,,
Accra Metropolitan Assembly,2011,CONSTRUCTION OF 0.6M U DRAIN ALONG KOFI PORTOPHY REET (CHAINAGE 0+240-0+480),road fund,9/6/2011,,,,,Accra Metropolitan Assembly,2011-09-06,,
Accra Metropolitan Assembly,2011,CONSTRUCTION OF 0.6M U DRAIN ALONG ANUMANSA STREET (CH.0+220-0+440)-OSU,road fund,6/22/2011,,,,,Accra Metropolitan Assembly,2011-06-22,,
Accra Metropolitan Assembly,2011,CONSTRUCTION OF 0.6M U DRAIN ALONG SUN FLOWER STREET LHS (CH.1+250-1+500)-EAST LEGON,road fund,Jan-11,,,,,Accra Metropolitan Assembly,2011-01-01,,
Accra Metropolitan Assembly,2011,CONSTRUCTION OF WALKWAY AT KASSADJAN WITHIN GONTEN ELECTORAL AREA IN THE OKAIKOI SOUTH METRO-(LOT 17A),road fund,Mar-11,,,,,Accra Metropolitan Assembly,2011-03-01,,
Accra Metropolitan Assembly,2011,CONSTRUCT FOR THE CONVERSION OF TOILET FACILITY INTO HEALTH POST AT NEW FADAMA IN THE GBEMONO ELECTRORAL AREA,dacf,Feb-11,,,,,Accra Metropolitan Assembly,2011-02-01,,
Accra Metropolitan Assembly,2011,CONSTRUCT FOR THE CONVERSION OF TOILET FACILITY INTO HEALTH POST AT NEW FADAMA IN THE GBEMONO ELECTORAL ATREA,dacf,Feb-11,,,,,Accra Metropolitan Assembly,2011-02-01,,
Accra Metropolitan Assembly,2011,CONSTRUCTION OF 3 NO. HARDWOOD FOOT BIRDGES IN THE WUOYENMAN ELECTORAL AREA,dacf,Jan-11,,,,,Accra Metropolitan Assembly,2011-01-01,,
Accra Metropolitan Assembly,2011,CONSTRUCTION OF PVC PIPE DRAINAGE AT BOTWE IN THE WUOYEMAN-(LOT 13A),dacf,Jan-11,,,,,Accra Metropolitan Assembly,2011-01-01,,
Accra Metropolitan Assembly,2011,INSTALLATION OF 15 NO. STREETLIGHTS WITHIN GBEBU ELECTORAL AREA IN THE ABLEKUMA SOUTH SUB METRO,igf,3/15/2011,,,,,Accra Metropolitan Assembly,2011-03-15,,
Accra Metropolitan Assembly,2011,CONVERSION OF TOILET FACILITY INTO HEALTH FACILITY AT NEW FADAMA IN THE GBEMOMO ELECTORAL AREA (LOT 16 A),dacf,Feb-11,,,,,Accra Metropolitan Assembly,2011-02-01,,
Accra Metropolitan Assembly,2011,15 NO. STREETLIGHTS WITHIN MAMPROBI ELECTORAL AREA IN THE ABLEKUMA CENTRAL SUB-METRO (LOT 42),dacf,Mar-11,,,,,Accra Metropolitan Assembly,2011-03-01,,
Accra Metropolitan Assembly,2011,INSTALLATION OF 15 NO. STREETLIGHTS WITHIN MAMOBI EAST ELECTORAL AREA AYAWASO EAST SUB-METRO (LOT 51),dacf,Mar-11,,,,,Accra Metropolitan Assembly,2011-03-01,,
Accra Metropolitan Assembly,2011,INSTALLATION OF 35 NO. STREETLIGHTS AT ROMAN/AIRPORT RESIDENTIAL AREA IN THE AYAWASO WEST SUB METRO (LOT 25A),dacf,Feb-11,,,,,Accra Metropolitan Assembly,2011-02-01,,
Accra Metropolitan Assembly,2011,INSTALATION OF 15 NO. STREETLIGHTS WITHIN NGLESHIE ELECTORAL AREA IN THE ASHEIDU KETEKE SUB METRO LOT 26,dacf,Aug-11,,,,,Accra Metropolitan Assembly,2011-08-01,,
Accra Metropolitan Assembly,2011,INSTALATION OF 15 NO. STREETLIGHTS WITHIN KAAJAANO ELECTORAL AREA IN THE LA SUB METRO LOT 27,dacf,Aug-11,,,,,Accra Metropolitan Assembly,2011-08-01,,
Accra Metropolitan Assembly,2011,INSTALLATION OF 10 NO. AND MAINTNACE ARYEE STREETLIGHTS DIKI ELELECTORAL AREA WITHIN THE AYAWASO CENTRAL SUB METRO,dacf,Aug-11,,,,,Accra Metropolitan Assembly,2011-08-01,,
Accra Metropolitan Assembly,2011,MAINTENANCE OF 50 NO. STREETLIGHTS WITHIN LAKPANAA ELECTORAL AREA IN THE LA SUB METRO (LOT 50-201),dacf,10/10/2010,,,,,Accra Metropolitan Assembly,2010-10-10,,
Accra Metropolitan Assembly,2011,RE ROOFING OF 6 CLOCK AND REONSTRUCTION OF A CANTEEN DOR DANSOMAN 2 JUNIOR SECONDARY SCHOOL,dacf,10/10/2010,,,,,Accra Metropolitan Assembly,2010-10-10,,
Accra Metropolitan Assembly,2011,REPAIR AND RECONSTRUCTION OF FENCE WALL FOR AYALOLO CLUSTER OF SCHOOLS AT ARENA,igf,3/15/2010,,,,,Accra Metropolitan Assembly,2010-03-15,,
Adaklu-Anyigbe District Assembly,2011,REHABILITATION OF TOILET FACILITIES AT ZIOPE AND MARKETS,dacf,,Feb-11,,,,Agotime-Ziope District Assembly,,2011-02-01,
Adaklu-Anyigbe District Assembly,2011,CONSTRUCT 1 NO 3 UNIT CLASSROOM BLK OFF & STORE,dacf,,May-08,,,,Agotime-Ziope District Assembly,,2008-05-01,
Adaklu-Anyigbe District Assembly,2011,CONSTRUCT 1 NO 3 UNIT CLASSROOM BLK OFF STORE & STAFF COMMON ROOM,dacf,,Mar-11,,,,Agotime-Ziope District Assembly,,2011-03-01,
Adaklu-Anyigbe District Assembly,2011,CONSTRUCT 1 NO 3 UNIT CLASSROOM BLK OFF STORE & STAFF COMMON ROOM,dacf,,Feb-11,,,,Agotime-Ziope District Assembly,,2011-02-01,
Adaklu-Anyigbe District Assembly,2011,CONSTRUCT 1 NO 3 UNIT CLASSROOM BLK & LIBRARY,dacf,,Feb-11,,,,Agotime-Ziope District Assembly,,2011-02-01,
Adaklu-Anyigbe District Assembly,2011,CONSTRUCT 1 NO 3 UNIT CLASSROOM BLK & LIBARRY,dacf,,,,,,Agotime-Ziope District Assembly,,,
Adaklu-Anyigbe District Assembly,2011,REHABILITATION 1 NO 6 UNIT CLASSROOM BLK & LIBRARY,dacf,,Jan-11,,,,Agotime-Ziope District Assembly,,2011-01-01,
Adaklu-Anyigbe District Assembly,2011,CONSTRUCTION OF 1 NO 3 UNIT CLASSROOM BLK & LIBRARY,dacf,,,,,,Agotime-Ziope District Assembly,,,
Adaklu-Anyigbe District Assembly,2011,COMPLETION OF 1NO 3 UNIT CLASSROOM BLOCK,dacf,,Mar-11,,,,Agotime-Ziope District Assembly,,2011-03-01,
Adaklu-Anyigbe District Assembly,2011,REHABILITATION OF A HEALTH CENTRE,dacf,,Jul-11,,,,Agotime-Ziope District Assembly,,2011-07-01,
Adaklu-Anyigbe District Assembly,2011,COMPLETION OF A HEALTH CENTRE,dacf,,Mar-11,,,,Agotime-Ziope District Assembly,,2011-03-01,
Adaklu-Anyigbe District Assembly,2011,CONSTRUCTION OF A LABORATORY,dacf,,Feb-11,,,,Agotime-Ziope District Assembly,,2011-02-01,
Adaklu-Anyigbe District Assembly,2011,COMPLETION OF A 3 UNIT CLASS ROOM BLOCK STAFF COMMON ROOM AND 6 UNIT WC TOILET,dacf,,Mar-11,,,,Agotime-Ziope District Assembly,,2011-03-01,
Adansi North District Assembly,2011,CONSTRUCTION OF ADMINISTRATION BLOCK COMPLEX,dacf,11/17/2006,,,,,Adansi North District Assembly,2006-11-17,,
Adansi North District Assembly,2011,CONSTRUCTION OF 6 UNIT CLASSROOM BLOCK AND ANCILLARY FACILITIES,getfund,6/3/2010,6/17/2010,,,,Adansi North District Assembly,2010-06-03,2010-06-17,
Adansi North District Assembly,2011,PRESIDENTIAL ACCOMMODATION FOR OFFICERS POSTED TO THE DISTRICT,dacf,10/20/2009,11/2/2009,,,,Adansi North District Assembly,2009-10-20,2009-11-02,
Adansi North District Assembly,2011,ADMINSTRATION BLOCK FOR TI AMASS,dacf,3/18/2010,9/14/2010,,,,Adansi North District Assembly,2010-03-18,2010-09-14,
Adansi North District Assembly,2011,1 NO 2 UNIT BEDROOM SEMI-DETACH STAFF QTRS,dacf,10/20/2009,11/6/2009,,,,Adansi North District Assembly,2009-10-20,2009-11-06,
Adansi North District Assembly,2011,CLADDING AND REHABILITATION OF CLASSROOM BLOCK,dacf,3/11/2010,6/15/2010,,,,Adansi North District Assembly,2010-03-11,2010-06-15,
Adansi North District Assembly,2011,CLADDING AND REHABILITATION OF CLASSROOM BLOCK,dacf,3/11/2010,6/15/2010,,,,Adansi North District Assembly,2010-03-11,2010-06-15,
Adansi North District Assembly,2011,CONSTRUCTION OF 1NO 6 UNIT CLASSROOM BLK OFFICE STORE AND 4 SEATER KVIP TOILET,getfund,8/25/2010,,,,,Adansi North District Assembly,2010-08-25,,
Adansi North District Assembly,2011,CONSTRUCTION OF 1 NO 3 UNIT CLASSROOM BLOCK OFFICE AND STORE,dacf,9/30/2008,5-Mar,,,,Adansi North District Assembly,2008-09-30,2009-03-05,
Adansi North District Assembly,2011,CONSTRUCTION OF 1NO 6 UNIT CLASSROOM BLK OFFICE STORE AND 4 SEATER WC TOILET,getfund,8/25/2010,,,,,Adansi North District Assembly,2010-08-25,,
Adansi North District Assembly,2011,CONSTRUCTION OF POLICE COMMANDERS BUNGALOW,dacf,10/20/2009,11/23/2009,,,,Adansi North District Assembly,2009-10-20,2009-11-23,
Adansi North District Assembly,2011,CONSTRUCTION OF 1NO 6 UNIT CLASSROOM BLOCK STAFF COMMON ROOM OFFICE STORE AND LIBRARY,other/unknown,,8/30/2010,,,,Adansi North District Assembly,,2010-08-30,
Adansi North District Assembly,2011,CONSTRUCTION OF 1NO 6 UNIT CLASSROOM BLOCK STAFF COMMON ROOM OFFICE STORE AND LIBRARY,other/unknown,8/5/2010,8/30/2010,,,,Adansi North District Assembly,2010-08-05,2010-08-30,
Adansi North District Assembly,2011,CONSTRUCTION OF FOMENA TOWN ROAD,other gog,,,,,,Adansi North District Assembly,,,
Adansi North District Assembly,2011,CONSTRUCTION OF AKROKERRI TOWN ROADS,other gog,,,,,,Adansi North District Assembly,,,
Adansi North District Assembly,2011,CONSTRUCTION OF 1NO 6 UNIT DORMITORY BLOCK AT ASARE BEDIAKO SHS,getfund,,,,,,Adansi North District Assembly,,,
Adansi North District Assembly,2011,CONSTRUCTION OF 1NO 3 UNIT CLASSROOM BLOCK OFFICE STORE STAFF COMMON ROOM AND 4 SEATER KVIP,dacf,,,,,,Adansi North District Assembly,,,
Adansi North District Assembly,2011,CONSTRUCTION OF FENCE WALL METAL ENTRANCE GATE AND PAVEMENT AT COMMUNITY HEALTH NURSING TRAININING  SCHOOL,dacf,,,,,,Adansi North District Assembly,,,
Adansi North District Assembly,2011,CONSTRUCTION OF OFFICE BLOCK FOR DISTRICT DIRECTORATE OF MOFA,other gog,,,,,,Adansi North District Assembly,,,
Adansi North District Assembly,2011,REHABILITATION OF 1 NO 6 UNIT CLASSBLOCK OFFICE AND STORE,dacf,,,,,,Adansi North District Assembly,,,
Adansi North District Assembly,2011,CONSTRUCTION OF 1NO 6 UNIT CLASSROOM BLOCK WITH ANCILLARY FACILITIES,getfund,8/25/2010,,,,,Adansi North District Assembly,2010-08-25,,
Adansi North District Assembly,2011,CONSTRUCTION OF 1NO 6 UNIT CLASSROOM BLOCK WITH ANCILLARY FACILITIES,getfund,8/25/2010,,,,,Adansi North District Assembly,2010-08-25,,
Adansi North District Assembly,2011,CONSTRUCTION OF 1NO 6 UNIT CLASSROOM BLOCK WITH ANCILLARY FACILITIES,getfund,8/25/2010,,,,,Adansi North District Assembly,2010-08-25,,
Adansi South District Assembly,2011,CONSTRUCTION 3 UNIT CLASSROOM BLOCK,ddf,8/5/2010,8/25/2010,,,,Adansi South District Assembly,2010-08-05,2010-08-25,
Adansi South District Assembly,2011,CONSTRUCTION OF 6 UNIT CLASSROOM,dacf,,,,,,Adansi South District Assembly,,,
Adansi South District Assembly,2011,CONSTRUCTION OF 3 UNIT RESIDENTIAL ACCOMODATION,dacf,,,,,,Adansi South District Assembly,,,
Adansi South District Assembly,2011,CONSTRUCTION OF 4-UNIT RESIDENTIAL ACCOMMODATION,dacf,,,,,,Adansi South District Assembly,,,
Adansi South District Assembly,2011,CONSTRUCTION CLASSROOM BLOCK,ddf,,,,,,Adansi South District Assembly,,,
Adansi South District Assembly,2011,CONSTRUCTION 3 UNIT CLASSROOM BLOCK,dacf,,,,,,Adansi South District Assembly,,,
Adansi South District Assembly,2011,CONSTRUCTION 3 UNIT CLASSROOM BLOCK,ddf,,,,,,Adansi South District Assembly,,,
Adansi South District Assembly,2011,CONSTRUCTION 3 UNIT CLASSROOM BLOCK,ddf,,,,,,Adansi South District Assembly,,,
Adansi South District Assembly,2011,CONSTRUCTION OF 14 SEATE VAULT CHAMBER,ddf,,,,,,Adansi South District Assembly,,,
Adansi South District Assembly,2011,CONSTRUCTION 6 UNIT CLASSROOM BLOCK,getfund,,,,,,Adansi South District Assembly,,,
Adansi South District Assembly,2011,CONSTRUCTION 5 NO BOREHOLE,dacf,,,,,,Adansi South District Assembly,,,
Adansi South District Assembly,2011,CONSTRUCTION 3 UNIT CLASSROOM BLOCK,ddf,,,,,,Adansi South District Assembly,,,
Adansi South District Assembly,2011,CONSTRUCTION 6 UNIT CLASSROOM BLOCK,getfund,,,,,,Adansi South District Assembly,,,
Adansi South District Assembly,2011,CONSTRUCTION 6 UNIT CLASSROOM BLOCK,getfund,,,,,,Adansi South District Assembly,,,
Adansi South District Assembly,2011,CONSTRUCTION 3 UNIT CLASSROOM BLOCK,dacf,,,,,,Adansi South District Assembly,,,
Adansi South District Assembly,2011,CONSTRUCTION 6 UNIT CLASSROOM BLOCK,dacf,,,,,,Adansi South District Assembly,,,
Adansi South District Assembly,2011,CONSTRUCTION 3 UNIT CLASSROOM BLOCK,ddf,,,,,,Adansi South District Assembly,,,
Adansi South District Assembly,2011,CONSTRUCTION 14 SEATE VAULT CHAMBER,ddf,,,,,,Adansi South District Assembly,,,
Adansi South District Assembly,2011,CONSTRUCTION 3 UNIT CLASSROOM BLOCK,ddf,,,,,,Adansi South District Assembly,,,
Adansi South District Assembly,2011,CONSTRUCTION CLASSROOM BLOCK,dacf,,,,,,Adansi South District Assembly,,,
Adansi South District Assembly,2011,CONSTRUCTION OF 6 UNIT CLASSROOM BLOCK,getfund,8/5/2010,8/25/2010,,,,Adansi South District Assembly,2010-08-05,2010-08-25,
Adansi South District Assembly,2011,CONSTRUCTION OF 6 UNIT CLASSROOM BLOCK,getfund,8/5/2010,8/26/2010,,,,Adansi South District Assembly,2010-08-05,2010-08-26,
Adansi South District Assembly,2011,CONSTRUCTION OF 6 UNIT CLASSROOM BLOCK,getfund,8/5/2010,8/25/2010,,,,Adansi South District Assembly,2010-08-05,2010-08-25,
Adansi South District Assembly,2011,CONSTRUCTION OF 3 UNIT CLASSROOM BLOCK (JHS),ddf,11/18/2010,11/29/2010,,,,Adansi South District Assembly,2010-11-18,2010-11-29,
Adansi South District Assembly,2011,CONSTRUCTION OF 20 SEATER VAULT TOILET CHAMBER,ddf,11/18/2010,11/23/2010,,,,Adansi South District Assembly,2010-11-18,2010-11-23,
Adansi South District Assembly,2011,CONSTRUCTION OF 3 UNIT CLASSROOM BLOCK,ddf,11/18/2010,11/29/2010,,,,Adansi South District Assembly,2010-11-18,2010-11-29,
Adansi South District Assembly,2011,CONSTRUCTION OF 3 UNIT CLASSROOM BLOCK,ddf,11/18/2010,11/23/2010,,,,Adansi South District Assembly,2010-11-18,2010-11-23,
Adansi South District Assembly,2011,CONSTRUCTION OF TEACHERS QUARTERS,ddf,11/18/2010,11/23/2010,,,,Adansi South District Assembly,2010-11-18,2010-11-23,
Adansi South District Assembly,2011,CONSTRUCTION OF 14 SEATER VAULT TOILET CHAMBER,ddf,11/18/2010,11/23/2010,,,,Adansi South District Assembly,2010-11-18,2010-11-23,
Adansi South District Assembly,2011,CONSTRUCTION OF 3 UNIT CLASSROOM BLOCK,ddf,11/18/2010,11/22/2010,,,,Adansi South District Assembly,2010-11-18,2010-11-22,
Adansi South District Assembly,2011,CONSTRUCTION OF 14 SEATER VAULT CHAMBER TOILET,ddf,11/18/2010,11/3/2010,,,,Adansi South District Assembly,2010-11-18,2010-11-03,
Adansi South District Assembly,2011,CONSTRUCTION OF 3 UNIT CLASSROOM BLOCK,dacf,6/6/2011,6/8/2011,,,,Adansi South District Assembly,2011-06-06,2011-06-08,
Adansi South District Assembly,2011,CONSTRUCTION OF AREA COUNCIL BLOCK,dacf,10/19/2009,10/26/2009,,,,Adansi South District Assembly,2009-10-19,2009-10-26,
Adansi South District Assembly,2011,CONSTRUCTION OF 7NO 4 SEATER AND NO 6 SEATER KVIP TOILET,dacf,10/19/2009,11/26/2009,,,,Adansi South District Assembly,2009-10-19,2009-11-26,
Adansi South District Assembly,2011,CONSTRUCTION OF 1 NO 6 UNIT CLASSROOM BLOCK,dacf,9/7/2010,9/14/2010,,,,Adansi South District Assembly,2010-09-07,2010-09-14,
Adansi South District Assembly,2011,CONSTRUCTION OF 6 UNIT CLASSROOM BLOCK,dacf,9/7/2010,9/21/2010,,,,Adansi South District Assembly,2010-09-07,2010-09-21,
Adansi South District Assembly,2011,CONSTRUCTION OF FIRE SERVICE TENDER BAY,dacf,5/3/2011,5/11/2011,,,,Adansi South District Assembly,2011-05-03,2011-05-11,
Adansi South District Assembly,2011,CONSTRUCTION OF 3 UNIT CLASSROOM BLOCK,igf,8/8/2011,8/15/2011,,,,Adansi South District Assembly,2011-08-08,2011-08-15,
Adansi South District Assembly,2011,CONSTRUCTION OF 3 UNIT CLASSROOM BLOCK,ddf,11/17/2011,11/24/2011,,,,Adansi South District Assembly,2011-11-17,2011-11-24,
Adansi South District Assembly,2011,CONSTRUCTION OF 3 UNIT CLASSROOM BLOCK,ddf,11/17/2011,11/24/2011,,,,Adansi South District Assembly,2011-11-17,2011-11-24,
Adansi South District Assembly,2011,CONSTRUCTION OF 3 UNIT CLASSROOM BLOCK,ddf,11/17/2011,11/28/2011,,,,Adansi South District Assembly,2011-11-17,2011-11-28,
Adansi South District Assembly,2011,CONSTRUCTION OF 3 UNIT CLASSROOM BLOCK,ddf,11/17/2011,11/30/2011,,,,Adansi South District Assembly,2011-11-17,2011-11-30,
Adansi South District Assembly,2011,CONSTRUCTION OF 3 UNIT CLASSROOM BLOCK,ddf,11/17/2011,12/13/2011,,,,Adansi South District Assembly,2011-11-17,2011-12-13,
Adansi South District Assembly,2011,CONSTRUCTION OF 3 UNIT TEACHERS QUARTERS BLOCK,ddf,11/17/2011,11/29/2011,,,,Adansi South District Assembly,2011-11-17,2011-11-29,
Adansi South District Assembly,2011,CONSTRUCTION OF 3 UNIT TEACHERS QUARTERSBLOCK,ddf,11/17/2011,12/20/2011,,,,Adansi South District Assembly,2011-11-17,2011-12-20,
Adansi South District Assembly,2011,CONSTRUCTION OF 14 SEATER VAULT CHAMBER TOILET,ddf,11/17/2011,12/13/2011,,,,Adansi South District Assembly,2011-11-17,2011-12-13,
Adansi South District Assembly,2011,CONSTRUCTION OF 14 SEATER VAULT CHAMBER TOILET,ddf,11/17/2011,11/22/2011,,,,Adansi South District Assembly,2011-11-17,2011-11-22,
Adansi South District Assembly,2011,CONSTRUCTION OF 3 UNIT CLASSROOM BLOCK,dacf,11/17/2011,11/24/2011,,,,Adansi South District Assembly,2011-11-17,2011-11-24,
Adansi South District Assembly,2011,CONSTRUCTION OF 1 NO 4 UNIT POLICE STAFF QUARTERS,dacf,11/17/2011,12/2/2011,,,,Adansi South District Assembly,2011-11-17,2011-12-02,
Adansi South District Assembly,2011,CONSTRUCTION OF 3 UNITSTAFF BUNGALOW,dacf,11/17/2011,12/6/2011,,,,Adansi South District Assembly,2011-11-17,2011-12-06,
Adansi South District Assembly,2011,CONSTRUCTION OF 3 UNIT CLASSROOM BLOCK,dacf,11/17/2011,11/24/2011,,,,Adansi South District Assembly,2011-11-17,2011-11-24,
Adansi South District Assembly,2011,CONSTRUCTION OF 5 NO BOREHOLES,dacf,11/17/2011,11/22/2011,,,,Adansi South District Assembly,2011-11-17,2011-11-22,
Adenta Municipal Assembly,2011,,,,,,,,Adenta Municipal Assembly,,,
Afigya-Kwabre District Assembly,2011,CONSTRUCTION OF ASSEMBLY HALL AND CANTEEN BLOCK,dacf,1/5/2010,,,,,Afigya-Kwabre District Assembly,2010-01-05,,
Afigya-Kwabre District Assembly,2011,CONSTRUCTION OF ADMINSTRATION BLOCK,dacf,1/5/2010,,,,,Afigya-Kwabre District Assembly,2010-01-05,,
Afigya-Kwabre District Assembly,2011,EXTERNAL WORKS ADMINISTRATION BLOCK,dacf,1/5/2010,,,,,Afigya-Kwabre District Assembly,2010-01-05,,
Afigya-Kwabre District Assembly,2011,CONSTRUCTION OF 6-UNIT CLASSROOM BLOCK,getfund,11/1/2008,,,,,Afigya-Kwabre District Assembly,2008-11-01,,
Afigya-Kwabre District Assembly,2011,CONSTRUCTION OF COMMUNITY CENTER,other gog,10/6/2008,,,,,Afigya-Kwabre District Assembly,2008-10-06,,
Afigya-Kwabre District Assembly,2011,CONSTRUCTION OF DCE'S BUNGALOW,dacf,11/15/2009,,,,,Afigya-Kwabre District Assembly,2009-11-15,,
Afigya-Kwabre District Assembly,2011,CONSTRUCTION OF 3-UNIT SEMI DETACHED QTR.,dacf,11/1/2009,,,,,Afigya-Kwabre District Assembly,2009-11-01,,
Afigya-Kwabre District Assembly,2011,CONST. OF 6-UNIT CLASSROOM BLOCK WITH ANCILARY,dacf,4/5/2011,,,,,Afigya-Kwabre District Assembly,2011-04-05,,
Afigya-Kwabre District Assembly,2011,REHABILITATION OF 3-UNIT CLASSROOM BLK,dacf,5/10/2009,,,,,Afigya-Kwabre District Assembly,2009-05-10,,
Afigya-Kwabre District Assembly,2011,CONSTRUCTION OF 6-UNIT CLASSROOM BLOCK,other/unknown,11/1/2008,,,,,Afigya-Kwabre District Assembly,2008-11-01,,
Afigya-Kwabre District Assembly,2011,CONSTRUCTION OF 1-NO.6-UNIT SCHOOL BLOCK,getfund,Jul-10,,,,,Afigya-Kwabre District Assembly,2010-07-01,,
Afigya-Kwabre District Assembly,2011,CONSTRUCTION OF 1-NO 6-UNIT SCHOOL BLOCK,getfund,Jul-10,,,,,Afigya-Kwabre District Assembly,2010-07-01,,
Afigya-Kwabre District Assembly,2011,CONSTRUCTION OF 1-NO. 3-UNIT CLASSROOM BLOCK,ddf,7/10/2010,,,,,Afigya-Kwabre District Assembly,2010-07-10,,
Afigya-Kwabre District Assembly,2011,CONSTRUCTION OF 1-NO3-CLASSROOM BLOCK,ddf,10/29/2010,,,,,Afigya-Kwabre District Assembly,2010-10-29,,
Afigya-Kwabre District Assembly,2011,CONSTRUCTION OF 1-NO3-CLASSROOM BLOCK,ddf,10/29/2010,,,,,Afigya-Kwabre District Assembly,2010-10-29,,
Afigya-Kwabre District Assembly,2011,PROVISION OF FURNITURE TO SOME SELECTED SCHOOLS,ddf,10/29/2010,,,,,Afigya-Kwabre District Assembly,2010-10-29,,
Afigya-Kwabre District Assembly,2011,CONSTRUCTION OF 1-NO 2- UNIT KINDGERGARTEN,ddf,10/29/2010,,,,,Afigya-Kwabre District Assembly,2010-10-29,,
Afigya-Kwabre District Assembly,2011,CONSTRUCTION OF MARKET STORES/STALLS/OPEN SHED,ddf,10/29/2010,,,,,Afigya-Kwabre District Assembly,2010-10-29,,
Afigya-Kwabre District Assembly,2011,SPOT IMPROVEMENT OF 3.5KM FEEDER ROAD,ddf,10/29/2010,,,,,Afigya-Kwabre District Assembly,2010-10-29,,
Afigya-Kwabre District Assembly,2011,CONSTRUCTION OF DINING HALL,ddf,10/29/2010,,,,,Afigya-Kwabre District Assembly,2010-10-29,,
Afigya-Kwabre District Assembly,2011,CONSTRUCTION OF 1NO3-UNIT CLASSROOM BLOCK,ddf,10/29/2010,,,,,Afigya-Kwabre District Assembly,2010-10-29,,
Afigya-Kwabre District Assembly,2011,CONSTRUCTION OF SMALL TOWNS WATER SYSTEM,other donor,Jan-09,,,,,Afigya-Kwabre District Assembly,2009-01-01,,
Afigya-Kwabre District Assembly,2011,CONSTRUTION OF 33 SCHOOL KVIP TOILETS,other donor,Nov-09,,,,,Afigya-Kwabre District Assembly,2009-11-01,,
Afigya-Kwabre District Assembly,2011,CONSTRUCTION OF 80 BOREHOLES,other donor,Jan-09,,,,,Afigya-Kwabre District Assembly,2009-01-01,,
Agona East District Assembly,2011,CONST. OF 6-UNIT (NAZIFATU) CBR & 3-SEATER W/C),getfund,Nov-10,,,,,Agona East District Assembly,2010-11-01,,
Agona East District Assembly,2011,CONST. OF 6-UNIT CBR WITH OTHER ANCILLARIES,getfund,Sep-10,,,,,Agona East District Assembly,2010-09-01,,
Agona East District Assembly,2011,CONST. OF 6-UNIT CRB WITH OTHER ANCILLARIES,getfund,Sep-10,,,,,Agona East District Assembly,2010-09-01,,
Agona East District Assembly,2011,CONST. OF 6-UNIT CRB WITH OTHER ANCILLARIES,getfund,Sep-10,,,,,Agona East District Assembly,2010-09-01,,
Agona East District Assembly,2011,CONST. OF 6-UNIT CRB WTH OTHER ANCILLARIES,getfund,Sep-10,,,,,Agona East District Assembly,2010-09-01,,
Agona East District Assembly,2011,CONST.OF 6-UNIT CRB WITH OTHER ANCILLARIES,dacf,,,,,,Agona East District Assembly,,,
Agona East District Assembly,2011,CONST. OF 1NO 3-UNIT RESIDENTIAL ACC.-DCD,dacf,Nov-10,,,,,Agona East District Assembly,2010-11-01,,
Agona East District Assembly,2011,CONST. OF 1NO. 4-IN-ONE STAFF ACC.,dacf,Nov-10,,,,,Agona East District Assembly,2010-11-01,,
Agona East District Assembly,2011,COMPLETION OF 1ST FLOOR OFFICE ACC. AEDA,dacf,Nov-10,,,,,Agona East District Assembly,2010-11-01,,
Agona East District Assembly,2011,CONST. OF 6-UNIT CRB AT KWANYAKO SEC/TECH,dacf,Nov-09,,,,,Agona East District Assembly,2009-11-01,,
Agona East District Assembly,2011,CONST. OF 6-UNIT CRB & 3-SEATER W/C METH. PRI,getfund,Dec-10,,,,,Agona East District Assembly,2010-12-01,,
Agona East District Assembly,2011,CONST. OF 6-UNIT CRB & 3-SEATER W/C PRESBY JHS,getfund,Dec-10,,,,,Agona East District Assembly,2010-12-01,,
Agona East District Assembly,2011,CONST. OF 4-SEATER TOILET FACILITY,dacf,Sep-10,,,,,Agona East District Assembly,2010-09-01,,
Agona East District Assembly,2011,CONST. OF 10-SEATER TOILET FACILITY,dacf,Sep-10,,,,,Agona East District Assembly,2010-09-01,,
Agona East District Assembly,2011,CONST. OF 10-SEATER TOILET FACILITY,dacf,Sep-10,,,,,Agona East District Assembly,2010-09-01,,
Agona East District Assembly,2011,CONST. OF 16-SEATER TOILET FACILITY,other/unknown,10/21/2010,,,,,Agona East District Assembly,2010-10-21,,
Agona East District Assembly,2011,CONST OF A FOOTBRIDGE,dacf,Sep-10,,,,,Agona East District Assembly,2010-09-01,,
Agona East District Assembly,2011,CONST OF A 3-UNIT CRB. OFFICE & STORE,dacf,Sep-10,,,,,Agona East District Assembly,2010-09-01,,
Agona East District Assembly,2011,CONST OF 6-UNIT CRB BLOCK OFFICE & STORE,getfund,Sep-07,,,,,Agona East District Assembly,2007-09-01,,
Agona East District Assembly,2011,"CONST OF 6-UNIT CRB BLOCK, OFFICE & STORE",getfund,Jul-10,,,,,Agona East District Assembly,2010-07-01,,
Agona East District Assembly,2011,"CONST. OF 6-UNIT CRB BLOCK, OFFICE & STORE",getfund,Jul-10,,,,,Agona East District Assembly,2010-07-01,,
Agona East District Assembly,2011,"CONST. OF 6-UNIT CRB BLOCK, OFFICE & STORE",getfund,Jul-11,,,,,Agona East District Assembly,2011-07-01,,
Agona East District Assembly,2011,"REHA.OF A FLAT FOR GES STAFF, PH 1",dacf,Aug-10,,,,,Agona East District Assembly,2010-08-01,,
Agona East District Assembly,2011,REHAB OF 3-UNIT CRB AND CONST. OF 1UNIT STAFF ROOM PH 1,other donor,Dec-10,,,,,Agona East District Assembly,2010-12-01,,
Agona East District Assembly,2011,EXTENSION OF HEALTH FACILITY AT ASAFO,multiple,,,,,,Agona East District Assembly,,,
Agona East District Assembly,2011,CONSTRUCTION OF CHPS CENTRE,ddf,Feb-11,,,,,Agona East District Assembly,2011-02-01,,
Agona East District Assembly,2011,CONST. OF MULTI-PURPOSE CENTRE,ddf,Feb-11,,,,,Agona East District Assembly,2011-02-01,,
Agona East District Assembly,2011,CONST. OF 1NO. 16 UNIT LOCKABLE STORE,ddf,Feb-11,,,,,Agona East District Assembly,2011-02-01,,
Agona East District Assembly,2011,CONST. OF 1NO. 16 UNIT LOCKABLE STORES,ddf,Feb-11,,,,,Agona East District Assembly,2011-02-01,,
Agona West Municipal Assembly,2011,,,,,,,,Agona West Municipal Assembly,,,
Ahafo Ano North District Assembly,2011,RE ROOFING OF MAIN WARDS AT TEPA GENERAL HOSPITAL,other/unknown,,9/7/2007,11/7/2007,,,Ahafo Ano North District Assembly,,2007-09-07,2007-11-07
Ahafo Ano North District Assembly,2011,CONSTRUCTION OF 2 NO MARKET STALL,other/unknown,,9/7/2007,1/7/2008,,,Ahafo Ano North District Assembly,,2007-09-07,2008-01-07
Ahafo Ano North District Assembly,2011,CONSTRUCTION OF POLICE QUARTERS,other/unknown,,8/7/2007,2/7/2008,,,Ahafo Ano North District Assembly,,2007-08-07,2008-02-07
Ahafo Ano North District Assembly,2011,CONSTRUCTION OF 1NO AREA COUNCIL BLOCK,other/unknown,,9/7/2007,11/7/2007,,,Ahafo Ano North District Assembly,,2007-09-07,2007-11-07
Ahafo Ano North District Assembly,2011,CONSTRUCTION OF 1NO AREA COUNCIL ADMIN BLOCK,other/unknown,,9/7/2007,11/7/2007,,,Ahafo Ano North District Assembly,,2007-09-07,2007-11-07
Ahafo Ano North District Assembly,2011,CONSTRUCTION OF 1 NO AREA COUNCIL ADMIN BLOCK,other/unknown,,9/7/2007,11/7/2007,,,Ahafo Ano North District Assembly,,2007-09-07,2007-11-07
Ahafo Ano North District Assembly,2011,REHABILITATION OF GUEST HOUSE AT DCES RESIDENCE,other/unknown,,9/7/2008,11/7/2008,,,Ahafo Ano North District Assembly,,2008-09-07,2008-11-07
Ahafo Ano North District Assembly,2011,CONSTRUCTION OF AQUA PRIVY TOILET,other/unknown,,9/7/2007,12/7/2007,,,Ahafo Ano North District Assembly,,2007-09-07,2007-12-07
Ahafo Ano North District Assembly,2011,CONSTRUCTION OF 1NO AQUA PRIVY TOILET TEPA SSS,other/unknown,,7/7/2007,12/7/2007,,,Ahafo Ano North District Assembly,,2007-07-07,2007-12-07
Ahafo Ano North District Assembly,2011,CONSTRUCTION OF 1NO 8 SEATER AQUA TOILET,other/unknown,,12/9/2008,1/6/2009,,,Ahafo Ano North District Assembly,,2008-12-09,2009-01-06
Ahafo Ano North District Assembly,2011,CONSTRUCTION OF 1NO 8 SEATER AQUA TOILET,other/unknown,,29-Oct,12/24/2008,,,Ahafo Ano North District Assembly,,2008-10-29,2008-12-24
Ahafo Ano North District Assembly,2011,CONSTRUCTION OF 2 STORY DIVISIONAL POLICE HEADQUARTERS,other/unknown,,10/29/2008,4/15/2009,,,Ahafo Ano North District Assembly,,2008-10-29,2009-04-15
Ahafo Ano North District Assembly,2011,CONSTRUCTION OF 1NO 3 UNIT CLASSROOM BLOCK WITH OFFICE STORE AND SANITARY,other/unknown,,10/29/2008,2/18/2009,,,Ahafo Ano North District Assembly,,2008-10-29,2009-02-18
Ahafo Ano North District Assembly,2011,CONSTRUCTION OF POLICE QUARTERS,other/unknown,,11/20/2008,3/12/2009,,,Ahafo Ano North District Assembly,,2008-11-20,2009-03-12
Ahafo Ano North District Assembly,2011,CONSTRUCTION OF 2NO MARKET STALLS,other/unknown,,2/3/2009,6/23/2009,,,Ahafo Ano North District Assembly,,2009-02-03,2009-06-23
Ahafo Ano North District Assembly,2011,CONSTRUCTION OF MARKET STALLS,other/unknown,,10/29/2008,2/4/2009,,,Ahafo Ano North District Assembly,,2008-10-29,2009-02-04
Ahafo Ano North District Assembly,2011,CONSTRUCTION OF NATIONAL HEALTH INSURANCE SCHEME OFFICE,other/unknown,,10/29/2008,2/4/2009,,,Ahafo Ano North District Assembly,,2008-10-29,2009-02-04
Ahafo Ano North District Assembly,2011,CONST OF 1NO 8 SEATER AQUA PRIVY TOILET,other/unknown,,9/17/2008,11/17/2008,,,Ahafo Ano North District Assembly,,2008-09-17,2008-11-17
Ahafo Ano North District Assembly,2011,CONST OF 1 NO 20 SEATER W C AT TAPE WARD 3,other/unknown,,9/23/2009,12/4/2009,,,Ahafo Ano North District Assembly,,2009-09-23,2009-12-04
Ahafo Ano North District Assembly,2011,COMPLETION OF TEPA SPORTS STADIUM,other/unknown,,9/2/2007,,,,Ahafo Ano North District Assembly,,2007-09-02,
Ahafo Ano North District Assembly,2011,1 NO 6 UNIT CLASSROOM BLOCK WITH OFFICE STORE LIBRARY TOILET URINAL & WATER,other/unknown,,7/7/2008,12/7/2008,,,Ahafo Ano North District Assembly,,2008-07-07,2008-12-07
Ahafo Ano North District Assembly,2011,CONSTRUCTION 1 NO HEALTH CENTRE,other/unknown,,7/12/2007,11/12/2007,,,Ahafo Ano North District Assembly,,2007-07-12,2007-11-12
Ahafo Ano North District Assembly,2011,CONSTRUCTION OF 2 NO MARKET STALL,other/unknown,,7/12/2007,11/12/2007,,,Ahafo Ano North District Assembly,,2007-07-12,2007-11-12
Ahafo Ano North District Assembly,2011,SPOT IMPROVEMENT OF TWABIDI BEPESO FEEDER ROAD 3.4KM,other/unknown,,11/7/2007,4/7/2008,,,Ahafo Ano North District Assembly,,2007-11-07,2008-04-07
Ahafo Ano North District Assembly,2011,CONST 1 NO COMMUNIITY LIBRARY,other/unknown,,5/28/2009,8/31/2009,,,Ahafo Ano North District Assembly,,2009-05-28,2009-08-31
Ahafo Ano North District Assembly,2011,CONSTRUCTION OF OPEN MARKET SHEDS,other/unknown,,3/24/2009,6/16/2009,,,Ahafo Ano North District Assembly,,2009-03-24,2009-06-16
Ahafo Ano North District Assembly,2011,CONSTRUCTION OF 1 NO 4 BEDROOM NURSES QUARTERS,other/unknown,,9/7/2007,7-Jan,,,Ahafo Ano North District Assembly,,2007-09-07,2008-01-07
Ahafo Ano North District Assembly,2011,CONSTRUCTION OF 7 NO HAND DUG WELLS & 2 NO BORE HOLES,other/unknown,,3/7/2007,7/7/2007,,,Ahafo Ano North District Assembly,,2007-03-07,2007-07-07
Ahafo Ano South District Assembly,2011,,,,,,,,Ahafo Ano South District Assembly,,,
Ahanta West District Assembly,2011,CONSTRUCTION OF LIGHT INDUSTRIAL AREA AT AGONA NKWANTA,dacf,,,,,,Ahanta West District Assembly,,,
Ahanta West District Assembly,2011,CONSTRUCTION OF 6 UNIT CLASSROOM BLOCKS WITH ANCILLARY FACILITIES,getfund,,10/6/2010,,,,Ahanta West District Assembly,,2010-10-06,
Ahanta West District Assembly,2011,CONSTRUCTION OF 6 UNIT CLASSROOM BLOCKS WITH ANCILLARY FACILITIES,getfund,,10/6/2010,,,,Ahanta West District Assembly,,2010-10-06,
Ahanta West District Assembly,2011,CONSTRUCTION OF OFFICE ANNEX IN AGONA AHANTA,dacf,,1/19/2011,,,,Ahanta West District Assembly,,2011-01-19,
Ahanta West District Assembly,2011,INSTALLATION OF STREET LIGHTS,ddf,,1/19/2011,,,,Ahanta West District Assembly,,2011-01-19,
Ahanta West District Assembly,2011,CONSTRUCTION OF 1 NO 4 UNITS TEACHERS ACCOMMODATION,ddf,,1/19/2011,,,,Ahanta West District Assembly,,2011-01-19,
Ahanta West District Assembly,2011,CONSTRUCTION OF 1NO 3 UNIT CLASSROOM BLOCK AND 1NO 4 SEATER KVIP,ddf,,1/19/2011,,,,Ahanta West District Assembly,,2011-01-19,
Ahanta West District Assembly,2011,CONSTRUCTION OF 1 NO 3 UNIT CLASSROOM BLOCK AND 1 NO 4 SEATER KVIP,ddf,,1/19/2011,,,,Ahanta West District Assembly,,2011-01-19,
Ahanta West District Assembly,2011,CONSTRUCTION OF 1 NO 2 UNIT K G BLOCK WITH ANCILLARY FACILITIES,ddf,,1/19/2011,,,,Ahanta West District Assembly,,2011-01-19,
Ahanta West District Assembly,2011,CONSTRUCTION OF 1NO SINGLE STOREY DORMITORY BLOCK FOR BBSHS,dacf,,1/19/2011,,,,Ahanta West District Assembly,,2011-01-19,
Ahanta West District Assembly,2011,CONSTRUCTION OF 1NO 3 UNIT CLASSROOM BLOCK AND 1 NO 4 SEATER KVIP,getfund,,,,,,Ahanta West District Assembly,,,
Ahanta West District Assembly,2011,CONSTRUCTION OF 1 NO 6 UNIT CLASSROOM BLOCKS WITH ANCILLARY FACILITIES,other donor,,8/12/2011,,,,Ahanta West District Assembly,,2011-08-12,
Ahanta West District Assembly,2011,CONSTRUCTION OF 1 NO 6 UNIT CLASSROOM BLOCKS WITH ANCILLARY FACILITIES,getfund,,8/28/2011,,,,Ahanta West District Assembly,,2011-08-28,
Ajumako/Enyan/Essiam District Assembly,2011,CONSTRUCTION OF 36 NO LOCKABLE STORES AJUMAKO,multiple,,,,,,Ajumako/Enyan/Essiam District Assembly,,,
Ajumako/Enyan/Essiam District Assembly,2011,CONSTRUCTION OF PRE SCHOOL ABROFOA,other donor,,,,,,Ajumako/Enyan/Essiam District Assembly,,,
Ajumako/Enyan/Essiam District Assembly,2011,CONSTRUCTION OF CAR PARK DWD OFFICE AJUMAKO,other donor,,,,,,Ajumako/Enyan/Essiam District Assembly,,,
Ajumako/Enyan/Essiam District Assembly,2011,COMPLETION OF HOSPITAL AJUMAKO,other gog,,,,,,Ajumako/Enyan/Essiam District Assembly,,,
Ajumako/Enyan/Essiam District Assembly,2011,REHABILITATION OF DCDS BUNGALOW,dacf,,,,,,Ajumako/Enyan/Essiam District Assembly,,,
Ajumako/Enyan/Essiam District Assembly,2011,CONST OF FEEDER ROAD 4 0KM EKUKROM NYAMEBEKYERE,other donor,,,,,,Ajumako/Enyan/Essiam District Assembly,,,
Ajumako/Enyan/Essiam District Assembly,2011,DRILL OF ONE BOREHOLE ETSI SONKWA,other donor,,,,,,Ajumako/Enyan/Essiam District Assembly,,,
Ajumako/Enyan/Essiam District Assembly,2011,DRILL AND CONSTRUCTION OF 20 BOREHOLES DISTRICT WIDE,other donor,,,,,,Ajumako/Enyan/Essiam District Assembly,,,
Ajumako/Enyan/Essiam District Assembly,2011,CONST OF 3 UNIT CLASSROOM BLOCK AMPIA AJUMAKO,multiple,,,,,,Ajumako/Enyan/Essiam District Assembly,,,
Ajumako/Enyan/Essiam District Assembly,2011,CONST OF 3 UNIT CLASSROOM BLOCK EKUPONG,multiple,,,,,,Ajumako/Enyan/Essiam District Assembly,,,
Ajumako/Enyan/Essiam District Assembly,2011,CONST OF 6 UNIT CLASSROOM BLOCK GESDI AJUMAKO,getfund,,,,,,Ajumako/Enyan/Essiam District Assembly,,,
Ajumako/Enyan/Essiam District Assembly,2011,COMPLETION OF GES OFFICE AJUMAKO,other gog,,,,,,Ajumako/Enyan/Essiam District Assembly,,,
Ajumako/Enyan/Essiam District Assembly,2011,CONSTRUCTION OF 3 UNIT CLASSROOMS BLOCK AKOTOGUA,dacf,,,,,,Ajumako/Enyan/Essiam District Assembly,,,
Ajumako/Enyan/Essiam District Assembly,2011,CONSTRUCTION OF 3 UNIT CLASSROOM UNIT CLASSROOM BLOCK OSEDZI JHS,dacf,,,,,,Ajumako/Enyan/Essiam District Assembly,,,
Ajumako/Enyan/Essiam District Assembly,2011,EXTENSION OF ELECTRICITY DISTRICTWIDE,other gog,,,,,,Ajumako/Enyan/Essiam District Assembly,,,
Ajumako/Enyan/Essiam District Assembly,2011,SPOT IMPROVEMENT OF FEEDER ROAD ESSASAN ESSAMAN,other donor,,,,,,Ajumako/Enyan/Essiam District Assembly,,,
Ajumako/Enyan/Essiam District Assembly,2011,SPOT IMPROVEMENT OF FEEDER ROAD ENYAN MAIM ENYAN APAA,other donor,,,,,,Ajumako/Enyan/Essiam District Assembly,,,
Ajumako/Enyan/Essiam District Assembly,2011,COMPLETION OF PRE SCHOOL EKUPON,other donor,,,,,,Ajumako/Enyan/Essiam District Assembly,,,
Ajumako/Enyan/Essiam District Assembly,2011,CONSTRUCTION OF 1 NO 6 SEATER KVIP TOILET GESDI,other donor,,,,,,Ajumako/Enyan/Essiam District Assembly,,,
Ajumako/Enyan/Essiam District Assembly,2011,CONSTRUCTION OF 6 UNIT CLASSROOM BLOCK AT ASEMPANYIN,dacf,,,,,,Ajumako/Enyan/Essiam District Assembly,,,
Ajumako/Enyan/Essiam District Assembly,2011,CONSTRUCTION OF 6 UNIT CLASSROOM BLOCK AT ASEMPANYIN,getfund,,,,,,Ajumako/Enyan/Essiam District Assembly,,,
Ajumako/Enyan/Essiam District Assembly,2011,CONSTRUCTION OF KITCHEN & SHED FOR ANYINASU SOLOMON SCHOOL FEEDING SCHOOL,dacf,,,,,,Ajumako/Enyan/Essiam District Assembly,,,
Ajumako/Enyan/Essiam District Assembly,2011,CONSTRUCTION OF KITCHEN AT AHAMAKROMBUA,dacf,,,,,,Ajumako/Enyan/Essiam District Assembly,,,
Ajumako/Enyan/Essiam District Assembly,2011,SPOT IMPROVEMENT OF FEEDER ROAD BADUKROM TO SUNKWA,other donor,,,,,,Ajumako/Enyan/Essiam District Assembly,,,
Ajumako/Enyan/Essiam District Assembly,2011,SPOT IMPROVEMENT OF FEEDER ROAD ENYAN MAIM ENYAN APAA,other donor,,,,,,Ajumako/Enyan/Essiam District Assembly,,,
Ajumako/Enyan/Essiam District Assembly,2011,SPOT IMPROVEMENT OF FEEDER ROAD ENYAN MAIM ENYAN APAA,other donor,,,,,,Ajumako/Enyan/Essiam District Assembly,,,
Ajumako/Enyan/Essiam District Assembly,2011,SPOT IMPROVEMENT OF FEEDER ROADS KWESI GYAN NO 1 OPEPEASI,other donor,,,,,,Ajumako/Enyan/Essiam District Assembly,,,
Ajumako/Enyan/Essiam District Assembly,2011,CONSTRUCTION OF 20 PLATFORM INSTALLATION OF PUMP DISTRICT WIDE,other donor,,,,,,Ajumako/Enyan/Essiam District Assembly,,,
Ajumako/Enyan/Essiam District Assembly,2011,CONSTRUCTION OF 6 UNIT CLASSROOM BLOCK FOR PRIMARY ETSI BEWORA ISLAMIC SCHOOL,getfund,,,,,,Ajumako/Enyan/Essiam District Assembly,,,
Ajumako/Enyan/Essiam District Assembly,2011,CONSTRUCTION OF 6 UNIT CLASSROOM BLOCK FOR PRIMARY OFABIR,getfund,,,,,,Ajumako/Enyan/Essiam District Assembly,,,
Ajumako/Enyan/Essiam District Assembly,2011,CONSTRUCTION OF 6 UNIT CLASSROOM BLOCK FOR PRIMARY ENYAN DENKYIRA DA A&B,getfund,,,,,,Ajumako/Enyan/Essiam District Assembly,,,
Ajumako/Enyan/Essiam District Assembly,2011,CONSTRUCTION OF 6 UNIT CLASSROOM BLOCK FOR PRIMARY ETSI BEWORA ISLAMIC SCHOOL,getfund,,,,,,Ajumako/Enyan/Essiam District Assembly,,,
Ajumako/Enyan/Essiam District Assembly,2011,REHABILITATION OF DFO DBA BUNGALOWS AJUMAKO,dacf,,,,,,Ajumako/Enyan/Essiam District Assembly,,,
Ajumako/Enyan/Essiam District Assembly,2011,CONSTRUCTION OF 2 NO 6 SEATER KVIP TOILET ENYAN DENKYIRA PRY SCH & OSEDZE METHODIST PRY,other donor,,,,,,Ajumako/Enyan/Essiam District Assembly,,,
Ajumako/Enyan/Essiam District Assembly,2011,CONSTRUCTION OF 1 NO 4 SEATER AND 6 SEATER KVIP TOILET AT NYAMEBEKYERE AND AWORODO DA PRY SCHOOL,other donor,,,,,,Ajumako/Enyan/Essiam District Assembly,,,
Ajumako/Enyan/Essiam District Assembly,2011,CONSTRUCTION 10 SEATER KVIP TOILET ABEADZE DA PRY SCH ENTUMBIL DA SCH PRY,other donor,,,,,,Ajumako/Enyan/Essiam District Assembly,,,
Ajumako/Enyan/Essiam District Assembly,2011,CONSTRUCTION 10 SEATER KVIP LATRINE AT ESSIAM CATH PRY & JHS,ddf,,,,,,Ajumako/Enyan/Essiam District Assembly,,,
Ajumako/Enyan/Essiam District Assembly,2011,CONST OF 3 UNIT CLASSROOM BLOCK AT ASSASAN,ddf,,,,,,Ajumako/Enyan/Essiam District Assembly,,,
Ajumako/Enyan/Essiam District Assembly,2011,CONST OF 3 UNIT CLASSROOM BLOCK AT BABIANIHA,ddf,,,,,,Ajumako/Enyan/Essiam District Assembly,,,
Ajumako/Enyan/Essiam District Assembly,2011,CONST OF 2 UNIT CLASSROOM BLOCK AT BABINSO,ddf,,,,,,Ajumako/Enyan/Essiam District Assembly,,,
Ajumako/Enyan/Essiam District Assembly,2011,CONST OF 2 UNIT CLASSROOM BLOCK AT ANOMABO KUMASI,ddf,,,,,,Ajumako/Enyan/Essiam District Assembly,,,
Ajumako/Enyan/Essiam District Assembly,2011,UPGRADING OF 5KM FEEDER ROAD TREBU TO BISEASE,ddf,,,,,,Ajumako/Enyan/Essiam District Assembly,,,
Ajumako/Enyan/Essiam District Assembly,2011,CONST OF 2UNIT CRM BLOCK AND PRE SCH AHAMADIYA AT BREMAN ESSIAM,ddf,,,,,,Ajumako/Enyan/Essiam District Assembly,,,
Ajumako/Enyan/Essiam District Assembly,2011,CONSTRUCTION OF CHPS COMPOUND ESSAMAN,other/unknown,,,,,,Ajumako/Enyan/Essiam District Assembly,,,
Ajumako/Enyan/Essiam District Assembly,2011,CONSTRUCTION OF CHPS COMPOUND ETSI FAMOAYE,other/unknown,,,,,,Ajumako/Enyan/Essiam District Assembly,,,
Ajumako/Enyan/Essiam District Assembly,2011,CONSTRUCTION OF 6 UNIT TEACHERS QUARTERS ENYAN APAA,getfund,,,,,,Ajumako/Enyan/Essiam District Assembly,,,
Ajumako/Enyan/Essiam District Assembly,2011,CONST OF 2 UNIT CLASSROOM BLOCK AT BREMAN ANAMOSI,other donor,,,,,,Ajumako/Enyan/Essiam District Assembly,,,
Ajumako/Enyan/Essiam District Assembly,2011,CONSTRUCTION OF 6 UNIT CLASSROOM BLOCK FOR PRIMARY ABAASA,getfund,,,,,,Ajumako/Enyan/Essiam District Assembly,,,
Ajumako/Enyan/Essiam District Assembly,2011,CONSTRUCTION OF 6 UNIT CLASSROOM BLOCK FOR PRIMARY ENYAN DENKYIRA D/A A&B,getfund,,,,,,Ajumako/Enyan/Essiam District Assembly,,,
Ajumako/Enyan/Essiam District Assembly,2011,CONSTRUCTION OF 6 UNIT CLASSROOM BLOCK FOR PRIMARY OBUOM,getfund,,,,,,Ajumako/Enyan/Essiam District Assembly,,,
Ajumako/Enyan/Essiam District Assembly,2011,CONSTRUCTION OF 6 UNIT CLASSROOM BLOCK FOR PRIMARY ABONWIM,getfund,,,,,,Ajumako/Enyan/Essiam District Assembly,,,
Ajumako/Enyan/Essiam District Assembly,2011,FENCING OF MAGISTRATE COURT AJUMAKO,dacf,,,,,,Ajumako/Enyan/Essiam District Assembly,,,
Ajumako/Enyan/Essiam District Assembly,2011,CONST OF SUNKWAA SMALL TOWN WATER SYSTEM,other donor,,,,,,Ajumako/Enyan/Essiam District Assembly,,,
Ajumako/Enyan/Essiam District Assembly,2011,CONST OF 2  NO CULVETS AT ALUKRASE MANDO & DENKYIRA BUKARIKROM,other donor,,,,,,Ajumako/Enyan/Essiam District Assembly,,,
Ajumako/Enyan/Essiam District Assembly,2011,CONSTRUCTION OF 36 NO LOCKABLE STORES AJUMAKO,multiple,,,,,,Ajumako/Enyan/Essiam District Assembly,,,
Ajumako/Enyan/Essiam District Assembly,2011,CONSTRUCTION OF PRE SCHOOL ABROFOA,other donor,,,,,,Ajumako/Enyan/Essiam District Assembly,,,
Ajumako/Enyan/Essiam District Assembly,2011,CONSTRUCTION OF CAR PARK DWD OFFICE AJUMAKO,other donor,,,,,,Ajumako/Enyan/Essiam District Assembly,,,
Ajumako/Enyan/Essiam District Assembly,2011,COMPLETION OF HOSPITAL AJUMAKO,other gog,,,,,,Ajumako/Enyan/Essiam District Assembly,,,
Ajumako/Enyan/Essiam District Assembly,2011,REHABILITATION OF DCD'S BUNGALOW,dacf,,,,,,Ajumako/Enyan/Essiam District Assembly,,,
Ajumako/Enyan/Essiam District Assembly,2011,CONST OF FEEDER ROAD 4.0KM EKUKROM NYAMEBEKYERE,other donor,,,,,,Ajumako/Enyan/Essiam District Assembly,,,
Ajumako/Enyan/Essiam District Assembly,2011,DRILL OF ONE BOREHOLE ETSI SONKWA,other donor,,,,,,Ajumako/Enyan/Essiam District Assembly,,,
Ajumako/Enyan/Essiam District Assembly,2011,DRILL AND CONSTRUCTION OF 20 BOREHOLES DISTRICT WIDE,other donor,,,,,,Ajumako/Enyan/Essiam District Assembly,,,
Ajumako/Enyan/Essiam District Assembly,2011,CONST OF 3 UNIT CLASSROOM BLOCK AMPIA AJUMAKO,multiple,,,,,,Ajumako/Enyan/Essiam District Assembly,,,
Ajumako/Enyan/Essiam District Assembly,2011,CONST OF 3 UNIT CLASSROOM BLOCK EKUPONG,multiple,,,,,,Ajumako/Enyan/Essiam District Assembly,,,
Ajumako/Enyan/Essiam District Assembly,2011,CONST OF 6 UNIT CLASSROOM BLOCK GESDI AJUMAKO,getfund,,,,,,Ajumako/Enyan/Essiam District Assembly,,,
Ajumako/Enyan/Essiam District Assembly,2011,COMPLETION OF GES OFFICE AJUMAKO,other gog,,,,,,Ajumako/Enyan/Essiam District Assembly,,,
Ajumako/Enyan/Essiam District Assembly,2011,CONSTRUCTION OF 3 UNIT CLASSROOMS BLOCK AKOTOGUA,dacf,,,,,,Ajumako/Enyan/Essiam District Assembly,,,
Ajumako/Enyan/Essiam District Assembly,2011,CONSTRUCTION OF 3 UNIT CLASSROOM BLOCK OSEDZI JHS,dacf,,,,,,Ajumako/Enyan/Essiam District Assembly,,,
Ajumako/Enyan/Essiam District Assembly,2011,EXTENSION OF ELECTRICITY DISTRICTWIDE,other gog,,,,,,Ajumako/Enyan/Essiam District Assembly,,,
Ajumako/Enyan/Essiam District Assembly,2011,SPOT IMPROVEMENT OF FEEDER ROAD ENYAN MAIM ENYAN  APAA,other donor,,,,,,Ajumako/Enyan/Essiam District Assembly,,,
Ajumako/Enyan/Essiam District Assembly,2011,CONSTRUCTION OF 1 NO 6 SEATER KVIP TOILET GESDI,other donor,,,,,,Ajumako/Enyan/Essiam District Assembly,,,
Ajumako/Enyan/Essiam District Assembly,2011,CONSTRUCTION OF ACCESS ROAD FROM TREBU BANTOMA BISEASE,dacf,,,,,,Ajumako/Enyan/Essiam District Assembly,,,
Ajumako/Enyan/Essiam District Assembly,2011,CONSTRUCTION OF 6 UNIT CLASSROOM BLOCK AT ASEMPANYIN,getfund,,,,,,Ajumako/Enyan/Essiam District Assembly,,,
Ajumako/Enyan/Essiam District Assembly,2011,CONSTRUCTION OF KITCHEN & SHED FOR ANYINASU SOLOMON SCHOOL FEEDING SCHOOL,dacf,,,,,,Ajumako/Enyan/Essiam District Assembly,,,
Ajumako/Enyan/Essiam District Assembly,2011,CONSTRUCTION OF KITCHEN AT AHAMAKROMBUA,other donor,,,,,,Ajumako/Enyan/Essiam District Assembly,,,
Ajumako/Enyan/Essiam District Assembly,2011,SPOT IMPROVEMENT OF FEEDER ROAD BADUKROM TO SUNKWA,other donor,,,,,,Ajumako/Enyan/Essiam District Assembly,,,
Ajumako/Enyan/Essiam District Assembly,2011,SPOT IMPROVEMENT OF FEEDER ROAD ASSASAN ESSAMAN,other donor,,,,,,Ajumako/Enyan/Essiam District Assembly,,,
Ajumako/Enyan/Essiam District Assembly,2011,SPOT IMPROVEMENT OF FEEDER ROAD ENYAN MAIM ENYAN APAA,other donor,,,,,,Ajumako/Enyan/Essiam District Assembly,,,
Ajumako/Enyan/Essiam District Assembly,2011,SPOT IMPROVEMENT OF FEEDER ROADS KWESI GYAN NO 1 OPEPEASI,other donor,,,,,,Ajumako/Enyan/Essiam District Assembly,,,
Ajumako/Enyan/Essiam District Assembly,2011,CONSTRUCTION OF 20 PLATFORM INSTALLATION OF PUMP DISTRICT WIDE,other donor,,,,,,Ajumako/Enyan/Essiam District Assembly,,,
Ajumako/Enyan/Essiam District Assembly,2011,CONSTRUCTION OF 6 UNIT CLASSROOM BLOCK FOR PRIMARY ETSI BEWORA ISLAMIC SCHOOL,getfund,,,,,,Ajumako/Enyan/Essiam District Assembly,,,
Ajumako/Enyan/Essiam District Assembly,2011,CONSTRUCTION OF 6 UNIT CLASSROOM BLOCK FOR PRIMARY OFABIR,getfund,,,,,,Ajumako/Enyan/Essiam District Assembly,,,
Ajumako/Enyan/Essiam District Assembly,2011,CONSTRUCTION OF 6 UNIT CLASSROOM BLOCK FOR PRIMARY ENYAN DENKYIRA DA A&B,getfund,,,,,,Ajumako/Enyan/Essiam District Assembly,,,
Ajumako/Enyan/Essiam District Assembly,2011,CONSTRUCTION OF 6 UNIT CLASSROOM BLOCK FOR PRIMARY ETSI BEWORA ISLAMIC SCHOOL,getfund,,,,,,Ajumako/Enyan/Essiam District Assembly,,,
Ajumako/Enyan/Essiam District Assembly,2011,REHABILITATION OF DFO DBA BUNGALOWS AJUMAKO,dacf,,,,,,Ajumako/Enyan/Essiam District Assembly,,,
Ajumako/Enyan/Essiam District Assembly,2011,CONSTRUCTION OF 2 NO 6 SEATER KVIP TOILET ENYAN DENKYIRA PR SCH & OSEDZE METHODIST PRY,other donor,,,,,,Ajumako/Enyan/Essiam District Assembly,,,
Ajumako/Enyan/Essiam District Assembly,2011,CONSTRUCTION OF 1 NO 4 SEATER AND 6 SEATER KVIP TOILET AT NYAMEBEKYERE AND AWORODO DA PRY SCHOOL,other donor,,,,,,Ajumako/Enyan/Essiam District Assembly,,,
Ajumako/Enyan/Essiam District Assembly,2011,CONSTRUCTION OF 2 NO 6 SEATER KVIP TOILETS ABEADZE DA PRY SCH ENTUMBIL DA SCH PRY,other donor,,,,,,Ajumako/Enyan/Essiam District Assembly,,,
Ajumako/Enyan/Essiam District Assembly,2011,CONSTRUCTION 10 SEAKER KVIP LATRINE AT ESSIAM CATH PRY & JHS,ddf,,,,,,Ajumako/Enyan/Essiam District Assembly,,,
Ajumako/Enyan/Essiam District Assembly,2011,CONST OF 3 UNIT CLASSROOM BLOCK AT ASSASAN,ddf,,,,,,Ajumako/Enyan/Essiam District Assembly,,,
Ajumako/Enyan/Essiam District Assembly,2011,CONST OF 3 UNIT CLASSROOM BLOCK AT BABIANIHA,ddf,,,,,,Ajumako/Enyan/Essiam District Assembly,,,
Ajumako/Enyan/Essiam District Assembly,2011,CONST OF 2 UNIT CLASSROOM BLOCK AT BABINSO,ddf,,,,,,Ajumako/Enyan/Essiam District Assembly,,,
Ajumako/Enyan/Essiam District Assembly,2011,CONST OF 2 UNIT CLASSROOM BLOCK AT ANOMABO KUMASI,ddf,,,,,,Ajumako/Enyan/Essiam District Assembly,,,
Ajumako/Enyan/Essiam District Assembly,2011,UPGRADING OF 5KM FEEDER ROAD TREBU TO BISEASE,ddf,,,,,,Ajumako/Enyan/Essiam District Assembly,,,
Ajumako/Enyan/Essiam District Assembly,2011,CONST OF 2UNIT CRM BLOCK AND PRE SCH AHAMADIYA AT BREMAN ESSIAM,ddf,,,,,,Ajumako/Enyan/Essiam District Assembly,,,
Ajumako/Enyan/Essiam District Assembly,2011,CONSTRUCTION OF CHPS COMPOUND ESSAMAN,other/unknown,,,,,,Ajumako/Enyan/Essiam District Assembly,,,
Ajumako/Enyan/Essiam District Assembly,2011,CONSTRUCTION OF CHPS COMPOUND ETSI FAMOAYE,other/unknown,,,,,,Ajumako/Enyan/Essiam District Assembly,,,
Ajumako/Enyan/Essiam District Assembly,2011,CONSTRUCTION  OF 6 UNIT TEACHERS QUARTERS ENYAN APAA,getfund,,,,,,Ajumako/Enyan/Essiam District Assembly,,,
Ajumako/Enyan/Essiam District Assembly,2011,CONST OF 2 UNIT CLASSROOM BLOCK AT BREMAN ANAMOSI,other donor,,,,,,Ajumako/Enyan/Essiam District Assembly,,,
Ajumako/Enyan/Essiam District Assembly,2011,CONSTRUCTION OF 6 UNIT CLASSROOM BLOCK FOR PRIMARY ABAASA,getfund,,,,,,Ajumako/Enyan/Essiam District Assembly,,,
Ajumako/Enyan/Essiam District Assembly,2011,CONSTRUCTION OF 6 UNIT CLASSROOM BLOCK FOR PRIMARY ENYAN DENKYIRA DA A&B,getfund,,,,,,Ajumako/Enyan/Essiam District Assembly,,,
Ajumako/Enyan/Essiam District Assembly,2011,CONSTRUCTION OF 6 UNIT CLASSROOM BLOCK FOR PRIMARY OBUOM,getfund,,,,,,Ajumako/Enyan/Essiam District Assembly,,,
Ajumako/Enyan/Essiam District Assembly,2011,CONSTRUCTION OF 6 UNIT CLASSROOM BLOCK FOR PRIMARY ABONWIM,getfund,,,,,,Ajumako/Enyan/Essiam District Assembly,,,
Ajumako/Enyan/Essiam District Assembly,2011,FENCING OF MAGISTRATE COURT AJUMAKO,dacf,,,,,,Ajumako/Enyan/Essiam District Assembly,,,
Ajumako/Enyan/Essiam District Assembly,2011,CONST OF SUNKWAA SMALL TOWN WATER SYSTEM,other donor,,,,,,Ajumako/Enyan/Essiam District Assembly,,,
Ajumako/Enyan/Essiam District Assembly,2011,CONST OF 2 NO CULVETS AT ATUKRASE MANDO & DENKYIRA BUKARIKROM,other donor,,,,,,Ajumako/Enyan/Essiam District Assembly,,,
Ajumako/Enyan/Essiam District Assembly,2011,CONSTRUCTION OF 36 NO LOCKABLE STORES AJUMAKO,multiple,,,,,,Ajumako/Enyan/Essiam District Assembly,,,
Ajumako/Enyan/Essiam District Assembly,2011,CONSTRUCTION OF PRE SCHOOL ABROFOA,other donor,,,,,,Ajumako/Enyan/Essiam District Assembly,,,
Ajumako/Enyan/Essiam District Assembly,2011,CONSTRUCTION OF CAR PARK DWD OFFICE AJUMAKO,other donor,,,,,,Ajumako/Enyan/Essiam District Assembly,,,
Ajumako/Enyan/Essiam District Assembly,2011,COMPLETION OF HOSPITAL AJUMAKO,other gog,,,,,,Ajumako/Enyan/Essiam District Assembly,,,
Ajumako/Enyan/Essiam District Assembly,2011,REHABILITATION OF DCD'S BUNGALOW,dacf,,,,,,Ajumako/Enyan/Essiam District Assembly,,,
Ajumako/Enyan/Essiam District Assembly,2011,CONST OF FEEDER ROAD 4.0KM EKUKROM NYAMEBEKYERE,other donor,,,,,,Ajumako/Enyan/Essiam District Assembly,,,
Ajumako/Enyan/Essiam District Assembly,2011,DRILL OF ONE BOREHOLES ETSI SONKWA,other donor,,,,,,Ajumako/Enyan/Essiam District Assembly,,,
Ajumako/Enyan/Essiam District Assembly,2011,DRILL AND CONSTRUCTION OF 20 BOREHOLES DISTRICT WIDE,other donor,,,,,,Ajumako/Enyan/Essiam District Assembly,,,
Ajumako/Enyan/Essiam District Assembly,2011,CONST OF 3 UNIT CLASSROOM BLOCK AMPIA AJUMAKO,multiple,,,,,,Ajumako/Enyan/Essiam District Assembly,,,
Ajumako/Enyan/Essiam District Assembly,2011,CONST OF 3 UNIT CLASSROOM BLOCK EKUPONG,multiple,,,,,,Ajumako/Enyan/Essiam District Assembly,,,
Ajumako/Enyan/Essiam District Assembly,2011,CONST OF 6 UNIT CLASSROOM BLOCK GESDI AJUMAKO,getfund,,,,,,Ajumako/Enyan/Essiam District Assembly,,,
Ajumako/Enyan/Essiam District Assembly,2011,COMPLETION OF GES OFFICE AJUMAKO,other gog,,,,,,Ajumako/Enyan/Essiam District Assembly,,,
Ajumako/Enyan/Essiam District Assembly,2011,CONSTRUCTION OF 3 UNIT CLASSROOMS BLOCK AKOTOGUA,dacf,,,,,,Ajumako/Enyan/Essiam District Assembly,,,
Ajumako/Enyan/Essiam District Assembly,2011,CONSTRUCTION OF 3 UNIT CLASSROOM BLOCK OSEDZI JHS,dacf,,,,,,Ajumako/Enyan/Essiam District Assembly,,,
Ajumako/Enyan/Essiam District Assembly,2011,EXTENSION OF ELECTRICITY DISTRICTWIDE,other gog,,,,,,Ajumako/Enyan/Essiam District Assembly,,,
Ajumako/Enyan/Essiam District Assembly,2011,COMPLETION OF PRE SCHOOL EKUPON,other donor,,,,,,Ajumako/Enyan/Essiam District Assembly,,,
Ajumako/Enyan/Essiam District Assembly,2011,CONSTRUCTION OF 1 NO 6 SEATER KVIP TOILET GESDI,other donor,,,,,,Ajumako/Enyan/Essiam District Assembly,,,
Ajumako/Enyan/Essiam District Assembly,2011,CONSTRUCTION OF ACCESS ROAD FROM TREBU BANTOMA BISEASE,dacf,,,,,,Ajumako/Enyan/Essiam District Assembly,,,
Ajumako/Enyan/Essiam District Assembly,2011,CONSTRUCTION OF 6 UNIT CLASSROOM BLOCK AT ASEMPANYIN,getfund,,,,,,Ajumako/Enyan/Essiam District Assembly,,,
Ajumako/Enyan/Essiam District Assembly,2011,CONSTRUCTION OF KITCHEN & SHED FOR ANYINASU SOLOMON SCHOOL FEEDING SCHOOL,dacf,,,,,,Ajumako/Enyan/Essiam District Assembly,,,
Ajumako/Enyan/Essiam District Assembly,2011,CONSTRUCTION OF KITCHEN AT AHAMAKROMBUA,other donor,,,,,,Ajumako/Enyan/Essiam District Assembly,,,
Ajumako/Enyan/Essiam District Assembly,2011,SPOT IMPROVEMENT OF FEEDER ROAD BADUKROM TO SUNKWA,other donor,,,,,,Ajumako/Enyan/Essiam District Assembly,,,
Ajumako/Enyan/Essiam District Assembly,2011,SPOT IMPROVEMENT OF FEEDER ROAD ASSASAN ESSAMAN,other donor,,,,,,Ajumako/Enyan/Essiam District Assembly,,,
Ajumako/Enyan/Essiam District Assembly,2011,SPOT IMPROVEMENT OF FEEDER ROAD ENYAN MAIM ENYAN APAA,other donor,,,,,,Ajumako/Enyan/Essiam District Assembly,,,
Ajumako/Enyan/Essiam District Assembly,2011,SPOT IMPROVEMENT OF FEEDER ROADS KWESI GYAN NO 1 OPEPEASI,other donor,,,,,,Ajumako/Enyan/Essiam District Assembly,,,
Ajumako/Enyan/Essiam District Assembly,2011,CONSTRUCTION OF 20 PLATFORM INSTALLATION OF PUMP DISTRICT WIDE,other donor,,,,,,Ajumako/Enyan/Essiam District Assembly,,,
Ajumako/Enyan/Essiam District Assembly,2011,CONSTRUCTION OF 6 UNIT CLASSROOM BLOCK FOR PRIMARY ETSI BEWORA ISLAMIC SCHOOL,getfund,,,,,,Ajumako/Enyan/Essiam District Assembly,,,
Ajumako/Enyan/Essiam District Assembly,2011,CONSTRUCTION OF 6 UNIT CLASSROOM BLOCK FOR PRIMARY OFABIR,getfund,,,,,,Ajumako/Enyan/Essiam District Assembly,,,
Ajumako/Enyan/Essiam District Assembly,2011,CONSTRUCTION OF 6 UNIT CLASSROOM BLOCK FOR PRIMARY,other/unknown,,,,,,Ajumako/Enyan/Essiam District Assembly,,,
Ajumako/Enyan/Essiam District Assembly,2011,CONSTRUCTION OF 6 UNIT CLASSROOM BLOCK FOR PRIMARY ETSI BEWORA ISLAMIC SCHOOL,getfund,,,,,,Ajumako/Enyan/Essiam District Assembly,,,
Ajumako/Enyan/Essiam District Assembly,2011,REHABILITATION OF DFO DBA BUNGALOWS AJUMAKO,dacf,,,,,,Ajumako/Enyan/Essiam District Assembly,,,
Ajumako/Enyan/Essiam District Assembly,2011,CONSTRUCTION OF 2 NO 6 SEATER KVIP TOILET ENYAN DENKYIRA PRY SCH & OSEDZE METHODIST PRY,other donor,,,,,,Ajumako/Enyan/Essiam District Assembly,,,
Ajumako/Enyan/Essiam District Assembly,2011,CONSTRUCTION OF 1 NO 4 SEATER AND 6 SEATER KVIP TOILET AT NYAMEBEKYERE AND AWORODO DA PRY SCHOOL,other donor,,,,,,Ajumako/Enyan/Essiam District Assembly,,,
Ajumako/Enyan/Essiam District Assembly,2011,CONSTRUCTION OF 2 NO 6 SEATER KVIP TOILETS ABEADZE DA PRY SCH ENTUMBIL DA SCH PRY,other donor,,,,,,Ajumako/Enyan/Essiam District Assembly,,,
Ajumako/Enyan/Essiam District Assembly,2011,CONSTRUCTION 10 SEATER KVIP LATRINE AT ESSIAM CATH PRY,ddf,,,,,,Ajumako/Enyan/Essiam District Assembly,,,
Ajumako/Enyan/Essiam District Assembly,2011,CONST OF 3 UNIT CLASSROOM BLOCK AT ASSASAN,ddf,,,,,,Ajumako/Enyan/Essiam District Assembly,,,
Ajumako/Enyan/Essiam District Assembly,2011,CONST OF 3 UNIT CLASSROOM BLOCK AT BABIANIHA,ddf,,,,,,Ajumako/Enyan/Essiam District Assembly,,,
Ajumako/Enyan/Essiam District Assembly,2011,CONST OF 2 UNIT CLASSROOM BLOCK AT BABINSO,ddf,,,,,,Ajumako/Enyan/Essiam District Assembly,,,
Ajumako/Enyan/Essiam District Assembly,2011,CONST OF 2 UNIT CLASSROOM BLOCK AT ANOMABO KUMASI,ddf,,,,,,Ajumako/Enyan/Essiam District Assembly,,,
Ajumako/Enyan/Essiam District Assembly,2011,UPGRADING OF 5KM FEEDER ROAD TREBU TO BISEASE,ddf,,,,,,Ajumako/Enyan/Essiam District Assembly,,,
Ajumako/Enyan/Essiam District Assembly,2011,CONST OF 2UNIT CRM BLOCK AND PRE SCH AHAMADIYA AT BREMAN ESSIAM,ddf,,,,,,Ajumako/Enyan/Essiam District Assembly,,,
Ajumako/Enyan/Essiam District Assembly,2011,CONSTRUCTION OF CHPS COMPOUND ESSAMAN,other/unknown,,,,,,Ajumako/Enyan/Essiam District Assembly,,,
Ajumako/Enyan/Essiam District Assembly,2011,CONSTRUCTION OF CHPS COMPOUND ETSI FAMOAYE,other/unknown,,,,,,Ajumako/Enyan/Essiam District Assembly,,,
Ajumako/Enyan/Essiam District Assembly,2011,CONSTRUCTION OF 6 UNIT TEACHERS QUARTERS ENYAN APAA,getfund,,,,,,Ajumako/Enyan/Essiam District Assembly,,,
Ajumako/Enyan/Essiam District Assembly,2011,CONST OF 2 UNIT CLASSROOM BLOCK AT BREMAN ANAMOSI,other donor,,,,,,Ajumako/Enyan/Essiam District Assembly,,,
Ajumako/Enyan/Essiam District Assembly,2011,CONSTRUCTION OF 6 UNIT CLASSROOM BLOCK FOR PRIMARY ABAASA,getfund,,,,,,Ajumako/Enyan/Essiam District Assembly,,,
Ajumako/Enyan/Essiam District Assembly,2011,CONSTRUCTION OF 6 UNIT CLASSROOM BLOCK FOR PRIMARY ENYAN DENKYIRA DA A&B,getfund,,,,,,Ajumako/Enyan/Essiam District Assembly,,,
Ajumako/Enyan/Essiam District Assembly,2011,CONSTRUCTION OF 6 UNIT CLASSROOM BLOCK FOR PRIMARY OBUOM,getfund,,,,,,Ajumako/Enyan/Essiam District Assembly,,,
Ajumako/Enyan/Essiam District Assembly,2011,CONSTRUCTION OF 6 UNIT CLASSROOM BLOCK FOR PRIMARY ABONWIM,getfund,,,,,,Ajumako/Enyan/Essiam District Assembly,,,
Ajumako/Enyan/Essiam District Assembly,2011,FENCING OF MAGISTRATE COURT AJUMAKO,dacf,,,,,,Ajumako/Enyan/Essiam District Assembly,,,
Ajumako/Enyan/Essiam District Assembly,2011,CONST OF SUNKWAA SMALL TOWN WATER SYSTEM,other donor,,,,,,Ajumako/Enyan/Essiam District Assembly,,,
Ajumako/Enyan/Essiam District Assembly,2011,CONST OF 2 NO CULVETS AT ATUKRASE MANDO & DENKYIRA BUKARIKROM,other donor,,,,,,Ajumako/Enyan/Essiam District Assembly,,,
Ajumako/Enyan/Essiam District Assembly,2011,CONSTRUCTION OF 36 NO LOCKABLE STORES AJUMAKO,multiple,,,,,,Ajumako/Enyan/Essiam District Assembly,,,
Ajumako/Enyan/Essiam District Assembly,2011,CONSTRUCTION OF PRE-SCHOOL ABROFOA,other donor,,,,,,Ajumako/Enyan/Essiam District Assembly,,,
Ajumako/Enyan/Essiam District Assembly,2011,CONSTRUCTION OF CAR PARK DWD OFFICE AJUMAKO,other donor,,,,,,Ajumako/Enyan/Essiam District Assembly,,,
Ajumako/Enyan/Essiam District Assembly,2011,COMPLETION OF HOSPITAL AJUMAKO,other donor,,,,,,Ajumako/Enyan/Essiam District Assembly,,,
Ajumako/Enyan/Essiam District Assembly,2011,REHABILITATION OF DCDS BUNGALOW,dacf,,,,,,Ajumako/Enyan/Essiam District Assembly,,,
Ajumako/Enyan/Essiam District Assembly,2011,CONST OF FEEDER ROAD 4.0KM EKUKROM NYAMEBEKYERE,other donor,,,,,,Ajumako/Enyan/Essiam District Assembly,,,
Ajumako/Enyan/Essiam District Assembly,2011,DRILL OF ONE BOREHOLE ETSI SONKWA,other donor,,,,,,Ajumako/Enyan/Essiam District Assembly,,,
Ajumako/Enyan/Essiam District Assembly,2011,DRILL AND CONSTRUCTION OF 20 BOREHOLES DISTRICT WIDE,other donor,,,,,,Ajumako/Enyan/Essiam District Assembly,,,
Ajumako/Enyan/Essiam District Assembly,2011,CONST OF 3 UNIT CLASSROOM BLOCK AMPIA-AJUMAKO,multiple,,,,,,Ajumako/Enyan/Essiam District Assembly,,,
Ajumako/Enyan/Essiam District Assembly,2011,CONST OF 3 UNIT CLASSROOM BLOCK EKUPONG,multiple,,,,,,Ajumako/Enyan/Essiam District Assembly,,,
Ajumako/Enyan/Essiam District Assembly,2011,CONST OF 6 UNIT CLASSROOM BLOCK GESDI AJUMAKO,getfund,,,,,,Ajumako/Enyan/Essiam District Assembly,,,
Ajumako/Enyan/Essiam District Assembly,2011,COMPLETION OF GES OFFICE AJUMAKO,other gog,,,,,,Ajumako/Enyan/Essiam District Assembly,,,
Ajumako/Enyan/Essiam District Assembly,2011,CONSTRUCTION OF 3 UNIT CLASSROOMS BLOCK AKOTOGUA,dacf,,,,,,Ajumako/Enyan/Essiam District Assembly,,,
Ajumako/Enyan/Essiam District Assembly,2011,CONSTRUCTION OF 3 UNIT CLASSROOM BLOCK OSEDZI JHS,dacf,,,,,,Ajumako/Enyan/Essiam District Assembly,,,
Ajumako/Enyan/Essiam District Assembly,2011,EXTENSION OF ELECTRICITY DISTRICTWIDE,other gog,,,,,,Ajumako/Enyan/Essiam District Assembly,,,
Ajumako/Enyan/Essiam District Assembly,2011,SPOT IMPROVEMENT OF FEEDER ROAD BADUKROM TO SUNKWA,other donor,,,,,,Ajumako/Enyan/Essiam District Assembly,,,
Ajumako/Enyan/Essiam District Assembly,2011,CONSTRUCTION OF 1 NO 6 SEATER KVIP TOILET GESDI,other donor,,,,,,Ajumako/Enyan/Essiam District Assembly,,,
Ajumako/Enyan/Essiam District Assembly,2011,CONSTRUCTION OF 3 UNIT CLASSROOM BLOCK AT ASEMPANYIN,getfund,,,,,,Ajumako/Enyan/Essiam District Assembly,,,
Ajumako/Enyan/Essiam District Assembly,2011,CONSTRUCTION OF KITCHEND & SHED FOR ANYINASU SOLOMON SCHOOL FEEDING SCHOOL,dacf,,,,,,Ajumako/Enyan/Essiam District Assembly,,,
Ajumako/Enyan/Essiam District Assembly,2011,CONSTRUCTI OF KITCHEN AT AHAMAKROMBUA,dacf,,,,,,Ajumako/Enyan/Essiam District Assembly,,,
Ajumako/Enyan/Essiam District Assembly,2011,SPOT IMPROVEMENT OF FEEDER ROAD ASSASAN ESSAMAN,other donor,,,,,,Ajumako/Enyan/Essiam District Assembly,,,
Ajumako/Enyan/Essiam District Assembly,2011,SPOT IMPROVEMENT OF FEEDER ROADS ENYAN MAIM ENYAN APAA,other donor,,,,,,Ajumako/Enyan/Essiam District Assembly,,,
Ajumako/Enyan/Essiam District Assembly,2011,SPOT IMPROVEMENT OF FEEDER ROADS KWESI GYAN NO 1 OPEPEASI,other donor,,,,,,Ajumako/Enyan/Essiam District Assembly,,,
Ajumako/Enyan/Essiam District Assembly,2011,CONSTRUCTION OF 20 PLATFORM INSTALLATION OF PUMP DISTRICT WIDE,other donor,,,,,,Ajumako/Enyan/Essiam District Assembly,,,
Ajumako/Enyan/Essiam District Assembly,2011,CONSTRUCTION OF 6 UNIT CLASSROOM BLOCK FOR PRIMARY ETSI BEWORA ISLAMIC SCHOOL,getfund,,,,,,Ajumako/Enyan/Essiam District Assembly,,,
Ajumako/Enyan/Essiam District Assembly,2011,CONSTRUCTION OF 6 UNIT CLASSROOM BLOCK FOR PRIMARY ETSI BEWORA ISLAMIC SCHOOL,getfund,,,,,,Ajumako/Enyan/Essiam District Assembly,,,
Ajumako/Enyan/Essiam District Assembly,2011,REHABILITATION OF DFO DBA BUNGALOWS AJUMAKO,dacf,,,,,,Ajumako/Enyan/Essiam District Assembly,,,
Ajumako/Enyan/Essiam District Assembly,2011,CONSTRUCTION OF 2 NO 6 SEATER KVIP TOILET ENYAN DENKYIRA PRY SCH & OSEDZE METHODIST PRY,other donor,,,,,,Ajumako/Enyan/Essiam District Assembly,,,
Ajumako/Enyan/Essiam District Assembly,2011,CONSTRUCTION OF 1 NO 4 SEATER AND 6 SEATER KVIP TOILET AT NYAMEBEKYERE AND AWORODO DA PRY SCHOOL,other donor,,,,,,Ajumako/Enyan/Essiam District Assembly,,,
Ajumako/Enyan/Essiam District Assembly,2011,CONSTRUCTION OF 2 NO 6 SEATER KVIP TOILETS ABEADZE DA PRY SCH ENTUMBIL DA SCH PRY,other donor,,,,,,Ajumako/Enyan/Essiam District Assembly,,,
Ajumako/Enyan/Essiam District Assembly,2011,CONSTRUCTION OF 2 PLATFORMS INSTALLATION OF PUMP (ADDENDUM),other donor,,,,,,Ajumako/Enyan/Essiam District Assembly,,,
Ajumako/Enyan/Essiam District Assembly,2011,CONSTRUCTION 10 SEATER KVIP LATRINE AT ESSIAM CATH PRY & JHS,ddf,,,,,,Ajumako/Enyan/Essiam District Assembly,,,
Ajumako/Enyan/Essiam District Assembly,2011,CONST OF 3 UNIT CLASSROOM BLOCK AT ASSASAN,ddf,,,,,,Ajumako/Enyan/Essiam District Assembly,,,
Ajumako/Enyan/Essiam District Assembly,2011,CONST OF 3 UNIT CLASSROOM BLOCK AT BABIANIHA,ddf,,,,,,Ajumako/Enyan/Essiam District Assembly,,,
Ajumako/Enyan/Essiam District Assembly,2011,CONST OF 2 UNIT CLASSROOM BLOCK AT BABINSO,ddf,,,,,,Ajumako/Enyan/Essiam District Assembly,,,
Ajumako/Enyan/Essiam District Assembly,2011,CONST OF 2 UNIT CLASSROOM BLOCK AT ANOMABO-KUMASI,ddf,,,,,,Ajumako/Enyan/Essiam District Assembly,,,
Ajumako/Enyan/Essiam District Assembly,2011,UPGRADING OF 5KM FEEDER ROAD TREBU TO BISEASE,ddf,,,,,,Ajumako/Enyan/Essiam District Assembly,,,
Ajumako/Enyan/Essiam District Assembly,2011,CONST OF 2UNIT CRM BLOCK AND PRE SCH AHAMADIYA AT BREMAN ESSIAM,ddf,,,,,,Ajumako/Enyan/Essiam District Assembly,,,
Ajumako/Enyan/Essiam District Assembly,2011,CONSTRUCTION OF CHPS COMPOUND ESSAMAN,other/unknown,,,,,,Ajumako/Enyan/Essiam District Assembly,,,
Ajumako/Enyan/Essiam District Assembly,2011,CONSTRUCTION OF CHPS COMPOUND ETSI FAMOAYE,other/unknown,,,,,,Ajumako/Enyan/Essiam District Assembly,,,
Ajumako/Enyan/Essiam District Assembly,2011,CONSTRUCTION OF 6 UNIT TEACHERS QUARTERS ENYAN APAA,getfund,,,,,,Ajumako/Enyan/Essiam District Assembly,,,
Ajumako/Enyan/Essiam District Assembly,2011,CONST OF 2 UNIT CLASSROOM BLOCK AT BREMAN ANAMOSI,other donor,,,,,,Ajumako/Enyan/Essiam District Assembly,,,
Ajumako/Enyan/Essiam District Assembly,2011,CONSTRUCTION OF 6 UNIT CLASSROOM BLOCK FOR PRIMARY ABAASA,getfund,,,,,,Ajumako/Enyan/Essiam District Assembly,,,
Ajumako/Enyan/Essiam District Assembly,2011,CONSTRUCTION OF 6 UNIT CLASSROOM BLOCK FOR PRIMARY ENYAN DENKYIRA DA A&B,getfund,,,,,,Ajumako/Enyan/Essiam District Assembly,,,
Ajumako/Enyan/Essiam District Assembly,2011,CONSTRUCTION OF 6 UNIT CLASSROOM BLOCK FOR PRIMARY OBUON,getfund,,,,,,Ajumako/Enyan/Essiam District Assembly,,,
Ajumako/Enyan/Essiam District Assembly,2011,CONSTRUCTION OF 6 UNIT CLASSROOM BLOCK FOR PRIMARY ABONWIM,getfund,,,,,,Ajumako/Enyan/Essiam District Assembly,,,
Ajumako/Enyan/Essiam District Assembly,2011,FENCING OF MAGISTRATE COURT AJUMAKO,dacf,,,,,,Ajumako/Enyan/Essiam District Assembly,,,
Ajumako/Enyan/Essiam District Assembly,2011,CONST OF SUNKWAA SMALL TOWN WATER SYSTEM,other donor,,,,,,Ajumako/Enyan/Essiam District Assembly,,,
Ajumako/Enyan/Essiam District Assembly,2011,CONST OF 2 NO CULVETS AT ATUKRASE MANDO & DENKYIRA BUKARIKROM,other donor,,,,,,Ajumako/Enyan/Essiam District Assembly,,,
Ajumako/Enyan/Essiam District Assembly,2011,SPOT IMPROVEMENT OF DENKYENDUA KOFI DONKOKROM F RJ,other donor,,,,,,Ajumako/Enyan/Essiam District Assembly,,,
Ajumako/Enyan/Essiam District Assembly,2011,SPOT IMPROVEMENT OF NSAWADZE-OBONTSER FR (4.5 KM),other donor,,,,,,Ajumako/Enyan/Essiam District Assembly,,,
Ajumako/Enyan/Essiam District Assembly,2011,CONSTRUCTION OF 6 SEATER WC TOILET AT AJUMAKO MARKET STORES,other donor,,,,,,Ajumako/Enyan/Essiam District Assembly,,,
Ajumako/Enyan/Essiam District Assembly,2011,CONSTRUCTION OF KITCHEN AT EKUKROM DA PRY SCHOOL,multiple,,,,,,Ajumako/Enyan/Essiam District Assembly,,,
Ajumako/Enyan/Essiam District Assembly,2011,CONSTRUCTION OF 1 NO DOCTORS BUNGALOW AT AJUMAKO,dacf,,,,,,Ajumako/Enyan/Essiam District Assembly,,,
Ajumako/Enyan/Essiam District Assembly,2011,CONSTRUCTION OF 1 NO SEMI-DETACHED BUNGALOW,dacf,,,,,,Ajumako/Enyan/Essiam District Assembly,,,
Ajumako/Enyan/Essiam District Assembly,2011,ADDENDUM DRILLING OF 2 NO BOREHOLES,other donor,,,,,,Ajumako/Enyan/Essiam District Assembly,,,
Ajumako/Enyan/Essiam District Assembly,2011,REHABILITATION OF 1 NO 3 UNIT CLASSROOM BK DA JHS AND CONSTRUCTION OF 1 NO 12 SEATER KVIP TOILET AT AJUMAKO ASSASAN,dacf,,,,,,Ajumako/Enyan/Essiam District Assembly,,,
Ajumako/Enyan/Essiam District Assembly,2011,REHABILITATION OF 1 NO 6 UNIT CLASSROOM BLOCK AT ETSII ABAKAH,dacf,,,,,,Ajumako/Enyan/Essiam District Assembly,,,
Ajumako/Enyan/Essiam District Assembly,2011,CONSTRUCTION OF AJUMAKO-ASSASSAN MARKET AND REHAB OF DURBAR GROUND AT EDU YAW,dacf,,,,,,Ajumako/Enyan/Essiam District Assembly,,,
Akatsi District Assembly,2011,CONSTRUCT DRAINS & SHED IN THE MARKET,other/unknown,,,,,,Akatsi South District Assembly,,,
Akatsi District Assembly,2011,REHABILITATE 2NO SMALL SCALE IRRIGATION FACILITIES,other/unknown,,,,,,Akatsi South District Assembly,,,
Akatsi District Assembly,2011,TO ESTABLISH 2NO SMALL SCALE CASSAVA PROCESSING FACILITY,other/unknown,,,,,,Akatsi South District Assembly,,,
Akatsi District Assembly,2011,CONSTRUCTION OF ROADS KM,other/unknown,,,,,,Akatsi South District Assembly,,,
Akatsi District Assembly,2011,REHABILITATION OF ROADS LINKING COMMUNITIES,other/unknown,,,,,,Akatsi South District Assembly,,,
Akatsi District Assembly,2011,CONSTRUCTION OF BRIDGES AND CULVERTS,other/unknown,,,,,,Akatsi South District Assembly,,,
Akatsi District Assembly,2011,PREPARE SITE PLAN FOR PUBLIC INSTITUTIONS IN 2 AREA COUNCILS,other/unknown,,,,,,Akatsi South District Assembly,,,
Akatsi District Assembly,2011,EXTEND ELECTRICITY TO 95 COMMUNITIES IN THE DISTRICT,other/unknown,,,,,,Akatsi South District Assembly,,,
Akatsi District Assembly,2011,UPGRADE ELECTRICITY NETWORK IN 10 COMMUNITIES,other/unknown,,,,,,Akatsi South District Assembly,,,
Akatsi District Assembly,2011,DRILLING AND CONSTRUCTION OF 25 NO BOREHOLES,other/unknown,,,,,,Akatsi South District Assembly,,,
Akatsi District Assembly,2011,CONSTRUCTION OF 1NO PIPE SCHEME,other/unknown,,,,,,Akatsi South District Assembly,,,
Akatsi District Assembly,2011,CONSTRUCTION OF 11 NO INSTITUTION LATRINE,other/unknown,,,,,,Akatsi South District Assembly,,,
Akatsi District Assembly,2011,SUPPLY 10 NO REFUSE CONTAINERS AT VANTAGE POINTS IN AKATSI,other/unknown,,,,,,Akatsi South District Assembly,,,
Akatsi District Assembly,2011,CONSTRUCTION 12 CLASSROOM BLOCKS WITH OFFICE STORE AND AUXILIARY FACILITIES,other/unknown,,,,,,Akatsi South District Assembly,,,
Akatsi District Assembly,2011,CONSTRUCT 5 KGS BY 2011,other/unknown,,,,,,Akatsi South District Assembly,,,
Akatsi District Assembly,2011,EXTEND THE PROVISION OF SCHOOL UNIFORMS TO MORE NEEDY CHILDREN,other/unknown,,,,,,Akatsi South District Assembly,,,
Akatsi District Assembly,2011,REHABILITATE 10 SCHOOLS BY 2011,other/unknown,,,,,,Akatsi South District Assembly,,,
Akatsi District Assembly,2011,CONSTRUCTION AND EXTEND OPD AND VCT CENTRES BY 2011,other/unknown,,,,,,Akatsi South District Assembly,,,
Akatsi District Assembly,2011,CONSTRUCTION 1NO WARD AT DISTRICT HOSPITAL,other/unknown,,,,,,Akatsi South District Assembly,,,
Akatsi District Assembly,2011,COMPLETION OF 3 NO CHPS COMPOUND,other/unknown,,,,,,Akatsi South District Assembly,,,
Akatsi District Assembly,2011,REHABILITATE 4 HEALTH CENTRES,other/unknown,,,,,,Akatsi South District Assembly,,,
Akatsi District Assembly,2011,INCREASE PUBLIC AWARENESS ON THE RIGHTS OF THE CHILD IN 3 COMMUNITIES OF EACH OF THE FIVE AREA COUNCILS,other/unknown,,,,,,Akatsi South District Assembly,,,
Akatsi District Assembly,2011,INCREASE AWARENESS ON HIV AIDS PREVENTION IN THE FIVE AREA COUNCILS,other/unknown,,,,,,Akatsi South District Assembly,,,
Akatsi District Assembly,2011,CONSTRUCT OF 3 NO SEMI DETACHED BUNGALOWS,other/unknown,,,,,,Akatsi South District Assembly,,,
Akatsi District Assembly,2011,PROVIDE OFFICE EQUIPMENT FOR DECENTRALIZED DEPARTMENTS IN THE DISTRICT BY 2013,other/unknown,,,,,,Akatsi South District Assembly,,,
Akatsi District Assembly,2011,RUN CIVIC EDUCATION CLUBS IN ALL THE SECOND CYCLE SCHOOLS,other/unknown,,,,,,Akatsi South District Assembly,,,
Akuapim North Municipal Assembly,2011,CONSTRUCTION OF 10 INSTITUTIONAL LATRINES,other/unknown,,,,,,Akuapim North Municipal Assembly,,,
Akuapim North Municipal Assembly,2011,REHABILITATION OF 10 NO PUBLIC TOILET FACILITIES IN THE DISTRICTS,other/unknown,,,,,,Akuapim North Municipal Assembly,,,
Akuapim North Municipal Assembly,2011,REHABILITATE SELECTED EXISTING TOWN DRAINS,other/unknown,,,,,,Akuapim North Municipal Assembly,,,
Akuapim North Municipal Assembly,2011,CONSTRUCT NEW DRAINS IN 10 SELECTED COMMUNITIES,other/unknown,,,,,,Akuapim North Municipal Assembly,,,
Akuapim North Municipal Assembly,2011,CONSTRUCTION OF 1 NO SMALL TOWN WATER SYSTEM,other/unknown,,,,,,Akuapim North Municipal Assembly,,,
Akuapim North Municipal Assembly,2011,CONSTRUCTION OF 5 NEW ADDITION BOREHOLES IN 5 SELECTED COMMUNITIES,other/unknown,,,,,,Akuapim North Municipal Assembly,,,
Akuapim North Municipal Assembly,2011,RENOVATION OF EXISTING BOREHOLES FACILITIES INTHE DISTRICT,other/unknown,,,,,,Akuapim North Municipal Assembly,,,
Akuapim North Municipal Assembly,2011,CONSTRUCTION OF 1 NO NURSES BUNGALOWS FOR SELECTED COMMUNITIES (MANGOASE),other/unknown,,,,,,Akuapim North Municipal Assembly,,,
Akuapim North Municipal Assembly,2011,CARRYING OUT ROUTINE MAINTENANCE ON BUNGALOWS FOR GOVERNMENT WORKERS,other/unknown,,,,,,Akuapim North Municipal Assembly,,,
Akuapim North Municipal Assembly,2011,CONSTRUCTION OF 20KM OF LINKING ROADS FROM RURAL SETTLEMENTS TO URBAN CENTRES,other/unknown,,,,,,Akuapim North Municipal Assembly,,,
Akuapim North Municipal Assembly,2011,RESHAPING OF DEPLORABLE ROADS IN THE DISTRICT,other/unknown,,,,,,Akuapim North Municipal Assembly,,,
Akuapim North Municipal Assembly,2011,PAVING OF MAMFI LORRY STATION ABIRIW MARKET,other/unknown,,,,,,Akuapim North Municipal Assembly,,,
Akuapim North Municipal Assembly,2011,SUPPLY OF 120 STREET LIGHTS AND ACCESSORIES,other/unknown,,,,,,Akuapim North Municipal Assembly,,,
Akuapim North Municipal Assembly,2011,RENOVATION OF MOFA OFFICE BLOCK,other/unknown,,,,,,Akuapim North Municipal Assembly,,,
Akuapim North Municipal Assembly,2011,CONSTRUCTION OF VETERINARY CLINIC,other/unknown,,,,,,Akuapim North Municipal Assembly,,,
Akuapim North Municipal Assembly,2011,CONSTRUCTION OF 3 NEW MARKETS IN THE DISTRICT,other/unknown,,,,,,Akuapim North Municipal Assembly,,,
Akuapim North Municipal Assembly,2011,REHABILITATE EXISTING MARKET STRUCTURES IN THE DISTRICT,other/unknown,,,,,,Akuapim North Municipal Assembly,,,
Akuapim North Municipal Assembly,2011,CONSTRUCTION OF 36 UNIT MARKET STALLS,other/unknown,,,,,,Akuapim North Municipal Assembly,,,
Akuapim North Municipal Assembly,2011,CREATE AWARENESS OF IMPORTANCE OF GRADING AND STANDARD IN LOCAL MARKETS,other/unknown,,,,,,Akuapim North Municipal Assembly,,,
Akuapim North Municipal Assembly,2011,CONSTRUCTION OF 1 NO 6 UNIT CLASSROOM BLOCK WITH OFFICE AND STORE AT MANGOASE SENIOR HIGH SCHOOL,other/unknown,,,,,,Akuapim North Municipal Assembly,,,
Akuapim North Municipal Assembly,2011,CONSTRUCTION OF 1 NO 6 UNIT CLASSROOM BLOCK WITH OFFICE STORE AT MANGOASE SENIOR HIGH SCHOOL,other/unknown,,,,,,Akuapim North Municipal Assembly,,,
Akuapim North Municipal Assembly,2011,CONSTRUCTION OF 1 NO 3 UNIT CLASSROOM BLOCK WITH OFFICE AT SIKORKOR,other/unknown,,,,,,Akuapim North Municipal Assembly,,,
Akuapim North Municipal Assembly,2011,CONSTRUCTION OF DORMITORY FOR MANGOASE SENIOR HIGH SCHOOL,other/unknown,,,,,,Akuapim North Municipal Assembly,,,
Akuapim North Municipal Assembly,2011,CONSTRUCTION OF DINING HALL FOR MANGOASE SENIOR HIGH SCHOOL,other/unknown,,,,,,Akuapim North Municipal Assembly,,,
Akuapim North Municipal Assembly,2011,CONSTRUCTION OF ADMINISTRATION BLOCK FOR MANGOASE SECONDARY SCHOOL,other/unknown,,,,,,Akuapim North Municipal Assembly,,,
Akuapim North Municipal Assembly,2011,CONSTRUCTION OF 6 UNIT CLASSROOM BLOCK OFFICE AND STORE AT DAWU AWUKUGUA METH PRIMARY,other/unknown,,,,,,Akuapim North Municipal Assembly,,,
Akuapim North Municipal Assembly,2011,CONSTRUCTION OF THREE UNIT CLASSROOM BLOCK AND STORE IN THE DISTRICT AT SANFO ANO DA JHS,other/unknown,,,,,,Akuapim North Municipal Assembly,,,
Akuapim North Municipal Assembly,2011,CONSTRUCTION OF THREE UNIT JHS CLASSROOM BLOCK AND CLADDING OF PAVILION,other/unknown,,,,,,Akuapim North Municipal Assembly,,,
Akuapim North Municipal Assembly,2011,REHABILITATION OF EXISTING CLASSROOM BLOCKS IN SELECTED COMMUNITIES,other/unknown,,,,,,Akuapim North Municipal Assembly,,,
Akuapim North Municipal Assembly,2011,CONSTRUCTION OF 2 TEACHERS BUNGALOWS IN THE DISTRICT (BENKUM SHS & TWUMGUASO),other/unknown,,,,,,Akuapim North Municipal Assembly,,,
Akuapim North Municipal Assembly,2011,CONSTRUCTION OF 4 NEW HEALTH FACILITIES IN SELECTED COMMUNITIES,other/unknown,,,,,,Akuapim North Municipal Assembly,,,
Akuapim North Municipal Assembly,2011,REHABILITATE EXISTING HEALTH FACILITIES,other/unknown,,,,,,Akuapim North Municipal Assembly,,,
Akuapim North Municipal Assembly,2011,"CONNECT ELECTRICITY AND WATER TO 4 AREA COUNCIL OFFICES (TUTU-OBOSOMASE, ASAMAN-NYANEBEKYERE,OKORASE-TINKONG,ASESEESO)",other/unknown,,,,,,Akuapim North Municipal Assembly,,,
Akuapim North Municipal Assembly,2011,CONNECT ELECTRICITY AND WATER TO AREA COUNCIL OFFICES TUTU OBOSOMASE ASAMAN BNYANEBEKYERE OKORASE TINKONG ASESEESO,other/unknown,,,,,,Akuapim North Municipal Assembly,,,
Akuapim South Municipal Assembly,2011,HYDROGEOLOGICAL INVESTIGATION OF 5NO BOREHOLES,other donor,,23-Mar-11,,,,Nsawam-Adoagyiri Municipal Assembly,,2011-03-23,
Akuapim South Municipal Assembly,2011,DRILLING & CONSTRUCTION OF 5NO BOREHOLES,other donor,,29-Mar-11,,,,Nsawam-Adoagyiri Municipal Assembly,,2011-03-29,
Akuapim South Municipal Assembly,2011,SPOT IMPROVEMENT,other donor,,18-Oct-11,,,,Nsawam-Adoagyiri Municipal Assembly,,2011-10-18,
Akuapim South Municipal Assembly,2011,CONSTRUCTION OF 1 NO 14 SEATER WC FACILITY,other donor,,1-Jul-11,31-Dec-11,,,Nsawam-Adoagyiri Municipal Assembly,,2011-07-01,2011-12-31
Akuapim South Municipal Assembly,2011,CONSTRUCTION OF 1NO 2 STREAM KG BLOCK,getfund,,14-Jan-12,30-May-12,,,Nsawam-Adoagyiri Municipal Assembly,,2012-01-14,2012-05-30
Akuapim South Municipal Assembly,2011,COMPLETION OF 1 NO 6 UNIT CLASSROOM BLOCK,getfund,,,,,,Nsawam-Adoagyiri Municipal Assembly,,,
Akuapim South Municipal Assembly,2011,CONSTRUCTION OF 1NO 6 UNIT CLASSROOM BLOCK,getfund,,,,,,Nsawam-Adoagyiri Municipal Assembly,,,
Akuapim South Municipal Assembly,2011,CONSTRUCTION OF 1 NO 6 UNIT CLASSROOM BLOCK,getfund,,,,,,Nsawam-Adoagyiri Municipal Assembly,,,
Akuapim South Municipal Assembly,2011,CONSTRUCTION OF 1 NO 6 UNIT CLASSROOM BLOCK,getfund,,,,,,Nsawam-Adoagyiri Municipal Assembly,,,
Akuapim South Municipal Assembly,2011,CONSTRUCTION OF 1NO 6 UNIT CLASSROOM BLOCK,getfund,,18-Aug-10,,,,Nsawam-Adoagyiri Municipal Assembly,,2010-08-18,
Akuapim South Municipal Assembly,2011,CONSTRUCTION OF 1 NO 6 UNIT CLASSROOM BLOCK,getfund,,,,,,Nsawam-Adoagyiri Municipal Assembly,,,
Akuapim South Municipal Assembly,2011,DRILLING & CONSTRUCTION OF 5NO BOREHOLES,other donor,,19-May-10,,,,Nsawam-Adoagyiri Municipal Assembly,,2010-05-19,
Akuapim South Municipal Assembly,2011,DRILLING & CONSTRUCTION OF 8NO BOREHOLES,other donor,,16-Oct-09,,,,Nsawam-Adoagyiri Municipal Assembly,,2009-10-16,
Akuapim South Municipal Assembly,2011,RENOVATION OF 1NO MDCD BUNGALOW,dacf,,10-Oct-09,,,,Nsawam-Adoagyiri Municipal Assembly,,2009-10-10,
Akuapim South Municipal Assembly,2011,CONSTRUCTION OF 1NO 6 UNIT CLASSROOM BLOCK,getfund,,,,,,Nsawam-Adoagyiri Municipal Assembly,,,
Akuapim South Municipal Assembly,2011,CONSTRUCTION OF 1NO 6 UNIT CLASSROOM BLOCK,getfund,,,,,,Nsawam-Adoagyiri Municipal Assembly,,,
Akuapim South Municipal Assembly,2011,CONSTRUCTION OF 1NO 6 UNIT CLASSROOM BLOCK,getfund,,,,,,Nsawam-Adoagyiri Municipal Assembly,,,
Akuapim South Municipal Assembly,2011,CONSTRUCTION OF 1NO 6 UNIT CLASSROOM BLOCK,getfund,,,,,,Nsawam-Adoagyiri Municipal Assembly,,,
Akuapim South Municipal Assembly,2011,CONSTRUCTION OF 1NO 6 UNIT CLASSROOM BLOCK,getfund,,,,,,Nsawam-Adoagyiri Municipal Assembly,,,
Akuapim South Municipal Assembly,2011,CONSTRUCTION OF 1NO 6 UNIT CLASSROOM BLOCK,getfund,,,,,,Nsawam-Adoagyiri Municipal Assembly,,,
Akuapim South Municipal Assembly,2011,CONSTRUCTION OF 1NO CHPS COMPOUND,other donor,,,,,,Nsawam-Adoagyiri Municipal Assembly,,,
Akuapim South Municipal Assembly,2011,CONSTRUCTION OF 1NO 8 SEATER KVIP HWF,other donor,,29-Mar-11,,,,Nsawam-Adoagyiri Municipal Assembly,,2011-03-29,
Akuapim South Municipal Assembly,2011,CONSTRUCTION OF 1NO TEACHERS QUARTERS,other donor,,,,,,Nsawam-Adoagyiri Municipal Assembly,,,
Akuapim South Municipal Assembly,2011,CONSTRUCTION OF 1NO 8 SEATER KVIP HWF,other donor,,15-Oct-09,,,,Nsawam-Adoagyiri Municipal Assembly,,2009-10-15,
Akuapim South Municipal Assembly,2011,CONSTRUCTION OF 4NO MWACAFE IRON REMOVAL,other donor,,15-Oct-09,,,,Nsawam-Adoagyiri Municipal Assembly,,2009-10-15,
Akuapim South Municipal Assembly,2011,REHABILITATION OF 4NO MWACAFE IRON REMOVAL,other donor,,15-Nov-09,,,,Nsawam-Adoagyiri Municipal Assembly,,2009-11-15,
Akuapim South Municipal Assembly,2011,CONSTRUCTION OF 1NO MWD OFFICE,other donor,,15-Oct-09,,,,Nsawam-Adoagyiri Municipal Assembly,,2009-10-15,
Akyemansa District Assembly,2011,,,,,,,,Akyemansa District Assembly,,,
Amansie Central District Assembly,2011,CONSTRUCTION OF 1NO 3 UNIT CLASSROOM BLOCK AND ANCILLIARY FACILITIES,ddf,,,,,,Amansie Central District Assembly,,,
Amansie Central District Assembly,2011,CONSTRUCTION OF 1NO 12 SEATER ACQUA PRIVY TOILET,dacf,,,,,,Amansie Central District Assembly,,,
Amansie Central District Assembly,2011,CONSTRUCTION OF 1NO 12 SATER AQUA PRIVY TOILET,dacf,,,,,,Amansie Central District Assembly,,,
Amansie Central District Assembly,2011,CONSTRUCTION OF 1NO 3 UNIT CLASSROOM BLOCK,ddf,,,,,,Amansie Central District Assembly,,,
Amansie Central District Assembly,2011,CONSTRUCTION OF 1NO 12 SEATER ACQUA PRIVY TOILET,dacf,,,,,,Amansie Central District Assembly,,,
Amansie Central District Assembly,2011,CONSTRUCTION OF 1NO CLINIC,ddf,,,,,,Amansie Central District Assembly,,,
Amansie Central District Assembly,2011,CONSTRUCTION OF 1NO 3 UNIT CLASSROOM BLOCK WITH ANCILLIARY FACILITIES,ddf,,,,,,Amansie Central District Assembly,,,
Amansie Central District Assembly,2011,CONSTRUCTION OF 1NO 6 UNIT CLASSROOM BLOCK WITH OFFICE STORE LIBRARY AND AQUA PRIVY,getfund,,,,,,Amansie Central District Assembly,,,
Amansie Central District Assembly,2011,CONSTRUCTION OF DISTRICT ADMINISTRATION BLOCK,dacf,,,,,,Amansie Central District Assembly,,,
Amansie Central District Assembly,2011,CONSTRUCTION OF 1NO 2 UNIT CLASSROOM BLOCK WITH OFFICE AND STORE,dacf,,,,,,Amansie Central District Assembly,,,
Amansie Central District Assembly,2011,CONSTRUCTION OF 1NO 6 UNIT CLASSROOM BLOCK WITH OFFICE STORE LIBRARY AND AQUA PRIVY,getfund,,,,,,Amansie Central District Assembly,,,
Amansie Central District Assembly,2011,CONSTRUCTION OF 1NO 6 UNIT CLASSROOM BLOCK WITH OFFICE STORE AND SANITARY FACILITY,getfund,,,,,,Amansie Central District Assembly,,,
Amansie Central District Assembly,2011,DRILLING OF 25 BOREHOLES,other donor,,,,,,Amansie Central District Assembly,,,
Amansie Central District Assembly,2011,MAINTENANCE OF ACCESS ROADS,dacf,,,,,,Amansie Central District Assembly,,,
Amansie Central District Assembly,2011,VETERINARY ACTIVITIES (CLINICAL TREATMENT SURVEILLANC ANTI RAVVIES CAMPAIGN,other gog,,,,,,Amansie Central District Assembly,,,
Amansie Central District Assembly,2011,CLADDING OF 2NO 3UNIT CLASSROOM BLOCK WITH ANCILLIARY FACILITIES,dacf,,,,,,Amansie Central District Assembly,,,
Amansie Central District Assembly,2011,CLADDING OF 2NO 3 UNIT CLASSROOM BLOCK WITH OFFICE AND STORE,dacf,,,,,,Amansie Central District Assembly,,,
Amansie Central District Assembly,2011,CONSTRUCTION OF 1NO 3 UNIT CLASSROOM BLOCK AND ANCILLARY FACILITIES,ddf,,,,,,Amansie Central District Assembly,,,
Amansie Central District Assembly,2011,CONSTRUCTION OF 1NO 3 UNIT CLASSROOM BLOCK AND TOILET,ddf,,,,,,Amansie Central District Assembly,,,
Amansie Central District Assembly,2011,CONSTRUCTION OF 1NO 3 UNIT CLASSROOM BLOCK AND TOILET,ddf,,,,,,Amansie Central District Assembly,,,
Amansie Central District Assembly,2011,CONSTRUCTION OF 1NO 3 UNIT CLASSROOM BLOCK AND TOILET,ddf,,,,,,Amansie Central District Assembly,,,
Amansie Central District Assembly,2011,CONSTRUCTION OF 2 UNIT BARRACKS TYPE ACCOMMODATION,dacf,,,,,,Amansie Central District Assembly,,,
Amansie Central District Assembly,2011,CONSTRUCTION OF 3 UNIT CLASSROOM BLOCK WITH OFFICES AND STORE,dacf,,,,,,Amansie Central District Assembly,,,
Amansie Central District Assembly,2011,CONSTRUCTION OF 2 UNIT BARRACKS TYPE RESIDENTIAL ACCOMMODATION,dacf,,,,,,Amansie Central District Assembly,,,
Amansie Central District Assembly,2011,CONSTRUCTION OF 3 UNIT CLASSROOM BLOCK WITH OFFICES & LIBRARY,multiple,,,,,,Amansie Central District Assembly,,,
Amansie Central District Assembly,2011,CONSTRUCTION OF AREA COUNCIL BUILDING,dacf,,,,,,Amansie Central District Assembly,,,
Amansie Central District Assembly,2011,CONSTRUCTION OF 1NO 6 UNIT CLASSROOM BLOCK WITH OFFICE STORE LIBRARY AND AQUA PRIVY,getfund,,,,,,Amansie Central District Assembly,,,
Amansie Central District Assembly,2011,CLADDING OF 2NO 3 UNIT CLASSROOM BLOCK WITH OFFICE SOTRE,dacf,,,,,,Amansie Central District Assembly,,,
Amansie Central District Assembly,2011,CONSTRUCTION OF 1NO 3 UNIT CLASSROOM BLOCK AND ANCILLIARY FACILITIES,dacf,,,,,,Amansie Central District Assembly,,,
Amansie Central District Assembly,2011,CONSTRUCTION OF 1NO 3 UNIT CLASSROOM BLOCK AND ANCILLIARY FACILITIES,dacf,,,,,,Amansie Central District Assembly,,,
Amansie Central District Assembly,2011,CONSTRUCTION OF 1NO 6 UNIT CLASSROOM BLOCK 2NO 3 UNIT TOILET BLOCKS AT ATOBIASE DA PRIMARY,getfund,,,,,,Amansie Central District Assembly,,,
Amansie Central District Assembly,2011,CONSTRUCTION OF 1NO 6 UNIT CLASSROOM BLOCK WITH ANCILLARY FACILITIES,getfund,,,,,,Amansie Central District Assembly,,,
Amansie Central District Assembly,2011,CONSTRUCTION OF 2NO 4 BEDROOM BARRACKS TYPE BUNGALOW,dacf,,,,,,Amansie Central District Assembly,,,
Amansie Central District Assembly,2011,CONSTRUCTION OF DINNING HALL AND KITCHEN FOR JASTECH,dacf,,,,,,Amansie Central District Assembly,,,
Amansie West District Assembly,2011,DUAL DESK FOR UPPER PRIMARY SCHOOLS WITHIN THE MUNICIPALITY DEC 2011,ddf,,,,,,Amansie West District Assembly,,,
Amansie West District Assembly,2011,MONO DESKS FOR JUNIOR HIGH SCHOOLS WITHIN THE MUNICIPALITY,ddf,,,,,,Amansie West District Assembly,,,
Amansie West District Assembly,2011,COMPLETE A UNIT CLASSROOM BLOCK AT TESHIE NORTHERN CLUSTER OF SCHOOLS AT DEC 2011,ddf,,,,,,Amansie West District Assembly,,,
Amansie West District Assembly,2011,CONSTRUCT 1 NO 10 SEATER TOILETS AT TESHIE NORTHERN CLUSTER OF SCHOOLS BY DEC 2011,ddf,,,,,,Amansie West District Assembly,,,
Amansie West District Assembly,2011,CONSTRUCT ASSEMBLYS OFFICE COMPLEX,ddf,,,,,,Amansie West District Assembly,,,
Amansie West District Assembly,2011,CONSTRUCTION OF 1NO 3UNIT CLASSROOM BLOCK WITH OFFICE STAFF STORE AND COMMON ROOM,other/unknown,,Oct-10,,,,Amansie West District Assembly,,2010-10-01,
Amansie West District Assembly,2011,CONSTRUCTION OF 1 NO 3 UNIT CLASSROOM BLOCK WITH OFFICE STAFF STORE AND COMMON ROOM,other/unknown,,Oct-10,,,,Amansie West District Assembly,,2010-10-01,
Amansie West District Assembly,2011,CONSTRUCTION OF 1NO 3UNIT CLASSROOM BLOCK WITH OFFICE STAFF STORE AND COMMON ROOM,other/unknown,,Oct-10,,,,Amansie West District Assembly,,2010-10-01,
Amansie West District Assembly,2011,CONSTRUCTION OF 1 NO 20 OPEN MARKET SHEDS,other/unknown,,Oct-10,,,,Amansie West District Assembly,,2010-10-01,
Amansie West District Assembly,2011,CONSTRUCTION OF 1 NO 20 OPEN MARKET SHEDS,other/unknown,,Oct-10,,,,Amansie West District Assembly,,2010-10-01,
Amansie West District Assembly,2011,CONSTRUCTION OF 1NO 20 OPEN MARKET SHEDS,other/unknown,,Oct-10,,,,Amansie West District Assembly,,2010-10-01,
Amansie West District Assembly,2011,CONSTRUCTION OF A RURAL CLINIC,other/unknown,,Oct-10,,,,Amansie West District Assembly,,2010-10-01,
Amansie West District Assembly,2011,CONSTRUCTION OF A 1NO HOSPITAL WARD,other/unknown,,Oct-10,,,,Amansie West District Assembly,,2010-10-01,
Amansie West District Assembly,2011,EXPANSION OF MARKET,other/unknown,,Oct-10,,,,Amansie West District Assembly,,2010-10-01,
Amansie West District Assembly,2011,REHABILITATION OF 1 NO 4 UNIT CLASSROOM BLOCK WITH OFFICE AND STORE,other/unknown,,Oct-10,,,,Amansie West District Assembly,,2010-10-01,
Amansie West District Assembly,2011,CONSTRUCTION OF A POLICE STATION,dacf,Oct-10,,,,,Amansie West District Assembly,2010-10-01,,
Amansie West District Assembly,2011,CONSTRUCTION OF 1NO SIX UNIT CLASSROOM BLOCK WITH ANCILLARY FACILITIES,getfund,Sep-10,,,,,Amansie West District Assembly,2010-09-01,,
Amansie West District Assembly,2011,CONSTRUCTION OF 1 NO SIX UNIT CLASSROOM BLOCK WITH ANCILLARY FACILITIES,getfund,Sep-10,,,,,Amansie West District Assembly,2010-09-01,,
Amansie West District Assembly,2011,CONSTRUCTION OF 1NO SIX UNIT CLASSROOM BLOCK WITH ANCILLARY FACILITIES,getfund,Sep-10,,,,,Amansie West District Assembly,2010-09-01,,
Amansie West District Assembly,2011,CONSTRUCTION OF OPD,dacf,Oct-10,,,,,Amansie West District Assembly,2010-10-01,,
Amansie West District Assembly,2011,CONSTRUCTION OF LIBRARY COMPLEX AND RESOURCE CENTRE,dacf,Oct-10,,,,,Amansie West District Assembly,2010-10-01,,
Amansie West District Assembly,2011,COMPLETION OF DA HALL,other/unknown,2008,,,,,Amansie West District Assembly,1905-06-30,,
Amansie West District Assembly,2011,REHABILITATION OF DISTRICT ADMINISTRATION BLOCK,other/unknown,Oct-10,,,,,Amansie West District Assembly,2010-10-01,,
Amansie West District Assembly,2011,CONSTRUCTION OF 1 NO 3 UNIT CLASSROOM BLK,other/unknown,,,Sep-07,,,Amansie West District Assembly,,,2007-09-01
Amansie West District Assembly,2011,CONSTRUCTION OF 1NO 6UNIT CLASSROOM BLK,other/unknown,,,Sep-07,,,Amansie West District Assembly,,,2007-09-01
Amenfi West District Assembly,2011,,,,,,,,Amenfi West District Assembly,,,
Aowin/Suaman District Assembly,2011,CONSTRUCTION OF SEMI DETACHED STAFF ACCOMMODATION FOR DBA AND DPO,dacf,,1/25/2010,,,,Aowin District Assembly,,2010-01-25,
Aowin/Suaman District Assembly,2011,CONSTRUCTION OF AREA COUNCIL OFFICE,dacf,,4/1/2008,,,,Aowin District Assembly,,2008-04-01,
Aowin/Suaman District Assembly,2011,REHABILITATION OF DCD BUNGALOW,dacf,,11/27/2008,,,,Aowin District Assembly,,2008-11-27,
Aowin/Suaman District Assembly,2011,REHABILITATION OF DCE BUNGALOW,dacf,,10/12/2009,,,,Aowin District Assembly,,2009-10-12,
Aowin/Suaman District Assembly,2011,CONSTRUCTION OF 9 NO PARKING BAY,dacf,,10/12/2009,,,,Aowin District Assembly,,2009-10-12,
Aowin/Suaman District Assembly,2011,COMPLETION OF DISTRICT MAGISTRATE COURT,dacf,,,,,,Aowin District Assembly,,,
Aowin/Suaman District Assembly,2011,REHABILITATION OF ASSEMBLEY HALL AND OFFICE,dacf,,1/25/2010,,,,Aowin District Assembly,,2010-01-25,
Aowin/Suaman District Assembly,2011,REHABILITATION OF WOODEN BRIDGES,dacf,,2/25/2011,,,,Aowin District Assembly,,2011-02-25,
Aowin/Suaman District Assembly,2011,CONSTRUCTION AND COMPLETEION OF COCOA HUSKS SOAP PROCESSING AND SKILLS LEAMING CENTER,ddf,,1/25/2010,,,,Aowin District Assembly,,2010-01-25,
Aowin/Suaman District Assembly,2011,CONSTRUCTION OF COMMUNITY CENTER COMPLEX,dacf,,8/24/2011,,,,Aowin District Assembly,,2011-08-24,
Aowin/Suaman District Assembly,2011,EXTENSION OF ELECTRICITY TO LIGHT INDUSTRIAL SITE,dacf,,8/24/2011,,,,Aowin District Assembly,,2011-08-24,
Aowin/Suaman District Assembly,2011,REHABILITATION OF OLD MARKET,dacf,,8/25/2001,,,,Aowin District Assembly,,2001-08-25,
Aowin/Suaman District Assembly,2011,CONSTRUCTION OF 2NO 40 UNIT MARKET SHEDS WITH ANCILLARY FACILITIES HEALTH,ddf,,8/24/2011,,,,Aowin District Assembly,,2011-08-24,
Aowin/Suaman District Assembly,2011,CONSTRUCTION OF CHPS COMPOUND,dacf,,4/1/2008,,,,Aowin District Assembly,,2008-04-01,
Aowin/Suaman District Assembly,2011,REHABILITATION OF YIWABRA HEALTH CENTER,dacf,,10/12/2009,,,,Aowin District Assembly,,2009-10-12,
Aowin/Suaman District Assembly,2011,REHABILITATION OF AKONTOMBRA NKWANTA HEALTH CENTER,dacf,,10/12/2009,,,,Aowin District Assembly,,2009-10-12,
Aowin/Suaman District Assembly,2011,CONSTRUCTION OF HEALTH CENTER,dacf,,1/25/2010,,,,Aowin District Assembly,,2010-01-25,
Aowin/Suaman District Assembly,2011,CONSTRUCTION OF HEALTH CENTRE,ddf,,10/26/2010,,,,Aowin District Assembly,,2010-10-26,
Aowin/Suaman District Assembly,2011,CONSTRUCTION OF 1NO 4 UNIT HEALTH STAFF RESIDENTIAL ACCOMMODATION,ddf,,10/26/2010,,,,Aowin District Assembly,,2010-10-26,
Aowin/Suaman District Assembly,2011,CONSTRUCTION OF 3 BEDROOM DOCTORS RESIDENTIAL ACCOMMODATIN,ddf,,10/26/2010,,,,Aowin District Assembly,,2010-10-26,
Aowin/Suaman District Assembly,2011,CONSTRUCTION OF 1NO SEMI DETACHED HEALTH STAFF RESIDENTIAL ACCOMMODATION,ddf,,10/26/2010,,,,Aowin District Assembly,,2010-10-26,
Aowin/Suaman District Assembly,2011,CONSTRUCTION OF CHPS COMPOUND,other donor,,3/19/2010,,,,Aowin District Assembly,,2010-03-19,
Aowin/Suaman District Assembly,2011,CONSTRUCTION OF CHPS COMPOUND,other donor,,10/12/2009,,,,Aowin District Assembly,,2009-10-12,
Aowin/Suaman District Assembly,2011,COMPLETION OF 6 UNIT CLASSROOM BLOCK WITH ANCILLARY FACILITIES,dacf,,4/1/2008,,,,Aowin District Assembly,,2008-04-01,
Aowin/Suaman District Assembly,2011,CONSTRUCTION OF 3 UNIT CLASSROOM BLOCK WITH ANCILLARY FACILITIES,dacf,,4/1/2008,,,,Aowin District Assembly,,2008-04-01,
Aowin/Suaman District Assembly,2011,CONSTRUCTION OF 1 STOREY 12 UNIT CLASSROOM BLOCK FOR DADIESO SHS,dacf,,4/1/2008,,,,Aowin District Assembly,,2008-04-01,
Aowin/Suaman District Assembly,2011,PROVISION FOR CONSTRUCTION OF 6 UNIT CLASSROOM BLOCK,multiple,,1/25/2010,,,,Aowin District Assembly,,2010-01-25,
Aowin/Suaman District Assembly,2011,CONSTRUCTION OF 3 BEDROOM TEACHERS ACCOMMODATION,other donor,,8/2/2009,,,,Aowin District Assembly,,2009-08-02,
Aowin/Suaman District Assembly,2011,CONSTRUCTION OF KINDERGATEN BLOCK,other donor,,8/2/2009,,,,Aowin District Assembly,,2009-08-02,
Aowin/Suaman District Assembly,2011,CONSTRUCTION OF 2 UNIT JHS BLOCK,other donor,,8/2/2009,,,,Aowin District Assembly,,2009-08-02,
Aowin/Suaman District Assembly,2011,CONSTRUCTION OF 2NO 3 UNIT TEACHERS ACCOMMODATION,other gog,,8/2/2008,,,,Aowin District Assembly,,2008-08-02,
Aowin/Suaman District Assembly,2011,CONSTRUCTION OF 2 NO 3 UNIT TEACHERS ACCOMMODATION,other gog,,8/2/2008,,,,Aowin District Assembly,,2008-08-02,
Aowin/Suaman District Assembly,2011,CONSTRUCTION OF 3 UNIT CLASSROOM BLOCK,other gog,,8/2/2008,,,,Aowin District Assembly,,2008-08-02,
Aowin/Suaman District Assembly,2011,CONSTRUCTION OF 1 NO SEMI DETACHED HEALTH STAFF RESIDENTIAL ACCOMMODATION,ddf,,10/26/2010,,,,Aowin District Assembly,,2010-10-26,
Aowin/Suaman District Assembly,2011,CONSTRUCTION OF CHPS COMPOUND,other donor,,3/19/2010,,,,Aowin District Assembly,,2010-03-19,
Aowin/Suaman District Assembly,2011,CONSTRUCTION OF CHPS COMPOUND,other donor,,10/12/2009,,,,Aowin District Assembly,,2009-10-12,
Aowin/Suaman District Assembly,2011,COMPLETION OF 6 UNIT CLASSROOM BLOCK WITH ANCILLARY FACILITIES,dacf,,4/1/2008,,,,Aowin District Assembly,,2008-04-01,
Aowin/Suaman District Assembly,2011,CONSTRUCTION OF 3 UNIT CLASSROOM BLOCK WITH ANCILLARY FACILITIES,dacf,,4/1/2008,,,,Aowin District Assembly,,2008-04-01,
Aowin/Suaman District Assembly,2011,CONSTRUCTION OF 1 STOREY 12 UNIT CLASSROOM BLOCK FOR DADIESO SHS,dacf,,4/1/2008,,,,Aowin District Assembly,,2008-04-01,
Aowin/Suaman District Assembly,2011,PROVISION FOR CONSTRUCTION OF 6 UNIT CLASSROOM BLOCK,multiple,,1/25/2010,,,,Aowin District Assembly,,2010-01-25,
Aowin/Suaman District Assembly,2011,CONSTRUCTION OF 3 BEDROOM TEACHERS ACCOMMODATION,other donor,,8/2/2009,,,,Aowin District Assembly,,2009-08-02,
Aowin/Suaman District Assembly,2011,CONSTRUCTION OF KINDERGATEN BLOCK,other donor,,8/2/2009,,,,Aowin District Assembly,,2009-08-02,
Aowin/Suaman District Assembly,2011,CONSTRUCTION OF 2 UNIT JHS BLOCK,other donor,,8/2/2009,,,,Aowin District Assembly,,2009-08-02,
Aowin/Suaman District Assembly,2011,CONSTRUCTION OF 2NO 3 UNIT TEACHERS ACCOMMODATION,other gog,,8/2/2008,,,,Aowin District Assembly,,2008-08-02,
Aowin/Suaman District Assembly,2011,CONSTRUCTION OF 2NO 3 UNIT TEACHERS ACCOMMODATION,other gog,,8/2/2008,,,,Aowin District Assembly,,2008-08-02,
Aowin/Suaman District Assembly,2011,CONSTRUCTION OF 3 UNIT CLASSROOM BLOCK,other gog,,8/2/2008,,,,Aowin District Assembly,,2008-08-02,
Aowin/Suaman District Assembly,2011,CONSTRUCTION OF 3 UNIT CLASSROOM BLOCK,other gog,,8/2/2008,,,,Aowin District Assembly,,2008-08-02,
Aowin/Suaman District Assembly,2011,CONSTRUCTION OF 3 UNIT CLASSROOM BLOCK,other gog,,8/2/2008,,,,Aowin District Assembly,,2008-08-02,
Aowin/Suaman District Assembly,2011,CONSTRUCTION OF 3 UNIT CLASSROOM BLOCK,other gog,,8/2/2008,,,,Aowin District Assembly,,2008-08-02,
Aowin/Suaman District Assembly,2011,CONSTRUCTION OF 1 NO 6 UNIT CLASSROOM BLOCK,other gog,,8/2/2008,,,,Aowin District Assembly,,2008-08-02,
Aowin/Suaman District Assembly,2011,CONSTRUCTION OF 1 NO 6 U NIT CLASSROOM BLOCK,other gog,,8/2/2008,,,,Aowin District Assembly,,2008-08-02,
Aowin/Suaman District Assembly,2011,CONSTRUCTION OF 1 NO 6 UNIT CLASSROOM BLOCK,other gog,,8/2/2008,,,,Aowin District Assembly,,2008-08-02,
Aowin/Suaman District Assembly,2011,REHABILITATION OF NYANNEY CAMP DA PRIMARY,ddf,,8/25/2011,,,,Aowin District Assembly,,2011-08-25,
Aowin/Suaman District Assembly,2011,COMPLETION OF 6 UNIT CLASSROOM BLOCK WITH ANCILLARY FACILITIES,dacf,,8/24/2011,,,,Aowin District Assembly,,2011-08-24,
Aowin/Suaman District Assembly,2011,CONSTRUCTION OF 3 UNIT CLASSROOM BLOCK AND 4 SEATER KVIP TOILET,dacf,,9/20/2010,,,,Aowin District Assembly,,2010-09-20,
Aowin/Suaman District Assembly,2011,CONSTRUCTION OF 3 UNIT CLASSROOM BLOCK WITH 4 SEATER KVIP TOILET,dacf,,8/16/2011,,,,Aowin District Assembly,,2011-08-16,
Aowin/Suaman District Assembly,2011,CONSTRUCTION OF 3 UNIT CLASSROOM BLOCK WITH 4 SEATER KVIP TOILET,dacf,,8/16/2011,,,,Aowin District Assembly,,2011-08-16,
Aowin/Suaman District Assembly,2011,CONSTRUCTION OF 6 UNIT CLASSROOM BLOCK WITH ANCILLARY FACILITIES,other gog,,9/23/2010,,,,Aowin District Assembly,,2010-09-23,
Aowin/Suaman District Assembly,2011,CONSTRUCTION OF 6 UNIT CLASSROOM BLOCK WITH ANCILLARY FACILITIES,other gog,,9/23/2010,,,,Aowin District Assembly,,2010-09-23,
Aowin/Suaman District Assembly,2011,CONSTRUCTION OF 6 UNIT CLASSROOM BLOCK WITH ANCILLARY FACILITIES,other gog,,9/23/2010,,,,Aowin District Assembly,,2010-09-23,
Aowin/Suaman District Assembly,2011,CONSTRUCTION OF 6 UNIT CLASSROOM BLOCK WITH ANCILLARY FACILITIES,other gog,,9/23/2010,,,,Aowin District Assembly,,2010-09-23,
Aowin/Suaman District Assembly,2011,CONSTRUCTION OF 6 UNIT CLASSROOM BLOCK WITH ANCILLARY FACILITIES,other gog,,8/11/2011,,,,Aowin District Assembly,,2011-08-11,
Aowin/Suaman District Assembly,2011,CONSTRUCTION AND COMPLETION IF 10 SEATER AQUA PRIVY TOILET,dacf,,11/27/2008,,,,Aowin District Assembly,,2008-11-27,
Aowin/Suaman District Assembly,2011,CONSTRUCTION OF 1 NO LOW SEATER WATER CLOSET TOILET FACILITY,ddf,,,,,,Aowin District Assembly,,,
Aowin/Suaman District Assembly,2011,CONSTRUCTION OF SMALL TOWN WATER SUPPLY SYSTEM,other donor,,2/1/2009,,,,Aowin District Assembly,,2009-02-01,
Aowin/Suaman District Assembly,2011,CONSTRUCTION OF SMALL TOWN WATER SUPPLY SYSTEM,other donor,,2/1/2009,,,,Aowin District Assembly,,2009-02-01,
Aowin/Suaman District Assembly,2011,CONSTRUCTION OF SMALL TOWN WATER SUPPLY SYSTEM,other donor,,2/1/2009,,,,Aowin District Assembly,,2009-02-01,
Aowin/Suaman District Assembly,2011,REHABILITATION OF 83NO FAULTY HAND PUMPS ON BOREHOLES AND HAND DUG WELLS,dacf,,10/1/2009,,,,Aowin District Assembly,,2009-10-01,
Aowin/Suaman District Assembly,2011,REHABILITATION OF SMALL TOWN WATER SYSTEM,dacf,,10/1/2009,,,,Aowin District Assembly,,2009-10-01,
Aowin/Suaman District Assembly,2011,REHABILITATION OF SMALL TOWN WATER SYSTEM,dacf,,10/1/2009,,,,Aowin District Assembly,,2009-10-01,
Aowin/Suaman District Assembly,2011,CONSTRUCTION OF 1 NO 4 SEATER KVIP,other donor,,3/24/2009,,,,Aowin District Assembly,,2009-03-24,
Aowin/Suaman District Assembly,2011,CONSTRUCTION OF 1NO 4 SEATER KVIP,other donor,,3/24/2009,,,,Aowin District Assembly,,2009-03-24,
Aowin/Suaman District Assembly,2011,CONSTRUCTION OF 1 NO 4 SEATER KVIP,other donor,,3/24/2009,,,,Aowin District Assembly,,2009-03-24,
Aowin/Suaman District Assembly,2011,CONSTRUCTION OF 1 NO 4 SEATER KVIP,other donor,,3/24/2009,,,,Aowin District Assembly,,2009-03-24,
Aowin/Suaman District Assembly,2011,CONSTRUCTION OF 1NO 6 SEATER KVIP,other donor,,3/24/2009,,,,Aowin District Assembly,,2009-03-24,
Aowin/Suaman District Assembly,2011,CONSTRUCTION OF 1NO 4 SEATER KVIP,other donor,,12/28/2009,,,,Aowin District Assembly,,2009-12-28,
Aowin/Suaman District Assembly,2011,CONSTRUCTION OF 1NO 6 SEATER KVIP,other donor,,12/28/2009,,,,Aowin District Assembly,,2009-12-28,
Aowin/Suaman District Assembly,2011,CONSTRUCTION OF 1NO 6 SEATER KVIP,other donor,,,,,,Aowin District Assembly,,,
Aowin/Suaman District Assembly,2011,CONSTRUCTION OF 1 NO 4 SEATER KVIP,other donor,,12/28/2009,,,,Aowin District Assembly,,2009-12-28,
Aowin/Suaman District Assembly,2011,CONSTRUCTION OF 1 NO 4 SEATER KVIP,other donor,,12/28/2009,,,,Aowin District Assembly,,2009-12-28,
Aowin/Suaman District Assembly,2011,CONSTRUCTION OF 1 NO 4 SEATER KVIP,other donor,,12/28/2009,,,,Aowin District Assembly,,2009-12-28,
Aowin/Suaman District Assembly,2011,CONSTRUCTION OF 1 NO 4 SEATER KVIP,other donor,,12/28/2009,,,,Aowin District Assembly,,2009-12-28,
Aowin/Suaman District Assembly,2011,CONSTRUCTION OF 1NO 4 SEATER KVIP,other donor,,12/28/2009,,,,Aowin District Assembly,,2009-12-28,
Aowin/Suaman District Assembly,2011,CONSTRUCTION OF 1 NO 12 LOW SEATER WATER CLOSET,dacf,,8/24/2011,,,,Aowin District Assembly,,2011-08-24,
Aowin/Suaman District Assembly,2011,REHABILITATION OF FEEDER ROAD PH 1 6KM,ddf,,8/30/2008,,,,Aowin District Assembly,,2008-08-30,
Aowin/Suaman District Assembly,2011,REHABILITATION OF FEEDER ROAD PH 6KM,other gog,,,,,,Aowin District Assembly,,,
Aowin/Suaman District Assembly,2011,REHABILITATION OF FEEDER ROAD PH II 3 7KM,other gog,,8/30/2008,,,,Aowin District Assembly,,2008-08-30,
Aowin/Suaman District Assembly,2011,RESHAPING OF ROAD 8.7KM,other gog,,12/15/2008,,,,Aowin District Assembly,,2008-12-15,
Aowin/Suaman District Assembly,2011,RESHAPING OF ROAD 4.5KM,other gog,,12/15/2008,,,,Aowin District Assembly,,2008-12-15,
Aowin/Suaman District Assembly,2011,RESHAPING OF ROAD 4.5KM,other gog,,12/15/2008,,,,Aowin District Assembly,,2008-12-15,
Aowin/Suaman District Assembly,2011,RESHAPING OF ROAD 22 1KM,other gog,,1/6/2009,,,,Aowin District Assembly,,2009-01-06,
Aowin/Suaman District Assembly,2011,RESHAPING OF ROAD 26 8KM,other gog,,7/22/2009,,,,Aowin District Assembly,,2009-07-22,
Aowin/Suaman District Assembly,2011,BITUMEN SURFACING 3 8KM,other gog,,,,,,Aowin District Assembly,,,
Aowin/Suaman District Assembly,2011,BITUMEN SURFACING 4.5 KM,other gog,,,,,,Aowin District Assembly,,,
Aowin/Suaman District Assembly,2011,BITUMENT SURFACING 3 KM,other gog,,,,,,Aowin District Assembly,,,
Aowin/Suaman District Assembly,2011,REHABILITATION 13.0 KM,other gog,,,,,,Aowin District Assembly,,,
Asante Akim North Municipal Assembly,2011,CONSTRUCTION OF 1NO 20-SEATER AQUA PRIVY TOILET FACILITY AT MENTUKWA,ddf,9/28/2010,10/1/2010,,,,Asante Akim Central Municipal Assembly,2010-09-28,2010-10-01,
Asante Akim North Municipal Assembly,2011,CONSTRUCTION OF 1 NO 20 SEATER AQUA PRIVY TOILET FACILITY AT MENTUKWA,ddf,9/28/2010,10/1/2010,,,,Asante Akim Central Municipal Assembly,2010-09-28,2010-10-01,
Asante Akim North Municipal Assembly,2011,TOILET AT PATRIENSA CONSTRUCTION OF 1NO. 20- SEATER,ddf,9/28/2010,10/1/2010,,,,Asante Akim Central Municipal Assembly,2010-09-28,2010-10-01,
Asante Akim North Municipal Assembly,2011,COMPLETION OF COLLINS SHS ADMINISTRATION BLOCK,dacf,,,,,,Asante Akim Central Municipal Assembly,,,
Asante Akim North Municipal Assembly,2011,CONSTRUCTION OF 1 NO. 4 UNIT TEACHERS QUARTERS,ddf,12/22/2010,1/30/2011,,,,Asante Akim Central Municipal Assembly,2010-12-22,2011-01-30,
Asante Akim North Municipal Assembly,2011,CONSTRUCTION OF 1 NO. 4 UNIT NURSES QUARTERS,ddf,12/22/2010,1/21/2011,,,,Asante Akim Central Municipal Assembly,2010-12-22,2011-01-21,
Asante Akim North Municipal Assembly,2011,CONSTRUCTION OF 1 NO 20 SEATER AQUA PRIVY TOILET FACILITY AT MENTUKWA,ddf,,,,,,Asante Akim Central Municipal Assembly,,,
Asante Akim North Municipal Assembly,2011,CONSTRUCTION OF 1 NO 20 SEATER AQUA PRIVY,ddf,,,,,,Asante Akim Central Municipal Assembly,,,
Asante Akim North Municipal Assembly,2011,TOILET AT PATRIENSA CONSTRUCTION OF 1 NO 20 SEATER,ddf,,,,,,Asante Akim Central Municipal Assembly,,,
Asante Akim North Municipal Assembly,2011,COMPLETION OF COLLINS SHS ADMINISTRATION BLOCK,dacf,,,,,,Asante Akim Central Municipal Assembly,,,
Asante Akim North Municipal Assembly,2011,CONSTRUCTION OF 1 NO 4 UNIT TEACHERS QUARTERS,ddf,,,,,,Asante Akim Central Municipal Assembly,,,
Asante Akim North Municipal Assembly,2011,CONSTRUCTION OF 1 NO 4 UNIT NURSES QUARTERS,ddf,,,,,,Asante Akim Central Municipal Assembly,,,
Asante Akim North Municipal Assembly,2011,CONSTRUCTION OF 1 NO 6 UNIT CLASSROOM BLOCK AND 2 SEATER,getfund,10/20/2011,11/30/2011,,,,Asante Akim Central Municipal Assembly,2011-10-20,2011-11-30,
Asante Akim North Municipal Assembly,2011,CONSTRUCTION OF 1 NO 6 UNIT CLASSROOM BLOCK AND 2 SEATER,getfund,10/20/2011,11/30/2011,,,,Asante Akim Central Municipal Assembly,2011-10-20,2011-11-30,
Asante Akim North Municipal Assembly,2011,REHABILITATION OF PUBLIC TOILETS,dacf,,,,,,Asante Akim Central Municipal Assembly,,,
Asante Akim North Municipal Assembly,2011,WASTE MANAGEMENT,dacf,,,,,,Asante Akim Central Municipal Assembly,,,
Asante Akim South District Assembly,2011,LOT 2A CONSTRUCTION OF 6 SEATER KVIP INSTITUTIONAL LATRINE,other donor,8/31/2010,9/14/2010,,,,Asante Akim South District Assembly,2010-08-31,2010-09-14,
Asante Akim South District Assembly,2011,LOT 2A CONSTRUCTION OF 6 SEATER KVIP INSTITUTIONAL LATRINE,other donor,8/31/2010,9/14/2010,,,,Asante Akim South District Assembly,2010-08-31,2010-09-14,
Asante Akim South District Assembly,2011,LOT 3A CONSTRUCTION OF 6 SEATER KVIP INSTITUTIONAL LATRINE,other donor,8/31/2010,9/14/2010,,,,Asante Akim South District Assembly,2010-08-31,2010-09-14,
Asante Akim South District Assembly,2011,LOT 3A CONSTRUCTION OF 6 SEATER KVIP INTITUTIONAL LATRINE,other donor,8/31/2010,9/14/2010,,,,Asante Akim South District Assembly,2010-08-31,2010-09-14,
Asante Akim South District Assembly,2011,LOT 3A CONSTRUCTION OF 4 SEATER KVIP INSTITUTIONAL LATRINE,other donor,8/31/2010,9/14/2010,,,,Asante Akim South District Assembly,2010-08-31,2010-09-14,
Asante Akim South District Assembly,2011,LOT 3A CONSTRUCTION OF 6 SEATER KVIP INSTITUTIONAL LATRINE,other donor,8/31/2010,9/14/2010,,,,Asante Akim South District Assembly,2010-08-31,2010-09-14,
Asante Akim South District Assembly,2011,LOT 3A CONSTRUCTION OF 6 SEATER KVIP INSTITUTIONAL LATRINE,other donor,8/31/2010,9/14/2010,,,,Asante Akim South District Assembly,2010-08-31,2010-09-14,
Asante Akim South District Assembly,2011,LOT 3A CONSTRUCTION OF 4 SEATER KVIP INSTITUTIONAL LATRINE,other donor,8/31/2010,9/14/2010,,,,Asante Akim South District Assembly,2010-08-31,2010-09-14,
Asante Akim South District Assembly,2011,CONSTRUCTION AND COMPLETION OF 1 NO 6 UNIT CLASSROOM BLOCK WITH OFFICE STAFF COMMON,other donor,11/19/2007,12/3/3007,,,,Asante Akim South District Assembly,2007-11-19,3007-12-03,
Asante Akim South District Assembly,2011,CONSTRUCTION AND COMPLETION OF 1 NO BAMBOO CENTER,dacf,3/1/2010,3/15/2010,,,,Asante Akim South District Assembly,2010-03-01,2010-03-15,
Asante Akim South District Assembly,2011,CONSTRUCTION OF 1 NO 6 UNIT CLASSROOM BLOCK WITH OFFICE STORE,dacf,3/1/2010,3/15/2010,,,,Asante Akim South District Assembly,2010-03-01,2010-03-15,
Asante Akim South District Assembly,2011,CONSTRUCTION AND COMPLETION OF 1 NO 6 UNIT CLASSROOM BLOCK,getfund,6/9/2010,6/16/2010,,,,Asante Akim South District Assembly,2010-06-09,2010-06-16,
Asante Akim South District Assembly,2011,CONSTRUCTION AND COMPLETION OF 1 NO 6 UNIT CLASSROOM BLOCK,getfund,6/9/2010,6/16/2010,,,,Asante Akim South District Assembly,2010-06-09,2010-06-16,
Asante Akim South District Assembly,2011,CONSTRUCTION AND COMPLETION OF 1 NO 6 UNIT CLASSROOM BLOCK,getfund,6/9/2010,6/16/2010,,,,Asante Akim South District Assembly,2010-06-09,2010-06-16,
Asante Akim South District Assembly,2011,CONSTRUCTION AND COMPLETION OF 1 NO 6 UNIT CLASSROOM BLOCK,getfund,6/9/2010,6/16/2010,,,,Asante Akim South District Assembly,2010-06-09,2010-06-16,
Asante Akim South District Assembly,2011,CONSTRUCTION OF 1 NO 3 UNIT CLASSROOM BLOCK,getfund,12/7/2010,1/4/2011,,,,Asante Akim South District Assembly,2010-12-07,2011-01-04,
Asante Akim South District Assembly,2011,CONSTRUCTION AND COMPLETION OF 1 NO 6 UNIT CLASSROOM BLOCK,other donor,7/27/2010,8/10/2010,,,,Asante Akim South District Assembly,2010-07-27,2010-08-10,
Asante Akim South District Assembly,2011,COMPLETION OF 1 NO 2 STORY DISTRICT POLICE STATION WITH POLICE,dacf,3/1/2010,3/15/2010,,,,Asante Akim South District Assembly,2010-03-01,2010-03-15,
Asante Akim South District Assembly,2011,CONSTRUCTION AND COMPLETION OF 3 UNIT CLASSROOM BLOCK WITH OFFICE,multiple,,8/15/2008,,,,Asante Akim South District Assembly,,2008-08-15,
Asante Akim South District Assembly,2011,CONSTRUCTION AND COMPLETION OF 3 UNIT CLASSROOM BLOCK WITH OFFICE,multiple,,8/14/2008,,,,Asante Akim South District Assembly,,2008-08-14,
Asante Akim South District Assembly,2011,CONSTRUCTION AND COMPLETION OF SINGLE STORY PRIMARY SCHOOL,getfund,11/7/2007,11/15/2007,,,,Asante Akim South District Assembly,2007-11-07,2007-11-15,
Asante Akim South District Assembly,2011,CONSTRUCTION AND COMPLETION OF SINGLE STORY KINDERGATEN,getfund,11/7/2007,11/15/2007,,,,Asante Akim South District Assembly,2007-11-07,2007-11-15,
Asante Akim South District Assembly,2011,CONSTRUCTION AND COMPLETION OF HEALTH CENTER,multiple,,3/13/2008,,,,Asante Akim South District Assembly,,2008-03-13,
Asante Akim South District Assembly,2011,1A LOT CONSTRUCTION OF 6 SEATER KVIP INSTITUTIONAL LATRINE,other donor,8/31/2010,9/14/2011,,,,Asante Akim South District Assembly,2010-08-31,2011-09-14,
Asante Akim South District Assembly,2011,1A LOT CONSTRUCTION OF 1 NO 6 SEATER INSTITUTIONAL LATRINE,other donor,8/31/2010,9/14/2011,,,,Asante Akim South District Assembly,2010-08-31,2011-09-14,
Asante Akim South District Assembly,2011,1A LOT CONSTRUCTION OF 1 NO 6 SEATER INSTITUTIONAL LATRINE,other donor,8/31/2010,9/14/2011,,,,Asante Akim South District Assembly,2010-08-31,2011-09-14,
Asante Akim South District Assembly,2011,1A LOT CONSTRUCTION OF 1 NO 6 SEATER INSTITUTIONAL LATRINE,other donor,8/31/2010,9/14/2011,,,,Asante Akim South District Assembly,2010-08-31,2011-09-14,
Asante Akim South District Assembly,2011,1A LOT CONSTRUCTION OF 1 NO 6 SEATER INSTITUTIONAL LATRINE,other donor,8/31/2010,9/14/2011,,,,Asante Akim South District Assembly,2010-08-31,2011-09-14,
Asante Akim South District Assembly,2011,1A LOT CONSTRUCTION OF 4 SEATER KVIP INSTITUTIONAL LATRINE,other donor,8/31/2010,9/14/2011,,,,Asante Akim South District Assembly,2010-08-31,2011-09-14,
Asante Akim South District Assembly,2011,2A LOT CONSTRUCTION OF 4 SEATER KVIP INSTITUTIONAL LATRINE,other donor,8/31/2010,9/14/2011,,,,Asante Akim South District Assembly,2010-08-31,2011-09-14,
Asante Akim South District Assembly,2011,2A LOT CONSTRUCTION OF 6 SEATER KVIP INSTITUTIONAL LATRINE,other donor,8/31/2010,9/14/2011,,,,Asante Akim South District Assembly,2010-08-31,2011-09-14,
Asante Akim South District Assembly,2011,LOT 4A CONSTRUCTION OF 4 SEATER KVIP INSTITUTIONAL LATRINE,other donor,8/31/2010,9/14/2011,,,,Asante Akim South District Assembly,2010-08-31,2011-09-14,
Asante Akim South District Assembly,2011,LOT 4A CONSTRUCTION OF 4 SEATER KVIP INSTITUTIONAL LATRINE,other donor,8/31/2010,9/14/2011,,,,Asante Akim South District Assembly,2010-08-31,2011-09-14,
Asante Akim South District Assembly,2011,LOT 4A CONSTRUCTION OF 4 SEATER KVIP INSTITUTIONAL LATRINE,other donor,8/31/2010,1/14/2011,,,,Asante Akim South District Assembly,2010-08-31,2011-01-14,
Asante Akim South District Assembly,2011,LOT 4A CONSTRUCTION OF 4 SEATER KVIP INSTITUTIONAL LATRINE,other donor,8/31/2010,9/14/2011,,,,Asante Akim South District Assembly,2010-08-31,2011-09-14,
Asante Akim South District Assembly,2011,LOT 4A CONSTRUCTION OF 4 SEATER KVIP INSTITUTIONAL LATRINE,other donor,8/31/2010,9/14/2011,,,,Asante Akim South District Assembly,2010-08-31,2011-09-14,
Asante Akim South District Assembly,2011,LOT 4A CONSTRUCTION OF 4 SEATER KVIP INSTITUTIONAL LATRINE,other donor,8/31/2010,9/14/2011,,,,Asante Akim South District Assembly,2010-08-31,2011-09-14,
Asante Akim South District Assembly,2011,CONSTRUCTION OF 3 UNIT CLASSROOM BLOCK WITH ANCILLARY FACILITIES,getfund,10/20/2011,12/5/2011,,,,Asante Akim South District Assembly,2011-10-20,2011-12-05,
Asante Akim South District Assembly,2011,LOT 5A CONSTRUCTION OF 6 SEATER KVIP INSTITUTIONAL LATRINE,other donor,8/31/2010,9/14/2011,,,,Asante Akim South District Assembly,2010-08-31,2011-09-14,
Asante Akim South District Assembly,2011,LOT 5A CONSTRUCTION OF 4 SEATER KVIP INSTITUTIONAL LATRINE,other donor,8/31/2010,9/14/2011,,,,Asante Akim South District Assembly,2010-08-31,2011-09-14,
Asante Akim South District Assembly,2011,LOT 5A CONSTRUCTION OF 6 SEATER KVIP INSTITUTIONAL LATRINE,other donor,8/31/2010,9/14/2011,,,,Asante Akim South District Assembly,2010-08-31,2011-09-14,
Asante Akim South District Assembly,2011,LOT 5A CONSTRUCTION OF 6 SEATER KVIP INSTITUTIONAL LATRINE,other donor,8/31/2010,9/14/2011,,,,Asante Akim South District Assembly,2010-08-31,2011-09-14,
Asante Akim South District Assembly,2011,LOT 5A CONSTRUCTION OF 6 SEATER KVIP INSTITUTIONAL LATRINE,other donor,8/31/2010,9/14/2011,,,,Asante Akim South District Assembly,2010-08-31,2011-09-14,
Asante Akim South District Assembly,2011,LOT 5A CONSTRUCTION OF 4 SEATER KVIP INSTITUTIONAL LATRINE,other donor,8/31/2010,9/14/2011,,,,Asante Akim South District Assembly,2010-08-31,2011-09-14,
Asante Akim South District Assembly,2011,CONSTRUCTION AND COMPLETION OF 1 NO 6 UNIT CLASSROOM BLOCK,other donor,8/31/2010,6/2/2010,,,,Asante Akim South District Assembly,2010-08-31,2010-06-02,
Asante Akim South District Assembly,2011,CONSTRUCTION OF 3 STORY BLOCK GIRLS DORMITORY 800 CAPACITY STUDENT,getfund,11/1/2010,1/4/2011,,,,Asante Akim South District Assembly,2010-11-01,2011-01-04,
Asante Akim South District Assembly,2011,COMPLETION OF 1  NO 20 SEATER W C PUBLIC TOILET,dacf,3/1/2010,3/15/2010,,,,Asante Akim South District Assembly,2010-03-01,2010-03-15,
Asante Akim South District Assembly,2011,MECHANIZATION OF 6 NO BORE HOLE PROJECT,other donor,2/8/2010,2/22/2010,,,,Asante Akim South District Assembly,2010-02-08,2010-02-22,
Asante Akim South District Assembly,2011,CONSTRUCTION OF 3 UNIT CLASSROOM BLOCK WITH ANCILLARY FACILITIES,getfund,10/20/2011,1/13/2012,,,,Asante Akim South District Assembly,2011-10-20,2012-01-13,
Asante Akim South District Assembly,2011,CONSTRUCTION OF 6 UNIT CLASSROOM BLOCK WITH ANCILLARY FACILITIES,getfund,10/20/2011,1/13/2012,,,,Asante Akim South District Assembly,2011-10-20,2012-01-13,
Asante Akim South District Assembly,2011,LOT 7 CONSTRUCTION OF 6 SEATER KVIP INTITUTIONAL LATRINE,other donor,9/29/2011,10/19/2011,,,,Asante Akim South District Assembly,2011-09-29,2011-10-19,
Asante Akim South District Assembly,2011,LOT 7 CONTRUCTION OF 6 SEATER KVIP INTITUTIONAL LATRINE,other donor,9/29/2011,10/19/2011,,,,Asante Akim South District Assembly,2011-09-29,2011-10-19,
Asante Akim South District Assembly,2011,LOT 7 CONSTRUCTION OF 6 SEATER KVIP INSTITUTIONAL LATRINE,other donor,9/29/2011,10/19/2011,,,,Asante Akim South District Assembly,2011-09-29,2011-10-19,
Asante Akim South District Assembly,2011,LOT 8 CONSTRUCTION OF 6 SEAT KVIP INTITUTION LATRINE,other donor,9/29/2011,10/19/2011,,,,Asante Akim South District Assembly,2011-09-29,2011-10-19,
Asante Akim South District Assembly,2011,LOT 8 CONSTRUCTION OF 4 SEAT KVIP INTITUTIONAL LATRINE,other donor,9/29/2011,10/19/2011,,,,Asante Akim South District Assembly,2011-09-29,2011-10-19,
Asante Akim South District Assembly,2011,LOT 9 CONSTRUCTION OF 6 SEATER KVIP INSTITUTIONAL LATRINE,other donor,9/29/2011,10/19/2011,,,,Asante Akim South District Assembly,2011-09-29,2011-10-19,
Asante Akim South District Assembly,2011,LOT 9 CONTRUCTION OF 6 SEATER KVIP INTITUTIONAL LATRINE,other donor,9/28/2011,10/19/2011,,,,Asante Akim South District Assembly,2011-09-28,2011-10-19,
Asante Akim South District Assembly,2011,LOT 9 CONSTRUCTION OF 6 SEATER KVIP INTITUTIONAL LATRINE,other donor,9/28/2011,10/19/2011,,,,Asante Akim South District Assembly,2011-09-28,2011-10-19,
Asante Akim South District Assembly,2011,LOT 10 CONSTRUCTION OF 6 SEATER KVIP INSTITUTIONAL LATRINE,other donor,9/29/2011,10/19/2011,,,,Asante Akim South District Assembly,2011-09-29,2011-10-19,
Asante Akim South District Assembly,2011,LOT 10 CONSTRUCTION OF 6 SEATER KVIP INSTITUTIONAL LATRINE,other donor,9/29/2011,10/19/2011,,,,Asante Akim South District Assembly,2011-09-29,2011-10-19,
Asante Akim South District Assembly,2011,LOT 10 CONSTRUCTION OF 4 SEATER KVIP INSTITUTIONAL LATRINE,other donor,9/29/2011,10/19/2011,,,,Asante Akim South District Assembly,2011-09-29,2011-10-19,
Asante Akim South District Assembly,2011,LOT 3 REMEDIAL WORKS OF 6 SEATER KVIP INSTITUTIONAL LATRINE,other donor,9/29/2011,10/19/2011,,,,Asante Akim South District Assembly,2011-09-29,2011-10-19,
Asante Akim South District Assembly,2011,LOT 3 REMIDIAL WORKS OF 6 SEATER KVIP INSTITUTIONAL LATRINE,other donor,9/29/2011,10/19/2011,,,,Asante Akim South District Assembly,2011-09-29,2011-10-19,
Asante Akim South District Assembly,2011,LOT 3 REMEDIAL WORKS OF 6 SEATER KVIP INSTITUTIONAL LATRINE,other donor,9/29/2011,10/19/2011,,,,Asante Akim South District Assembly,2011-09-29,2011-10-19,
Asante Akim South District Assembly,2011,LOT 3 REMEDIAL WORKS OF 6 SEATER KVIP INSTITUTIONAL LATRINE,other donor,9/29/2011,10/19/2011,,,,Asante Akim South District Assembly,2011-09-29,2011-10-19,
Asante Akim South District Assembly,2011,LOT 3 REMEDIAL WORKS OF 6 SEATER KVIP INSTITUTIONAL LATRINE,other donor,9/29/2011,10/19/2011,,,,Asante Akim South District Assembly,2011-09-29,2011-10-19,
Asante Akim South District Assembly,2011,LOT 3 REMEDIAL WORKS OF 6 SEATER KVIP INTITUTIONAL LATRINE,other donor,9/29/2011,10/19/2011,,,,Asante Akim South District Assembly,2011-09-29,2011-10-19,
Asante Akim South District Assembly,2011,LOT 3 REMEDIAL WORKS OF 4 SEATER KVIP INSTITUTIONAL LATRINE,other donor,9/29/2011,10/19/2011,,,,Asante Akim South District Assembly,2011-09-29,2011-10-19,
Asante Akim South District Assembly,2011,CONSTRUCTION OF 6 SEATER KVIP INSTITUTIONAL LATRINES (LOTS 1A) @ JUASO SDA PRIMARY SCHOOL,other donor,,,,,,Asante Akim South District Assembly,,,
Asante Akim South District Assembly,2011,CONSTRUCTION OF NO INSTITUTIONAL LATRINES (1A LOTS),other donor,,,,,,Asante Akim South District Assembly,,,
Asante Akim South District Assembly,2011,CONSTRUCTION OF NO INSTITUTIONAL LATRINES (1A LOTS),other donor,,,,,,Asante Akim South District Assembly,,,
Asante Akim South District Assembly,2011,CONSTRUCTION OF 1 NO 6 SEATER INSTITUTIONAL LATRINES (1A LOTS),other donor,,,,,,Asante Akim South District Assembly,,,
Asante Akim South District Assembly,2011,CONSTRUCTION OF 6 SEATER KVIP INSTITUTIONAL LATRINES (LOTS IA) @ JUASO SDA PRIMARY SCHOOL,other donor,,,,,,Asante Akim South District Assembly,,,
Asante Akim South District Assembly,2011,CONSTRUCTION OF NO INSTITUTIONAL LATRINES (1A LOTS),other donor,,,,,,Asante Akim South District Assembly,,,
Asante Akim South District Assembly,2011,CONSTRUCTION OF NO INSTITUTIONAL LATRINES (1A LOTS),other donor,,,,,,Asante Akim South District Assembly,,,
Asante Akim South District Assembly,2011,CONSTRUCTION OF 1 NO 6 SEATER INSTITUTIONAL LATRINES (1A LOTS),other donor,,,,,,Asante Akim South District Assembly,,,
Asante Akim South District Assembly,2011,CONSTRUCTION OF NO INSTITUTIONAL LATRINES (1A LOTS),other donor,,,,,,Asante Akim South District Assembly,,,
Asante Akim South District Assembly,2011,CONSTRUCTION OF 4 SEATER KVIP INSTITUTIONAL LATRINES (2A LOTS),other donor,,,,,,Asante Akim South District Assembly,,,
Asante Akim South District Assembly,2011,CONSTRUCTION OF 4 SEATER KVIP INSTITUTIONAL LATRINES (2A LOTS),other donor,,,,,,Asante Akim South District Assembly,,,
Asante Akim South District Assembly,2011,CONSTRUCTION OF 4 SEATER KVIP INSTITUTIONAL LATRINES (2 A LOTS),other donor,,,,,,Asante Akim South District Assembly,,,
Asante Akim South District Assembly,2011,CONSTRUCTION OF 4 SEATER KVIP INSTITUTIONAL LATRINES (2 A LOTS),other donor,,,,,,Asante Akim South District Assembly,,,
Asante Akim South District Assembly,2011,CONSTRUCTION OF 4 SEATER KVIP INSTITUTIONAL LATRINES (2 A LOTS),other donor,,,,,,Asante Akim South District Assembly,,,
Asante Akim South District Assembly,2011,CONSTRUCTION OF 4 SEATER KVIP INSTITUTIONAL LATRINES (3 A LOTS),other donor,,,,,,Asante Akim South District Assembly,,,
Asante Akim South District Assembly,2011,CONSTRUCTION OF 6 SEATER KVIP INSTITUTIONAL LATRINES 3 A LOTS,other donor,,,,,,Asante Akim South District Assembly,,,
Asante Akim South District Assembly,2011,CONSTRUCTION ON OF 4 SEATER KVIP INSTITUTIONAL LATRINES (3 A LOTS),other donor,,,,,,Asante Akim South District Assembly,,,
Asante Akim South District Assembly,2011,CONSTRUCTION ON OF 6 SEATER KVIP INSTITUTIONAL LATRINES (3 A LOTS),other donor,,,,,,Asante Akim South District Assembly,,,
Asante Akim South District Assembly,2011,CONSTRUCTION OF 4 SEATER KVIP INSTITUTIONAL LATRINES 4 A LOTS,other donor,,,,,,Asante Akim South District Assembly,,,
Asante Akim South District Assembly,2011,CONSTRUCTION OF 4 SEATER KVIP INSTITUTIONAL LATRINES 4 A LOTS,other donor,,,,,,Asante Akim South District Assembly,,,
Asante Akim South District Assembly,2011,CONSTRUCTION OF 4 SEATER KVIP INSTITUTIONAL LATRINES 4 A LOTS,other donor,,,,,,Asante Akim South District Assembly,,,
Asante Akim South District Assembly,2011,CONSTRUCTION OF 4 SEATER KVIP INSTITUTIONAL LATRINES 4 A LOTS,other donor,,,,,,Asante Akim South District Assembly,,,
Asante Akim South District Assembly,2011,CONSTRUCTION OF 6 SEATER KVIP INSTITUTIONAL LATRINES 5 A LOTS,other donor,,,,,,Asante Akim South District Assembly,,,
Asante Akim South District Assembly,2011,CONSTRUCTION OF 6 SEATER KVIP INSTITUTIONAL LATRINES 5 A LOTS,other donor,,,,,,Asante Akim South District Assembly,,,
Asante Akim South District Assembly,2011,CONSTRUCTION OF 4 SEATER KVIP INSTITUTIONAL LATRINES(4 A LOTS),other donor,,,,,,Asante Akim South District Assembly,,,
Asante Akim South District Assembly,2011,CONSTRUCTION OF 6 SEATER KVIP INSTITUTIONAL LATRINES (5A LOTS),other donor,,,,,,Asante Akim South District Assembly,,,
Asante Akim South District Assembly,2011,CONSTRUCTION OF 4 SEATER KVIP INSTITUTIONAL LATRINES (5A LOTS),other donor,,,,,,Asante Akim South District Assembly,,,
Asante Akim South District Assembly,2011,CONSTRUCTION OF 4 SEATER KVIP INSTITUTIONAL LATRINES (5A LOTS),other donor,,,,,,Asante Akim South District Assembly,,,
Asante Akim South District Assembly,2011,COMPLETION OF 1 NO 20 SEATER WC TOILET,dacf,,,,,,Asante Akim South District Assembly,,,
Asante Akim South District Assembly,2011,MECHANIZATION OF 7 NO BORE-HOLE PROJECT,other donor,,,,,,Asante Akim South District Assembly,,,
Asante Akim South District Assembly,2011,CONSTRUCTION OF 6 SEATER KVIP INSTITUTIONAL LATRINES LOT 7,other donor,,,,,,Asante Akim South District Assembly,,,
Asante Akim South District Assembly,2011,CONSTRUCTION OF 6 SEATER KVIP INSTITUTIONAL,other donor,,,,,,Asante Akim South District Assembly,,,
Asante Akim South District Assembly,2011,CONSTRUCTION OF 6 SEATER KVIP INSTITUTIONAL LATRINES LOT 7,other donor,,,,,,Asante Akim South District Assembly,,,
Asante Akim South District Assembly,2011,CONSTRUCTION OF 6 SEATER KVIP INSTITUTIONAL LATRINES LOT 8,other donor,,,,,,Asante Akim South District Assembly,,,
Asante Akim South District Assembly,2011,CONSTRUCTION OF 4 SEATER KVIP INSTITUTIONAL LATRINES LOT 8,other donor,,,,,,Asante Akim South District Assembly,,,
Asante Akim South District Assembly,2011,CONSTRUCTION OF 6 SEATER KVIP INSTITUTIONAL LATRINES LOT 9,other donor,,,,,,Asante Akim South District Assembly,,,
Asante Akim South District Assembly,2011,CONSTRUCTION OF 6 SEATER KVIP INSTITUTIONAL LATRINES LOT 9,other donor,,,,,,Asante Akim South District Assembly,,,
Asante Akim South District Assembly,2011,CONSTRUCTION OF 6 SEATER KVIP INSTITUTIONAL LATRINES LOT 9,other donor,,,,,,Asante Akim South District Assembly,,,
Asante Akim South District Assembly,2011,CONSTRUCTION OF 6 SEATER KVIP INSTITUTIONAL LATRINES LOT 10,other donor,,,,,,Asante Akim South District Assembly,,,
Asante Akim South District Assembly,2011,CONSTRUCTION OF 6 SEATER KVIP INSTITUTIONAL LATRINES LOT 10,other donor,,,,,,Asante Akim South District Assembly,,,
Asante Akim South District Assembly,2011,CONSTRUCTION OF 4 SEATER KVIP INSTITUTIONAL LATRINES LOT 10,other donor,,,,,,Asante Akim South District Assembly,,,
Asante Akim South District Assembly,2011,REMEDIAL WORKS OF 6 SEATER KVIP INSTITUTIONAL LATRINES LOT3,other donor,,,,,,Asante Akim South District Assembly,,,
Asante Akim South District Assembly,2011,REMEDIAL WORKS OF 6 SEATER KVIP INSTITUTIONAL LATRINES LOT3,other donor,,,,,,Asante Akim South District Assembly,,,
Asante Akim South District Assembly,2011,CONSTRUCTION OF 4 SEATER KVIP INSTITUTIONAL LATRINES LOT 10,other donor,,,,,,Asante Akim South District Assembly,,,
Asante Akim South District Assembly,2011,REMEDIAL WORKS OF 6 SEATER KVIP INSTITUTIONAL LATRINES LOT3,other donor,,,,,,Asante Akim South District Assembly,,,
Asante Akim South District Assembly,2011,REMEDIAL WORKS OF 6 SEATER KVIP INSTITUTIONAL LATRINES LOT3,other donor,,,,,,Asante Akim South District Assembly,,,
Asante Akim South District Assembly,2011,REMEDIAL WORKS OF 6 SEATER KVIP INSTITUTION AT LATIRNES (LOT3),other donor,,,,,,Asante Akim South District Assembly,,,
Asante Akim South District Assembly,2011,REMEDIAL WORKS OF 4 SEATER KVIP INSTITUTIONAL LATRINES LOT 3,other donor,,,,,,Asante Akim South District Assembly,,,
Ashaiman Municipal Assembly,2011,CONSTRUCTION OF 3 UNIT CLASSROOM BLOCKS WITH ANCILLARIES,multiple,,,,,,Ashaiman Municipal Assembly,,,
Ashaiman Municipal Assembly,2011,CONSTRUCTION OF 6 UNIT CLASSROOM BLOCKS WITH ANCILLARIES,multiple,,,,,,Ashaiman Municipal Assembly,,,
Ashaiman Municipal Assembly,2011,REHABILITATION OF ASHAIMAN SENIOR HIGH SCHOOL ASSEMBLY,multiple,,,,,,Ashaiman Municipal Assembly,,,
Ashaiman Municipal Assembly,2011,"CONSTRUCTION OF 6- UNIT CLASSROOM BLOCKS AT TSUI-BLEOO, COMM",multiple,,,,,,Ashaiman Municipal Assembly,,,
Ashaiman Municipal Assembly,2011,CONSTRUCTION OF 2NO. WARD ROOMS FOR HEALTH FACILITY AT ASHAIMAN POLYCLINIC,multiple,,,,,,Ashaiman Municipal Assembly,,,
Ashaiman Municipal Assembly,2011,CONSTRUCTION OF HEALTH STAFF QUARTERS,igf,,,,,,Ashaiman Municipal Assembly,,,
Ashaiman Municipal Assembly,2011,UPGRADE HEALTH CENTER TO A HOSPITAL,multiple,,,,,,Ashaiman Municipal Assembly,,,
Ashaiman Municipal Assembly,2011,REHABILITATION & RENOVATION WORKS FOR ASHAIMAN HEALTH DIRECTORATE,igf,,,,,,Ashaiman Municipal Assembly,,,
Ashaiman Municipal Assembly,2011,FENCING OF LORRY PARK/MARKET AND ASSEMBLY BUILDINGS,igf,,,,,,Ashaiman Municipal Assembly,,,
Ashaiman Municipal Assembly,2011,REHABILITATION WORKS AT ASHAIMAN NII ADJOR MARKET (PHASE 1),igf,,,,,,Ashaiman Municipal Assembly,,,
Ashaiman Municipal Assembly,2011,INSTALLATION OF STREET LIGHTS IN ALL CRIME PRONE AREAS,igf,,,,,,Ashaiman Municipal Assembly,,,
Ashaiman Municipal Assembly,2011,CONSTRUCTION OF 2 NO. 10 SEATER AT ASHAIMAN MAIN MARKET,igf,,,,,,Ashaiman Municipal Assembly,,,
Ashaiman Municipal Assembly,2011,REHABILITATION OF ASHAIMAN CLUSTER OF SCHOOLS FENCE WALL,other/unknown,,,,,,Ashaiman Municipal Assembly,,,
Ashaiman Municipal Assembly,2011,CONSTRUCTION OF 4-UNIT 1 NO. KITCHEN FOR SCHOOOL FEEDING PROGRAMME FOR ASHAIMAN CLUSTER OF SCHOOLS,other/unknown,,,,,,Ashaiman Municipal Assembly,,,
Ashaiman Municipal Assembly,2011,REHABILITATION AND PAINTING OF PRIMARY SCHOOL AT ASHAIMAN CLUSTER OF SCHOOLS,other/unknown,,,,,,Ashaiman Municipal Assembly,,,
Ashaiman Municipal Assembly,2011,CONSTRUCTION OF 2-STOREY 12-UNIT CLASSROOM BLOCK WITH ANCILLARY FACILITIES AT LEBANON TSUI BLEOO BASIC SCHOOL,other/unknown,,,,,,Ashaiman Municipal Assembly,,,
Ashaiman Municipal Assembly,2011,CONSTRUCTION OF 2- STOREY 12-UNIT CLASSROOM BLOCK WITH ANCILLARY FACILITIES AT LEBANON TSUI BLEOO BASIC SCHOOL,other/unknown,,,,,,Ashaiman Municipal Assembly,,,
Ashaiman Municipal Assembly,2011,RENOVATION OF GROUND FLOOR AT ASHAIMAN MUNICIPAL ASSEMBLY,other/unknown,,,,,,Ashaiman Municipal Assembly,,,
Ashaiman Municipal Assembly,2011,CONSTRUCTION OF 3- STOREY 18-UNIT CLASSROOM BLOCK WITH ANCILLAY FACILITIES,other/unknown,,,,,,Ashaiman Municipal Assembly,,,
Ashaiman Municipal Assembly,2011,CONSTRUCTION OF 2- STOREY 12-UNIT CLASSROOM BLOCK WITH ANCILLARY FACILITIES,other/unknown,,,,,,Ashaiman Municipal Assembly,,,
Ashaiman Municipal Assembly,2011,REHABILITATION OF IRRIGATION FACILITIES,multiple,,,,,,Ashaiman Municipal Assembly,,,
Ashaiman Municipal Assembly,2011,CONSTRUCTION OF 1-STOREY OFFICE BLOCK FOR ASHAIMAN MUNICIPAL ASSEMBLY,igf,,,,,,Ashaiman Municipal Assembly,,,
Ashaiman Municipal Assembly,2011,CONSTRUCTION OF FENCE WALL AND AROUND PROPOSED SITE FOR MCE RESIDENCE,igf,,,,,,Ashaiman Municipal Assembly,,,
Ashaiman Municipal Assembly,2011,GRAVELLING OF NIKOI DSANI ROADS (41),igf,,,,,,Ashaiman Municipal Assembly,,,
Ashaiman Municipal Assembly,2011,CONSTRUCTION OF 600MM U DRAIN ALONG AFARIWAA ROAD (RHS,igf,,,,,,Ashaiman Municipal Assembly,,,
Ashaiman Municipal Assembly,2011,DRAINAGE WORKS ALONG ASHAIMAN NEW TOWN OBLIGADO LINK,igf,,,,,,Ashaiman Municipal Assembly,,,
Ashaiman Municipal Assembly,2011,DRAINAGE WORKS ALONG KOWANASO ROAD,igf,,,,,,Ashaiman Municipal Assembly,,,
Ashaiman Municipal Assembly,2011,CONSTRUCTION OF RETAINING WALL AT ALLIED OIL FILLING STATION ON ASHAIMAN ZENU MAIN ROAD,igf,,,,,,Ashaiman Municipal Assembly,,,
Ashaiman Municipal Assembly,2011,CONSTRUCTION OF 900MM U DRAIN AT CLEMENTINA SCHOOL,igf,,,,,,Ashaiman Municipal Assembly,,,
Ashaiman Municipal Assembly,2011,CONSTRUCTION OF 600MM U DRAIN ALONG CHRISTIAN ALONG CHRISTIAN VILLAGE EPA LINK,igf,,,,,,Ashaiman Municipal Assembly,,,
Ashaiman Municipal Assembly,2011,GRAVELLING OF ASHAIMAN UNDERPASS,igf,,,,,,Ashaiman Municipal Assembly,,,
Ashaiman Municipal Assembly,2011,CONSTRUCTION OF 600MM U DRAIN AT MIDDLE EAST ZONE 5,igf,,,,,,Ashaiman Municipal Assembly,,,
Ashaiman Municipal Assembly,2011,SURFACING OF VALCO FLAT ONE WAY LINK 1&2 ROADS,igf,,,,,,Ashaiman Municipal Assembly,,,
Ashaiman Municipal Assembly,2011,DRAINAGE WORKS ALONG KOWANASO ROAD PH II,igf,,,,,,Ashaiman Municipal Assembly,,,
Ashaiman Municipal Assembly,2011,CONSTRUCTION OF 600MM U DRAIN ALONG AFARIWAA ROAD (LHS),igf,,,,,,Ashaiman Municipal Assembly,,,
Ashaiman Municipal Assembly,2011,DRAINAGE WORKS ALONG JERICHO TAXI RANK,igf,,,,,,Ashaiman Municipal Assembly,,,
Ashaiman Municipal Assembly,2011,GRAVELLING OF NIGHT MARKET ROAD (1.28KM),igf,,,,,,Ashaiman Municipal Assembly,,,
Ashaiman Municipal Assembly,2011,DRAINAGE WORKS ALONG AGIRI NYARKO SCHOOL COMPLEX,igf,,,,,,Ashaiman Municipal Assembly,,,
Ashaiman Municipal Assembly,2011,GRAVELLING WORKS AT VALCO JUNCTION-JERICHO TAXI RANK,igf,,,,,,Ashaiman Municipal Assembly,,,
Ashaiman Municipal Assembly,2011,DRAINAGE WORKS ALONG JERICHO MAIN ROAD,igf,,,,,,Ashaiman Municipal Assembly,,,
Ashaiman Municipal Assembly,2011,CONSTRUCTION OF 900MM U DRAIN ALONG MIDDLE EAST APOSTOLIC CHURCH ROAD,igf,,,,,,Ashaiman Municipal Assembly,,,
Ashaiman Municipal Assembly,2011,SURFACING OF JERICHO TAXI RANK NAKITA,igf,,,,,,Ashaiman Municipal Assembly,,,
Ashaiman Municipal Assembly,2011,CONSTRUCTION OF DOUBLE CELL 900MM PIPE CULVERT AT AGRIC MOSQUE,igf,,,,,,Ashaiman Municipal Assembly,,,
Ashaiman Municipal Assembly,2011,"DRAINAGE WORK AT MANDELA LINK, ZONE 5 PH. II",igf,,,,,,Ashaiman Municipal Assembly,,,
Ashaiman Municipal Assembly,2011,"DRAINAGE WORK AT MANDELA LINK, ZONE 5",igf,,,,,,Ashaiman Municipal Assembly,,,
Ashaiman Municipal Assembly,2011,CONSTRUCTION OF 900MM U DRAIN AT ADA STORE,igf,,,,,,Ashaiman Municipal Assembly,,,
Ashaiman Municipal Assembly,2011,CONSTRUCTION OF 900MM U DRAIN AT PINK LADY STEP 5,igf,,,,,,Ashaiman Municipal Assembly,,,
Ashaiman Municipal Assembly,2011,DRAINAGE WORKS ALONG ROCKY ROAD,igf,,,,,,Ashaiman Municipal Assembly,,,
Asikuma/Odoben/Brakwa District Assembly,2011,COMPLETION OF TQ,multiple,6/13/2008,6/13/2008,,,,Asikuma/Odoben/Brakwa District Assembly,2008-06-13,2008-06-13,
Asikuma/Odoben/Brakwa District Assembly,2011,CONSTRUCTION OF TOWN HALL,dacf,9/1/2007,9/10/2007,,,,Asikuma/Odoben/Brakwa District Assembly,2007-09-01,2007-09-10,
Asikuma/Odoben/Brakwa District Assembly,2011,CONSTRUCTION OF BAC OFFICE,other/unknown,6/12/2008,6/26/2008,,,,Asikuma/Odoben/Brakwa District Assembly,2008-06-12,2008-06-26,
Asikuma/Odoben/Brakwa District Assembly,2011,CONSTRUCTION OF 6 UNIT CLASSROOM BLOCK,dacf,8/15/2008,8/25/2008,,,,Asikuma/Odoben/Brakwa District Assembly,2008-08-15,2008-08-25,
Asikuma/Odoben/Brakwa District Assembly,2011,CONSTRUCTION OF AREA COUNCIL OFFICE,dacf,5/3/2008,5/17/2008,,,,Asikuma/Odoben/Brakwa District Assembly,2008-05-03,2008-05-17,
Asikuma/Odoben/Brakwa District Assembly,2011,CONSTRUCTION OF 2NO 6 SEATER KVIP TOILETS,other donor,10/26/2009,11/17/2009,,,,Asikuma/Odoben/Brakwa District Assembly,2009-10-26,2009-11-17,
Asikuma/Odoben/Brakwa District Assembly,2011,CONSTRUCTION OF 2NO 6 SEATER KVIP TOILET,other donor,10/26/2009,12/17/2009,,,,Asikuma/Odoben/Brakwa District Assembly,2009-10-26,2009-12-17,
Asikuma/Odoben/Brakwa District Assembly,2011,CONSTRUCTION OF ADMINISTRATION BLOCK FOR BRAKWA SHS,dacf,10/4/2007,10/18/2007,,,,Asikuma/Odoben/Brakwa District Assembly,2007-10-04,2007-10-18,
Asikuma/Odoben/Brakwa District Assembly,2011,RE ROOFING,dacf,Jun-10,,,,,Asikuma/Odoben/Brakwa District Assembly,2010-06-01,,
Asikuma/Odoben/Brakwa District Assembly,2011,CONSTRUCTION OF 6 UNIT CLASSROOM BLOCK 4 SEATER TOILET,ddf,2/11/2010,3/16/2010,,,,Asikuma/Odoben/Brakwa District Assembly,2010-02-11,2010-03-16,
Asikuma/Odoben/Brakwa District Assembly,2011,CONSTRUCTION OF 6 UNIT CLASSROOM BLOCK 4 SEATER KVIP AND URINAL,ddf,2/11/2010,3/16/2010,,,,Asikuma/Odoben/Brakwa District Assembly,2010-02-11,2010-03-16,
Asikuma/Odoben/Brakwa District Assembly,2011,CONSTRUCTION OF 6 UNIT CLASSROOM BLOCK,ddf,2/11/2010,3/16/2010,,,,Asikuma/Odoben/Brakwa District Assembly,2010-02-11,2010-03-16,
Asikuma/Odoben/Brakwa District Assembly,2011,CONSTRUCTION OF 3 UNIT CLASSROOM BLOCK 4 SEATER KVIP AND URINAL,ddf,2/11/2010,3/11/2010,,,,Asikuma/Odoben/Brakwa District Assembly,2010-02-11,2010-03-11,
Asikuma/Odoben/Brakwa District Assembly,2011,CONSTRUCTION OF 4 UNIT CLASSROOM BLOCK 4 SEATER KVIP TOILET AND URINAL,ddf,2/11/2010,3/11/2010,,,,Asikuma/Odoben/Brakwa District Assembly,2010-02-11,2010-03-11,
Asikuma/Odoben/Brakwa District Assembly,2011,CONSTRUCTION OF GIRLS HOSTEL,ddf,2/11/2010,3/16/2010,,,,Asikuma/Odoben/Brakwa District Assembly,2010-02-11,2010-03-16,
Asikuma/Odoben/Brakwa District Assembly,2011,CONSTRUCTION OF TEACHERS QUARTERS,ddf,2/11/2010,3/16/2010,,,,Asikuma/Odoben/Brakwa District Assembly,2010-02-11,2010-03-16,
Asikuma/Odoben/Brakwa District Assembly,2011,CONSTRUCTION OF TEACHERS QUARTERS,other donor,2/11/2010,3/16/2010,,,,Asikuma/Odoben/Brakwa District Assembly,2010-02-11,2010-03-16,
Asikuma/Odoben/Brakwa District Assembly,2011,CONSTRUCTION OF 22NO BORE HOLES,other donor,2/3/2010,3/16/2010,,,,Asikuma/Odoben/Brakwa District Assembly,2010-02-03,2010-03-16,
Asikuma/Odoben/Brakwa District Assembly,2011,CONSTRUCTION OF 8 SEATER KIVP LATRINES,other donor,8/12/2010,9/9/2010,,,,Asikuma/Odoben/Brakwa District Assembly,2010-08-12,2010-09-09,
Asikuma/Odoben/Brakwa District Assembly,2011,CONSTRUCTION OF 1 NO 8 SEATER AND 1NO 6 SEATER KVIP,other donor,8/12/2010,9/9/2010,,,,Asikuma/Odoben/Brakwa District Assembly,2010-08-12,2010-09-09,
Asikuma/Odoben/Brakwa District Assembly,2011,CONSTRUCTION OF SEATER KVIP LATRINES,other donor,8/12/2010,9/9/2010,,,,Asikuma/Odoben/Brakwa District Assembly,2010-08-12,2010-09-09,
Asikuma/Odoben/Brakwa District Assembly,2011,SPOT IMPROVEMENT OF FEEDER ROAD,other donor,8/12/2010,8/26/2010,,,,Asikuma/Odoben/Brakwa District Assembly,2010-08-12,2010-08-26,
Asikuma/Odoben/Brakwa District Assembly,2011,SPOT IMPROVEMENT OF FEED ROAD,other donor,8/10/2010,8/23/2010,,,,Asikuma/Odoben/Brakwa District Assembly,2010-08-10,2010-08-23,
Asikuma/Odoben/Brakwa District Assembly,2011,SPOT IMPROVEMENT OF FEED ROAD,other donor,8/10/2010,8/23/2010,,,,Asikuma/Odoben/Brakwa District Assembly,2010-08-10,2010-08-23,
Asikuma/Odoben/Brakwa District Assembly,2011,SPOT IMPROVEMENT OF FEED ROAD,other donor,8/10/2010,8/23/2010,,,,Asikuma/Odoben/Brakwa District Assembly,2010-08-10,2010-08-23,
Asikuma/Odoben/Brakwa District Assembly,2011,CONSTRUCTION OF FOOD BRIGES,other donor,8/12/2010,8/23/2010,,,,Asikuma/Odoben/Brakwa District Assembly,2010-08-12,2010-08-23,
Asikuma/Odoben/Brakwa District Assembly,2011,COMPLETION OF 6 UNIT CLASSROOM BLOCK,dacf,8/15/2008,8/29/2008,,,,Asikuma/Odoben/Brakwa District Assembly,2008-08-15,2008-08-29,
Assin North Municipal Assembly,2011,,,,,,,,Assin North Municipal Assembly,,,
Assin South District Assembly,2011,,,,,,,,Assin South District Assembly,,,
Asunafo North Municipal Assembly,2011,,,,,,,,Asunafo North Municipal Assembly,,,
Asunafo South District Assembly,2011,,,,,,,,Asunafo South District Assembly,,,
Asuogyaman District Assembly,2011,REHABILITATION OF 10 SEATER TOILET,ddf,,12/20/2010,,,,Asuogyaman District Assembly,,2010-12-20,
Asuogyaman District Assembly,2011,CLEARING OF FINAL DISPOSAL SITE FOR OPERATION,ddf,,2/15/2011,,,,Asuogyaman District Assembly,,2011-02-15,
Asuogyaman District Assembly,2011,CONSTRUCTION OF 1 NO 3 UNIT CLASSROOM BLOCK WITH OFFICE STORE AND STAFF COMMOM ROOM,ddf,,11/20/2010,,,,Asuogyaman District Assembly,,2010-11-20,
Asuogyaman District Assembly,2011,REHABILITATION OF 30 SEATER WC TOILET,ddf,,11/20/2010,,,,Asuogyaman District Assembly,,2010-11-20,
Asuogyaman District Assembly,2011,ADJENA MANYA YOYIM RENOVATION AND OTHER ROADS,ddf,,11/20/2010,,,,Asuogyaman District Assembly,,2010-11-20,
Asuogyaman District Assembly,2011,CONSTRUCTION OF WARD FOR BOSO CLINIC,ddf,,11/19/2010,,,,Asuogyaman District Assembly,,2010-11-19,
Asuogyaman District Assembly,2011,CONSTRUCTION AND DRILLING OF 2 BOREHOLES,ddf,,11/20/2010,,,,Asuogyaman District Assembly,,2010-11-20,
Asuogyaman District Assembly,2011,CONSTRUCTION OF 3 UNIT CLASSROOM BLOCK WITH OFFICE STORE AND STAFF COMMON ROOM FOR YENIAMA LA JHS,ddf,,11/20/2010,,,,Asuogyaman District Assembly,,2010-11-20,
Asuogyaman District Assembly,2011,CONSTRUCTION OF 2NO 16UNIT MARKET SHEDS,ddf,,11/20/2010,,,,Asuogyaman District Assembly,,2010-11-20,
Asuogyaman District Assembly,2011,REHABILITATION OF 3 UNIT CLASSROOM BLOCK WITH OFFICE STORE AND STAFF COMMOM ROOM,ddf,,6/22/2010,,,,Asuogyaman District Assembly,,2010-06-22,
Asuogyaman District Assembly,2011,RENOVATION OF ATIMPOKU SLAUGHTER HOUSE,ddf,,3/3/2011,,,,Asuogyaman District Assembly,,2011-03-03,
Asuogyaman District Assembly,2011,PAVING OF ATIMPOKU LORRY PARK AND MARKET SHED FOR ABOLLO SELLERS,ddf,,11/20/2010,,,,Asuogyaman District Assembly,,2010-11-20,
Asuogyaman District Assembly,2011,SUPPLY OF STREETLIGHT,ddf,,1/31/2011,,,,Asuogyaman District Assembly,,2011-01-31,
Asuogyaman District Assembly,2011,RESHAPING OF SELECTED FEEDER ROADS,ddf,,1/31/2011,,,,Asuogyaman District Assembly,,2011-01-31,
Asuogyaman District Assembly,2011,CONSTRUCTION OF 1 NO 6 UNIT CLASSROOM BLOCK WITH ANCILLARY FACILTIES,getfund,,2/10/2011,,,,Asuogyaman District Assembly,,2011-02-10,
Asuogyaman District Assembly,2011,CONSTRUCTION OF 1 NO 6 UNIT CLASSROOM BLOCK WITH ANCILLARY FACILITIES,getfund,,2/10/2011,,,,Asuogyaman District Assembly,,2011-02-10,
Asuogyaman District Assembly,2011,CONSTRUCTION OF 1 NO 6 UNIT CLASSROOM BLOCK WITH ANCILLARY FACILITIES,getfund,,2/10/2011,,,,Asuogyaman District Assembly,,2011-02-10,
Asuogyaman District Assembly,2011,CONSTRUCTION OF 1 NO 6 UNIT CLASSROOM BLOCK WTH ANCILLARY FACILITIES,getfund,,2/10/2011,,,,Asuogyaman District Assembly,,2011-02-10,
Asuogyaman District Assembly,2011,CONSTRUCTION OF 1 NO 6 UNIT CLASSROOM BLOCK WITH ANCILLARY FACILITIES,getfund,,2/10/2011,,,,Asuogyaman District Assembly,,2011-02-10,
Asuogyaman District Assembly,2011,CONSTRUCTION OF 1 N O 6 UNIT CLASSROOM BLOCK WITH ANCILLARY FACILITIES,getfund,,2/10/2011,,,,Asuogyaman District Assembly,,2011-02-10,
Asuogyaman District Assembly,2011,CONSTRUCTION OF 1 NO 6 UNIT CLASSROOM BLOCK WITH ANCILLARY FACILITIES,getfund,,2/10/2011,,,,Asuogyaman District Assembly,,2011-02-10,
Asuogyaman District Assembly,2011,CONSTRUCTION OF 6 UNIT CLASSROOM BLOCK AT APEGUSO SHS,getfund,,,,,,Asuogyaman District Assembly,,,
Asuogyaman District Assembly,2011,CONSTRUCTION OF 6UNIT CLASSROOM BLOCK AT ANUM SHS,getfund,,,,,,Asuogyaman District Assembly,,,
Asuogyaman District Assembly,2011,CONSTRUCTION OF 12 UNIT CLASSROOM BLOCK AT BOSO SECONDARY SCHOOL,getfund,,,,,,Asuogyaman District Assembly,,,
Asuogyaman District Assembly,2011,CONSTRUCTION OF DORMITORY FOR BOSO SHS,getfund,,,,,,Asuogyaman District Assembly,,,
Asuogyaman District Assembly,2011,CONSTRUCTION OF TEACHERS QUARTERS AT APEGUSO SHS,getfund,,,,,,Asuogyaman District Assembly,,,
Asutifi North District Assembly,2011,,,,,,,,Asutifi North District Assembly,,,
Atebubu-Amantin District Assembly,2011,,,,,,,,Atebubu-Amantin District Assembly,,,
Atiwa District Assembly,2011,INSTITUTE TOWN HALL MEETINGS DURING PREPARATION OF FEE FIXING AND OTHER COMMUNITY INTERFACE PROGRAMMES,other/unknown,,,,,,Atiwa District Assembly,,,
Atiwa District Assembly,2011,CONSTRUCT 1NO AREA COUNCIL OFFICE,other/unknown,,,,,,Atiwa District Assembly,,,
Atiwa District Assembly,2011,UNDERTAKE EXTENSION OF THE OFFICE BLOCK,other/unknown,,,,,,Atiwa District Assembly,,,
Atiwa District Assembly,2011,COMPLETE 1NO RESIDENTIAL ACCOMMODATION FOR DCD,other/unknown,,,,,,Atiwa District Assembly,,,
Atiwa District Assembly,2011,CONSTRUCT 1NO 3 UNIT BED RESIDENTIAL ACCOMMODATION,other/unknown,,,,,,Atiwa District Assembly,,,
Atiwa District Assembly,2011,CONSTRUCT 3 UNIT BEDROOM STAFF QUARTERS,other/unknown,,,,,,Atiwa District Assembly,,,
Atiwa District Assembly,2011,CONSTRUCT 2NO TWO BEDROOM SEMI DETACHED STAFF QUARTERS,other/unknown,,,,,,Atiwa District Assembly,,,
Atiwa District Assembly,2011,PROVIDE TEMPORARY ACCOMMODATION FOR SELECTED HEADS OF DEPARTMENTS AND STAFF,other/unknown,,,,,,Atiwa District Assembly,,,
Atiwa District Assembly,2011,ACQUIRED 1 NO 3 BEDROOM ACCOMMODATION FOR DFO,other/unknown,,,,,,Atiwa District Assembly,,,
Atiwa District Assembly,2011,REHABILITATION OF 15NO BOREHOLE FACILITIES IN 12 COMMUNITIES,other/unknown,,,,,,Atiwa District Assembly,,,
Atiwa District Assembly,2011,INVESTIGATION AND DRILLING SUPERVISION OF 15NO BOREHOLES IN 12 COMMUNITIES,other/unknown,,,,,,Atiwa District Assembly,,,
Atiwa District Assembly,2011,REHABILITATION OF PUBLIC TOILETS,other/unknown,,,,,,Atiwa District Assembly,,,
Atiwa District Assembly,2011,CONSTRUCTION OF SLAUGHTER HOUSE,other/unknown,,,,,,Atiwa District Assembly,,,
Atiwa District Assembly,2011,CONSTRUCT 20SEATER WC TOILET,other/unknown,,,,,,Atiwa District Assembly,,,
Atiwa District Assembly,2011,SUPPORT FOR CONSTRUCTION OF HOUSEHOLD LATRINES,other/unknown,,,,,,Atiwa District Assembly,,,
Atiwa District Assembly,2011,CONSTRUCT ANIMAL POUNDS,other/unknown,,,,,,Atiwa District Assembly,,,
Atiwa District Assembly,2011,INSTALL STREETLIGHTS AND REHABILITATE FAULTY ONES,other/unknown,,,,,,Atiwa District Assembly,,,
Atwima Kwanwoma District Assembly,2011,CONSTRUCTION OF 1 NO 3 UNIT CLASSROOM BLOCK WITH OFFICE STAFF STORE COMMON ROOM FOR DA PRIMARY AND JHS,other/unknown,,Nov-10,,,,Atwima Kwanwoma District Assembly,,2010-11-01,
Atwima Kwanwoma District Assembly,2011,CONSTRUCTION OF 1 NO 3 UNIT CLASSROOM BLOCK WITH OFFICE STAFF STORE COMMON ROOM FOR JHS,other/unknown,,Nov-10,,,,Atwima Kwanwoma District Assembly,,2010-11-01,
Atwima Kwanwoma District Assembly,2011,CONSTRUCTION OF 1 NO 3 UNIT CLASSROOM BLOCK WITH OFFICE STAFF AND COMMON ROOM,other/unknown,,Nov-10,,,,Atwima Kwanwoma District Assembly,,2010-11-01,
Atwima Kwanwoma District Assembly,2011,CONSTRUCTION OF 1 NO 2 U NIT CLASSROOM BLOCK WITH OFFICE STAFF STORE,other/unknown,,Nov-10,,,,Atwima Kwanwoma District Assembly,,2010-11-01,
Atwima Kwanwoma District Assembly,2011,CONSTRUCTION OF 1 NO 3 UNIT CLASSROOM BLOCK WITH OFFICE STAFF STORE COMMON ROOM,other/unknown,,Nov-10,,,,Atwima Kwanwoma District Assembly,,2010-11-01,
Atwima Kwanwoma District Assembly,2011,CONSTRUCTION OF 1 NO 12 SEATER AQUA PRIVY TOILET,other/unknown,,Nov-10,,,,Atwima Kwanwoma District Assembly,,2010-11-01,
Atwima Kwanwoma District Assembly,2011,CONSTRUCTION OF 1 NO 12 SEATER AQUA PRIVY TOILET,other/unknown,,Nov-10,,,,Atwima Kwanwoma District Assembly,,2010-11-01,
Atwima Kwanwoma District Assembly,2011,CONSTRUCTION OF 1 NO 12 SEATER AQUA PRIVY TOILET,other/unknown,,Nov-10,,,,Atwima Kwanwoma District Assembly,,2010-11-01,
Atwima Kwanwoma District Assembly,2011,CONSTRUCTION OF 1 NO 3 UNIT CLASSROOM BLOCK WITH OFFICE STAFF STORE COMMON ROOM FOR DA PRIMARY SCHOOL,other/unknown,,Nov-10,,,,Atwima Kwanwoma District Assembly,,2010-11-01,
Atwima Kwanwoma District Assembly,2011,CONSTRUCTION OF 1 NO 6 UNIT CLASSROOM BLOCK WITH OFFICE STAFF AND COMMON ROOM FOR DA PRIMARY SCHOOL,other/unknown,,Nov-10,,,,Atwima Kwanwoma District Assembly,,2010-11-01,
Atwima Kwanwoma District Assembly,2011,CONSTRUCTION OF 1 NO 12 SEATER AQUA PRIVY TOILET,other/unknown,,Nov-10,,,,Atwima Kwanwoma District Assembly,,2010-11-01,
Atwima Kwanwoma District Assembly,2011,CONSTRUCTION OF 1 NO DISTRICT CHIEFS EXECUTIVE BUNGALOW,other/unknown,,Nov-10,,,,Atwima Kwanwoma District Assembly,,2010-11-01,
Atwima Kwanwoma District Assembly,2011,CONSTRUCTION OF 1 NO DISTRICT COORDINATING DIRECTORS BUNGALOW,other/unknown,,Nov-10,,,,Atwima Kwanwoma District Assembly,,2010-11-01,
Atwima Mponua District Assembly,2011,FACILITATE THE PROVISION OF 10 LITRE BINS AT 7 MARKET CENTRES,other/unknown,,,,,,Atwima Mponua District Assembly,,,
Atwima Mponua District Assembly,2011,REHABILITATE THE ADIEMBRA IRRIGATION SYSTEM,other/unknown,,,,,,Atwima Mponua District Assembly,,,
Atwima Mponua District Assembly,2011,PROMOTE 3 CLUSTER IRRIGATION FARMING PRACTICES IN THE DISTRICT,other/unknown,,,,,,Atwima Mponua District Assembly,,,
Atwima Mponua District Assembly,2011,PROVIDE 1000 FARMERS WITH AGRO CHEMICALS AND OTHER INPUTS,other/unknown,,,,,,Atwima Mponua District Assembly,,,
Atwima Mponua District Assembly,2011,FACILITATE THE EXTENSION OF ELECTRICITY TO 30 COMMUNITIES,other/unknown,,,,,,Atwima Mponua District Assembly,,,
Atwima Mponua District Assembly,2011,PROVIDE 250 STREET LIGHTING SYSTEMS TO COMMUNITIES IN THE DISTRICT,other/unknown,,,,,,Atwima Mponua District Assembly,,,
Atwima Mponua District Assembly,2011,DRILL 40 BOREHOLES IN RURAL COMMUNITIES,other/unknown,,,,,,Atwima Mponua District Assembly,,,
Atwima Mponua District Assembly,2011,FACILITATE THE EXTENSION OF SMALL TOWN PIPE WATER SYSTEM TO 2 OTHER COMMUNITIES,other/unknown,,,,,,Atwima Mponua District Assembly,,,
Atwima Mponua District Assembly,2011,CONSTRUCT 5 HAND DUG WELLS IN THE DISTRICT,other/unknown,,,,,,Atwima Mponua District Assembly,,,
Atwima Mponua District Assembly,2011,REHABILITATE 5 BORKEN BOREHOLES IN THE DISTRICT,other/unknown,,,,,,Atwima Mponua District Assembly,,,
Atwima Mponua District Assembly,2011,CONSTRUCT 1 NO 6 SEATER WC TOILET FOR OTAAKROM MARKET,other/unknown,,,,,,Atwima Mponua District Assembly,,,
Atwima Mponua District Assembly,2011,CONSTRUCT 1 NO 12 SEATER KVIP PUBLIC TOILET AT BAYEREBON NO 3,other/unknown,,,,,,Atwima Mponua District Assembly,,,
Atwima Mponua District Assembly,2011,REHABILITATE 2 KVIPS AT NYINAHIN AND MPASATIA,other/unknown,,,,,,Atwima Mponua District Assembly,,,
Atwima Mponua District Assembly,2011,CONSTRUCT 1 NO 20 SEATER WC TOILETS IN THE DISTRICT,other/unknown,,,,,,Atwima Mponua District Assembly,,,
Atwima Mponua District Assembly,2011,EVACUATE 4 REFUSE HEAPS IN SOME SELECTED COMMMUNITIES,other/unknown,,,,,,Atwima Mponua District Assembly,,,
Atwima Mponua District Assembly,2011,REHABILITATE 10KM ANTWIAGYEI NKWANTA ANTWIAGYEI FEEDER ROAD,other/unknown,,,,,,Atwima Mponua District Assembly,,,
Atwima Mponua District Assembly,2011,COMPLETE THE REHABILITATION OF 11KM MANUKROM BAYEREBON FEEDER ROAD,other/unknown,,,,,,Atwima Mponua District Assembly,,,
Atwima Mponua District Assembly,2011,CONSTRUCT 19 NO SPEED RAMPS ON THE MPASATIA BIBIANI HIGHWAYS,other/unknown,,,,,,Atwima Mponua District Assembly,,,
Atwima Mponua District Assembly,2011,CONSTRUCT 2NO FOOTBRIDGES AT NYINAHIN,other/unknown,,,,,,Atwima Mponua District Assembly,,,
Atwima Mponua District Assembly,2011,CONSTRUCT 3 NO CULVERTS AT ENWIREM,other/unknown,,,,,,Atwima Mponua District Assembly,,,
Atwima Mponua District Assembly,2011,CONSTRUCT A COMMUNITY INFORMATION CENTRE CIC AT MPASATIA,other/unknown,,,,,,Atwima Mponua District Assembly,,,
Atwima Mponua District Assembly,2011,COMPLETE THE CONSTRUCTION OF 2 STOREY 12 UNIT CLASSROOM BLOCK FOR NYINAHIN JUNCTION CLUSTER OF SCHOOLS,other/unknown,,,,,,Atwima Mponua District Assembly,,,
Atwima Mponua District Assembly,2011,COMPLETE THE CONSTRUCTION OF 1 NO 6 UNIT CLASSROOM AT AGOGOSO,other/unknown,,,,,,Atwima Mponua District Assembly,,,
Atwima Mponua District Assembly,2011,COMPLETE THE CONSTRUCTION OF 3 STOREY GIRLS DORMITORY BLOCK FOR MPASATIA SHS,other/unknown,,,,,,Atwima Mponua District Assembly,,,
Atwima Mponua District Assembly,2011,COMPLETE THE CONSTRUCTION OF 1 NO 6 UNIT CLASSROOM BLOCK FOR NYINAHIN SHS,other/unknown,,,,,,Atwima Mponua District Assembly,,,
Atwima Mponua District Assembly,2011,CONSTRUCT 1 NO 6 UNIT CLASSROOM BLOCK WITH ANCILLARY FACILITIES AT APENKRO,other/unknown,,,,,,Atwima Mponua District Assembly,,,
Atwima Mponua District Assembly,2011,CONSTRUCT 1 NO 3 UNIT CLASSROOM BLOCK WITH AT SREBOUSO,other/unknown,,,,,,Atwima Mponua District Assembly,,,
Atwima Mponua District Assembly,2011,COMPLETE THE CONSTRUCTION OF 1 NO 4 UNIT TEACHERS QUARTERS AT KUFFOUR CAMP,other/unknown,,,,,,Atwima Mponua District Assembly,,,
Atwima Mponua District Assembly,2011,COMPLETE THE CONSTRUCTION OF 1NO 6 UNIT CLASSROOM BLOCK WITH 6 SEATER KVIP TOILET FACILITY AND TEACHERS QUARTERS FOR AKOMFRE DA PRIMARY,other/unknown,,,,,,Atwima Mponua District Assembly,,,
Atwima Mponua District Assembly,2011,COMPLETE THE CONSTRUCTION OF 1NO 6 UNIT CLASSROOM BLOCK WITH 6 SEATER KVIP TOILET FACILITY FOR ADUMASA DA PRIMARY,other/unknown,,,,,,Atwima Mponua District Assembly,,,
Atwima Mponua District Assembly,2011,COMPLETE THE CONSTRUCTION OF GIRLS DORMITORY BLOCK FOR NYINAHIN SHS,other/unknown,,,,,,Atwima Mponua District Assembly,,,
Atwima Mponua District Assembly,2011,CONSTRUCT 1 NO 6 UNIT CLASSROOM BLOCK EMERGENCY GETFUND PROJECT FOR NYINAHIN SENIOR HIGH SCHOOL NEW SITE,getfund,,,,,,Atwima Mponua District Assembly,,,
Atwima Mponua District Assembly,2011,CONSTRUCT 1 NO 6 UNIT CLASSROOM BLOCK EMERGENCY GETFUND PROJECT FOR MPASATIA SENIOR HIGH SCHOOL,getfund,,,,,,Atwima Mponua District Assembly,,,
Atwima Mponua District Assembly,2011,CONSTRUCT 1 NO 6 UNIT CLASSROOM BLOCK AT ADUPRI,other/unknown,,,,,,Atwima Mponua District Assembly,,,
Atwima Mponua District Assembly,2011,CONSTRUCT 1 NO 6 UNIT CLASSROOM BLOCK AT KWANFIFIN,other/unknown,,,,,,Atwima Mponua District Assembly,,,
Atwima Mponua District Assembly,2011,CONSTRUCT 1 NO 3 UNIT CLASSROOM BLOCK WITH AUXILIARY FACILITIES AT BREDI,other/unknown,,,,,,Atwima Mponua District Assembly,,,
Atwima Mponua District Assembly,2011,CONSTRUCT 1 NO 3 UNIT CLASSROOM BLOCK WITH AUXILIARY FACILITIES AT PAMUROSO,other/unknown,,,,,,Atwima Mponua District Assembly,,,
Atwima Mponua District Assembly,2011,CONSTRUCT 1 NO 6 UNIT CLASSROOM BLOCK WITH AUXILIARY FACILITIES AT APENIMADI,other/unknown,,,,,,Atwima Mponua District Assembly,,,
Atwima Mponua District Assembly,2011,CONSTRUCT 1 NO 6 UNIT CLASSROOM BLOCK WITH AUXILIARY FACILITIES AT PASORO,other/unknown,,,,,,Atwima Mponua District Assembly,,,
Atwima Mponua District Assembly,2011,CONSTRUCT 10 NO KVIPS FOR BASIC SCHOOLS IN THE DISTRICT,other/unknown,,,,,,Atwima Mponua District Assembly,,,
Atwima Mponua District Assembly,2011,FACILITATE THE EXTENSION OF SCHOOL FEEDING PROGRAMME TO INCLUDE 10 NEW BASIC SCHOOLS,other/unknown,,,,,,Atwima Mponua District Assembly,,,
Atwima Mponua District Assembly,2011,"PROVIDE 1,000 PUPILS WITH SCHOOL UNIFORMS",other/unknown,,,,,,Atwima Mponua District Assembly,,,
Atwima Mponua District Assembly,2011,PROVIDE A FULL FUNCTIONAL RURAL CLINIC WITH NURSES QUARTERS AT NAAGOLE,other/unknown,,,,,,Atwima Mponua District Assembly,,,
Atwima Mponua District Assembly,2011,COMPLETE THE CONSTRUCTION OF NURSES QUARTERS AT SRESO TINPOM,other/unknown,,,,,,Atwima Mponua District Assembly,,,
Atwima Mponua District Assembly,2011,COMPLETE THE CREATION OF COMPUTERIZED DATABASE SYSTEM AT NYINAHIN HOSPITAL,other/unknown,,,,,,Atwima Mponua District Assembly,,,
Atwima Mponua District Assembly,2011,CONSTRUCT 60 BED CAPACITY DORMITORY BLOCK AT OTAAKROM ICCES,other/unknown,,,,,,Atwima Mponua District Assembly,,,
Atwima Mponua District Assembly,2011,COMPLETE THE CONSTRUCTION AND FURNISHING OF DISTRICT ASSEMBLY OFFICE COMPLEX,other/unknown,,,,,,Atwima Mponua District Assembly,,,
Atwima Mponua District Assembly,2011,COMPLETE THE CONSTRUCTION AND FURNISHING OF DISTRICT ASSEMBLY HALL COMPLEX,other/unknown,,,,,,Atwima Mponua District Assembly,,,
Atwima Mponua District Assembly,2011,COMPLETE THE CONSTRUCTION AND FURNISHING OF DISTRICT ASSEMBLY GUEST HOUSE,other/unknown,,,,,,Atwima Mponua District Assembly,,,
Atwima Mponua District Assembly,2011,COMPLETED THE CONSTRUCTION AND FURNISH 5 NO SENIOR STAFF SEMI DETACHED BUNGALOWS,other/unknown,,,,,,Atwima Mponua District Assembly,,,
Atwima Mponua District Assembly,2011,COMPLETE THE CONSTRUCTION AND FURNISHING OF POLICE STATION AT TANODUMASI,other/unknown,,,,,,Atwima Mponua District Assembly,,,
Atwima Mponua District Assembly,2011,CONSTRUCT DISTRICT POLICE BARRACKS AT NYINAHIN,other/unknown,,,,,,Atwima Mponua District Assembly,,,
Atwima Nwabiagya District Assembly,2011,,,,,,,,Atwima Nwabiagya District Assembly,,,
Awutu Senya District Assembly,2011,CONSTRUCTION OF 1NO 6 UNIT CLASSROOM WITH OFFICE STORE STAFF ROOM LIBRARY WITH 4 SEATER KVIP LATRINE & 2 UNIT URINAL CONNECTION OF WATER & ELECTRICITY,getfund,,9/20/2010,,,,Awutu Senya District Assembly,,2010-09-20,
Awutu Senya District Assembly,2011,CONSTRUCTION OF 1NO 6 UNIT CLASSROOM BLOCKS WITH OFFICE STORE STAFF ROOM LIBRARY WITH 4 SEATER KVIP LATRINE &,getfund,,9/20/2010,,,,Awutu Senya District Assembly,,2010-09-20,
Awutu Senya District Assembly,2011,1NO 6 UNIT CLASSROOM BLOCK WITH ANCILLARY FACILITIES,getfund,,10/13/2010,,,,Awutu Senya District Assembly,,2010-10-13,
Awutu Senya District Assembly,2011,1NO 6 UNIT CLASSROOM BLOCKS WITH ANCILLARY FACILITIES,getfund,,10/13/2010,,,,Awutu Senya District Assembly,,2010-10-13,
Awutu Senya District Assembly,2011,CONSTRUCTION OF 1NO 6 UNIT CLASSROOM BLOCKS WITH ANCILLARY FACILITIES,getfund,,,,,,Awutu Senya District Assembly,,,
Awutu Senya District Assembly,2011,CONSTRUCTION OF 1NO 6 UNIT CLASSROOM BLOCKS WITH ANCILLARY FACILITIES,getfund,,,,,,Awutu Senya District Assembly,,,
Awutu Senya District Assembly,2011,CONSTRUCTION OF 1 NO 6 UNIT CLASSROOM BLOCKS WITH ANCILLARY FACILITIES,getfund,,7/27/2011,,,,Awutu Senya District Assembly,,2011-07-27,
Awutu Senya District Assembly,2011,CONSTRUCTION OF 1NO 6 UNIT CLASSROOM BLOCKS WITH ANCILLARY FACILITIES,getfund,,,,,,Awutu Senya District Assembly,,,
Awutu Senya District Assembly,2011,CONSTRUCTION OF 1NO 3 UNIT CLASSROOM CONNECTION OF WATER & ELECTRICITY BLOCKS WITH OFFICE STORE STAFF ROOM,getfund,,10/13/2010,,,,Awutu Senya District Assembly,,2010-10-13,
Awutu Senya District Assembly,2011,CONSTRUCTION OF 1NO 6 UNIT CLASSROOM BLOCK,getfund,,10/13/2010,,,,Awutu Senya District Assembly,,2010-10-13,
Awutu Senya District Assembly,2011,CONSTRUCTION OF 1NO 6 UNIT CLASSROOM BLOCK,getfund,,,,,,Awutu Senya District Assembly,,,
Awutu Senya District Assembly,2011,CONSTRUCTION OF 1NO 6 UNIT CLASSROOM BLOCK,getfund,,,,,,Awutu Senya District Assembly,,,
Awutu Senya District Assembly,2011,1NO 6 UNIT CLASSROOM BLOCKS WITH ANCILLARY FACILITIES,getfund,,10/13/2010,,,,Awutu Senya District Assembly,,2010-10-13,
Awutu Senya District Assembly,2011,EXTENSION OF ELECTRICITY TO COMMUNITIES,other gog,,,,,,Awutu Senya District Assembly,,,
Awutu Senya District Assembly,2011,EXTENSION OF ELECTRICITY TO COMMUNITIES,other gog,,,,,,Awutu Senya District Assembly,,,
Awutu Senya District Assembly,2011,SURFACING OF JEIKRODUA OSAEKROM FEEDER ROAD (1.80KM),other donor,,May-11,,,,Awutu Senya District Assembly,,2011-05-01,
Awutu Senya District Assembly,2011,SURFACING OF BAWJIASE AKUFOKRODUA ADAWUKWA FEEDER ROAD (6.40KM),other donor,,May-11,,,,Awutu Senya District Assembly,,2011-05-01,
Awutu Senya District Assembly,2011,SPOT IMPROVEMENT OF MAYENDA OBHODAKABA FEEDER ROAD (3.20KM),other donor,,May-11,,,,Awutu Senya District Assembly,,2011-05-01,
Awutu Senya District Assembly,2011,SPOT IMPROVEMENT OF KWAME KWEI AWEIKU ANAMAN AKUARA FEEDER ROAD 7.70KM,other donor,,May-11,,,,Awutu Senya District Assembly,,2011-05-01,
Awutu Senya District Assembly,2011,CONSTRUCTION OF DORMITORY FOR SENYA SHS,other gog,,,,,,Awutu Senya District Assembly,,,
Awutu Senya District Assembly,2011,CONSTRUCTION OF DORMITORY FOR OBRACHIRE,other/unknown,,,,,,Awutu Senya District Assembly,,,
Awutu Senya District Assembly,2011,CONSTRUCTION 6 UNIT CLASSROOM BLOCK AT SENYA SHS,other/unknown,,,,,,Awutu Senya District Assembly,,,
Awutu Senya District Assembly,2011,EXTENSION OF WATER TO CTIES (INTER-CONNECTIVITY PROJECT),multiple,,,,,,Awutu Senya District Assembly,,,
Awutu Senya District Assembly,2011,CONSTRUCTION OF NINE (9) BOREHOLES,other donor,,,,,,Awutu Senya District Assembly,,,
Awutu Senya District Assembly,2011,CONSTRUCTION OF CULVERTS,other gog,,,,,,Awutu Senya District Assembly,,,
Awutu Senya District Assembly,2011,CONSTRUCTION OF 3 STOREY OFFICE COMPLEX,dacf,,Jan-11,,,,Awutu Senya District Assembly,,2011-01-01,
Awutu Senya District Assembly,2011,RESHAPING OF NEW KASOA NEWTOWN ROADS,dacf,,,,,,Awutu Senya District Assembly,,,
Awutu Senya District Assembly,2011,OPENING OF ACCESS ROADS,other/unknown,,,,,,Awutu Senya District Assembly,,,
Awutu Senya District Assembly,2011,CONSTRUCTION OF CULVERT AT KASOA NEW MARKET,other gog,,,,,,Awutu Senya District Assembly,,,
Awutu Senya District Assembly,2011,CONSTRUCTION OF CHPS COMPOUND,other gog,,,,,,Awutu Senya District Assembly,,,
Awutu Senya District Assembly,2011,CONSTRUCTION OF CHPS COMPOUND,other gog,,,,,,Awutu Senya District Assembly,,,
Awutu Senya District Assembly,2011,CONSTRUCTION OF LIBRARY AND CHILDRENS PARK,other gog,,,,,,Awutu Senya District Assembly,,,
Awutu Senya District Assembly,2011,CONSTRUCTION OF 1NO 6 UNIT CLASSROOM BLOCKS WITH ANCILLARY FACILITIES,other donor,,,,,,Awutu Senya District Assembly,,,
Awutu Senya District Assembly,2011,CONSTRUCTION OF 1NO 6 UNIT CLASSROOM BLOCKS WITH ANCILLARY FACILITIES,other donor,,,,,,Awutu Senya District Assembly,,,
Awutu Senya District Assembly,2011,REHABILITATION OF AWUTU BERAKU OBRACHIRE ROAD,other donor,,,,,,Awutu Senya District Assembly,,,
Awutu Senya District Assembly,2011,REHABILITATION OF OFAAKOR APRA BUDUBURAM RD,other donor,,,,,,Awutu Senya District Assembly,,,
Awutu Senya District Assembly,2011,REHABILITATION OF OFAAKOR KASOA ROAD,other donor,,,,,,Awutu Senya District Assembly,,,
Awutu Senya District Assembly,2011,SMALL TOWN WATER,other donor,,,,,,Awutu Senya District Assembly,,,
Awutu Senya District Assembly,2011,CONSTRUCTION OF 3 NO CULVERTS,ddf,,1/10/2011,,,,Awutu Senya District Assembly,,2011-01-10,
Awutu Senya District Assembly,2011,COMPLETION OF RURAL HEALTH FACILITIES,ddf,,,,,,Awutu Senya District Assembly,,,
Awutu Senya District Assembly,2011,CONSTRUCT AREA COUNCIL OFFICE,ddf,,,,,,Awutu Senya District Assembly,,,
Awutu Senya District Assembly,2011,DESILTING OF OKRUDU,ddf,,,,,,Awutu Senya District Assembly,,,
Awutu Senya District Assembly,2011,CONSTRUCTION OF CULVERTS,other/unknown,,,,,,Awutu Senya District Assembly,,,
Awutu Senya District Assembly,2011,COMPLETE THE CONSTRUCTION RCH,ddf,,,,,,Awutu Senya District Assembly,,,
Awutu Senya District Assembly,2011,ALLOCATION FOR MAINTENANCE OF FACILITIES (REPAIR OF RIPPED-OFF SCHOOLS),ddf,,,,,,Awutu Senya District Assembly,,,
Awutu Senya District Assembly,2011,CONST OF 1 NO 6 UNIT CLASSROOM BLOCK WITH ANCILLARY FACILITIES,other donor,,11/23/2009,,,,Awutu Senya District Assembly,,2009-11-23,
Awutu Senya District Assembly,2011,CONST OF 1NO 6 UNIT CLASSROOM BLOCK WITH ANCILLARY FACILITIES,other donor,,12/2/2009,,,,Awutu Senya District Assembly,,2009-12-02,
Awutu Senya District Assembly,2011,CONST OF 1NO 3 UNIT CLASSROOM BLOCK WITH ANCILLARY FACILITIES,other donor,,12/2/2009,,,,Awutu Senya District Assembly,,2009-12-02,
Awutu Senya District Assembly,2011,CONST OF 1 NO 3 UNIT CLASSROOM BLOCK,other donor,,6/30/1905,,,,Awutu Senya District Assembly,,1905-06-30,
Awutu Senya District Assembly,2011,CONST OF 1 NO 3 UNIT CLASSROOM BLOCK,other donor,,Sep-08,,,,Awutu Senya District Assembly,,2008-09-01,
Awutu Senya District Assembly,2011,CONST OF RURAL CLINIC CHPS COMPOUND,other donor,,2008,,,,Awutu Senya District Assembly,,1905-06-30,
Awutu Senya District Assembly,2011,CONST OF EARLY CHILDHOOD DEVELOPMENT CENTRE,other donor,,11/28/2008,,,,Awutu Senya District Assembly,,2008-11-28,
Awutu Senya District Assembly,2011,CONST OF 20 UNIT MARKET STALLS,other donor,,11/28/2008,,,,Awutu Senya District Assembly,,2008-11-28,
Awutu Senya District Assembly,2011,BACKFILLING AROUND CULVERT AND 100MM APPROACHES ON THE OPEIKUMA ROAD,other donor,,,,,,Awutu Senya District Assembly,,,
Awutu Senya District Assembly,2011,GROUNDWORKS AND PAVEMENT BETWEEN MARKETS SHEDS,other donor,,,,,,Awutu Senya District Assembly,,,
Awutu Senya District Assembly,2011,CONST OF 1 NO 3 UNIT CLASSROOM BLOCK WITH ANCILLARY FACILITIES,other donor,,2008,,,,Awutu Senya District Assembly,,1905-06-30,
Awutu Senya District Assembly,2011,EXTENSION & ERECTION OF STANDPIPES IN COMMUNITIES,igf,,,,,,Awutu Senya District Assembly,,,
Awutu Senya District Assembly,2011,OPENING UP AND RE-SHAPING OF ROADS,multiple,,1/1/2011,,,,Awutu Senya District Assembly,,2011-01-01,
Awutu Senya District Assembly,2011,ELECTRICITY EXTENSION TO 47 NEW COMMUNITIES TO BE EXTENSION TO OTHER PARTS OF THE DISTRICT INCLUDING KASOA BAWJHIASE PAPASE SENYA JEI KRODUA BONTRASE,multiple,,1/1/2011,,,,Awutu Senya District Assembly,,2011-01-01,
Awutu Senya District Assembly,2011,PROVISION OF STREETLIGHTS AT BEACH WITH PROCEEDS FROM PRE MIX ACTIVITIES,other/unknown,,,,,,Awutu Senya District Assembly,,,
Awutu Senya District Assembly,2011,73 ACRE BLOCK FARM FOR MAIZE,other gog,,,,,,Awutu Senya District Assembly,,,
Awutu Senya District Assembly,2011,TEN ACRES OF PLANTING MATERIALS FOR BANKYE HEMAA UNDER THE ROOTS & TUBER DEVELOPMENT PROJECT,other gog,,,,,,Awutu Senya District Assembly,,,
Awutu Senya District Assembly,2011,OFFICE ACOMODATION PAY-RENT ON FACILITIES USED FOR OFFICES,other/unknown,,1/1/2011,,,,Awutu Senya District Assembly,,2011-01-01,
Awutu Senya District Assembly,2011,CONSTRUCTION OF AREA COUNCIL OFFICES,dacf,,1/1/2011,,,,Awutu Senya District Assembly,,2011-01-01,
Awutu Senya District Assembly,2011,MAINTENANCE OF OFFICE EQUIPMENT,dacf,,1/1/2011,,,,Awutu Senya District Assembly,,2011-01-01,
Awutu Senya District Assembly,2011,MIDA & RELIEF INTERNATIONAL (BOREHOLES DRILLING),dacf,,1/1/2011,,,,Awutu Senya District Assembly,,2011-01-01,
Awutu Senya District Assembly,2011,SUPPORT LIQUID WASTE MANAGEMENT,dacf,,1/1/2011,,,,Awutu Senya District Assembly,,2011-01-01,
Awutu Senya District Assembly,2011,SUPPORT SOLID WASTE MANAGEMENT,dacf,,1/1/2011,,,,Awutu Senya District Assembly,,2011-01-01,
Awutu Senya District Assembly,2011,PAY FOR WASTE MANAGEMENT (ZOOMLION),dacf,,1/1/2011,,,,Awutu Senya District Assembly,,2011-01-01,
Bawku Municipal Assembly,2011,,,,,,,,Bawku Municipal Assembly,,,
Bawku West District Assembly,2011,,,,,,,,Bawku West District Assembly,,,
Bekwai Municipal Assembly,2011,,,,,,,,Bekwai Municipal Assembly,,,
Berekum Municipal Assembly,2011,,,,,,,,Berekum Municipal Assembly,,,
Bia District Assembly,2011,MAINTAIN 145 KM  OF TRUCK ROADS,other/unknown,,,,,,Bia West District Assembly,,,
Bia District Assembly,2011,MAINTAIN 110KM OF FEEDER ROADS,other/unknown,,,,,,Bia West District Assembly,,,
Bia District Assembly,2011,REHABILITATE 75KM OF FEEDER ROADS,other/unknown,,,,,,Bia West District Assembly,,,
Bia District Assembly,2011,NO OF FARMERS FIELD SCHOOL FIELD DAYS ORGANIZED FOR INLAND VALLEYS RICE PROJECT BENEFICIARIES,other/unknown,,,,,,Bia West District Assembly,,,
Bia District Assembly,2011,NO OF LOCKABLE STORES CONSTRUCTED,other/unknown,,,,,,Bia West District Assembly,,,
Bia District Assembly,2011,NO OF MECHANIZED BOREHOLES CONSTRUCTED AT DA RESIDENCES,other/unknown,,,,,,Bia West District Assembly,,,
Bia District Assembly,2011,NO OF 12 SEATER AQUA PRIVY WATER CLOSET TOILET CONSTRUCTED,other/unknown,,,,,,Bia West District Assembly,,,
Bia District Assembly,2011,NO OF SLAUGHTER HOUSES AND MEAT SHOPS CONSTRUCTED,other/unknown,,,,,,Bia West District Assembly,,,
Bia District Assembly,2011,NO OF 5 ROOM CHALETS COMPLETED,other/unknown,,,,,,Bia West District Assembly,,,
Bia District Assembly,2011,AVAILABILITY OF CENTRAL ADMINISTRATION BLOCK AND ASSEMBLY HALL COMPLEX,other/unknown,,,,,,Bia West District Assembly,,,
Bia District Assembly,2011,AVAILABILITY OF 6UNIT HALL AND CHAMBER FLAT FOR JUNIOR STAFF,other/unknown,,,,,,Bia West District Assembly,,,
Bia District Assembly,2011,AVAILABILITY OF 1NO 2BEDROOM SEMI DETACHED BUNGALOW FOR DA STAFF AT ESSAM,other/unknown,,,,,,Bia West District Assembly,,,
Bia District Assembly,2011,NO OF REFRESHNER WORKSHOPS ORGANIZED FOR AREA COUNCIL MEMBERS ON THEIR ROLES,other/unknown,,,,,,Bia West District Assembly,,,
Biakoye District Assembly,2011,,,,,,,,Biakoye District Assembly,,,
Bibiani/Ahwiaso/Bekwai District Assembly,2011,,,,,,,,Bibiani/Ahwiaso/Bekwai District Assembly,,,
Birim Central Municipal Assembly,2011,,,,,,,,Birim Central Municipal Assembly,,,
Birim North District Assembly,2011,,,,,,,,Birim North District Assembly,,,
Birim South District Assembly,2011,,,,,,,,Birim South District Assembly,,,
Bole District Assembly,2011,,,,,,,,Bole District Assembly,,,
Bolgatanga Municipal Assembly,2011,,,,,,,,Bolgatanga Municipal Assembly,,,
Bongo District Assembly,2011,CONSTRUCTION OF 3 UNIT CLASSROOM BLOCK WITH ANCILLARY FACILITIES,ddf,,,,,,Bongo District Assembly,,,
Bongo District Assembly,2011,CONSTRUCTION OF 3 UNIT CLASSROOM BLOCK WITH ANCILLARY FACILITIES,ddf,,,,,,Bongo District Assembly,,,
Bongo District Assembly,2011,CONSTRUCTION OF 3 UNIT CLASSROOM BLOCK WITH ANCILLARY FACILITIES,ddf,,,,,,Bongo District Assembly,,,
Bongo District Assembly,2011,CONSTRUCTION OF 2 UNIT KINDERGARTEN BLOCK WITH ANCILLARY FACILITIES,ddf,,,,,,Bongo District Assembly,,,
Bongo District Assembly,2011,CONSTRUCTION OF 2 UNIT KINDERGARTEN BLOCK WITH ANCILLARY FACILITIES,ddf,,,,,,Bongo District Assembly,,,
Bongo District Assembly,2011,CONSTRUCTION OF EMERGENCY 3 UNIT CLASSROOM BLOCK WITH OFFICE AND STORE,ddf,,,,,,Bongo District Assembly,,,
Bongo District Assembly,2011,CONSTRUCTION OF 3 UNIT CLASSROOM BLOCK WITH ANCILLARY FACILITIES,other donor,,,,,,Bongo District Assembly,,,
Bongo District Assembly,2011,CONSTRUCTION OF 3 UNIT CLASSROOM BLOCK WITH ANCILLARY FACILITIES,other donor,,,,,,Bongo District Assembly,,,
Bongo District Assembly,2011,CONSTRUCTION OF POLICE POST WITH ANCILLARY FACILITIES,dacf,,,,,,Bongo District Assembly,,,
Bongo District Assembly,2011,CONSTRUCTION OF POLICE POST WITH ANCILLARY FACILITIES,dacf,,,,,,Bongo District Assembly,,,
Bongo District Assembly,2011,CONSTRUCTION OF A COMMUNITY RADIO STATION,dacf,,,,,,Bongo District Assembly,,,
Bongo District Assembly,2011,ROOFING OF 6 UNIT CLASSROOM BLOCK AND 3 UNIT CLASSROOM BLOCK,dacf,,,,,,Bongo District Assembly,,,
Bongo District Assembly,2011,REHABILITATION OF SOE AREA COUNCIL AND 2 UNIT KINDERGARTEN BLOCK,dacf,,,,,,Bongo District Assembly,,,
Bongo District Assembly,2011,COMPLETION OF 2 UNIT KINDERGARTEN BLOCK WITH OFFICE STORE AND THE COMPLETION OF 3 UNIT CLASSROOM BLOCK WITH OFFICE,dacf,,,,,,Bongo District Assembly,,,
Bongo District Assembly,2011,REHABILITATION OF NAMOO AND GOWRIE AREA COUNCILS,dacf,,,,,,Bongo District Assembly,,,
Bongo District Assembly,2011,REHABILITATION OF 2 UNIT KINDERGARTEN BLOCK WITH ANCILLARY FACILITIES,dacf,,,,,,Bongo District Assembly,,,
Bongo District Assembly,2011,CONSTRUCTION OF 6 UNIT CLASSROOM BLOCK WITH ANCILLARY FACILITIES,getfund,,,,,,Bongo District Assembly,,,
Bongo District Assembly,2011,CONSTRUCTION OF 6 UNIT CLASSROOM BLOCK WITH ANCILLARY FACILITIES,getfund,,,,,,Bongo District Assembly,,,
Bongo District Assembly,2011,CONSTRUCTION OF 6 UNIT CLASSROOM BLOCK WITH ANCILLARY FACILITIES,getfund,,,,,,Bongo District Assembly,,,
Bongo District Assembly,2011,CONSTRUCTION OF 6 UNIT CLASSROOM BLOCK WITH ANCILLARY FACILITIES,getfund,,,,,,Bongo District Assembly,,,
Bongo District Assembly,2011,CONSTRUCTION OF 6 UNIT CLASSROOM BLOCK WITH ANCILLARY FACILITIES,getfund,,,,,,Bongo District Assembly,,,
Bongo District Assembly,2011,CONSTRUCTION OF 6 UNIT CLASSROOM BLOCK WITH ANCILLARY FACILITIES,getfund,,,,,,Bongo District Assembly,,,
Bongo District Assembly,2011,CONSTRUCTION OF 3 UNIT CLASSROOM BLOCK WITH ANCILLARY FACILITIES,getfund,,,,,,Bongo District Assembly,,,
Bongo District Assembly,2011,CONSTRUCTION OF NURSES QUARTERS,ddf,,,,,,Bongo District Assembly,,,
Bongo District Assembly,2011,CONSTRUCTION OF CHPS COMPOUND A PAVILION AND A BOREHOLE,ddf,,,,,,Bongo District Assembly,,,
Bongo District Assembly,2011,CONSTRUCTION OF CHPS COMPOUND A PAVILION AND A BOREHOLE,ddf,,,,,,Bongo District Assembly,,,
Bongo District Assembly,2011,CONSTRUCTION OF NURSES QUARTERS,other donor,,,,,,Bongo District Assembly,,,
Bongo District Assembly,2011,CONSTRUCTION OF NURSES QUARTERS,other donor,,,,,,Bongo District Assembly,,,
Bongo District Assembly,2011,CONSTRUCTION OF A KITCHEN,other donor,,,,,,Bongo District Assembly,,,
Bongo District Assembly,2011,REHABILITATION AND MAINTENANCE WORKS ON MAGISTRATES OFFICE & DCES RESIDENCE,dacf,,,,,,Bongo District Assembly,,,
Bongo District Assembly,2011,MAINTENANCE OF OFFICE EQUIPMENTS,dacf,,,,,,Bongo District Assembly,,,
Bosome Freho District Assembly,2011,CONSTRUCTION OF 1NO. 3-UNIT CLASSROOM BLOCK,multiple,,10/9/2008,,,,Bosome Freho District Assembly,,2008-10-09,
Bosome Freho District Assembly,2011,CONSTRUCTION OF AREA COUNCIL BLOCK,multiple,,10/9/2008,,,,Bosome Freho District Assembly,,2008-10-09,
Bosome Freho District Assembly,2011,CONSTRUCTION OF 12-SEATER AQUA PRIVY TOILET,multiple,,10/9/2008,,,,Bosome Freho District Assembly,,2008-10-09,
Bosome Freho District Assembly,2011,"CONSTRUCTION OF 1NO. 6UNIT CLASSROOM BLOCK WITH OFFICE, STORE AND SANITARY FACILITY FOR D/A PRIMARY",other donor,8/31/2009,9/7/2009,,,,Bosome Freho District Assembly,2009-08-31,2009-09-07,
Bosome Freho District Assembly,2011,CONSTRUCTION OF 1NO 3UNIT CLASSROOM BLOCK,dacf,5/9/2007,,,,,Bosome Freho District Assembly,2007-05-09,,
Bosome Freho District Assembly,2011,"CONSTRUCTION OF 1NO. 3-UNIT DORMITORY BLOCK WITH SANITARY HOUSE, KITCHEN AND DINING HALL AND 1NO. 6UNIT CLASSROOM BLOCK FOR BOSOME FREHO SECONDARY SCHOOL",dacf,7/26/2007,,,,,Bosome Freho District Assembly,2007-07-26,,
Bosome Freho District Assembly,2011,COMPLETION OF CONST. OF ENHANCED RURAL CLINIC,other donor,11/10/2008,11/10/2008,,,,Bosome Freho District Assembly,2008-11-10,2008-11-10,
Bosome Freho District Assembly,2011,REHABILITATION OF RENTED PREMISES FOR DISTRICT EDUCATION OFFICE,dacf,,,,,,Bosome Freho District Assembly,,,
Bosome Freho District Assembly,2011,"CONSTRUCTION OF 1NO. 3-UNIT CLASSROOM BLOCK WITH OFFICE, STORE AND SANITARY FACILITY FOR PRESBY PRIMARY",dacf,10/14/2009,10/20/2009,,,,Bosome Freho District Assembly,2009-10-14,2009-10-20,
Bosome Freho District Assembly,2011,"MECHANIZATION OF 1 NO. BOREHOLE FOR DCD, DPO, DFO, DBA, AND DCE BUNGALOWS",dacf,5/8/2010,,,,,Bosome Freho District Assembly,2010-05-08,,
Bosome Freho District Assembly,2011,"MECHANIZATION OF 1 NO. BOREHOLE FOR DCD, DPO, DFO, DBA, AND DCE BUNGALOWS",dacf,5/8/2010,,,,,Bosome Freho District Assembly,2010-05-08,,
Bosome Freho District Assembly,2011,CONSTRUCTION OF 1 NO. 12 SEATER AQUA PRIVY TOILET,dacf,,,,,,Bosome Freho District Assembly,,,
Bosome Freho District Assembly,2011,CONSTRUCTION OF 1 NO. 12 SEATER AQUA PRIVY TOILET,dacf,,,,,,Bosome Freho District Assembly,,,
Bosome Freho District Assembly,2011,CONSTRUCTION OF 2-STOREY 44-OFFICES ADMINISTRATION BLOCK,dacf,1/21/2011,1/26/2011,,,,Bosome Freho District Assembly,2011-01-21,2011-01-26,
Bosome Freho District Assembly,2011,CONSTRUCTION OF RAIN HARVESTING SYSTEM FOR DISTRICT ASSEM. OFFICES,dacf,,,,,,Bosome Freho District Assembly,,,
Bosome Freho District Assembly,2011,CONSTRUCTION OF 1NO. 6UNIT CLASSROOM BLOCK WITH OFFICE STORE AND LIBRARY,getfund,,,,,,Bosome Freho District Assembly,,,
Bosome Freho District Assembly,2011,CONSTRUCTION OF 1NO. 6UNIT CLASSROOM BLOCK WITH OFFICE STORE AND LIBRARY,getfund,,,,,,Bosome Freho District Assembly,,,
Bosome Freho District Assembly,2011,CONSTRUCTION OF 1NO. 6UNIT CLASSROOM BLOCK WITH OFFICE STORE AND LIBRARY,getfund,7/26/2010,,,,,Bosome Freho District Assembly,2010-07-26,,
Bosome Freho District Assembly,2011,CONSTRUCTION OF 1NO. 6UNIT CLASSROOM BLOCK WITH OFFICE STORE AND LIBRARY,getfund,7/26/2010,,,,,Bosome Freho District Assembly,2010-07-26,,
Bosome Freho District Assembly,2011,CONSTRUCTION OF 2STOREY DORMITORY BLOCK FOR BOSOME SENIOR HIGH TECHNICAL SCHOOL,getfund,11/7/2007,11/7/2007,,,,Bosome Freho District Assembly,2007-11-07,2007-11-07,
Bosome Freho District Assembly,2011,CONSTRUCTION OF 1NO. 3-UNIT CLASSROOM BLOCK WITH OFFICE AND STORE,multiple,5/13/2010,5/21/2010,,,,Bosome Freho District Assembly,2010-05-13,2010-05-21,
Bosome Freho District Assembly,2011,CLADDING OF 2 NO. 3-UNIT CLASSROOM BLOCK WITH OFFICE AND STORE,ddf,10/28/2010,11/15/2010,,,,Bosome Freho District Assembly,2010-10-28,2010-11-15,
Bosome Freho District Assembly,2011,CONSTRUCTION OF 1 NO. 12 SEATER AQUA PRIVY TOILET AND URINAL,ddf,10/25/2010,11/12/2010,,,,Bosome Freho District Assembly,2010-10-25,2010-11-12,
Bosome Freho District Assembly,2011,CONSTRUCTION OF 2 NO. 10- UNIT MARKET STALLS,ddf,10/25/2010,11/12/2010,,,,Bosome Freho District Assembly,2010-10-25,2010-11-12,
Bosome Freho District Assembly,2011,CONSTRUCTION OF 1 NO. 3-UNIT CLASSROOM BLOCK WITH OFFICE AND STORE,ddf,10/28/2010,11/12/2010,,,,Bosome Freho District Assembly,2010-10-28,2010-11-12,
Bosome Freho District Assembly,2011,CONSTRUCTION OF 6-UNIT MARKET STORES AND BANKING HALL,ddf,10/28/2010,11/12/2010,,,,Bosome Freho District Assembly,2010-10-28,2010-11-12,
Bosome Freho District Assembly,2011,CLADDING OF 1 NO. 6-UNIT CLASSROOM BLOCK WITH OFFICE AND STORE,ddf,10/28/2010,11/12/2010,,,,Bosome Freho District Assembly,2010-10-28,2010-11-12,
Bosome Freho District Assembly,2011,REHABILITATION OF ASIWA HEALTH CENTRE,other/unknown,3/30/2011,4/15/2011,,,,Bosome Freho District Assembly,2011-03-30,2011-04-15,
Bosome Freho District Assembly,2011,EXTENSION OF ELECTRICITY,other gog,,,,,,Bosome Freho District Assembly,,,
Bosome Freho District Assembly,2011,PARTIAL RECONSTRUCTION OF BOMFIA JN-ASIWA ROAD (KM 0.0-26.2,other gog,,,,,,Bosome Freho District Assembly,,,
Bosome Freho District Assembly,2011,REHABILITATION OF BEKWAI (AMOAFUL) AMPAH-ASIWA ROAD,other gog,,,,,,Bosome Freho District Assembly,,,
Bosomtwe District Assembly,2011,,,,,,,,Bosomtwe District Assembly,,,
Builsa District Assembly,2011,,,,,,,,Builsa District Assembly,,,
Bunkprugu-Yunyoo District Assembly,2011,,,,,,,,Bunkprugu-Yunyoo District Assembly,,,
Cape Coast Metropolitan Assembly,2011,CONSTRUCTION OF 14 SEATER W/C TOILET FACILITY,other/unknown,,,,,,Cape Coast Metropolitan Assembly,,,
Cape Coast Metropolitan Assembly,2011,CONSTRUCTION OF 20 SEATER W/C TOILET FACILITY,other/unknown,,,,,,Cape Coast Metropolitan Assembly,,,
Cape Coast Metropolitan Assembly,2011,CONSTRUCTION OF 12 SEATER W/C TOILET FACILITY,other/unknown,,,,,,Cape Coast Metropolitan Assembly,,,
Cape Coast Metropolitan Assembly,2011,CONSTRUCTION OF SHED FOR FISHERMEN AT ABOROFO MPOANO NEAR CAPE CAPE COAST CASTLE,other/unknown,,,,,,Cape Coast Metropolitan Assembly,,,
Cape Coast Metropolitan Assembly,2011,RECONSTRUCTION OF OBELISK IN FROM OF CAPE COAST CASTLE,other/unknown,,,,,,Cape Coast Metropolitan Assembly,,,
Cape Coast Metropolitan Assembly,2011,SOD CUTTING FOR THE KOTOKURABA MARKET/PRESIDENTS WORKING VISIT,other/unknown,,,,,,Cape Coast Metropolitan Assembly,,,
Cape Coast Metropolitan Assembly,2011,CONSTRUCTION OF A 10 SEATER W/C TOILET FACILITY,other/unknown,,,,,,Cape Coast Metropolitan Assembly,,,
Cape Coast Metropolitan Assembly,2011,CONSTRUCTION OF A 10 SEATER W/C TOILET FACILITY,other/unknown,,,,,,Cape Coast Metropolitan Assembly,,,
Cape Coast Metropolitan Assembly,2011,CONSTRUCTION OF A 10 SEATER W/C TOILET FACILITY,other/unknown,,,,,,Cape Coast Metropolitan Assembly,,,
Cape Coast Metropolitan Assembly,2011,CONSTRUCTION OF A 10 SEATER W/C TOILET FACILITY,other/unknown,,,,,,Cape Coast Metropolitan Assembly,,,
Cape Coast Metropolitan Assembly,2011,CONSTRUCTION OF A 10 SEATER W/C TOILET FACILITY,other/unknown,,,,,,Cape Coast Metropolitan Assembly,,,
Cape Coast Metropolitan Assembly,2011,CONSTRUCTION OF A 10 SEATER W/C TOILET FACILITY,other/unknown,,,,,,Cape Coast Metropolitan Assembly,,,
Cape Coast Metropolitan Assembly,2011,CONSTRUCTION OF A 10 SEATER W/C TOILET FACILITY,other/unknown,,,,,,Cape Coast Metropolitan Assembly,,,
Cape Coast Metropolitan Assembly,2011,CONSTRUCTION OF A 10 SEATER W/C TOILET FACILITY (CHANGED FROM 10 TO 16-SEATER),other/unknown,,,,,,Cape Coast Metropolitan Assembly,,,
Cape Coast Metropolitan Assembly,2011,CONSTRUCTION OF A 10 SEATER W/C TOILET FACILITY,other/unknown,,,,,,Cape Coast Metropolitan Assembly,,,
Cape Coast Metropolitan Assembly,2011,CONSTRUCTION OF A 10 SEATER W/C TOILET FACILITY,other/unknown,,,,,,Cape Coast Metropolitan Assembly,,,
Cape Coast Metropolitan Assembly,2011,REFURBISHMENT OF SCIENCE RES/ICT CENTRE,other/unknown,,,,,,Cape Coast Metropolitan Assembly,,,
Cape Coast Metropolitan Assembly,2011,ESTABLISHMENT OF SCIENCE RESOURCE CENTER,other/unknown,,,,,,Cape Coast Metropolitan Assembly,,,
Cape Coast Metropolitan Assembly,2011,SETTING UP OF CLINIC FOR THE AGED MINISTRIES BLOCK,other/unknown,,,,,,Cape Coast Metropolitan Assembly,,,
Cape Coast Metropolitan Assembly,2011,CONSTRUCTION OF MATERNITY BLOCK FOR EFUTU CLINIC,other/unknown,,,,,,Cape Coast Metropolitan Assembly,,,
Cape Coast Metropolitan Assembly,2011,CONSTRUCTION OF SHED AT PAPRATAM,other/unknown,,,,,,Cape Coast Metropolitan Assembly,,,
Cape Coast Metropolitan Assembly,2011,CONSTRUCTION OF 10 SEATER W/C TOILET FACILITY AT THE BEACH (LOT 1),other/unknown,,,,,,Cape Coast Metropolitan Assembly,,,
Cape Coast Metropolitan Assembly,2011,CONSTRUCTION OF 10 SEATER W/C TOILET FACILITY AT THE BEACH (LOT 2),other/unknown,,,,,,Cape Coast Metropolitan Assembly,,,
Cape Coast Metropolitan Assembly,2011,CONSTRUCTION OF 10 SEATER W/C TOILET FACILITY AT THE BEACH (LOT 3),other/unknown,,,,,,Cape Coast Metropolitan Assembly,,,
Cape Coast Metropolitan Assembly,2011,CONSTRUCTION OF 10 SEATER W/C FACILITY AT THE BEACH (LOT 4),other/unknown,,,,,,Cape Coast Metropolitan Assembly,,,
Cape Coast Metropolitan Assembly,2011,CONSTRUCTION OF 10 SEATER W/C TOILET FACILITY (LOT 1),other/unknown,,,,,,Cape Coast Metropolitan Assembly,,,
Cape Coast Metropolitan Assembly,2011,CONSTRUCTION OF 10 SEATER W/C TOILET FACILITY (LOT 1),other/unknown,,,,,,Cape Coast Metropolitan Assembly,,,
Cape Coast Metropolitan Assembly,2011,CONSTRUCTION OF 10 SEATER W/C TOILET FACILITY (LOT 1),other/unknown,,,,,,Cape Coast Metropolitan Assembly,,,
Cape Coast Metropolitan Assembly,2011,CONSTRUCTION OF 10 SEATER W/C TOILET FACILITY (LOT 1),other/unknown,,,,,,Cape Coast Metropolitan Assembly,,,
Cape Coast Metropolitan Assembly,2011,CONSTRUCTION OF 10 SEATER W/C TOILET FACILITY (LOT 1),other/unknown,,,,,,Cape Coast Metropolitan Assembly,,,
Central Gonja District Assembly,2011,,,,,,,,Central Gonja District Assembly,,,
Chereponi District Assembly,2011,CONSTRUCTION OF 1NO 3 UNIT CLASSROOM BLOCK OFFICE STORE 4 SEATER KVIP AND URINAL,other/unknown,,6/29/2011,,,,Chereponi District Assembly,,2011-06-29,
Chereponi District Assembly,2011,CONSTRUCTION OF 1NO 3 UNIT CLASSROOM BLOCK OFFICE STORE 4 SEATER KVIP AND URINAL,other/unknown,,6/21/2011,,,,Chereponi District Assembly,,2011-06-21,
Chereponi District Assembly,2011,CONSTRUCTION AND FURNISHING OF 1NO 3 UNIT TEACHERS QUARTERS,other/unknown,,6/23/2011,,,,Chereponi District Assembly,,2011-06-23,
Chereponi District Assembly,2011,CONSTRUCTION OF 1NO CHIPS COMPOUND,other/unknown,,6/14/2011,,,,Chereponi District Assembly,,2011-06-14,
Chereponi District Assembly,2011,CONSTRUCTION OF 1NO 30 UNIT MARKET STALLS,other/unknown,,,,,,Chereponi District Assembly,,,
Chereponi District Assembly,2011,CONSTRUCTION OF 1NO 10 UNIT LOCKABLE STORES,other/unknown,,,,,,Chereponi District Assembly,,,
Chereponi District Assembly,2011,CONSTRUCTION OF 1NO BUTCHERS HOUSE,other/unknown,,,,,,Chereponi District Assembly,,,
Chereponi District Assembly,2011,CONSTRUCTION OF 1NO 8 SEATER KVIP AND SOLID WASTE HOLDING BAY,other/unknown,,,,,,Chereponi District Assembly,,,
Chereponi District Assembly,2011,CONSTRUCTION OF 30 UNIT MARKET STALLS,other/unknown,,,,,,Chereponi District Assembly,,,
Chereponi District Assembly,2011,CONSTRUCTION OF 1NO 3UNIT CLASS BLOCK URINAL AND 4 SEATER KVIP E/P PRIMARY,other/unknown,,,,,,Chereponi District Assembly,,,
Chereponi District Assembly,2011,CONSTRUCTION OF STAFF QUARTERS,other/unknown,,2004,,,,Chereponi District Assembly,,1905-06-26,
Chereponi District Assembly,2011,CONSTRUCTION OF 3 UNIT CLASSROOM OFFICE & STORE 2 URINAL & 4 SEATER KVIP,other/unknown,,2005,,,,Chereponi District Assembly,,1905-06-27,
Chereponi District Assembly,2011,CONSTRUCTION OF 3 UNIT CLASSROOM OFFICE&STORE 2 URINAL & 4 SEATER KVIP,other/unknown,,2006,,,,Chereponi District Assembly,,1905-06-28,
Chereponi District Assembly,2011,CONSTRUCTION OF DINING HALL COMPLEX,other/unknown,,2007,,,,Chereponi District Assembly,,1905-06-29,
Chereponi District Assembly,2011,CONSTRUCTION OF COMMUNITY LIBRARY &SUPPLY OF FURNISHING MATERIALS,other/unknown,,2008,,,,Chereponi District Assembly,,1905-06-30,
Chereponi District Assembly,2011,CONSTRUCTION OF 3 UNIT CLASSROOM OFFICE&STORE 2 URINAL & 4 SEATER KVIP,other/unknown,,2008,,,,Chereponi District Assembly,,1905-06-30,
Chereponi District Assembly,2011,CONSTRUCTION OF 1NO 3UNIT CLASSROOM BLOCK,other/unknown,,9/6/2010,,,,Chereponi District Assembly,,2010-09-06,
Chereponi District Assembly,2011,CONSTRUCTION OF 1 NO 3UNIT CLASSROOM BLOCK,other/unknown,,9/6/2010,,,,Chereponi District Assembly,,2010-09-06,
Chereponi District Assembly,2011,CONSTRUCTION OF 1NO 6UNIT CLASSROOM BLOCK,other/unknown,,9/6/2010,,,,Chereponi District Assembly,,2010-09-06,
Chereponi District Assembly,2011,REHABILITATION OF DOCTORS BUNGALOW,other/unknown,,9/6/2010,,,,Chereponi District Assembly,,2010-09-06,
Chereponi District Assembly,2011,REHABILITATION OF MATERNITY WARD,other/unknown,,9/6/2010,,,,Chereponi District Assembly,,2010-09-06,
Chereponi District Assembly,2011,REHABILITATION OF NURSES ANNEX,other/unknown,,9/6/2010,,,,Chereponi District Assembly,,2010-09-06,
Chereponi District Assembly,2011,CONSTRUCTION OF KITCHEN FACILITY,other/unknown,,9/6/2010,,,,Chereponi District Assembly,,2010-09-06,
Chereponi District Assembly,2011,CONSTRUCTION OF KITCHEN FACILITY,other/unknown,,9/6/2010,,,,Chereponi District Assembly,,2010-09-06,
Chereponi District Assembly,2011,CONSTRUCTION OF KITCHEN FACILITY,other/unknown,,9/6/2010,,,,Chereponi District Assembly,,2010-09-06,
Chereponi District Assembly,2011,CONSTRUCTION OF 1NO COMMUNITY INFORMATION CENTRE,other gog,,10/11/2008,,,,Chereponi District Assembly,,2008-10-11,
Chereponi District Assembly,2011,CONSTRUCTION OF 1NO 3 UNIT CLASSROOM BLOCK WITH 4 SEATER KVIP OFFICE STORE AND URINAL,other donor,,7/24/2009,,,,Chereponi District Assembly,,2009-07-24,
Chereponi District Assembly,2011,REHABILITATION AND FURNISHING OF GES DIRECTORS QUARTER,dacf,,1/12/2010,,,,Chereponi District Assembly,,2010-01-12,
Chereponi District Assembly,2011,CONSTRUCTION AND FURNISHING OF 3 BEDROOM TEACHERS QUARTERS AT,other donor,,12/16/2009,,,,Chereponi District Assembly,,2009-12-16,
Chereponi District Assembly,2011,REHABILITATION OF 1NO 3UNIT CLASSROOM BLOCK AT CHESTEC,other donor,,2/1/2010,,,,Chereponi District Assembly,,2010-02-01,
Chereponi District Assembly,2011,REHABILITATION OF 1NO 3UNIT CLASSROOM BLOCK AT CENTRAL PRIMARY,other donor,,2/1/2010,,,,Chereponi District Assembly,,2010-02-01,
Chereponi District Assembly,2011,REHABILITATION OF 1NO 3UNIT CLASSROOM BLOCK,other donor,,2/1/2010,,,,Chereponi District Assembly,,2010-02-01,
Chereponi District Assembly,2011,CONSTRUCTION OF 1NO ADMINISTRATION BLOCK FOR CHEREPONI SENIOR HIGH TECHNICAL,other donor,,7/24/2009,,,,Chereponi District Assembly,,2009-07-24,
Chereponi District Assembly,2011,CONSTRUCTION OF 1NO 4 UNIT TEACHERS ACCOMMODATION,other/unknown,,7/24/2009,,,,Chereponi District Assembly,,2009-07-24,
Chereponi District Assembly,2011,REHABILITATION OF 1NO 3UNIT CLASSROOM BLOCK AT CHESTEC,other/unknown,,5/13/2011,,,,Chereponi District Assembly,,2011-05-13,
Chereponi District Assembly,2011,REHABILITATION OF 1NO 3UNIT CLASSROOM BLOCK AT CENTRAL PRIMARY,other/unknown,,5/13/2011,,,,Chereponi District Assembly,,2011-05-13,
Chereponi District Assembly,2011,REHABILITATION OF 1NO 3UNIT CLASSROOM BLOCK,other/unknown,,5/13/2011,,,,Chereponi District Assembly,,2011-05-13,
Chereponi District Assembly,2011,FREE SCHOOL UNIFORMS,other/unknown,,5/17/2010,,,,Chereponi District Assembly,,2010-05-17,
Chereponi District Assembly,2011,CONSTRUCTION OF 1NO 3 UNIT CLASSROOM BLOCK OFFICE STORE 4 SEATER KVIP AND URINAL,other/unknown,,5/14/2010,,,,Chereponi District Assembly,,2010-05-14,
Chereponi District Assembly,2011,REHABILITATION AND FURNISHING OF DISTRICT DIRECTOR OF EDUCATION QUARTERS,dacf,,1/28/2010,,,,Chereponi District Assembly,,2010-01-28,
Chereponi District Assembly,2011,CONSTRUCTION OF 1NO 3UNIT CLASSROOM BLOCK OFFICE STORE URINAL AND KVIP,other/unknown,,9/13/2010,,,,Chereponi District Assembly,,2010-09-13,
Chereponi District Assembly,2011,CONSTRUCTION OF 1NO 3UNIT CLASSROOM BLOCK OFFICE STORE URINAL AND KVIP,other/unknown,,8/27/2010,,,,Chereponi District Assembly,,2010-08-27,
Chereponi District Assembly,2011,CONSTRUCTION OF 1NO 3UNIT CLASSROOM BLOCK OFFICE STORE URINAL AND KVIP,other/unknown,,8/27/2010,,,,Chereponi District Assembly,,2010-08-27,
Chereponi District Assembly,2011,CONSTRUCTION OF 1NO 3UNIT CLASSROOM BLOCK OFFICE STORE URINAL AND KVIP,other/unknown,,8/27/2010,,,,Chereponi District Assembly,,2010-08-27,
Chereponi District Assembly,2011,CONSTRUCTION OF 1NO 6UNIT CLASSROOM BLOCK OFFICE STORE URINAL AND KVIP,getfund,,7/12/2010,,,,Chereponi District Assembly,,2010-07-12,
Chereponi District Assembly,2011,CONSTRUCTION OF 1NO 6UNIT CLASSROOM BLOCK OFFICE STORE URINAL AND KVIP,getfund,,7/12/2010,,,,Chereponi District Assembly,,2010-07-12,
Chereponi District Assembly,2011,CONSTRUCTION OF 1NO 6UNIT CLASSROOM BLOCK OFFICE STORE URINAL AND KVIP,getfund,,7/12/2010,,,,Chereponi District Assembly,,2010-07-12,
Chereponi District Assembly,2011,CONSTRUCTION OF 1NO 3UNIT CLASSROOM BLOCK,ddf,,12/30/2010,,,,Chereponi District Assembly,,2010-12-30,
Chereponi District Assembly,2011,CONSTRUCTION OF 1NO 3UNIT CLASSROOM BLOCK,ddf,,12/30/2010,,,,Chereponi District Assembly,,2010-12-30,
Chereponi District Assembly,2011,CONSTRUCTION OF 1NO 6UNIT CLASSROOM BLOCK,ddf,,12/30/2010,,,,Chereponi District Assembly,,2010-12-30,
Chereponi District Assembly,2011,CONSTRUCTION OF KITCHEN AND DINNING,ddf,,12/30/2010,,,,Chereponi District Assembly,,2010-12-30,
Chereponi District Assembly,2011,CONSTRUCTION OF KITCHEN AND DINNING,ddf,,12/30/2010,,,,Chereponi District Assembly,,2010-12-30,
Chereponi District Assembly,2011,CONSTRUCTION OF KITCHEN AND DINNING,ddf,,12/30/2010,,,,Chereponi District Assembly,,2010-12-30,
Chereponi District Assembly,2011,CONSTRUCTION OF 1NO 6UNIT CLASSROOM BLOCK OFFICE STORE URINAL AND KVIP,getfund,,7/12/2010,,,,Chereponi District Assembly,,2010-07-12,
Chereponi District Assembly,2011,PROVIDE SCHOOL UNIFORM FOR PUPILS,other/unknown,,2/1/2011,,,,Chereponi District Assembly,,2011-02-01,
Chereponi District Assembly,2011,REHABILITATION OF 1NO 3UNIT CLASSROOM BLOCK OFFICE AND STORE,other/unknown,,2/1/2011,,,,Chereponi District Assembly,,2011-02-01,
Chereponi District Assembly,2011,REHABILITATION OF 1NO 2UNIT CLASSROOM BLOCK,other/unknown,,2/1/2011,,,,Chereponi District Assembly,,2011-02-01,
Chereponi District Assembly,2011,PROVISION OF GENDER FRIENDLY URINALS IN TEN 10 BASIC SCHOOLS,other/unknown,,4/1/2011,,,,Chereponi District Assembly,,2011-04-01,
Chereponi District Assembly,2011,PROVIDE POLY/WATER TANK IN THIRTEEN BASIC SCHOOLS,other/unknown,,4/1/2011,,,,Chereponi District Assembly,,2011-04-01,
Chereponi District Assembly,2011,REHABILITATION OF 1NO 3UNIT CLASSROOM BLOCK 4NO STORES AND OFFICE,other/unknown,,2/1/2011,,,,Chereponi District Assembly,,2011-02-01,
Chereponi District Assembly,2011,REHABILITATION OF 1NO 3UNIT CLASSROOM BLOCK STORES AND OFFICE,other/unknown,,1/4/2011,,,,Chereponi District Assembly,,2011-01-04,
Chereponi District Assembly,2011,REHABILITATION OF 1NO 3UNIT CLASSROOM BLOCK STORES AND OFFICE,other/unknown,,4/1/2011,,,,Chereponi District Assembly,,2011-04-01,
Chereponi District Assembly,2011,CONSTRUCTION OF DORMITORY BLOCK AT SENIOR HIGH SCHOOL,getfund,,3/31/2011,,,,Chereponi District Assembly,,2011-03-31,
Chereponi District Assembly,2011,CONSTRUCTION OF 1NO 3 UNIT CLASSROOM BLOCK OFFICE STORE 4 SEATER KVIP AND URINAL,other/unknown,,7/10/2011,,,,Chereponi District Assembly,,2011-07-10,
Chereponi District Assembly,2011,CONSTRUCTION OF 1NO 3 UNIT CLASSROOM BLOCK OFFICE STORE 4 SEATER KVIP AND URINAL,other/unknown,,7/10/2011,,,,Chereponi District Assembly,,2011-07-10,
Chereponi District Assembly,2011,CONSTRUCTION AND FURNISHING OF 1NO 3 UNIT TEACHERS QUARTERS,other/unknown,,7/10/2011,,,,Chereponi District Assembly,,2011-07-10,
Chereponi District Assembly,2011,REHABILITATION OF 1NO 3UNIT CLASSROOM BLOCK,other/unknown,,5/13/2011,,,,Chereponi District Assembly,,2011-05-13,
Chereponi District Assembly,2011,REHABILITATION OF 1NO 3UNIT CLASSROOM BLOCK,other/unknown,,5/13/2011,,,,Chereponi District Assembly,,2011-05-13,
Chereponi District Assembly,2011,REHABILITATION OF 1NO 3UNIT CLASSROOM BLOCK EP JHS,other/unknown,,5/13/2011,,,,Chereponi District Assembly,,2011-05-13,
Chereponi District Assembly,2011,CONSTRUCTION OF 1NO 6UNIT CLASSROOM BLOCK WITH ANCILLIARY FACILITIES,getfund,,8/25/2011,,,,Chereponi District Assembly,,2011-08-25,
Chereponi District Assembly,2011,CONSTRUCTION OF 1NO 6UNIT CLASSROOM BLOCK WITH ANCILLIARY FACILITIES,getfund,,8/25/2011,,,,Chereponi District Assembly,,2011-08-25,
Chereponi District Assembly,2011,CONSTRUCTION OF 1NO 3UNIT CLASSROOM BLOCK WITH ANCILLIARY FACILITIES,getfund,,8/25/2011,,,,Chereponi District Assembly,,2011-08-25,
Chereponi District Assembly,2011,REHABILITATION OF CHPS ZONE,dacf,,1/12/2010,,,,Chereponi District Assembly,,2010-01-12,
Chereponi District Assembly,2011,CONSTRUCTION AND UPGRADING OF CHEREPONI POLY CLINIC,other/unknown,,,,,,Chereponi District Assembly,,,
Chereponi District Assembly,2011,REHABILITATION AND FURNISHING OF STOREY BUILDING FOR MEDICAL OFFICER,ddf,,12/30/2010,,,,Chereponi District Assembly,,2010-12-30,
Chereponi District Assembly,2011,REHABILITATION OF MATERNITY WARD,ddf,,12/23/2010,,,,Chereponi District Assembly,,2010-12-23,
Chereponi District Assembly,2011,REHABILITATION OF NURSES ANNEXES QUARTERS,ddf,,12/16/2010,,,,Chereponi District Assembly,,2010-12-16,
Chereponi District Assembly,2011,AMBULANCE TO CHEREPONI POLYCLINIC,other/unknown,,1/12/2010,,,,Chereponi District Assembly,,2010-01-12,
Chereponi District Assembly,2011,CONSTRUCTION AND FURNISHING OF CHIPS COMPOUND,other/unknown,,7/10/2011,,,,Chereponi District Assembly,,2011-07-10,
Chereponi District Assembly,2011,CONSTRUCTION OF A WALKWAY TO LINK POLYCLINIC,other/unknown,,10/10/2011,,,,Chereponi District Assembly,,2011-10-10,
Chereponi District Assembly,2011,REHABILITATION OF 2NO OVERHEAD TANKS,dacf,,3/24/2010,,,,Chereponi District Assembly,,2010-03-24,
Chereponi District Assembly,2011,EXTENSION OF WATER TO STAFF RESIDENTIAL AREA,dacf,,1/15/2010,,,,Chereponi District Assembly,,2010-01-15,
Chereponi District Assembly,2011,REHABILITATION OF CHEREPONI WATER SYSTEM,ddf,,1/12/2010,,,,Chereponi District Assembly,,2010-01-12,
Chereponi District Assembly,2011,CONSTRUCTION OF 1NO 8 SEATER KVIP AND SOLID WASTE HOLDING BAY,other/unknown,,8/6/2010,,,,Chereponi District Assembly,,2010-08-06,
Chereponi District Assembly,2011,REHABILITATION OF 2NO HIGH LEVEL TANKS,dacf,,4/6/2010,,,,Chereponi District Assembly,,2010-04-06,
Chereponi District Assembly,2011,CONSTRUCTION OF 10NO BOREHOLES,other/unknown,,,,,,Chereponi District Assembly,,,
Chereponi District Assembly,2011,DRILLING AND CONSTRUCTION OF SMALL TOWN WATER SYSTEM,other/unknown,,10/14/2011,,,,Chereponi District Assembly,,2011-10-14,
Chereponi District Assembly,2011,DRILLING AND CONSTRUCTION OF 7NO BOREHOLES AT 7SCHOOLS,other/unknown,,,,,,Chereponi District Assembly,,,
Chereponi District Assembly,2011,DISLODGEMENT OF SLAPS FOR 5NO TOILETS FACILITY,dacf,,6/21/2011,,,,Chereponi District Assembly,,2011-06-21,
Chereponi District Assembly,2011,REHABILITATION AND CONSTRUCTION OF SLAPS FOR 5NO TOILET FACILITIES,dacf,,6/25/2011,,,,Chereponi District Assembly,,2011-06-25,
Chereponi District Assembly,2011,BLOCK FARMS,other/unknown,,,,,,Chereponi District Assembly,,,
Chereponi District Assembly,2011,CONST OF VETERINAYR CLINIC,dacf,,3/24/2010,,,,Chereponi District Assembly,,2010-03-24,
Chereponi District Assembly,2011,CONSTRUCTION OF DAM,other/unknown,,,,,,Chereponi District Assembly,,,
Chereponi District Assembly,2011,AFFORESTATION/TREE PLANTING,other/unknown,,4/15/2010,,,,Chereponi District Assembly,,2010-04-15,
Chereponi District Assembly,2011,CONST OF 1NO DUG OUT AT WENCHIKI UNDER LIVESTOCK IMPROVEMENT,other/unknown,,2/2/2010,,,,Chereponi District Assembly,,2010-02-02,
Chereponi District Assembly,2011,REHABILITATION AND EXPANSION OF DUG OUT,other/unknown,,12/23/2010,,,,Chereponi District Assembly,,2010-12-23,
Chereponi District Assembly,2011,CONSTRUCTION OF CORN MILL,other/unknown,,,,,,Chereponi District Assembly,,,
Chereponi District Assembly,2011,CONSTRUCTION OF GRAIN BANKS,other/unknown,,,,,,Chereponi District Assembly,,,
Chereponi District Assembly,2011,CONSTRUCTION OF ADMINISTRATION BLOCK ANNEX B,dacf,,1/6/2010,,,,Chereponi District Assembly,,2010-01-06,
Chereponi District Assembly,2011,CONSTRUCTION OF 20NO STALLS,dacf,,1/12/2010,,,,Chereponi District Assembly,,2010-01-12,
Chereponi District Assembly,2011,CONSTRUCTION OF 1NO 3 UNIT BEDROOM BUNGALOW,dacf,,1/18/2010,,,,Chereponi District Assembly,,2010-01-18,
Chereponi District Assembly,2011,CONSTRUCTION OF POLICE POST,dacf,,1/12/2010,,,,Chereponi District Assembly,,2010-01-12,
Chereponi District Assembly,2011,FIXING OF TILES TO NEWLY CONSTRUCTED STRUCTURE,dacf,,1/6/2010,,,,Chereponi District Assembly,,2010-01-06,
Chereponi District Assembly,2011,CONSTRUCTION OF INTERNAL ROAD NETWORK AT NEW STAFF RESIDENTIAL AREA,dacf,,1/5/2010,,,,Chereponi District Assembly,,2010-01-05,
Chereponi District Assembly,2011,CONSTRUCTION OF 1NO 30UNITS MARKET STALLS,other/unknown,,8/6/2010,,,,Chereponi District Assembly,,2010-08-06,
Chereponi District Assembly,2011,CONSTRUCTION OF 1NO 30UNITS MARKET STALLS,other/unknown,,8/6/2010,,,,Chereponi District Assembly,,2010-08-06,
Chereponi District Assembly,2011,CONSTRUCTION OF 1NO 30UNITS MARKET STORES,other/unknown,,8/6/2010,,,,Chereponi District Assembly,,2010-08-06,
Chereponi District Assembly,2011,ESTABLISHMENT OF FM STATION,other/unknown,,10/10/2011,,,,Chereponi District Assembly,,2011-10-10,
Chereponi District Assembly,2011,RECONSTRUCTION OF 1NO 30UNITS MARKET STALLS,other/unknown,,11/17/2011,,,,Chereponi District Assembly,,2011-11-17,
Chereponi District Assembly,2011,SPOT IMPROVEMENT OF FEEDER ROADS (6.00KM),other/unknown,,7/20/2009,,,,Chereponi District Assembly,,2009-07-20,
Chereponi District Assembly,2011,CONSTRUCTION OF 6NO ACCESS CULVERT,dacf,,,,,,Chereponi District Assembly,,,
Chereponi District Assembly,2011,SPOT IMPROVEMENT OF ROADS (19.10KM),other/unknown,,7/20/2009,,,,Chereponi District Assembly,,2009-07-20,
Chereponi District Assembly,2011,SPOT IMPROVEMENT OF KUDANI BAKANU ROAD,other/unknown,,11/1/2010,,,,Chereponi District Assembly,,2010-11-01,
Chereponi District Assembly,2011,SPOT IMPROVEMENT OF OMATI-TOASALA KUMBOLI,other/unknown,,11/1/2010,,,,Chereponi District Assembly,,2010-11-01,
Chereponi District Assembly,2011,CONSTRUCTION OF INTERNAL ROADS AND KIRBS AT RESIDENTIAL AREA,dacf,,1/5/2010,,,,Chereponi District Assembly,,2010-01-05,
Chereponi District Assembly,2011,SPOT IMPROVEMENT OF NATURI TO TINCHANGO ROAD(8.9KM),dacf,,8/30/2010,,,,Chereponi District Assembly,,2010-08-30,
Chereponi District Assembly,2011,CONSTRUCTION AND GRAVELLING,other/unknown,,,,,,Chereponi District Assembly,,,
Chereponi District Assembly,2011,CONSTRUCTION AND GRAVELLING,other/unknown,,,,,,Chereponi District Assembly,,,
Chereponi District Assembly,2011,CONSTRUCTION AND GRAVELLING,other/unknown,,,,,,Chereponi District Assembly,,,
Chereponi District Assembly,2011,CONSTRUCTION OF CULVERT AND GRAVELLING,other/unknown,,,,,,Chereponi District Assembly,,,
Chereponi District Assembly,2011,BITUMINOUS SURFACING OF THE TOWNSHIP ROAD,other/unknown,,12/31/2010,,,,Chereponi District Assembly,,2010-12-31,
Chereponi District Assembly,2011,CONNECTING OF NANSONI TO THE NATIONAL ELECTRICITY GRID,other/unknown,,8/1/2009,,,,Chereponi District Assembly,,2009-08-01,
Chereponi District Assembly,2011,CONNECTING OF WENCHIKI TO THE NATIONAL ELECTRICITY GRID,other/unknown,,8/1/2009,,,,Chereponi District Assembly,,2009-08-01,
Chereponi District Assembly,2011,CONNECTING OF KUDANI TO THE NATIONAL ELECTRICITY GRID,other/unknown,,8/1/2009,,,,Chereponi District Assembly,,2009-08-01,
Chereponi District Assembly,2011,CONNECTING OF WONJUGA TO THE NATIONAL ELECTRICITY GRID,other/unknown,,8/1/2009,,,,Chereponi District Assembly,,2009-08-01,
Chereponi District Assembly,2011,CONNECTING OF BANJANI TO THE NATIONAL ELECTRICITY GRID,other/unknown,,8/1/2009,,,,Chereponi District Assembly,,2009-08-01,
Chereponi District Assembly,2011,CONNECTING OF MASAWOSE TO THE NATIONAL ELECTRICITY GRID,other/unknown,,8/1/2009,,,,Chereponi District Assembly,,2009-08-01,
Chereponi District Assembly,2011,CONNECTING OF GARINKUKA TO THE NATIONAL ELECTRICITY GRID,other/unknown,,8/1/2009,,,,Chereponi District Assembly,,2009-08-01,
Chereponi District Assembly,2011,CONNECTING OF ANDO NYAMANU TOSALA TO THE NATIONAL ELECTRICITY GRID,other/unknown,,8/1/2009,,,,Chereponi District Assembly,,2009-08-01,
Chereponi District Assembly,2011,REHABILITATION OF PERSONS WITH DISABILITIES RESOURCE CENTRE,dacf,,1/18/2010,,,,Chereponi District Assembly,,2010-01-18,
Chereponi District Assembly,2011,REHABILITATION OF 1NO 3UNIT RAINSTORM AFFECTED SCHOOL,ddf,,5/15/2011,,,,Chereponi District Assembly,,2011-05-15,
Chereponi District Assembly,2011,REHABILITATION OF 1NO 3UNIT RAINSTORM AFFECTED SCHOOL,ddf,,5/18/2011,,,,Chereponi District Assembly,,2011-05-18,
Chereponi District Assembly,2011,RE-ROOFING OF RAINSTORM AFFECTED OFFICE,ddf,,6/10/2011,,,,Chereponi District Assembly,,2011-06-10,
Chereponi District Assembly,2011,REHABILITATION OF RAINSTORM AFFECTED 6UNIT CLASSROOM BLOCK,ddf,,6/10/2011,,,,Chereponi District Assembly,,2011-06-10,
Chereponi District Assembly,2011,REHABILITATION OF DORMITORY BLOCK,ddf,,6/10/2011,,,,Chereponi District Assembly,,2011-06-10,
Chereponi District Assembly,2011,REHABILITATION OF DISABILITY CENTRE,ddf,,,,,,Chereponi District Assembly,,,
Chereponi District Assembly,2011,REHABILITATION OF SPORTS MASTERS BUNGALOW,ddf,,,,,,Chereponi District Assembly,,,
Chereponi District Assembly,2011,REHABILITATION OF SPORTS MASTERS BUNGALOW,ddf,,,,,,Chereponi District Assembly,,,
Dangme East District Assembly,2011,CONSTRUCTION OF 1NO. 12-SEATER WATER CLOSET TOILET,ddf,2/24/2011,,,,,Ada East District Assembly,2011-02-24,,
Dangme East District Assembly,2011,WATER DISTRIBUTION EXTENSION TO 8 COMMUNITIES,other donor,3/8/2011,,,,,Ada East District Assembly,2011-03-08,,
Dangme East District Assembly,2011,WATER DISTRIBUTION EXTENSION TO 9 COMMUNITIES,other donor,3/8/2011,,,,,Ada East District Assembly,2011-03-08,,
Dangme East District Assembly,2011,WATER DISTRIBUTION EXTENSION TO 8 COMMUNITIES,other donor,3/8/2011,,,,,Ada East District Assembly,2011-03-08,,
Dangme East District Assembly,2011,CONSTRUCTION OF 1NO. 2-STOREY TOURIST CENTRE (PHASE 1:GROUND FLOOR),ddf,2/24/2011,,,,,Ada East District Assembly,2011-02-24,,
Dangme East District Assembly,2011,CONSTRUCTION OF 1NO. 6-UNIT CLASSROOM BLOCK & 2NO.3-UNIT KVIP TOILET,getfund,9/24/2010,,,,,Ada East District Assembly,2010-09-24,,
Dangme East District Assembly,2011,CONSTRUCTION OF 1NO. 6-UNIT CLASSROOM BLOCK & 2NO.3-UNIT KVIP TOILET,getfund,9/24/2010,,,,,Ada East District Assembly,2010-09-24,,
Dangme East District Assembly,2011,"CONSTRUCTION OF 1NO. 6-UNIT CLASSROOM BLOCK, OFFICE & STORE",multiple,2/24/2011,,,,,Ada East District Assembly,2011-02-24,,
Dangme East District Assembly,2011,CONSTRUCTION OF 1NO. 2-STOREY. 12-UNIT CLASSROOM WITH ANCILLARY FACILITIES,getfund,10/12/2010,,,,,Ada East District Assembly,2010-10-12,,
Dangme East District Assembly,2011,CONSTRUCTION OF 1NO. 6-UNIT CLASSROOM BLOCK WITH ANCILLARY FACILITIES,getfund,10/12/2010,,,,,Ada East District Assembly,2010-10-12,,
Dangme East District Assembly,2011,CONSTRUCTION OF 1NO. 6-UNIT CLASSROOM BLOCK WITH ANCILLARY FACILITIES,getfund,10/12/2010,,,,,Ada East District Assembly,2010-10-12,,
Dangme East District Assembly,2011,CONSTRUCTION OF 1NO. 6-UNIT CLASSROOM BLOCK WITH ANCILLARY FACILITIES,getfund,10/12/2010,,,,,Ada East District Assembly,2010-10-12,,
Dangme East District Assembly,2011,CONSTRUCTION OF 1NO. 6-UNIT CLASSROOM BLOCK WITH ANCILLARY FACILITIES,getfund,10/12/2010,,,,,Ada East District Assembly,2010-10-12,,
Dangme East District Assembly,2011,CONSTRUCTION OF 1NO. 6-UNIT CLASSROOM BLOCK WITH ANCILLARY FACILITIES,getfund,10/19/2010,,,,,Ada East District Assembly,2010-10-19,,
Dangme East District Assembly,2011,"RE-CONSTRUCTION OF 1NO. 6-UNIT CLASSROOM BLOCK, OFFICE & STORE",igf,5/30/2011,,,,,Ada East District Assembly,2011-05-30,,
Dangme East District Assembly,2011,"COMPLETION OF 1NO. 2-STOREY, 6-UNIT CLASSROOM BLOCK WITH ANCILLARY FACILITIES",getfund,6/6/2011,,,,,Ada East District Assembly,2011-06-06,,
Dangme East District Assembly,2011,CONSTRUCTION OF 1NO. 8-SEATER WATER CLOSET TOILET,dacf,8/25/2011,,,,,Ada East District Assembly,2011-08-25,,
Dangme East District Assembly,2011,DISLODGING & DISINFECTION OF 15NO. PUBLIC & INSTITUTIONAL TOILET,dacf,8/1/2011,,,,,Ada East District Assembly,2011-08-01,,
Dangme East District Assembly,2011,CONSTRUCTION OF 1NO. 8-SEATER WATER CLOSET TOILET,dacf,7/20/2011,,,,,Ada East District Assembly,2011-07-20,,
Dangme East District Assembly,2011,"CONSTRUCTION OF ADDITIONAL OFFICE, SLIDING WINDOWS, FLOOR TILES & COURT PLATFORM",dacf,7/20/2011,,,,,Ada East District Assembly,2011-07-20,,
Dangme East District Assembly,2011,CONNECTION OF STREETLIGHT AT SOME SELECTED AREAS,dacf,7/20/2011,,,,,Ada East District Assembly,2011-07-20,,
Dangme East District Assembly,2011,CONSTRUCTION OF 1NO. 8-SEATER WATER CLOSET TOILET,ddf,2/24/2011,,,,,Ada East District Assembly,2011-02-24,,
Dangme East District Assembly,2011,CONSTRUCTION OF 1NO. 20-SEATER WATER CLOSET TOILET & ANCILLARY FACILITIES,other donor,11/4/2011,,,,,Ada East District Assembly,2011-11-04,,
Dangme East District Assembly,2011,"CONSTRUCTION OF 1NO. 10-SEATER WATER CLOSET TOILET, BUYBACK CENTER & ANCILLARY FACILITIES",other donor,11/4/2011,,,,,Ada East District Assembly,2011-11-04,,
Dangme East District Assembly,2011,CONST. OF BIG-ADA AREA COUNCIL,dacf,7/12/2010,,,,,Ada East District Assembly,2010-07-12,,
Dangme East District Assembly,2011,CONNECTION OF STREETLIGHT FOR GHANA NATIONAL FIRE SERVICE,dacf,5/10/2011,,,,,Ada East District Assembly,2011-05-10,,
Dangme East District Assembly,2011,REPAIR & CONNECTION OF STREETLIGHT AT SOME SELECTED AREAS,dacf,5/10/2011,,,,,Ada East District Assembly,2011-05-10,,
Dangme East District Assembly,2011,"REHABILITATION OF 1NO. 3-UNIT CLSRM. BLK, OFFICE & STORE",dacf,2/24/2011,,,,,Ada East District Assembly,2011-02-24,,
Dangme East District Assembly,2011,"REHABILITATION OF 1NO. 6-UNIT CLSRM. BLK, OFFICE & STORE",dacf,2/24/2011,,,,,Ada East District Assembly,2011-02-24,,
Dangme East District Assembly,2011,"REHABILITATION OF 1NO. 6-UNIT CLSRM. BLK, OFFICE & STORE",dacf,7/19/2011,,,,,Ada East District Assembly,2011-07-19,,
Dangme East District Assembly,2011,"ROOFING OF 1NO. 6-UNIT CLSRM BLK, OFFICE & STORE",dacf,7/20/2011,,,,,Ada East District Assembly,2011-07-20,,
Dangme East District Assembly,2011,RENOVATION WORKS,other/unknown,9/27/2011,,,,,Ada East District Assembly,2011-09-27,,
Dangme East District Assembly,2011,CONSTRUCTION OF 1NO. 3-UNIT CLSRM BLK WITH ANCILLARY FACILITIES,getfund,10/28/2011,,,,,Ada East District Assembly,2011-10-28,,
Dangme East District Assembly,2011,CONSTRUCTION OF 1NO. 6-UNIT CLSRM BLK WITH ANCILLARY FACILITIES,getfund,10/28/2011,,,,,Ada East District Assembly,2011-10-28,,
Dangme East District Assembly,2011,CONSTRUCTION OF 1NO. 6-UNIT CLSRM BLK WITH ANCILLARY FACILITIES,getfund,10/28/2011,,,,,Ada East District Assembly,2011-10-28,,
Dangme East District Assembly,2011,ROUTINE MAINTENANCE WORK ON KASSEH-TAMATOKU FEEDER ROAD (8.5KM),road fund,9/29/2011,,,,,Ada East District Assembly,2011-09-29,,
Dangme East District Assembly,2011,ROUTINE MAINTENANCE WORK ON CEASARKOPE-KAJA FEEDER ROAD (6.90KM),road fund,9/29/2011,,,,,Ada East District Assembly,2011-09-29,,
Dangme East District Assembly,2011,ROUTINE MAINTENANCE WORK ON TODJE-ENGLEESI KENYA FEEDER ROAD (7.00KM),road fund,9/29/2011,,,,,Ada East District Assembly,2011-09-29,,
Dangme East District Assembly,2011,ROUTINE MAINTENANCE WORK ON HWAKPO-ENGLEESI FEEDER ROAD (14.00KM),road fund,9/29/2011,,,,,Ada East District Assembly,2011-09-29,,
Dangme East District Assembly,2011,ROUTINE MAINTENANCE WORK ON KONI-WONYE FEEDER ROAD (8.40KM),road fund,9/29/2011,,,,,Ada East District Assembly,2011-09-29,,
Dangme East District Assembly,2011,ROUTINE MAINTENANCE WORK ON PANYA JN.- PANYA FEEDER ROAD (7.10KM),road fund,9/29/2011,,,,,Ada East District Assembly,2011-09-29,,
Dangme East District Assembly,2011,SPOT IMPROVEMENT OF NENE ADA- AKAKPO JN. FEEDER ROAD (0.60KM),other donor,9/27/2011,,,,,Ada East District Assembly,2011-09-27,,
Dangme East District Assembly,2011,SPOT IMPROVEMENT OF LUHUESE-OBANI-KWALAKPOYOM FEEDER ROAD (0.60KM),other donor,9/27/2011,,,,,Ada East District Assembly,2011-09-27,,
Dangme West District Assembly,2011,CONSTRUCTION OF 1 NO 6 UNIT CLASSROOM BLOCK STAFF COMMON ROOM LIBRARY OFFICE AND STORE FOR AGOMEDA D A BASIC SCHOOL,dacf,,1/26/2010,,,,Shai-Osudoku District Assembly,,2010-01-26,
Dangme West District Assembly,2011,CONSTRUCTION OF 1 NO 6 UNIT CLASSROOM BLOCK WITH STAFF COMMON ROOM LIBRARY OFFICE AND STORE FOR MOBOLE D A BASIC SCHOOL,getfund,,11/5/2010,,,,Shai-Osudoku District Assembly,,2010-11-05,
Dangme West District Assembly,2011,CONSTRUCTION OF 1 NO 6 UNIT CLASSROOM BLOCK WITH STAFF COMMON ROOM LIBRARY OFFICE AND STORE FOR SOMEH D A BASIC SCHOOL,getfund,,11/5/2010,,,,Shai-Osudoku District Assembly,,2010-11-05,
Dangme West District Assembly,2011,CONSTRUCTION OF 1 NO 6 UNIT CLASSROOM BLOCK WITH STAFF COMMON ROOM LIBRARY OFFICE AND STORE FOR DAWA PRESBY BASIC SCHOOL,getfund,,11/5/2010,,,,Shai-Osudoku District Assembly,,2010-11-05,
Dangme West District Assembly,2011,CONSTRUCTION OF 1 NO 6 UNIT CLASSROOM BLOCK WITH STAFF COMMON ROOM LIBRARY OFFICE AND STORE FOR KPATSIREMIDOR D A BASIC SCHOOL,getfund,,11/5/2010,,,,Shai-Osudoku District Assembly,,2010-11-05,
Dangme West District Assembly,2011,CONSTRUCTION OF 1 NO 3 UNIT CLASSROOM BLOCK FOR KPOHE D A BASIC SCHOOL,dacf,,11/22/2010,,,,Shai-Osudoku District Assembly,,2010-11-22,
Dangme West District Assembly,2011,CONSTRUCTION OF 1 NO 6 UNIT CLASSROOM BLOCK WITH STAFF COMMON ROOM LIBRARY OFFICE AND STORE FOR PRAMPRAM PRESBY BASIC SCHOOL,dacf,,8/23/2010,,,,Shai-Osudoku District Assembly,,2010-08-23,
Dangme West District Assembly,2011,CONSTRUCTION OF 1 NO 6 UNIT CLASSROOM BLOCK WITH STAFF COMMON ROOM LIBRARY OFFICE AND STORE FOR PRAMPRAM D A BASIC SCHOOL,dacf,,8/23/2010,,,,Shai-Osudoku District Assembly,,2010-08-23,
Dangme West District Assembly,2011,CONSTRUCTION OF 1 NO 3 UNIT CLASSROOM BLOCK FOR MATAHEKO D A BASIC SCHOOL,dacf,,11/22/2010,,,,Shai-Osudoku District Assembly,,2010-11-22,
Dangme West District Assembly,2011,CONSTRUCTION OF 1 NO 3 UNIT CLASSROOM BLOCK FOR LAKPLEKU D A BASIC SCHOOL,dacf,,8/11/2010,,,,Shai-Osudoku District Assembly,,2010-08-11,
Dangme West District Assembly,2011,SPOT IMPROVEMENT OF AREA A ADAKOPE FEEDER ROAD 14.00KM,other donor,,11/22/2010,,,,Shai-Osudoku District Assembly,,2010-11-22,
Dangme West District Assembly,2011,SPOT IMPROVEMENT OF ADJARKOPE DEDUKOPE FEEDER ROAD 7 60KM,other donor,,11/22/2010,,,,Shai-Osudoku District Assembly,,2010-11-22,
Dangme West District Assembly,2011,SPOT IMPROVEMENT OF AREA DEDUKOPE TOKPO FEEDER ROAD 6.40 KM,other donor,,11/22/2010,,,,Shai-Osudoku District Assembly,,2010-11-22,
Dangme West District Assembly,2011,CONSTRUCTION OF 1 NO 8 SEATER KVIP LATRINE ASEBI COMMUNITY,dacf,,11/22/2010,,,,Shai-Osudoku District Assembly,,2010-11-22,
Dangme West District Assembly,2011,CONSTRUCTION OF 1NO 3 UNIT STAFF BUNGALOW FOR DWDA STAFF,dacf,,11/22/2010,,,,Shai-Osudoku District Assembly,,2010-11-22,
Dangme West District Assembly,2011,CONSTRUCTION OF 1NO 3 UNIT STAFF BUNGALOW FOR DISTRICT HEALTH DIRECTOR,dacf,,11/22/2010,,,,Shai-Osudoku District Assembly,,2010-11-22,
Dangme West District Assembly,2011,CONSTRUCTION OF WALL AT DODOWA PRESBY SCHOOL,dacf,,8/18/2010,,,,Shai-Osudoku District Assembly,,2010-08-18,
Dangme West District Assembly,2011,LANDSCAPING WORKS AT DODOWA PRESBY SCHOOL,dacf,,8/18/2010,,,,Shai-Osudoku District Assembly,,2010-08-18,
Dangme West District Assembly,2011,CONSTRUCTION OF 1 NO 6 UNIT CLASSROOM BLOCK WITH STAFF COMMON ROOM OFFICE AND STORE FOR LOTSUBUER D A BASIC SCHOOL,other donor,,8/19/2010,,,,Shai-Osudoku District Assembly,,2010-08-19,
Dangme West District Assembly,2011,HYDROGEOLOGICAL INVESTIGATIONS SUPERVISION OF 15 BOREHOLES DRILLING,other donor,,18-Aug,,,,Shai-Osudoku District Assembly,,2010-08-18,
Dangme West District Assembly,2011,HYDROGEOLOGICAL INVESTIGATIONS SUPERVISION OF 10 BOREHOLES DRILLING,other donor,,8/18/2010,,,,Shai-Osudoku District Assembly,,2010-08-18,
Dangme West District Assembly,2011,DRILLING OF 15 BOREHOLES,other donor,,2/21/2011,,,,Shai-Osudoku District Assembly,,2011-02-21,
Dangme West District Assembly,2011,DRILLING OF 10 BOREHOLES,other donor,,2/21/2011,,,,Shai-Osudoku District Assembly,,2011-02-21,
Dangme West District Assembly,2011,CONSTRUCTION OF 7 NO IRON AND MANGANESE REMOVAL PLANTS,other donor,,2/21/2011,,,,Shai-Osudoku District Assembly,,2011-02-21,
Dangme West District Assembly,2011,EXTENSION SERVICES IN COMMUNITY MOBILIZATION FOR 15 BOREHOLES DRILLING,other donor,,2/21/2011,,,,Shai-Osudoku District Assembly,,2011-02-21,
Dangme West District Assembly,2011,EXTENSION SERVICES IN COMMUNITY MOBILIZATION FOR 10 BOREHOLES DRILLING,other donor,,2/21/2011,,,,Shai-Osudoku District Assembly,,2011-02-21,
Dangme West District Assembly,2011,CONSTRUCTION OF PIPE EXTENSION WORKS UNDER THE 3 DISTRICTS WATER PROJECT IN TSOPOLI AREA,other donor,,2/21/2011,,,,Shai-Osudoku District Assembly,,2011-02-21,
Dangme West District Assembly,2011,CONSTRUCTION OF PIPE EXTENSION WORKS UNDER THE 3 DISTRICTS WATER PROJECT IN DAWA HUAPA AREA,other donor,,2/21/2011,,,,Shai-Osudoku District Assembly,,2011-02-21,
Dangme West District Assembly,2011,CONSTRUCTION OF PIPE EXTENSION WORKS UNDER THE 3 DISTRICTS WATER PROJECT IN AGORTOR AREA,other donor,,2/21/2011,,,,Shai-Osudoku District Assembly,,2011-02-21,
Dangme West District Assembly,2011,CONSTRUCTION OF 1 NO 3 UNIT CLASSROOM BLOCK OFFICE STORE FOR NYAPIENYA D A BASIC SCHOOL,ddf,,10/17/2010,,,,Shai-Osudoku District Assembly,,2010-10-17,
Dangme West District Assembly,2011,CONSTRUCTION OF 1 NO 3 UNIT CLASSROOM BLOCK OFFICE STORE FOR DODOWA PRESBY BASIC SCHOOL,ddf,,10/17/2011,,,,Shai-Osudoku District Assembly,,2011-10-17,
Dangme West District Assembly,2011,CONSTRUCTION OF 1 NO CHPS COMPOUND AT MOBOLE COMMUNITY,ddf,,10/14/2011,,,,Shai-Osudoku District Assembly,,2011-10-14,
Dangme West District Assembly,2011,CONSTRUCTION OF 1 NO CHPS COMPOUND AT AYERTEPA COMMUNITY,ddf,,10/14/2011,,,,Shai-Osudoku District Assembly,,2011-10-14,
Dormaa East District Assembly,2011,CONSTRUCTION OF DISTRICT CHIEF EXECUTIVES BUNGALOW AT WAMFIE,dacf,9/6/2010,,,,,Dormaa East District Assembly,2010-09-06,,
Dormaa East District Assembly,2011,CONSTRUCTION OF DISTRICT CO COORDINATING DIRECTORS BUNGALOW AT WAMFIE,dacf,9/6/2010,,,,,Dormaa East District Assembly,2010-09-06,,
Dormaa East District Assembly,2011,CONSTRUCTION OF 1 NO BEDROOM SEMI DETACHED BUNGALOW AT WAMFIE,dacf,9/6/2010,,,,,Dormaa East District Assembly,2010-09-06,,
Dormaa East District Assembly,2011,CONSTRUCTION OF 1 NO BEDROOM SEMI DETACHED BUNGALOW AT WAMFIE,dacf,9/6/2010,,,,,Dormaa East District Assembly,2010-09-06,,
Dormaa East District Assembly,2011,CONSTRUCTION OF 6 UNIT CLASSROOM BLOCK WITH ANCILLARY FACILITIES AT WAMFIE RC PRIMARY SCHOOL WAMFIE,getfund,9/6/2010,,,,,Dormaa East District Assembly,2010-09-06,,
Dormaa East District Assembly,2011,CONSTRUCTION OF 6 UNIT CLASSROOM BLOCK WITH ANCILLARY FACILITIES AT DORMAA AKWAMU PRESBY PRIMARY DORMAA AKWAMU,getfund,9/2/2010,,,,,Dormaa East District Assembly,2010-09-02,,
Dormaa East District Assembly,2011,CLEARING AND RE SHARING OF NSESERESU FOSUKROM FEEDER ROADS,dacf,2/1/2011,,,,,Dormaa East District Assembly,2011-02-01,,
Dormaa East District Assembly,2011,CONSTRUCTION OF BOX CULVERT WAMFIE,dacf,1/27/2011,,,,,Dormaa East District Assembly,2011-01-27,,
Dormaa East District Assembly,2011,CONSTRUCTION OF 1 NO 12 SEATER W/C TOILET AT WAMFIE,ddf,1/26/2011,,,,,Dormaa East District Assembly,2011-01-26,,
Dormaa East District Assembly,2011,CONSTRUCTION OF 1 NO 3 UNIT CLASSROOM BLOCK FOR SDA JHS AT WAMFIE,ddf,4/21/2011,,,,,Dormaa East District Assembly,2011-04-21,,
Dormaa East District Assembly,2011,CONSTRUCTION OF 1 NO 3 UNIT CLASSROOM BLOCK FOR METHODIST K/G SCHOOL AT WAMFIE,dacf,4/26/2011,,,,,Dormaa East District Assembly,2011-04-26,,
Dormaa East District Assembly,2011,CONSTRUCTION OF 1 NO 3 UNIT CLASSROOM BLOCK FOR R/C JHS WAMANAFO,dacf,4/26/2011,,,,,Dormaa East District Assembly,2011-04-26,,
Dormaa East District Assembly,2011,CONSTRUCTION OF CHP COMPOUND AT PREPRA SHED,dacf,4/26/2011,,,,,Dormaa East District Assembly,2011-04-26,,
Dormaa East District Assembly,2011,CONSTRUCTION OF 1 NO 3 UNIT CLASSROOM BLOCK FOR D/A JHS WAMFIE,dacf,4/26/2011,,,,,Dormaa East District Assembly,2011-04-26,,
Dormaa East District Assembly,2011,CONSTRUCTION OF 1 NO 10 MARKET STORES AND OPEN SHED WAMANAFO,dacf,4/26/2011,,,,,Dormaa East District Assembly,2011-04-26,,
Dormaa East District Assembly,2011,CONSTRUCTION OF 1 NO 3 UNIT CLASSROOM BLOCK FOR ISLAMIC JHS WAMFIE,dacf,4/26/2011,,,,,Dormaa East District Assembly,2011-04-26,,
Dormaa East District Assembly,2011,CONSTRUCTION OF 1 NO 4 SEATER KVIP A WAMFIE RC PRIMARY SCHOOL CEILING DRAINS AND APRONS PAVEMENTS ADDITIONAL WORKS GETFUND,getfund,5/12/2011,,,,,Dormaa East District Assembly,2011-05-12,,
Dormaa East District Assembly,2011,CONSTRUCTION OF NO 4 SEATER KVIP A D AKAWAMU PRESBY PRIMARY SCHOOL CEILING DRAINS AND APRONS PAVEMENTS (ADDITIONAL WORKS GETFUND),getfund,5/12/2011,,,,,Dormaa East District Assembly,2011-05-12,,
Dormaa East District Assembly,2011,CONSTRUCTION OF FENCE WALL AND SECURITY POST AT THE NEWLY CONSTRUCTED DCES RESIDENCY,dacf,8/9/2011,,,,,Dormaa East District Assembly,2011-08-09,,
Dormaa East District Assembly,2011,CONSTRUCTION OF 1 NO 6 UNIT CLASSROOM BLOCK FOR KOBEDI,getfund,8/1/2011,,,,,Dormaa East District Assembly,2011-08-01,,
Dormaa Municipal Assembly,2011,CONSTRUCTION OF 2 NO 6 UNIT CLASSROOM BLOCKS WITH AN OFFICE AND STORE,other donor,,,,,,Dormaa Municipal Assembly,,,
Dormaa Municipal Assembly,2011,CONSTRUCTION OF 1 NO 20 SEATER AQUA PRIMARY TOILETS,dacf,,,,,,Dormaa Municipal Assembly,,,
Dormaa Municipal Assembly,2011,CONSTRUCTION OF 37 NO BOREHOLES,other donor,,,,,,Dormaa Municipal Assembly,,,
Dormaa Municipal Assembly,2011,CONSTRUCTION OF FENCE WALL AND SECURITY POST AT MCES RESIDENCE,dacf,,,,,,Dormaa Municipal Assembly,,,
Dormaa Municipal Assembly,2011,EXTENSIONS OF MCES RESIDENCY,dacf,,,,,,Dormaa Municipal Assembly,,,
Dormaa Municipal Assembly,2011,RESHAPING OF FEEDER ROADS,other/unknown,,,,,,Dormaa Municipal Assembly,,,
Dormaa Municipal Assembly,2011,PROVISION OF MEDICAL EQUIPMENT FOR THE OPERATION OF CHPS COMPOUNDS,dacf,,,,,,Dormaa Municipal Assembly,,,
Dormaa Municipal Assembly,2011,CONSTRUCTION OF 3NO 3 UNIT CLASSROOM BLOCKS WITH AN OFFICE AND STORE,multiple,,,,,,Dormaa Municipal Assembly,,,
Dormaa Municipal Assembly,2011,COMPLETION OF NEW ASSEMBLE BLOCKS,dacf,,,,,,Dormaa Municipal Assembly,,,
Dormaa Municipal Assembly,2011,CONSTRUCTION OF 1NO OPEN SHED AND SCREEDING OF GROUND,ddf,,,,,,Dormaa Municipal Assembly,,,
Dormaa Municipal Assembly,2011,CONSTRUCTION OF 500 SEATER SPECTATORS STAND,dacf,,,,,,Dormaa Municipal Assembly,,,
Dormaa Municipal Assembly,2011,MECHANISATION OF 2 NO BOREHOLES,ddf,,,,,,Dormaa Municipal Assembly,,,
Dormaa Municipal Assembly,2011,COMPLETION OF PWD ADMINISTRATION BLOCK FOR DORMAA MUNICIPAL EDUCATIN DIRECTORATE,dacf,,,,,,Dormaa Municipal Assembly,,,
Dormaa Municipal Assembly,2011,REHABILITATION OF 1NO 4 UNIT CLASSROOM BLOCK,dacf,,,,,,Dormaa Municipal Assembly,,,
Dormaa Municipal Assembly,2011,CONSTRUCTION OF 1 NO CLINIC WITH ANCILLARY FACILITIES,dacf,,,,,,Dormaa Municipal Assembly,,,
East Akim Municipal Assembly,2011,CONSTRUCTION OF DINING HALL FOR THE SCHOOL FOR THE DEAF,getfund,,11/6/2006,,,,East Akim Municipal Assembly,,2006-11-06,
East Akim Municipal Assembly,2011,CONSTRUCTION OF 1 NO 6 UNIT CLASSROOM BLOCK FOR M/A PRIMARY SCHOOL,getfund,,1/15/2010,,,,East Akim Municipal Assembly,,2010-01-15,
East Akim Municipal Assembly,2011,CONSTRUCTION OF ASSEMBLY OFFICE ANNEX,dacf,,4/4/2006,,,,East Akim Municipal Assembly,,2006-04-04,
East Akim Municipal Assembly,2011,CONSTRUCTION OF 1 NO 6 UNIT  CLASSROOM BLOCK FOR SOKODE JUASO M/A PRIMARY SCHOOL,getfund,,12/18/2008,,,,East Akim Municipal Assembly,,2008-12-18,
East Akim Municipal Assembly,2011,CONSTRUCTION OF 1 NO 6 UNIT CLASSROOM BLOCK FOR ADADIENTEM RC PRIMARY SCHOOL,getfund,,11/4/2008,,,,East Akim Municipal Assembly,,2008-11-04,
East Akim Municipal Assembly,2011,CONSTRUCTION OF 1 NO 6 UNIT CLASSROOM BLOCK FOR ADONKWANTA PRESBY PRIMARY SCHOOL,getfund,,8/6/2008,,,,East Akim Municipal Assembly,,2008-08-06,
East Akim Municipal Assembly,2011,CONSTRUCTION OF 1 NO 6 UNIT CLASSROOM BLOCK FOR KUKURANTUMI METHODIST PRIMARY,getfund,,9/23/2009,,,,East Akim Municipal Assembly,,2009-09-23,
East Akim Municipal Assembly,2011,CONSTRUCTION J B DANQUAH MEMORIAL LIBRARY,dacf,,4/16/2004,,,,East Akim Municipal Assembly,,2004-04-16,
East Akim Municipal Assembly,2011,CONSTRUCTION OF COURT BUILDING,dacf,,4/29/2004,,,,East Akim Municipal Assembly,,2004-04-29,
East Akim Municipal Assembly,2011,CONSTRUCTION OF 1 NO 6 UNIT CLASSROOM BLOCK FOR ASIKAM PRESBY PRIMARY,getfund,,10/4/2010,,,,East Akim Municipal Assembly,,2010-10-04,
East Akim Municipal Assembly,2011,CONSTRUCTION OF 1 NO 6 UNIT CLASSROOM BLOCK AT ISLAMIC PRIMARY SCHOOL,getfund,,10/4/2010,,,,East Akim Municipal Assembly,,2010-10-04,
East Akim Municipal Assembly,2011,CONSTRUCTION OF 1 NO 6 UNIT CLASSROOM BLOCK AT APEDWA PRIMARY SCHOOL,getfund,,8/27/2010,,,,East Akim Municipal Assembly,,2010-08-27,
East Akim Municipal Assembly,2011,CONSTRUCTION OF 1 NO 6 UNIT CLASSROOM BLOCK FOR TONTRO M/A PRIMARY,getfund,,1/6/2011,,,,East Akim Municipal Assembly,,2011-01-06,
East Akim Municipal Assembly,2011,CONSTRUCTION OF 1 NO UNIT CLASSROOM BLOCK AT ADUKROM M/A PRIMARY,getfund,,8/27/2010,,,,East Akim Municipal Assembly,,2010-08-27,
East Akim Municipal Assembly,2011,CONSTRUCTION OF 1NO ZONAL COUNCIL OFFICE FOR OSIEM,dacf,,9/16/2010,,,,East Akim Municipal Assembly,,2010-09-16,
East Akim Municipal Assembly,2011,CONSTRUCTION OF 1 NO ZONAL COUNCIL FOR ASAFO,dacf,,8/31/2010,,,,East Akim Municipal Assembly,,2010-08-31,
East Akim Municipal Assembly,2011,CONSTRUCTION OF 1 NO ZONAL COUNCIL OFFICE FOR APEDWA,dacf,,8/31/2010,,,,East Akim Municipal Assembly,,2010-08-31,
East Akim Municipal Assembly,2011,CONSTRUCTION OF 4 UNIT CLASSROOM BLOCK FOR OLD TAFO PRESBY J H S,dacf,,7/19/2010,,,,East Akim Municipal Assembly,,2010-07-19,
East Akim Municipal Assembly,2011,RENOVATION OF (CLINIC) ANHWEBENG COMMUNITY,other/unknown,,9/24/2010,,,,East Akim Municipal Assembly,,2010-09-24,
East Akim Municipal Assembly,2011,CONSTRUCTION OF 1 NO SLAUGHTER HOUSE AT NEW TAFO,dacf,,9/26/2010,,,,East Akim Municipal Assembly,,2010-09-26,
East Akim Municipal Assembly,2011,CONSTRUCTION OF 1 NO 10 SEATER W/C  TOILET AT KIBI NEW TOWN,dacf,,1/5/2011,,,,East Akim Municipal Assembly,,2011-01-05,
East Akim Municipal Assembly,2011,CONSTRUCTION OF 1 NO 10 SEATER TOILET AT OSIEM,dacf,,11/10/2010,,,,East Akim Municipal Assembly,,2010-11-10,
East Akim Municipal Assembly,2011,CONSTRUCTION OF 1 N O 4 UNIT SSQ (A) AT KIBI,dacf,,7/19/2010,,,,East Akim Municipal Assembly,,2010-07-19,
East Akim Municipal Assembly,2011,CONSTRUCTION OF 1 NO 4 UNIT SSQ B AT KIBI,dacf,,7/13/2010,,,,East Akim Municipal Assembly,,2010-07-13,
East Akim Municipal Assembly,2011,CONSTRUCTION OF 1 NO FIRE STATION,dacf,,8/3/2011,,,,East Akim Municipal Assembly,,2011-08-03,
East Akim Municipal Assembly,2011,CONSTRUCTION OF 1 NO 10 SEATER AQUA PRIVY TOILET ZONGO,ddf,,12/23/2010,,,,East Akim Municipal Assembly,,2010-12-23,
East Akim Municipal Assembly,2011,CONSTRUCTION OF CHPS CENTER AT POTROASE,ddf,,1/5/2011,,,,East Akim Municipal Assembly,,2011-01-05,
East Akim Municipal Assembly,2011,CONSTRUCTION OF 1 NO 4 UNIT TEACHER QUARTER,ddf,,12/23/2010,,,,East Akim Municipal Assembly,,2010-12-23,
East Akim Municipal Assembly,2011,CONSTRUCTION OF 1 NO 3 UNIT CLASSROOM BLOCK FOR NEW TAFO M/A J H S,ddf,,1/6/2011,,,,East Akim Municipal Assembly,,2011-01-06,
East Akim Municipal Assembly,2011,BITUMINOUS SURFACING OF KUKURANTUMI AKIM ASAFO (0.0-7.0KM),other gog,,10/19/2011,,,,East Akim Municipal Assembly,,2011-10-19,
East Akim Municipal Assembly,2011,BITUMINOUS SURFACING OF KUKURANTUMI AKIM ASAFO (7.0-13.4KM),other gog,,10/3/2011,,,,East Akim Municipal Assembly,,2011-10-03,
East Akim Municipal Assembly,2011,CONSTRUCTION OF 1 NO STEEL BRIDGE ON AKIM ADUKROM AGYAPOMAA,other donor,,5/26/2010,,,,East Akim Municipal Assembly,,2010-05-26,
East Akim Municipal Assembly,2011,CONSTRUCTION OF 1 NO STEEL BRIDGE ON AKIM ODUMASE BREPRO,other donor,,6/15/2010,,,,East Akim Municipal Assembly,,2010-06-15,
East Akim Municipal Assembly,2011,BITUMEN SURFACING OF ASIAAKWA TOWN ROADS,other/unknown,,,,,,East Akim Municipal Assembly,,,
East Akim Municipal Assembly,2011,RESHAPING OF NEW TAFO TONTRO & OTHER (19.04KM),road fund,,,,,,East Akim Municipal Assembly,,,
East Akim Municipal Assembly,2011,RESHAPING OF ASAFO AGYAPOMA AND OTHERS (18.40KM),road fund,,,,,,East Akim Municipal Assembly,,,
East Akim Municipal Assembly,2011,RESHAPING OF BOMPOSO NO2 TWAKAN AND OTHERS (18.80KM),road fund,,,,,,East Akim Municipal Assembly,,,
East Akim Municipal Assembly,2011,CONSTRUCTION 1 NO 6 UNIT CLASSROOM BLOCK AT APAPAM METHODIST PRIMARY SCHOOL,getfund,,9/19/2011,,,,East Akim Municipal Assembly,,2011-09-19,
East Akim Municipal Assembly,2011,CONSTRUCTION 1 NO 6 UNIT CLASSROOM BLOCK AT POTUOASE PRESBY PRIMARY SCHOOL,getfund,,9/19/2011,,,,East Akim Municipal Assembly,,2011-09-19,
East Akim Municipal Assembly,2011,CONSTRUCTION 1 NO 6 UNIT CLASSROOM BLOCK AT ASAFO ISLAMIC PRIMARY SCHOOL,getfund,,12/8/2011,,,,East Akim Municipal Assembly,,2011-12-08,
East Akim Municipal Assembly,2011,CONSTRUCTION 1 NO 6 UNIT CLASSROOM BLOCK AT ASAFO ISLAMIC PRIMARY SCHOOL,getfund,,11/15/2011,,,,East Akim Municipal Assembly,,2011-11-15,
East Akim Municipal Assembly,2011,CONSTRUCTION OF KITCHEN DINNING FOR ASAFO SHS,getfund,,11/15/2011,,,,East Akim Municipal Assembly,,2011-11-15,
East Akim Municipal Assembly,2011,CONSTRUCTION OF 1 NO 2 STOREY ADMINISTRATION LIBERARY BLOCK FOR SHS,getfund,,,,,,East Akim Municipal Assembly,,,
East Akim Municipal Assembly,2011,CONSTRUCTION 2 NO 4 UNIT TEACHERS QUARTER,getfund,,,,,,East Akim Municipal Assembly,,,
East Akim Municipal Assembly,2011,CONSTRUCTION 1 NO 6 UNIT CLASSROOM BLOCK AT M/A  PRIMARY SCHOOL,getfund,,9/19/2011,,,,East Akim Municipal Assembly,,2011-09-19,
East Akim Municipal Assembly,2011,CONSTRUCTION 1 NO 3 UNIT CLASSROOM BLOCK AT M/A JHS,getfund,,,,,,East Akim Municipal Assembly,,,
East Akim Municipal Assembly,2011,CONSTRUCTION OF 1 NO 2 UNIT KINDERGARTEN CLASSROOM BLOCK FOR KUKURANTUMI,getfund,,12/8/2011,,,,East Akim Municipal Assembly,,2011-12-08,
East Akim Municipal Assembly,2011,CONSTRUCTION 1 NO 6 UNIT CLASSROOM BLCOK FOR R/C,getfund,,,,,,East Akim Municipal Assembly,,,
East Akim Municipal Assembly,2011,CONSTRUCTION 1 NO 6 UNIT CLASSROOM BLOCK AT OSIEM ISLAMIC PRIMARY,getfund,,10/4/2011,,,,East Akim Municipal Assembly,,2011-10-04,
East Gonja District Assembly,2011,,,,,,,,East Gonja District Assembly,,,
East Mamprusi District Assembly,2011,,,,,,,,East Mamprusi District Assembly,,,
Effutu Municipal Assembly,2011,,,,,,,,Effutu Municipal Assembly,,,
Ejisu Juaben  Municipal Assembly,2011,CONSTRUCTION OF 1NO 3 UNIT CLASSROOM BLOCK,dacf,9/24/2010,10/4/2010,,,,Ejisu Juaben  Municipal Assembly,2010-09-24,2010-10-04,
Ejisu Juaben  Municipal Assembly,2011,CONSTRUCTION OF 1 STOREY CLASSROOM BLOCK,dacf,5/27/2010,,,,,Ejisu Juaben  Municipal Assembly,2010-05-27,,
Ejisu Juaben  Municipal Assembly,2011,CONSTRUCTION OF 1 NO 3 UNIT CLASSROOM BLOCK,getfund,1/25/2011,3/7/2011,,,,Ejisu Juaben  Municipal Assembly,2011-01-25,2011-03-07,
Ejisu Juaben  Municipal Assembly,2011,CONSTRUCTION OF 2NO 3 UNIT TEACHERS QUARTERS,ddf,1/14/2009,1/28/2010,,,,Ejisu Juaben  Municipal Assembly,2009-01-14,2010-01-28,
Ejisu Juaben  Municipal Assembly,2011,CONSTRUCTION OF SCHOOL FEEDING KITCHEN FOR DA PRIMARY,dacf,10/15/2011,,,,,Ejisu Juaben  Municipal Assembly,2011-10-15,,
Ejisu Juaben  Municipal Assembly,2011,CONSTRUCTION OF 1NO 3 UNIT CLASSROOM BLOCK WITH OFFICE STORE AND URINAL,ddf,9/20/2010,10/4/2010,,,,Ejisu Juaben  Municipal Assembly,2010-09-20,2010-10-04,
Ejisu Juaben  Municipal Assembly,2011,CONSTRUCTION OF 1NO 3 UNIT CLASSROOM BLOCK WITH OFFICE STORE AND URINAL,ddf,9/20/2010,10/4/2010,,,,Ejisu Juaben  Municipal Assembly,2010-09-20,2010-10-04,
Ejisu Juaben  Municipal Assembly,2011,CONSTRUCTION OF 1NO 3 UNIT CLASSROOM BLOCK WITH OFFICE STORE AND URINAL,ddf,9/20/2010,10/4/2010,,,,Ejisu Juaben  Municipal Assembly,2010-09-20,2010-10-04,
Ejisu Juaben  Municipal Assembly,2011,CONSTRUCTION OF 1NO 3 UNIT CLASSROOM BLOCK WITH OFFICE STORE AND URINAL,ddf,9/20/2010,10/4/2010,,,,Ejisu Juaben  Municipal Assembly,2010-09-20,2010-10-04,
Ejisu Juaben  Municipal Assembly,2011,CONSTRUCTION OF 3 UNIT BEDROOM JUDGE BUNGALOW,dacf,9/20/2010,10/5/2010,,,,Ejisu Juaben  Municipal Assembly,2010-09-20,2010-10-05,
Ejisu Juaben  Municipal Assembly,2011,CONSTRUCTION OF 16 SEATER TOILET,dacf,9/20/2010,10/4/2010,,,,Ejisu Juaben  Municipal Assembly,2010-09-20,2010-10-04,
Ejisu Juaben  Municipal Assembly,2011,REHABILITATION OF 8NO PUBLIC LATRINE,ddf,12/30/2010,1/14/2011,,,,Ejisu Juaben  Municipal Assembly,2010-12-30,2011-01-14,
Ejisu Juaben  Municipal Assembly,2011,CONSTRUCTION OF 1NO 16 SEATER AQUA PRIVY TOILET,ddf,12/30/2010,1/14/2011,,,,Ejisu Juaben  Municipal Assembly,2010-12-30,2011-01-14,
Ejisu Juaben  Municipal Assembly,2011,REHABILITATION OF 1NO 3 UNIT CLASSROOM BLOCK,ddf,12/30/2010,1/14/2011,,,,Ejisu Juaben  Municipal Assembly,2010-12-30,2011-01-14,
Ejisu Juaben  Municipal Assembly,2011,CONSTRUCTION OF 1NO 3 UNIT CLASSROOM BLOCK,dacf,9/20/2010,1/14/2011,,,,Ejisu Juaben  Municipal Assembly,2010-09-20,2011-01-14,
Ejisu Juaben  Municipal Assembly,2011,CONSTRUCTION OF 1NO 4 UNIT CLASSROOM BLOCK,ddf,12/30/2010,1/14/2011,,,,Ejisu Juaben  Municipal Assembly,2010-12-30,2011-01-14,
Ejisu Juaben  Municipal Assembly,2011,REHABILITATION OF ASSEMBLY ZONAL COUNCIL,dacf,7/5/2010,8/12/2011,,,,Ejisu Juaben  Municipal Assembly,2010-07-05,2011-08-12,
Ejisu Juaben  Municipal Assembly,2011,REHABILITATION OF HEALTH POST ACHIASE,ddf,12/30/2010,1/14/2011,,,,Ejisu Juaben  Municipal Assembly,2010-12-30,2011-01-14,
Ejisu Juaben  Municipal Assembly,2011,CONSTRUCTION OF 3 BEDROOM DOCTORS BUNGALOW,ddf,12/30/2010,1/14/2011,,,,Ejisu Juaben  Municipal Assembly,2010-12-30,2011-01-14,
Ejisu Juaben  Municipal Assembly,2011,CONSTRUCTION OF 4NO BOREHOLES AT ESAASE GYEDE BONWIRE NYEREPOASO AND KROFOFROM,ddf,12/30/2010,1/14/2011,,,,Ejisu Juaben  Municipal Assembly,2010-12-30,2011-01-14,
Ejisu Juaben  Municipal Assembly,2011,COMPLETION CONSTRUCTION OF 1NO 8 UNITS CLASSROOM BLOCK WITH 12 SEATER AQUA PRIVY,other donor,3/22/2010,4/17/2010,,,,Ejisu Juaben  Municipal Assembly,2010-03-22,2010-04-17,
Ejisu Juaben  Municipal Assembly,2011,COMPLETION CONSTRUCTION OF 1NO 6 UNIT CLASSROOM BLOCK WITH ANCILLARY FACILITIES,getfund,1/25/2011,,,,,Ejisu Juaben  Municipal Assembly,2011-01-25,,
Ejisu Juaben  Municipal Assembly,2011,COMPLETION CONSTRUCTION OF 1NO 6 UNIT CLASSROOM BLOCK WITH ANCILLARY FACILITIES,getfund,8/27/2010,9/6/2010,,,,Ejisu Juaben  Municipal Assembly,2010-08-27,2010-09-06,
Ejisu Juaben  Municipal Assembly,2011,COMPLETION CONSTRUCTION OF 1NO 6 UNIT CLASSROOM BLOCK WITH ANCILLARY FACILITIES,getfund,9/24/2010,10/4/2010,,,,Ejisu Juaben  Municipal Assembly,2010-09-24,2010-10-04,
Ejisu Juaben  Municipal Assembly,2011,COMPLETION CONSTRUCTION OF 1NO 3UNIT CLASSROOM BLOCK WITH ANCILIARY FACILITIES,getfund,3/25/2010,10/4/2010,,,,Ejisu Juaben  Municipal Assembly,2010-03-25,2010-10-04,
Ejisu Juaben  Municipal Assembly,2011,COMPLETION  CONSTRUCTION OF 1NO 3 UNIT CLASSROOM BLCOK WITH ANCILLARY FACILITIES,getfund,8/27/2010,9/6/2010,,,,Ejisu Juaben  Municipal Assembly,2010-08-27,2010-09-06,
Ejisu Juaben  Municipal Assembly,2011,CONSTRUCTION OF 3 UNIT CLASSROOM BLOCK,ddf,9/20/2010,,,,,Ejisu Juaben  Municipal Assembly,2010-09-20,,
Ejisu Juaben  Municipal Assembly,2011,REHABILITATION OF EJISU ZONAL COUNCIL,dacf,7/5/2011,,,,,Ejisu Juaben  Municipal Assembly,2011-07-05,,
Ejisu Juaben  Municipal Assembly,2011,RENOVATION OF MCES OFFICE,dacf,7/5/2011,7/12/2011,,,,Ejisu Juaben  Municipal Assembly,2011-07-05,2011-07-12,
Ejisu Juaben  Municipal Assembly,2011,RENOVATION OF MCES RESIDENCY,dacf,7/5/2011,7/12/2011,,,,Ejisu Juaben  Municipal Assembly,2011-07-05,2011-07-12,
Ejisu Juaben  Municipal Assembly,2011,REHABILITATION OF 1NO 6 UNIT CLASSROOM BLOCK AT NOBEWAM PRIMARY AND JUABEN PRESBY,ddf,12/20/2011,1/3/2012,,,,Ejisu Juaben  Municipal Assembly,2011-12-20,2012-01-03,
Ejisu Juaben  Municipal Assembly,2011,REHABILITATION OF 1 NO 3 UNIT CLASSROOM BLOCK AT DUMAKWAI M/A AND EDWENASE M/A SCHOOLS,ddf,12/20/2011,1/3/2012,,,,Ejisu Juaben  Municipal Assembly,2011-12-20,2012-01-03,
Ejisu Juaben  Municipal Assembly,2011,CONSTRUCTION OF 1NO 3 UNIT TEACHERS QUARTERS AT MANHYIA,ddf,12/20/2011,1/3/2012,,,,Ejisu Juaben  Municipal Assembly,2011-12-20,2012-01-03,
Ejisu Juaben  Municipal Assembly,2011,CONSTRUCTION OF CHIPS COMPOUND WITH 4 SEATER WATER CLOSET TOILET FACILITY AT NEW KOFORIDUA,ddf,12/20/2011,1/3/2012,,,,Ejisu Juaben  Municipal Assembly,2011-12-20,2012-01-03,
Ejisu Juaben  Municipal Assembly,2011,CONSTRUCTION OF 1NO 3 UNIT CLASSROOM BLOCK AND 4 SEATER AQUA PRIVY FOR BOANKRA METHODIST PRIMARY,ddf,12/20/2011,1/3/2012,,,,Ejisu Juaben  Municipal Assembly,2011-12-20,2012-01-03,
Ejisu Juaben  Municipal Assembly,2011,CONSTRUCTION OF 1NO 2 BEDROOM HEAD TEACHERS BUNGALOW AT ADAKO JACHIE,ddf,12/20/2011,1/3/2012,,,,Ejisu Juaben  Municipal Assembly,2011-12-20,2012-01-03,
Ejisu Juaben  Municipal Assembly,2011,REHABILITATION OF 10 NO PUBLIC TOILETS,ddf,12/20/2011,1/3/2012,,,,Ejisu Juaben  Municipal Assembly,2011-12-20,2012-01-03,
Ejisu Juaben  Municipal Assembly,2011,REHABILITATION OF ABANKRO SCHOOL,dacf,12/9/2011,12/16/2011,,,,Ejisu Juaben  Municipal Assembly,2011-12-09,2011-12-16,
Ejisu Juaben  Municipal Assembly,2011,CONSTRUCTION OF ISLAMIC J H S AT JUABEN,dacf,12/9/2011,12/16/2011,,,,Ejisu Juaben  Municipal Assembly,2011-12-09,2011-12-16,
Ejura Sekyedumase Municipal Assembly,2011,CONSTRUCTION OF 1 STOREY ADMINISTRATION BLOCK,other/unknown,,2009,,,,Ejura Sekyedumase Municipal Assembly,,1905-07-01,
Ejura Sekyedumase Municipal Assembly,2011,CONSTRUCTION OF 6 UNIT CLASSROOM BLOCK WITH DOUBLE VERANDA HEAD TEACHERS OFFICE STORE COMMON ROOM LIBRARY AND SANITARY FACILITY,other/unknown,,2010,,,,Ejura Sekyedumase Municipal Assembly,,1905-07-02,
Ejura Sekyedumase Municipal Assembly,2011,CONSTRUCTION OF 3 UNIT CLASSROOM BLOCK WITH DOUBLE VERANDA HEAD TEACHERS OFFICE STORE AND SANITARY FACILITY,other/unknown,,2010,,,,Ejura Sekyedumase Municipal Assembly,,1905-07-02,
Ejura Sekyedumase Municipal Assembly,2011,CONSTRUCTION OF 2 UNIT CLASSROOM BLOCK WITH SINGLE VERANDA HEAD TEACHER'S OFFICE STORE DINING/UTILITY AND SANITARY FACILITY,other/unknown,,2010,,,,Ejura Sekyedumase Municipal Assembly,,1905-07-02,
Ejura Sekyedumase Municipal Assembly,2011,CONSTRUCTION OF 3 UNIT CLASSROOM BLOCK WITH DOUBLE VERANDA HEAD TEACHER'S OFFICE STORE AND SANITARY FACILITY,other/unknown,,2010,,,,Ejura Sekyedumase Municipal Assembly,,1905-07-02,
Ejura Sekyedumase Municipal Assembly,2011,CONSTRUCTION OF 6 UNIT CLASSROOM BLOCK WITH DOUBLE VERANDA HEAD TEACHER'S OFFICE STORE STAFF COMMON ROOM LIBRARY AND SANITARY FACILITY,other/unknown,,2010,,,,Ejura Sekyedumase Municipal Assembly,,1905-07-02,
Ejura Sekyedumase Municipal Assembly,2011,CONSTRUCTION OF 3 UNIT CLASSROOM BLOCK WITH DOUBLE VERANDA HEAD TEACHER'S OFFICE STORE AND SANITARY FACILITY,other/unknown,,2010,,,,Ejura Sekyedumase Municipal Assembly,,1905-07-02,
Ejura Sekyedumase Municipal Assembly,2011,CONSTRUCTION OF 2 UNIT CLASSROOM BLOCK WITH SINGLE VERANDA HEAD TEACHER'S OFFICE STORE DINING/UTILITIES AND SANITARY FACILITY,other/unknown,,2010,,,,Ejura Sekyedumase Municipal Assembly,,1905-07-02,
Ejura Sekyedumase Municipal Assembly,2011,CONSTRUCTION OF 3 UNIT CLASSROOM BLOCK WITH DOUBLE VERANDS HEAD TEACHER'S OFFICE STORE AND SANITARY FACILITY,other/unknown,,2010,,,,Ejura Sekyedumase Municipal Assembly,,1905-07-02,
Ejura Sekyedumase Municipal Assembly,2011,CONSTRUCTION OF 2 UNIT CLASSROOM BLOCK WITH SINGLE VERANDA HEAD TEACHER'S OFFICE STORE DINNING/UTILITIES AND SANITARY FACILITY,other/unknown,,2010,,,,Ejura Sekyedumase Municipal Assembly,,1905-07-02,
Ejura Sekyedumase Municipal Assembly,2011,CONSTRUCTION OF 6 UNIT CLASSROOM BLOCK WITH SINGLE VERANDA HEAD TEACHER'S OFFICE STORE AND STAFF COMMON ROOM LIBRARY AND SANITARY FACILITY,other/unknown,,2010,,,,Ejura Sekyedumase Municipal Assembly,,1905-07-02,
Ejura Sekyedumase Municipal Assembly,2011,CONSTRUCTION OF 2 UNIT CLASSROOM BLOCK WITH SINGLE VERANDA HEAD TEACHER'S OFFICE STORE DINNING/UTILITIES AND SANITARY FACILITY,other/unknown,,2010,,,,Ejura Sekyedumase Municipal Assembly,,1905-07-02,
Ejura Sekyedumase Municipal Assembly,2011,CONSTRUCTION OF 3 UNIT CLASSROOM BLOCK WITH DOUBLE VERANDA HEAD TEACHER'S OFFICE STORE AND SANITARY FACILITY,other/unknown,,2010,,,,Ejura Sekyedumase Municipal Assembly,,1905-07-02,
Ejura Sekyedumase Municipal Assembly,2011,CONSTRUCTION OF 1NO B.S 1-6 CLASSROOM BLOCK WITH ANCILLARY,other/unknown,,2010,,,,Ejura Sekyedumase Municipal Assembly,,1905-07-02,
Ejura Sekyedumase Municipal Assembly,2011,CONSTRUCTION OF 1NO B S 1 6 CLASSROOM BLOCK WITH ANCILLARY,other/unknown,,2010,,,,Ejura Sekyedumase Municipal Assembly,,1905-07-02,
Ejura Sekyedumase Municipal Assembly,2011,CONSTRUCTION OF 1NO B S 1 6 CLASSROOM BLOCK WITH ANCILLARY,other/unknown,,2010,,,,Ejura Sekyedumase Municipal Assembly,,1905-07-02,
Ejura Sekyedumase Municipal Assembly,2011,CONSTRUCTION OF 1NO CHILDRENS WARD AT EJURA GOVERNMENT HOSPITAL,other/unknown,,2010,,,,Ejura Sekyedumase Municipal Assembly,,1905-07-02,
Ejura Sekyedumase Municipal Assembly,2011,CONSTRUCTION OF 2NO BOREHOLES,other/unknown,,2010,,,,Ejura Sekyedumase Municipal Assembly,,1905-07-02,
Ejura Sekyedumase Municipal Assembly,2011,CONSTRUCTION OF 2NO BOREHOLES,other/unknown,,2010,,,,Ejura Sekyedumase Municipal Assembly,,1905-07-02,
Ejura Sekyedumase Municipal Assembly,2011,CONSTRUCTION OF 2NO BOREHOLE,other/unknown,,2010,,,,Ejura Sekyedumase Municipal Assembly,,1905-07-02,
Ejura Sekyedumase Municipal Assembly,2011,CONSTRUCTION OF 1NO BOREHOLE,other/unknown,,2010,,,,Ejura Sekyedumase Municipal Assembly,,1905-07-02,
Ejura Sekyedumase Municipal Assembly,2011,CONSTRUCTION OF 2NO BOREHOLES,other/unknown,,2010,,,,Ejura Sekyedumase Municipal Assembly,,1905-07-02,
Ejura Sekyedumase Municipal Assembly,2011,CONSTRUCTION OF 1NO BOREHOLES,other/unknown,,2010,,,,Ejura Sekyedumase Municipal Assembly,,1905-07-02,
Ejura Sekyedumase Municipal Assembly,2011,CONSTRUCTION OF 2NO BOREHOLES,other/unknown,,2010,,,,Ejura Sekyedumase Municipal Assembly,,1905-07-02,
Ejura Sekyedumase Municipal Assembly,2011,CONSTRUCTION OF 2NO BOREHOLES,other/unknown,,2010,,,,Ejura Sekyedumase Municipal Assembly,,1905-07-02,
Ejura Sekyedumase Municipal Assembly,2011,CONSTRUCTION OF SMALL TOWN WATER SYSTEMS,other/unknown,,2010,,,,Ejura Sekyedumase Municipal Assembly,,1905-07-02,
Ejura Sekyedumase Municipal Assembly,2011,CONSTRUCTION OF 2NO BOREHOLES,other/unknown,,2010,,,,Ejura Sekyedumase Municipal Assembly,,1905-07-02,
Ejura Sekyedumase Municipal Assembly,2011,EMERGENCY REHABILITATION OF EJURA-BABASO ROAD AND DROMANKUMA KYENKYENKURA(14.5KM),other/unknown,,2011,,,,Ejura Sekyedumase Municipal Assembly,,1905-07-03,
Ejura Sekyedumase Municipal Assembly,2011,CONSTRUCTION OF 1 NO GROUND FLOOR 3-STOREY MULTIPURPOSE LOCKABLE SHOP,other/unknown,,2010,,,,Ejura Sekyedumase Municipal Assembly,,1905-07-02,
Ejura Sekyedumase Municipal Assembly,2011,INDUSTRY DEVELOPMENT CENTRE,other/unknown,,2010,,,,Ejura Sekyedumase Municipal Assembly,,1905-07-02,
Ejura Sekyedumase Municipal Assembly,2011,CONSTRUCTION OF 1NO 6 BEDROOM RESIDENTIAL ACCOMMODATION FOR THE DISTRICT CHIEF EXECUTIVE,other/unknown,,2009,,,,Ejura Sekyedumase Municipal Assembly,,1905-07-01,
Ejura Sekyedumase Municipal Assembly,2011,CONSTRUCTION OF 1NO COMMUNITY RESOURCE CENTRE,other/unknown,,2009,,,,Ejura Sekyedumase Municipal Assembly,,1905-07-01,
Ejura Sekyedumase Municipal Assembly,2011,PAVEMENT OF EJURA MARKET,other gog,,,,,,Ejura Sekyedumase Municipal Assembly,,,
Ejura Sekyedumase Municipal Assembly,2011,CONSTRUCTION OF 1NO COMMUNITY RESOURCE CENTRE AT SEKYEDUMASE,igf,,,,,,Ejura Sekyedumase Municipal Assembly,,,
Ejura Sekyedumase Municipal Assembly,2011,CONSTRUCTION OF 1 NO 6 BEDROOM RESIDENTIAL ACCOMMODATION FOR THE DISTRICT CHIEF EXECUTIVE AT EJURA,igf,,,,,,Ejura Sekyedumase Municipal Assembly,,,
Ejura Sekyedumase Municipal Assembly,2011,SPOT IMPROVEMENT OF AFRAMSO-NTOMMU FEEDER ROAD (1.0KM),other gog,,,,,,Ejura Sekyedumase Municipal Assembly,,,
Ejura Sekyedumase Municipal Assembly,2011,REHABILITATION OF SEKYEDUMASE ANYINASU ROAD (KM),other gog,,,,,,Ejura Sekyedumase Municipal Assembly,,,
Ellembele District Assembly,2011,MANUFACTURING OF 800 NO SCHOOL DESK,ddf,,,,,,Ellembele District Assembly,,,
Ellembele District Assembly,2011,REHABILITATION OF 6 UNIT CLASSROOM BLK & COMPLETION OF ICT CENTRE,ddf,,,,,,Ellembele District Assembly,,,
Ellembele District Assembly,2011,CONSTRUCTION OF 1NO 2 STREAM JUBILEE KINDERGARTEN AT NKROFUL,other/unknown,,,,,,Ellembele District Assembly,,,
Ellembele District Assembly,2011,CONSTRUCTION 3 UNIT CLASSROOM BLOCK WITH OFFICE STORE AND STAFF COMMON ROOM AT KUMGBUNLI,other/unknown,,,,,,Ellembele District Assembly,,,
Ellembele District Assembly,2011,CONSTRUCTION OF 3 UNIT  CLASSROOM BLK WITH OFFICE STORE AND STAFFROOM,other/unknown,,,,,,Ellembele District Assembly,,,
Ellembele District Assembly,2011,CONSTRUCTION OF 6 UNIT CLASSROOM BLOCK WITH ANCILLARY FACILITIES AT NEW BAKANTA,getfund,,,,,,Ellembele District Assembly,,,
Ellembele District Assembly,2011,CONSTRUCTION OF 6 UNIT CLASSROOM BLOCK WITH ANCILLARY FACILITIES AT BESEKE NO 2,getfund,,,,,,Ellembele District Assembly,,,
Ellembele District Assembly,2011,CONSTRUCTION OF 6 UNIT CLASSROOM BLOCK WITH ANCILLARY FACILITIES AT EWEREKO,getfund,,,,,,Ellembele District Assembly,,,
Ellembele District Assembly,2011,CONSTRUCTION OF 6 UNIT CLASSROOM BLOCK WITH ANCILLARY FACILITIES AT KWESIKROM,getfund,,,,,,Ellembele District Assembly,,,
Ellembele District Assembly,2011,CONSTRUCTION OF 4 ROOM TEACHER QUARTER AT MENZEZOR,ddf,,,,,,Ellembele District Assembly,,,
Ellembele District Assembly,2011,CONSTRUCTION OF 4 BEDROOM GUEST HOUSE AT NKROFUL,other/unknown,,,,,,Ellembele District Assembly,,,
Ellembele District Assembly,2011,COMPLETION OF COMMUNITY LIBRARY AND ICT CENTRE AT ESIAMA,other/unknown,,,,,,Ellembele District Assembly,,,
Ellembele District Assembly,2011,"CONSTRUCTION OF POLICE STATION AND 3-ROOM BOYS QUARTERS WITH TOILET, BATH AND KITCHEN AT AIYINASI",other/unknown,,,,,,Ellembele District Assembly,,,
Ellembele District Assembly,2011,CONSTRUCTION OF 2 STOREY BEDROOM SEMI DETARCHED STAFF QUARTERS,other/unknown,,,,,,Ellembele District Assembly,,,
Ellembele District Assembly,2011,CONSTRUCTION OF COMMUNITY CENTER AT AIYINASI REVISED,other/unknown,,,,,,Ellembele District Assembly,,,
Ellembele District Assembly,2011,CREATING OF FINAL REFUSE DISPOSAL SITE AT AMPAIN,other/unknown,,,,,,Ellembele District Assembly,,,
Ellembele District Assembly,2011,CONSTRUCTION OF 16 SEATER AQUA PRIVY TOILET AT SANZULE,other/unknown,,,,,,Ellembele District Assembly,,,
Ellembele District Assembly,2011,CONSTRUCTION OF 16 SEATER AQUA PRIVY TOILET AT ATUABO,other/unknown,,,,,,Ellembele District Assembly,,,
Ellembele District Assembly,2011,CONSTRUCTION OF 6 NO BOREHOLES,other/unknown,,,,,,Ellembele District Assembly,,,
Ellembele District Assembly,2011,CONSTRUCTION OF 16 SEATER AQUA PRIVY TOILET AT ESIAMA,other/unknown,,,,,,Ellembele District Assembly,,,
Ellembele District Assembly,2011,CREATION OF LINK ROAD FROM ATABABU SANTASU SISKROM FEEDER ROAD 23KM,other/unknown,,,,,,Ellembele District Assembly,,,
Ellembele District Assembly,2011,RENOVATION OF AIDOUSUAZO CLINIC,ddf,,,,,,Ellembele District Assembly,,,
Fanteakwa District Assembly,2011,REHABILITATION OF DISTRICT ASSEMBLY OFFICE COMPLEX BLOCK AND PAVEMENT OF FORECOURT,other/unknown,,,,,,Fanteakwa District Assembly,,,
Fanteakwa District Assembly,2011,REHABILITATION OF BEGORO POLICE STATION,other/unknown,,,,,,Fanteakwa District Assembly,,,
Fanteakwa District Assembly,2011,CONSTRUCTION 4 UNIT 2 BEDROOM QUARTER,other/unknown,,2011,,,,Fanteakwa District Assembly,,1905-07-03,
Fanteakwa District Assembly,2011,CONSTRUCTION OF 3NO SUMMER HUT,other/unknown,,2011,,,,Fanteakwa District Assembly,,1905-07-03,
Fanteakwa District Assembly,2011,CONSTRUCTION OF 2UNIT 26 NO MARKET STORE,other/unknown,,2011,,,,Fanteakwa District Assembly,,1905-07-03,
Fanteakwa District Assembly,2011,REHABILITATION OF DBOS BUNGALOW,other/unknown,,2011,,,,Fanteakwa District Assembly,,1905-07-03,
Fanteakwa District Assembly,2011,CONSTRUCTION OF GES OFFICE COMPLEX,other/unknown,,2011,,,,Fanteakwa District Assembly,,1905-07-03,
Fanteakwa District Assembly,2011,RECONSTRUCTION OF 1 BEDROOM SELF CONTAIN AND TWO BOYS DORM,other/unknown,,2011,,,,Fanteakwa District Assembly,,1905-07-03,
Fanteakwa District Assembly,2011,CONSTRUCTION OF 14 SEATER AQUA PRIVY TOILET,other/unknown,,2011,,,,Fanteakwa District Assembly,,1905-07-03,
Fanteakwa District Assembly,2011,DRILLING AND CONSTRUCTION OF 25NO BOREHOLE,other/unknown,,2011,,,,Fanteakwa District Assembly,,1905-07-03,
Fanteakwa District Assembly,2011,CONSTRUCTION OF 1NO 8 SEATER KVIP LATRINE,other/unknown,,,,,,Fanteakwa District Assembly,,,
Fanteakwa District Assembly,2011,CONSTRUCTION OF 1NO 8 SEATER KVIP LATRINE,other/unknown,,6/10/2010,,,,Fanteakwa District Assembly,,2010-06-10,
Fanteakwa District Assembly,2011,CONSTRUCTION OF 6 UNIT CLASS ROOM BLOCK WITH AUXILIARY FACILITIES,other/unknown,,2010,,,,Fanteakwa District Assembly,,1905-07-02,
Fanteakwa District Assembly,2011,CONSTRUCTION OF 6 UNIT CLASS ROOM BLOCK WITH AUXILIARY FACILITIES,other/unknown,,2010,,,,Fanteakwa District Assembly,,1905-07-02,
Fanteakwa District Assembly,2011,CONSTRUCTION OF 6 UNIT CLASS ROOM BLOCK WITH AUXILIARY FACILITIES,other/unknown,,2010,,,,Fanteakwa District Assembly,,1905-07-02,
Ga East Municipal Assembly,2011,,,,,,,,Ga East Municipal Assembly,,,
Ga South Municipal Assembly,2011,CONSTRUCTION OF THREE (3) UNIT CLASSROOM BLOCK WITH OFFICE AND STORE,dacf,11/24/2010,,,,,Ga South Municipal Assembly,2010-11-24,,
Ga South Municipal Assembly,2011,CONSTRUCTION OF OFFICE BLOCK FOR THE GSMA WORKS DEPARTMENT,dacf,1/12/2008,,,,,Ga South Municipal Assembly,2008-01-12,,
Ga South Municipal Assembly,2011,CONSTRUCTION OF A PUBLIC PLACE OF CONVINIENCE,dacf,11/26/2008,,,,,Ga South Municipal Assembly,2008-11-26,,
Ga South Municipal Assembly,2011,CONSTRUCTION OF 12 NR INSTITUTIONAL KVIP LATRINES,other donor,2/6/2010,,,,,Ga South Municipal Assembly,2010-02-06,,
Ga South Municipal Assembly,2011,CONSTRUCTION OF SIX (6) UNIT CLASSROOM BLOCK WITH OFFICE STORE TEACHERS COMMON ROOM AND EIGHTS (8) SEATER KVIP,dacf,4/14/2010,,,,,Ga South Municipal Assembly,2010-04-14,,
Ga South Municipal Assembly,2011,CONSTRUCTION OF OF THREE (3) UNIT CLASSROOM BLOCK WITH OFFICE STORE TEACHERS COMMON ROOM AND SIX (6) SEATER KVIP,multiple,4/13/2010,,,,,Ga South Municipal Assembly,2010-04-13,,
Ga South Municipal Assembly,2011,CONSTRUCTION OF THREE (3) UNIT CLASSROOM BLOCK WITH OFFICE STORE TEACHERS COMMON ROON AND SIX  (6) SEATER KVIP,multiple,4/14/2010,,,,,Ga South Municipal Assembly,2010-04-14,,
Ga South Municipal Assembly,2011,CONSTRUCTION OF ONE NO TWO BEDROOM SEMI DETACHED BUNGALOW (PHASE),dacf,7/22/2010,,,,,Ga South Municipal Assembly,2010-07-22,,
Ga South Municipal Assembly,2011,CONSTRUCTION OF REGIONAL COUNCIL OFFICES,dacf,10/29/2010,,,,,Ga South Municipal Assembly,2010-10-29,,
Ga South Municipal Assembly,2011,CONSTRUCTION OF OFFICES FOR HEALTH DIRECTORATE,dacf,10/29/2010,,,,,Ga South Municipal Assembly,2010-10-29,,
Ga South Municipal Assembly,2011,CONSTRUCTION OF SIX CLASSROOM BLOCK WITH ANCILARY FACILITIES,getfund,1/12/2010,,,,,Ga South Municipal Assembly,2010-01-12,,
Ga South Municipal Assembly,2011,CONSTRUCTION OF SIX CLASSROOM BLOCK WITH ANCILARY FACILITIES,getfund,1/12/2010,,,,,Ga South Municipal Assembly,2010-01-12,,
Ga South Municipal Assembly,2011,CONSTRUCTION OF SIX CLASSROOM BLOCK WITH ANCILARY FACILITIES,getfund,1/12/2010,,,,,Ga South Municipal Assembly,2010-01-12,,
Ga South Municipal Assembly,2011,CONSTRUCTION OF SIX CLASSROOM BLOCK WITH ANCILARY FACILITIES,getfund,1/12/2010,,,,,Ga South Municipal Assembly,2010-01-12,,
Ga South Municipal Assembly,2011,CONSTRUCTION OF SIX CLASSROOM BLOCK WITH ANCILARY FACILITIES,getfund,1/12/2010,,,,,Ga South Municipal Assembly,2010-01-12,,
Ga South Municipal Assembly,2011,CONSTRUCTION OF SIX CLASSROOM BLOCK WITH ANCILARY FACILITIES,getfund,1/12/2010,,,,,Ga South Municipal Assembly,2010-01-12,,
Ga South Municipal Assembly,2011,CONSTRUCTION OF SIX CLASSROOM BLOCK WITH ANCILARY FACILITIES,getfund,1/12/2010,,,,,Ga South Municipal Assembly,2010-01-12,,
Ga South Municipal Assembly,2011,CONSTRUCTION OF SIX CLASSROOM BLOCK WITH ANCILARY FACILITIES,getfund,1/12/2010,,,,,Ga South Municipal Assembly,2010-01-12,,
Ga South Municipal Assembly,2011,CONSTRUCTION OF SIX CLASSROOM BLOCK WITH ANCILARY FACILITIES,getfund,1/12/2010,,,,,Ga South Municipal Assembly,2010-01-12,,
Ga South Municipal Assembly,2011,CONSTRUCTION OF SIX CLASSROOM BLOCK WITH ANCILARY FACILITIES,getfund,1/12/2010,,,,,Ga South Municipal Assembly,2010-01-12,,
Ga South Municipal Assembly,2011,CONSTRUCTION OF SIX CLASSROOM BLOCK WITH ANCILARY FACILITIES,getfund,1/12/2010,,,,,Ga South Municipal Assembly,2010-01-12,,
Ga South Municipal Assembly,2011,CONSTRUCTION OF SIX CLASSROOM BLOCK WITH ANCILARY FACILITIES,getfund,1/12/2010,,,,,Ga South Municipal Assembly,2010-01-12,,
Ga South Municipal Assembly,2011,COMPLETION OF A THREE (3) UNIT CLASSROOM BLOCK WITH AND STORE,ddf,2/21/2011,,,,,Ga South Municipal Assembly,2011-02-21,,
Ga South Municipal Assembly,2011,COMPLETION OF TWO (2)NO. 3 UNIT TEACHERS QUARTERS,ddf,2/21/2011,,,,,Ga South Municipal Assembly,2011-02-21,,
Ga South Municipal Assembly,2011,COMPLETION OF A CHPS COMPOUND,ddf,2/21/2011,,,,,Ga South Municipal Assembly,2011-02-21,,
Ga South Municipal Assembly,2011,RENOVATION OF A CHPS COMPOUND,ddf,2/21/2011,,,,,Ga South Municipal Assembly,2011-02-21,,
Ga South Municipal Assembly,2011,COMPLETION OF HEALTH CENTRE,ddf,2/21/2011,,,,,Ga South Municipal Assembly,2011-02-21,,
Ga South Municipal Assembly,2011,COMPLETION OF TWO 2 KINGDREGATEN BLOCK WITH LIBRARY OFFICE AND STORE,ddf,2/21/2011,,,,,Ga South Municipal Assembly,2011-02-21,,
Ga South Municipal Assembly,2011,CONSTRUCTION OF ONE 1 SIX UNIT CLASSROOM BLOCK WITH OFFICE AND STORE,ddf,2/21/2011,,,,,Ga South Municipal Assembly,2011-02-21,,
Ga South Municipal Assembly,2011,COMPLETION OF ONE SIX UNIT CLASSROOM BLOCK WITH OFFICE AND STORE,ddf,2/21/2011,,,,,Ga South Municipal Assembly,2011-02-21,,
Ga South Municipal Assembly,2011,CONSTRUCTION OF 1 NO EIGHT (8) SEATER INSTITUTIONAL KVIP LATRINES,multiple,5/20/2010,,,,,Ga South Municipal Assembly,2010-05-20,,
Ga South Municipal Assembly,2011,COSNTRUCTION OF 1 NO EIGHT (8) SEATER INSTITUTIONAL KVIP LATRINES,multiple,5/20/2010,,,,,Ga South Municipal Assembly,2010-05-20,,
Ga South Municipal Assembly,2011,CONSTRUCTION OF 1NO EIGHT (8) SEATER INSTITUTIONAL VIPO LATRINES,multiple,5/20/2010,,,,,Ga South Municipal Assembly,2010-05-20,,
Ga South Municipal Assembly,2011,CONSTRUCTION OF 1NO EIGHT (8) SEATER INSTITUIONAL KVIP LATRINES,multiple,5/20/2010,,,,,Ga South Municipal Assembly,2010-05-20,,
Ga South Municipal Assembly,2011,CONSTRUCTION OF 1NO EIGHT (8) SEATER INSTITUTIONAL KVIP,multiple,5/20/2010,,,,,Ga South Municipal Assembly,2010-05-20,,
Ga South Municipal Assembly,2011,CONSTRUCTION OF 1NO EIGHT (8) SEAER INSTITUTIONAL KVIP LATRINES,multiple,5/20/2010,,,,,Ga South Municipal Assembly,2010-05-20,,
Ga South Municipal Assembly,2011,CONSTRUCTION OF 1NO EIGHTA (8) SEATER INSTITUTIONAL KVIP LATRINES,multiple,5/20/2010,,,,,Ga South Municipal Assembly,2010-05-20,,
Ga South Municipal Assembly,2011,CONSTRUCTION OF 1NO EIGHT 8 SEATER INSTITUTIONAL KVIP LATRINES,multiple,5/20/2010,,,,,Ga South Municipal Assembly,2010-05-20,,
Ga South Municipal Assembly,2011,CONSTRUCTION OF 1 NBO EIGHT (8) SEATER INSTITUTIONAL KVIP LATRIENS,multiple,5/20/2010,,,,,Ga South Municipal Assembly,2010-05-20,,
Ga South Municipal Assembly,2011,CONSTRUCTION OF 1NO EIGHT 8 SEATER INSTITUTIONAL KVIP LATRINES,multiple,20-May,,,,,Ga South Municipal Assembly,2010-05-20,,
Ga South Municipal Assembly,2011,CONSTRUCTION OF 1NO EIGHT 8 SEATER INSTITUTIONAL KVIP LATRINE,multiple,5/20/2010,,,,,Ga South Municipal Assembly,2010-05-20,,
Ga South Municipal Assembly,2011,CONSTRUCTION OF 1NO EIGHT 8 SEATER INSTITUTIONAL KVIP LATRINES,multiple,May-10,,,,,Ga South Municipal Assembly,2010-05-20,,
Ga South Municipal Assembly,2011,DRILLING OF 15NO BOREHOLES,multiple,6/1/2010,,,,,Ga South Municipal Assembly,2010-06-01,,
Ga South Municipal Assembly,2011,DRILLING OF 20NO BOREHOLES,multiple,6/1/2010,,,,,Ga South Municipal Assembly,2010-06-01,,
Ga South Municipal Assembly,2011,CONSTRUCTION OF 1NO 20 SEATER WATER CLOSET PUBLIC TOILET,multiple,7/1/2010,,,,,Ga South Municipal Assembly,2010-07-01,,
Ga South Municipal Assembly,2011,CONSTRUCTION OF 2NO 20 SEATER WATER CLOSET PUBLIC TOILET,multiple,7/1/2010,,,,,Ga South Municipal Assembly,2010-07-01,,
Ga West Municipal Assembly,2011,,,,,,,,Ga West Municipal Assembly,,,
Garu-Tempane District Assembly,2011,,,,,,,,Garu-Tempane District Assembly,,,
Gomoa East District Assembly,2011,CONSTRUCTION OF CHPS COMPOUND AT LOME,other gog,,,,,,Gomoa East District Assembly,,,
Gomoa East District Assembly,2011,CONSTRUCTION OF CHPS COMPOUND AT FETTEH,other gog,,,,,,Gomoa East District Assembly,,,
Gomoa East District Assembly,2011,CONSTRUCTION OF CHPS COMPOUND AT ABOSO,other gog,,,,,,Gomoa East District Assembly,,,
Gomoa East District Assembly,2011,CONSTRUCTION OF 1NO 20 SEATER AQUA PRIVY TOILET FACILITY WITH SOLID WASTE HOLDING BAY AT AKWAMU,other donor,,,,,,Gomoa East District Assembly,,,
Gomoa East District Assembly,2011,CONSTRUCTION OF 1NO 20 SEATER AQUA PRIVY TOILET FACILITY AT MANGOASE,dacf,,,,,,Gomoa East District Assembly,,,
Gomoa East District Assembly,2011,CONSTRUCTION OF SOME SELECTED DRAINS IN AKWAMU TOWNSHIP,other donor,,,,,,Gomoa East District Assembly,,,
Gomoa East District Assembly,2011,CONSTRUCTION OF2 NO 2 UNIT KG BLOCK OFFICE AND STORE WITH 1 UNIT 2 SEATER KVIP LATRINE DA PRIMARY,ddf,,,,,,Gomoa East District Assembly,,,
Gomoa East District Assembly,2011,CONSTRUCTION OF 2 NO 2 UNIT KG BLOCK WITH ANCILLARY FACILITIES,getfund,,,,,,Gomoa East District Assembly,,,
Gomoa East District Assembly,2011,CONSTRUCTION OF 2 NO 3 UNIT CLASSROOM BLOCK WITH ANCILLARY FACILITIES,ddf,,,,,,Gomoa East District Assembly,,,
Gomoa East District Assembly,2011,CONSTRUCTION OF 1 NO 3 UNIT CLASSROOM BLOCK WITH ANCILLARY FACILITIES,getfund,,,,,,Gomoa East District Assembly,,,
Gomoa East District Assembly,2011,CONSTRUCTION OF INFORMATION COMMUNICATION TECHNOLOGY (ICT) COMPLEX,multiple,,,,,,Gomoa East District Assembly,,,
Gomoa East District Assembly,2011,SPOT IMPROVEMENT OF (7.80 KM) FEEDER ROAD,other donor,,,,,,Gomoa East District Assembly,,,
Gomoa East District Assembly,2011,3.30 KM SPOT IMPROVEMENT OF PAN AFRICA UNIV COLLEGE JN PAN AFRICA UNIV COLLEGE (0.75 KM) ASEBU RESIDENTIAL AREA 0.55KM) POMADZE POLICE RESIDENCE (0.95 KM) POMADZE NEW SITE (1.05KM),dacf,,,,,,Gomoa East District Assembly,,,
Gomoa East District Assembly,2011,CONSTRUCTION OF FENCE WALL AND ANCILLARY WORKS AT DCD AND DFO BUNGALOWS,dacf,,,,,,Gomoa East District Assembly,,,
Gomoa East District Assembly,2011,CONSTRUCTION OF FENCE WALL AND ANCILLARY WORKS AT DCE BUNGALOW,dacf,,,,,,Gomoa East District Assembly,,,
Gomoa East District Assembly,2011,CONSTRUCTION OF MARKET COMPLEX (PHASE 1),dacf,,,,,,Gomoa East District Assembly,,,
Gomoa East District Assembly,2011,EXTENSION OF PIPE BORNE WATER FROM MANFE KOPE ADABRA JN TO MANFE KOPE ADABRA,other donor,,,,,,Gomoa East District Assembly,,,
Gomoa East District Assembly,2011,EXTENSION OF PIPE BORNE WATER FROM AFRANSI TO OFASO,ddf,,,,,,Gomoa East District Assembly,,,
Gomoa West District Assembly,2011,3-UNIT CLASSROOM BLOCK OFFICE STORE WITH 4-SEATER KVIP,other donor,,9/20/2009,,,,Gomoa West District Assembly,,2009-09-20,
Gomoa West District Assembly,2011,CONSTRUCTION OF 6-UNIT CLASSROOM BLOCK LIBRARY OFFICE AND STORE,other donor,,9/29/2009,,,,Gomoa West District Assembly,,2009-09-29,
Gomoa West District Assembly,2011,CONSTRUCTION OF 6-UNIT CLASSROOM BLOCK LIBRARY OFFICE AND STORE,other donor,,9/29/2009,,,,Gomoa West District Assembly,,2009-09-29,
Gomoa West District Assembly,2011,CONSTRUCTION OF 6-UNIT CLASSROOM BLOCK LIBRARY OFFICE AND STORE,other donor,,9/29/2009,,,,Gomoa West District Assembly,,2009-09-29,
Gomoa West District Assembly,2011,CONSTRUCTION OF 3 UNIT CLASSROOM BLOCK LIBRARY OFFICE AND STORE,other donor,,9/20/2009,,,,Gomoa West District Assembly,,2009-09-20,
Gomoa West District Assembly,2011,CONSTRUCTION OF 3 UNIT CLASSROOM BLOCK LIBRARY OFFICE AND STORE,other donor,,9/20/2009,,,,Gomoa West District Assembly,,2009-09-20,
Gomoa West District Assembly,2011,CONSTRUCTION OF 3 UNIT CLASSROOM BLOCK & 4-SEATER TOILET,multiple,,Aug-08,,,,Gomoa West District Assembly,,2008-08-01,
Gomoa West District Assembly,2011,CONSTRUCTION OF 6 UNIT CLASSROOM BLOCK LIBRARY OFFICE AND STORE,multiple,,Feb-09,,,,Gomoa West District Assembly,,2009-02-01,
Gomoa West District Assembly,2011,CONSTRUCTION OF 6-UNIT TEACHERS QUARTERS,multiple,,Feb-09,,,,Gomoa West District Assembly,,2009-02-01,
Gomoa West District Assembly,2011,CONSTRUCTION OF 6 UNIT CLASSROOM BLOCK LIBRARY OFFICE AND STORE,multiple,,Feb-09,,,,Gomoa West District Assembly,,2009-02-01,
Gomoa West District Assembly,2011,CONSTRUCTION OF EARY CHILDHOOD DEVELOPMENT CENTRE WITH CANTEEN,multiple,,Feb-09,,,,Gomoa West District Assembly,,2009-02-01,
Gomoa West District Assembly,2011,CONSTRUCTION OF 6 UNIT TEACHERS QUARTER,multiple,,Feb-09,,,,Gomoa West District Assembly,,2009-02-01,
Gomoa West District Assembly,2011,CONSTRUCTION OF 6 UNIT CLASSROOM BLOCK LIBRARY OFFICE AND STORE,multiple,,Feb-09,,,,Gomoa West District Assembly,,2009-02-01,
Gomoa West District Assembly,2011,CONSTRUCTION OF 6 UNIT TEACHERS QUARTERS,multiple,,Feb-09,,,,Gomoa West District Assembly,,2009-02-01,
Gomoa West District Assembly,2011,CONSTRUCTION OF 6 UNIT CLASSROOM BLOCK LIBRARY OFFICE AND STORE,multiple,,Feb-09,,,,Gomoa West District Assembly,,2009-02-01,
Gomoa West District Assembly,2011,CONSTRUCTION OF EARY CHILDHOOD DEVELOPMENT CENTRE WITH CANTEEN,multiple,,Feb-09,,,,Gomoa West District Assembly,,2009-02-01,
Gomoa West District Assembly,2011,CONSTRUCTION OF 6 UNIT CLASSROOM BLOCK LIBRARY OFFICE AND STORE,multiple,,Feb-09,,,,Gomoa West District Assembly,,2009-02-01,
Gomoa West District Assembly,2011,CONSTRUCTION OF 6 UNIT TEACHERS QUARTERS,multiple,,Feb-09,,,,Gomoa West District Assembly,,2009-02-01,
Gomoa West District Assembly,2011,CONSTRUCTION OF EARY CHILDHOOD DEVELOPMENT CENTRE,multiple,,Feb-09,,,,Gomoa West District Assembly,,2009-02-01,
Gomoa West District Assembly,2011,CONSTRUCTION OF EARY CHILDHOOD DEVELOPMENT CENTRE WITH CANTEEN,multiple,,Feb-09,,,,Gomoa West District Assembly,,2009-02-01,
Gomoa West District Assembly,2011,CONSTRUCTION OF 6 UNIT CLASSROOM BLOCK LIBRARY OFFICE AND STORE,multiple,,Feb-09,,,,Gomoa West District Assembly,,2009-02-01,
Gomoa West District Assembly,2011,CONSTRUCTION OF 6 UNIT STAFF QUARTERS,multiple,,Feb-09,,,,Gomoa West District Assembly,,2009-02-01,
Gomoa West District Assembly,2011,REHABILITATION OF APAM JUNCTION MARKET PROVISION OF 4 NO 20 UNIT MARKET STALLS,multiple,,Feb-09,,,,Gomoa West District Assembly,,2009-02-01,
Gomoa West District Assembly,2011,REHABILITATION OF APAM JUNCTION MARKET PROVISION OF A CRECHE,multiple,,Feb-09,,,,Gomoa West District Assembly,,2009-02-01,
Gomoa West District Assembly,2011,CONSTRUCTION OF 1 NO 10 SEATER WC TOILET,multiple,,Feb-09,,,,Gomoa West District Assembly,,2009-02-01,
Gomoa West District Assembly,2011,CONSTRUCTION OF 50 BED FEMALE SURGICAL & MEDICAL WARD,multiple,,Feb-09,,,,Gomoa West District Assembly,,2009-02-01,
Gomoa West District Assembly,2011,CONSTRUCTION OF CHILD WELFARE CLINIC,multiple,,Feb-09,,,,Gomoa West District Assembly,,2009-02-01,
Gomoa West District Assembly,2011,CONSTRUCTION OF LABORATORY,multiple,,Feb-09,,,,Gomoa West District Assembly,,2009-02-01,
Gomoa West District Assembly,2011,CONSTRUCTION OF MOTHERS HOSTEL,multiple,,Feb-09,,,,Gomoa West District Assembly,,2009-02-01,
Gomoa West District Assembly,2011,REHABILITATION OF APAM FISH MARKET,multiple,,Feb-09,,,,Gomoa West District Assembly,,2009-02-01,
Gomoa West District Assembly,2011,CONSTRUCTION OF 15 NO REFUSE CONTAINER PLATFORMS,multiple,,Feb-09,,,,Gomoa West District Assembly,,2009-02-01,
Gomoa West District Assembly,2011,REHABILITATION AND EXPANSION OF APAM JUNCTION MARKET CONSTRUCTION OF WAREHOUSE & REVENUE COLLECTION OFFICES,multiple,,Feb-09,,,,Gomoa West District Assembly,,2009-02-01,
Gomoa West District Assembly,2011,CONSTRUCTION OF ICT/TEACHERS RESOURCE CENTRE,multiple,,Feb-09,,,,Gomoa West District Assembly,,2009-02-01,
Gomoa West District Assembly,2011,PAVEMENT OF KANTAM LORRY PARK,multiple,,Feb-09,,,,Gomoa West District Assembly,,2009-02-01,
Gomoa West District Assembly,2011,CONSTRUCTION OF 10 SEATER WATER CLOSETS SUITES AT KANTAM LORRY PARK,multiple,,Feb-09,,,,Gomoa West District Assembly,,2009-02-01,
Gomoa West District Assembly,2011,REHABILITATION AND EXPANSION OF APAM JUNCTION MARKET CONSTRUCTION OF 2 NO 10 SEATER WATER CLOSET SUITES,multiple,,Feb-09,,,,Gomoa West District Assembly,,2009-02-01,
Gomoa West District Assembly,2011,CONSTRUCTION OF 6 UNIT TEACHERS QUARTERS,multiple,,Feb-09,,,,Gomoa West District Assembly,,2009-02-01,
Gomoa West District Assembly,2011,SPOT IMPROVEMENT OF DAWURAMPONG TO DEBISO (3.6KM),other donor,,9/8/2009,,,,Gomoa West District Assembly,,2009-09-08,
Gomoa West District Assembly,2011,CONSTRUCTION OF 6 SEATER KVIP LATRINES AT ABONKO DA JHS AKYEMFO METH PRI ANKAMU ISLAMIC PRI,other donor,,9/17/2009,,,,Gomoa West District Assembly,,2009-09-17,
Gomoa West District Assembly,2011,CONSTRUCTION OF 6 SEATER KVIP LATRINES AT ESHIEM ROMAN CATHOLIC PRI JHS TARKWA ISLAMIC PRI & APAM CATHOLIC PRI,other donor,,9/17/2009,,,,Gomoa West District Assembly,,2009-09-17,
Gomoa West District Assembly,2011,CONSTRUCTION OF 3NO KICHEN AND INSTITUTIONAL LATRINES FOR POLICE OFFICES,dacf,,Jul-09,,,,Gomoa West District Assembly,,2009-07-01,
Gomoa West District Assembly,2011,CONSTRUCTION OF AREA COUNCIL OFFICE,dacf,,5/26/2008,,,,Gomoa West District Assembly,,2008-05-26,
Gomoa West District Assembly,2011,REHABILITATION AND CONSTRUCTION OF 2NO 20 UNIT MARKET SHEAD,dacf,,Sep-10,,,,Gomoa West District Assembly,,2010-09-01,
Gomoa West District Assembly,2011,REHABILITATION OF DISTRICT ADMINISTRATION BLOCK,dacf,,Mar-10,,,,Gomoa West District Assembly,,2010-03-01,
Gomoa West District Assembly,2011,FINAL SEALING OF DISTRICT ASSEMBLY FRONTAGE,dacf,,,,,,Gomoa West District Assembly,,,
Gomoa West District Assembly,2011,CONSTRUCTION OF 3 UNIT CLASSROOM BLOCK,dacf,,,,,,Gomoa West District Assembly,,,
Gomoa West District Assembly,2011,CONSTRUCTION OF 3 UNIT CLASSROOM BLOCK,dacf,,,,,,Gomoa West District Assembly,,,
Gomoa West District Assembly,2011,COMPLETION OF LIBRARY,dacf,,,,,,Gomoa West District Assembly,,,
Gomoa West District Assembly,2011,RENOVATION OF ICT CENTRE,dacf,,,,,,Gomoa West District Assembly,,,
Gomoa West District Assembly,2011,COMPLETION OF DCE BUNGALOW,dacf,,,,,,Gomoa West District Assembly,,,
Gomoa West District Assembly,2011,REHABILITATION OF APAM METHODIST PRIMARY,dacf,,,,,,Gomoa West District Assembly,,,
Gomoa West District Assembly,2011,RENOVATION OF DCDS BUNGALOW,dacf,,,,,,Gomoa West District Assembly,,,
Gomoa West District Assembly,2011,RENOVATION OF DFOS BUNGALOW,dacf,,,,,,Gomoa West District Assembly,,,
Gomoa West District Assembly,2011,RENOVATION OF DBAS BUNGALOW,dacf,,Nov-11,,,,Gomoa West District Assembly,,2011-11-01,
Gomoa West District Assembly,2011,SUPPLY OF 1NO WATER TANKER,other/unknown,,Dec-10,,,,Gomoa West District Assembly,,2010-12-01,
Gomoa West District Assembly,2011,CONSTRUCTION,other/unknown,12/1/2010,,,,,Gomoa West District Assembly,2010-12-01,,
Gomoa West District Assembly,2011,CONSTRUCTION,other/unknown,12/1/2010,,,,,Gomoa West District Assembly,2010-12-01,,
Gomoa West District Assembly,2011,CONSTRUCTION,other/unknown,12/17/2010,,,,,Gomoa West District Assembly,2010-12-17,,
Gomoa West District Assembly,2011,CONSTRUCTION,other/unknown,12/17/2010,,,,,Gomoa West District Assembly,2010-12-17,,
Gomoa West District Assembly,2011,CONSTRUCTION,other/unknown,12/17/2010,,,,,Gomoa West District Assembly,2010-12-17,,
Gomoa West District Assembly,2011,CONSTRUCTION 2UNIT KG BLOCK,other/unknown,11/29/2010,,,,,Gomoa West District Assembly,2010-11-29,,
Gomoa West District Assembly,2011,CONSTRUCTION NURSES QTRS,other/unknown,12/17/2010,,,,,Gomoa West District Assembly,2010-12-17,,
Gomoa West District Assembly,2011,CONSTRUCTION 12SEATER AQUA PRIVY,other/unknown,12/27/2010,,,,,Gomoa West District Assembly,2010-12-27,,
Gomoa West District Assembly,2011,CONSTRUCTION 2UNIT KG BLOCK,other/unknown,11/29/2010,,,,,Gomoa West District Assembly,2010-11-29,,
Gomoa West District Assembly,2011,CONSTRUCTION 10SEATER AQUA PRIVY LATRINE,other/unknown,12/27/2010,,,,,Gomoa West District Assembly,2010-12-27,,
Gomoa West District Assembly,2011,CONSTRUCTION 3UNIT CLASSROOM BLOCK,other/unknown,12/15/2010,,,,,Gomoa West District Assembly,2010-12-15,,
Gushegu District Assembly,2011,,,,,,,,Gushegu District Assembly,,,
Ho Municipal Assembly,2011,,,,,,,,Ho Municipal Assembly,,,
Hohoe Municipal Assembly,2011,,,,,,,,Hohoe Municipal Assembly,,,
Jaman North District Assembly,2011,COMPLETION OF 1NO 3 UNIT CLASSROOM BLOCK WITH OFFICE STORE LIBRARY AND STAFF COMMON ROOM WITH 4 SEATER KVIP TOILET & URINAL AT SAMPA PRES SCH,dacf,1/26/2010,2/17/2010,,,,Jaman North District Assembly,2010-01-26,2010-02-17,
Jaman North District Assembly,2011,COMPLETION OF LIBRARY BLOCK AT SAMPA ISLAMIC JHS,dacf,1/26/2010,2/17/2010,,,,Jaman North District Assembly,2010-01-26,2010-02-17,
Jaman North District Assembly,2011,COMPLETION OF LIBRARY BLOCK AT DUADASO NO 2 PRIM,dacf,1/26/2010,2/17/2010,,,,Jaman North District Assembly,2010-01-26,2010-02-17,
Jaman North District Assembly,2011,CONST OF 1NO 3 UNIT CLASSROOM BLOCK WITH ANCILLARY FACILITIES,dacf,1/26/2010,2/17/2010,,,,Jaman North District Assembly,2010-01-26,2010-02-17,
Jaman North District Assembly,2011,CONST OF 1NO SEMI DETACHED SENIOR STAFF QUARTERS,dacf,1/26/2010,2/17/2010,,,,Jaman North District Assembly,2010-01-26,2010-02-17,
Jaman North District Assembly,2011,COMPLETION OF 1NO MATERNITY BLOCK,dacf,1/26/2010,2/17/2010,,,,Jaman North District Assembly,2010-01-26,2010-02-17,
Jaman North District Assembly,2011,CONST OF 1NO 6 UNITS CLASSROOM BLOCKS AND ANCILLARY FACILITIES AT SAMPA MODEL PRIM SCH,getfund,8/6/2011,10/16/2010,,,,Jaman North District Assembly,2011-08-06,2010-10-16,
Jaman North District Assembly,2011,CONST OF 1NO 6 UNITS CLASSROOM BLOCKS AND ANCILLARY FACILITIES AT GOKA DEMONSTRATION PRIM SCHOOL,getfund,9/6/2011,10/16/2010,,,,Jaman North District Assembly,2011-09-06,2010-10-16,
Jaman North District Assembly,2011,CONST OF 1NO 6UNITS CLASSROOM BLOCKS AND ANCILLARY FACILITIES AT JININI PRIMARY SCHOOL,getfund,9/6/2011,10/16/2010,,,,Jaman North District Assembly,2011-09-06,2010-10-16,
Jaman North District Assembly,2011,CONST OF 1NO 6 UNITS CLASSROOM BLOCKS AND ANCILLARY FACILITIES DUADASO PRESBY PRIM SCH,getfund,9/6/2011,10/16/2010,,,,Jaman North District Assembly,2011-09-06,2010-10-16,
Jaman North District Assembly,2011,CONSTRUCTION OF SMALL WATER SUPPLY PROJECT,other gog,,,,,,Jaman North District Assembly,,,
Jaman North District Assembly,2011,DRILLING AND CONSTRUCTION OF 12 NO BOREHOLES IN SELECTED COMMUNITIES,other/unknown,,,,,,Jaman North District Assembly,,,
Jaman North District Assembly,2011,CONSTRUCTION OF OFFICE BLOCK FOR LAMAI NORTH DISTRICT ASSEMBLY,igf,,,,,,Jaman North District Assembly,,,
Jaman South District Assembly,2011,RESHAPING OF ADAMSU-ZEZERA FEEDER ROADS,dacf,Aug-11,,,,,Jaman South District Assembly,2011-08-01,,
Jaman South District Assembly,2011,CONSTRUCTION OF 1 NO 6 UNIT CLASSROOM BLK AND ANCILLARY FACILITIES AT ATUNA,other gog,1/12/2011,,,,,Jaman South District Assembly,2011-01-12,,
Jaman South District Assembly,2011,CONSTRUCTION OF 1 NO 6 UNIT CLASSROOM BLK AND ANCILLARY FACILITIES AT ADIAKO,other gog,1/12/2011,,,,,Jaman South District Assembly,2011-01-12,,
Jaman South District Assembly,2011,CONST OF 12 UNIT CLASSROOM BLOCK WITH STORE AT OLP,getfund,1/26/2011,,,,,Jaman South District Assembly,2011-01-26,,
Jaman South District Assembly,2011,RESHAPING OF FEEDER ROADS,multiple,Oct-10,,,,,Jaman South District Assembly,2010-10-01,,
Jaman South District Assembly,2011,PROVISION OF 12 NO BOREHOLES DISTRICT WIDE,other gog,Oct-10,,,,,Jaman South District Assembly,2010-10-01,,
Jaman South District Assembly,2011,DISLODGEMENT OF 14 PUBLIC TOILETS (MANUAL),dacf,Oct-10,,,,,Jaman South District Assembly,2010-10-01,,
Jaman South District Assembly,2011,ACQUISITION OF FINAL REFUSE DISPOSAL SITE AT DROBO,dacf,Oct-10,,,,,Jaman South District Assembly,2010-10-01,,
Jaman South District Assembly,2011,CONST OF 1 NO 1 UNIT CLASS ROOM BLOCK AT DWENEM,other gog,Oct-10,,,,,Jaman South District Assembly,2010-10-01,,
Jaman South District Assembly,2011,CONST OF 1 NO 6 UNIT CLASS ROOM BLOCK AT DROBO,other gog,Oct-10,,,,,Jaman South District Assembly,2010-10-01,,
Jaman South District Assembly,2011,CONST OF 1 NO 6 UNIT CLASS ROOM BLOCK AT AKOSUA FEBIRI DROBO,other gog,Oct-10,,,,,Jaman South District Assembly,2010-10-01,,
Jaman South District Assembly,2011,CONST OF 3 UNIT CLASSROOM BLOCK AT DODOSUO,other/unknown,Nov-04,,,,,Jaman South District Assembly,2004-11-01,,
Jaman South District Assembly,2011,CONST OF AREA COUNCIL AT KWAMESEIKROM,dacf,Nov-04,,,,,Jaman South District Assembly,2004-11-01,,
Jaman South District Assembly,2011,CONST OF 1 NO ADM BLOCK FOR OLP AT KWASIBOURKROM,dacf,Nov-04,,,,,Jaman South District Assembly,2004-11-01,,
Jaman South District Assembly,2011,CONST OF SLAUGHTER HOUSE AT JAPEKROM,dacf,Dec-04,,,,,Jaman South District Assembly,2004-12-01,,
Jaman South District Assembly,2011,CONST OF 1 NO BUTCHERS SHOP AT JAPEKROM,dacf,Jan-06,,,,,Jaman South District Assembly,2006-01-01,,
Jaman South District Assembly,2011,CONST OF 6 UNIT CLASSROOM BLOCK AT ZEZERA,dacf,Dec-05,,,,,Jaman South District Assembly,2005-12-01,,
Jaman South District Assembly,2011,RENOVATION & COMPLETION OF 6 UNIT CLASSROOM BLOCK AT MPUOASU,dacf,Dec-05,,,,,Jaman South District Assembly,2005-12-01,,
Jaman South District Assembly,2011,CONST OF 1 NO 3 STOREY DIST ASSEM ADM BLOCK AT DROBO,dacf,Dec-06,,,,,Jaman South District Assembly,2006-12-01,,
Jaman South District Assembly,2011,CONST OF DIST FIRE STATION,dacf,Dec-06,,,,,Jaman South District Assembly,2006-12-01,,
Jaman South District Assembly,2011,CONST OF NHIS BLK @ DROBO,dacf,Dec-06,,,,,Jaman South District Assembly,2006-12-01,,
Jaman South District Assembly,2011,CONST OF WARE HOUSE AT DROBO,dacf,Sep-06,,,,,Jaman South District Assembly,2006-09-01,,
Jaman South District Assembly,2011,CONSTRUCTION OF 1 NO 3 UNIT JHS BLK AND ANCILLARY FACILITIES AT JAPEKROM,multiple,Jan-10,,,,,Jaman South District Assembly,2010-01-01,,
Jaman South District Assembly,2011,CONTINUES WORK ON STEEL BRIDGE AT ASANE JANKUFU FEEDER ROADS,other gog,Jan-10,,,,,Jaman South District Assembly,2010-01-01,,
Jaman South District Assembly,2011,CONST OF 2 NO SEPTIC TANK TOILET AT ATUNA AND ADAMSU,dacf,Mar-10,,,,,Jaman South District Assembly,2010-03-01,,
Jaman South District Assembly,2011,CONST OF 2 NO SEMI DETACH BUNGALOW AT DROBO,dacf,Jan-10,,,,,Jaman South District Assembly,2010-01-01,,
Jaman South District Assembly,2011,CONST OF FENCE WALL AROUND DCES RESIDENCE,dacf,2/19/2010,,,,,Jaman South District Assembly,2010-02-19,,
Jaman South District Assembly,2011,CONST 1 NO POLYCLINIC AT DROBO,dacf,4/21/2010,,,,,Jaman South District Assembly,2010-04-21,,
Jaman South District Assembly,2011,1 CONST OF 1 NO 6 UNIT CLASSROOM BLOCK WITH OFFICE AND STORE AT DROBO,dacf,8/30/2010,,,,,Jaman South District Assembly,2010-08-30,,
Jasikan District Assembly,2011,RENOV OF 3NO BUNGALOW,dacf,,,,,,Jasikan District Assembly,,,
Jasikan District Assembly,2011,RENOV OF BUNGALOW NO A 091,dacf,,,,,,Jasikan District Assembly,,,
Jasikan District Assembly,2011,RENOV OF DCE BUNGALOW,dacf,,,,,,Jasikan District Assembly,,,
Jasikan District Assembly,2011,RENOV OF GES BUNGALOW,dacf,,,,,,Jasikan District Assembly,,,
Jasikan District Assembly,2011,DRILLING OF 6NO BOREHOLES,other donor,,,,,,Jasikan District Assembly,,,
Jasikan District Assembly,2011,CONSTRUCTION OF 2NO FERRO CEMENT TANK,other donor,,,,,,Jasikan District Assembly,,,
Jasikan District Assembly,2011,CONSTR OF 3 UNIT CLASSROOM,dacf,,,,,,Jasikan District Assembly,,,
Jasikan District Assembly,2011,CONST OF AREA COUNCIL OFFICE,dacf,,,,,,Jasikan District Assembly,,,
Jasikan District Assembly,2011,CONSTRUCTION OF 6 UNIT CLASSROOM,getfund,,,,,,Jasikan District Assembly,,,
Jasikan District Assembly,2011,CONSTRUCTION OF 6 UNIT CLASSROOM,getfund,,,,,,Jasikan District Assembly,,,
Jasikan District Assembly,2011,CONSTRUCTION OF 6 UNIT CLASSROOM,getfund,,,,,,Jasikan District Assembly,,,
Jasikan District Assembly,2011,CONSTRUCTION OF 6 UNIT CLASSROOM,other donor,,,,,,Jasikan District Assembly,,,
Jasikan District Assembly,2011,CONSTRUCTION OF 10NO KVIP,other donor,,,,,,Jasikan District Assembly,,,
Jasikan District Assembly,2011,REHABILITATION OF PUBLIC TOILET,dacf,,,,,,Jasikan District Assembly,,,
Jasikan District Assembly,2011,CONSTRUCTION OF 12 SEATER VAULT CHAMBER,ddf,,,,,,Jasikan District Assembly,,,
Jasikan District Assembly,2011,CONSTRUCTION OF FENCE WALL OPEN SHED,ddf,,,,,,Jasikan District Assembly,,,
Jasikan District Assembly,2011,CONSTRUCTION OF 4 SEATER KVIP LATRINE,dacf,,,,,,Jasikan District Assembly,,,
Jasikan District Assembly,2011,CONSTRUCTION OF 2NO 4 SEATER KVIP,dacf,,,,,,Jasikan District Assembly,,,
Jasikan District Assembly,2011,RENOVATION OF 12 LOCKABLE STORES AND 2NO OPEN SHEDS AND MEAT SHOP,ddf,,,,,,Jasikan District Assembly,,,
Jasikan District Assembly,2011,REHABILITATION OF STREET LIGHT,ddf,,,,,,Jasikan District Assembly,,,
Jasikan District Assembly,2011,SPOT IMPROVEMENT OF 13.5KM FDR ROADS,other donor,,,,,,Jasikan District Assembly,,,
Jasikan District Assembly,2011,CONST OF U DRAIN,ddf,,,,,,Jasikan District Assembly,,,
Jasikan District Assembly,2011,CONSTRUCTION OF ICT CENTER,other gog,,,,,,Jasikan District Assembly,,,
Jasikan District Assembly,2011,DRILLING OF 8NO BHS,other donor,,,,,,Jasikan District Assembly,,,
Jasikan District Assembly,2011,CONSTRUCTION OF 6 UNIT CLASSROOM,getfund,,,,,,Jasikan District Assembly,,,
Jasikan District Assembly,2011,CONSTRUCTION OF 6 UNIT CLASSROOM,getfund,,,,,,Jasikan District Assembly,,,
Jasikan District Assembly,2011,CONSTRUCTION OF 6 UNIT CLASSROOM,getfund,,,,,,Jasikan District Assembly,,,
Jirapa District Assembly,2011,CONSTRUCTION OF CHPS COMPOUND,other/unknown,,19-Apr,,,,Jirapa District Assembly,,2018-04-19,
Jirapa District Assembly,2011,REHABILITATION OF 3 UNIT CLASSROOM BLOCK OFFICE AND STORE,other/unknown,,28-Apr,,,,Jirapa District Assembly,,2018-04-28,
Jirapa District Assembly,2011,CONSTRUCTION OF 8 UNIT MARKET SHED,other/unknown,,19-Apr,,,,Jirapa District Assembly,,2018-04-19,
Jirapa District Assembly,2011,CONSTRUCTION OF 8 UNIT MARKET SHED,other/unknown,,19-Apr,,,,Jirapa District Assembly,,2018-04-19,
Jirapa District Assembly,2011,CONSTRUCTION OF 8 UNIT MARKET SHED,other/unknown,,19-Apr,,,,Jirapa District Assembly,,2018-04-19,
Jirapa District Assembly,2011,CONSTRUCTION OF SLAUGHTER HOUSE,other/unknown,,19-Apr,,,,Jirapa District Assembly,,2018-04-19,
Jirapa District Assembly,2011,CONSTRUCTION OF CHPS COMPOUND,other/unknown,,19-Apr,,,,Jirapa District Assembly,,2018-04-19,
Jirapa District Assembly,2011,CONSTRUCTION OF 3 UNIT CLASSROOM BLOCK WITH ANCILLARY FACILITIES,other/unknown,,19-Apr,,,,Jirapa District Assembly,,2018-04-19,
Jirapa District Assembly,2011,CONSTRUCTION OF 2 UNIT DAY CARE CENTRE,other/unknown,,19-Apr,,,,Jirapa District Assembly,,2018-04-19,
Jirapa District Assembly,2011,CONSTRUCTION OF 2 UNIT DAY CARE CENTRE,other/unknown,,19-Apr,,,,Jirapa District Assembly,,2018-04-19,
Jirapa District Assembly,2011,CONSTRUCTION OF SEMI DETACHED TEACHERS QUARTERS,other/unknown,,19-Apr,,,,Jirapa District Assembly,,2018-04-19,
Jirapa District Assembly,2011,CONSTRUCTION OF SEMI DETACHED TEACHERS QUARTERS,other/unknown,,19-Apr,,,,Jirapa District Assembly,,2018-04-19,
Jirapa District Assembly,2011,RESHAPING OF 5.6 KM ROAD,other/unknown,,19-Apr,,,,Jirapa District Assembly,,2018-04-19,
Jirapa District Assembly,2011,RESHAPING OF 1.4KM ROAD,other/unknown,,19-Apr,,,,Jirapa District Assembly,,2018-04-19,
Jirapa District Assembly,2011,RESHAPING OF 1.2 KM ROAD,other/unknown,,19-Apr,,,,Jirapa District Assembly,,2018-04-19,
Jirapa District Assembly,2011,RESHAPING OF 1.1KM ROAD,other/unknown,,19-Apr,,,,Jirapa District Assembly,,2018-04-19,
Jirapa District Assembly,2011,RESHAPING OF 0.5KM ROAD,other/unknown,,19-Apr,,,,Jirapa District Assembly,,2018-04-19,
Jirapa District Assembly,2011,RESHAPING OF 2.1KM ROAD,other/unknown,,19-Apr,,,,Jirapa District Assembly,,2018-04-19,
Jirapa District Assembly,2011,CONSTRUCTION OF SEMI DETACHED TEACHERS QUARTERS,other/unknown,,19-Apr,,,,Jirapa District Assembly,,2018-04-19,
Jirapa District Assembly,2011,RESHAPING OF 5.6 KM ROAD,other/unknown,,19-Apr,,,,Jirapa District Assembly,,2018-04-19,
Jirapa District Assembly,2011,RESHAPING OF 1.4KM ROAD,other/unknown,,19-Apr,,,,Jirapa District Assembly,,2018-04-19,
Jirapa District Assembly,2011,RESHAPING OF 1.2 KM ROAD,other/unknown,,19-Apr,,,,Jirapa District Assembly,,2018-04-19,
Jirapa District Assembly,2011,RESHAPING OF 1.1KM ROAD,other/unknown,,19-Apr,,,,Jirapa District Assembly,,2018-04-19,
Jirapa District Assembly,2011,RESHAPING OF 0.5KM ROAD,other/unknown,,19-Apr,,,,Jirapa District Assembly,,2018-04-19,
Jirapa District Assembly,2011,RESHAPING OF 2.1 KM ROAD,other/unknown,,19-Apr,,,,Jirapa District Assembly,,2018-04-19,
Jirapa District Assembly,2011,RESHAPING OF 0.8KM ROAD,other/unknown,,19-Apr,,,,Jirapa District Assembly,,2018-04-19,
Jirapa District Assembly,2011,CONNECT ELECTRICITY TO MARKET,other/unknown,,19-Apr,,,,Jirapa District Assembly,,2018-04-19,
Jirapa District Assembly,2011,MAINTENANCE OF STREETS LIGHTS,other/unknown,,19-Apr,,,,Jirapa District Assembly,,2018-04-19,
Jirapa District Assembly,2011,CONSTRUCTION OF 1NO AQUA PRIVY TOILET,other/unknown,,19-Apr,,,,Jirapa District Assembly,,2018-04-19,
Jirapa District Assembly,2011,CONSTRUCTION OF 5NO 6 UNIT CLASSROOM BLOCK,other/unknown,,19-Apr,,,,Jirapa District Assembly,,2018-04-19,
Jirapa District Assembly,2011,CONSTRUCTION OF 3 UNIT CLASSROOM BLOCK,other/unknown,,19-Apr,,,,Jirapa District Assembly,,2018-04-19,
Jirapa District Assembly,2011,CONSTRUCTION OF 3 UNIT CLASSROOM BLOCK,other/unknown,,19-Apr,,,,Jirapa District Assembly,,2018-04-19,
Jirapa District Assembly,2011,CONSTRUCTION OF 3NO SEMI DETACHED STAFF QUARTERS,other/unknown,,19-Apr,,,,Jirapa District Assembly,,2018-04-19,
Jirapa District Assembly,2011,REHABILITATION OF 3 UNIT CLASSROOM BLOCK,other/unknown,,19-Apr,,,,Jirapa District Assembly,,2018-04-19,
Jirapa District Assembly,2011,CONSTRUCTION OF 3 UNIT CLASSROOM BLOCK WITH A WASH ROOM,other/unknown,,19-Apr,,,,Jirapa District Assembly,,2018-04-19,
Jirapa District Assembly,2011,FACE-UPLIFTMENT OF RURAL CLINIC,other/unknown,,19-Apr,,,,Jirapa District Assembly,,2018-04-19,
Jirapa District Assembly,2011,CONSTRUCTION OF 2 NO CHPS COMPOUND,other/unknown,,19-Apr,,,,Jirapa District Assembly,,2018-04-19,
Jirapa District Assembly,2011,RENOVATION OF AREA COUNCILS,other/unknown,,20-Jun,,,,Jirapa District Assembly,,2018-06-20,
Jirapa District Assembly,2011,RENOVATION OF AREA COUNCILS,other/unknown,,20-Jun,,,,Jirapa District Assembly,,2018-06-20,
Jirapa District Assembly,2011,RENOVATION OF AREA COUNCILS,other/unknown,,20-Jun,,,,Jirapa District Assembly,,2018-06-20,
Jirapa District Assembly,2011,RENOVATION OF AREA COUNCILS,other/unknown,,20-Jun,,,,Jirapa District Assembly,,2018-06-20,
Jirapa District Assembly,2011,RENOVATION OF AREA COUNCILS,other/unknown,,20-Jun,,,,Jirapa District Assembly,,2018-06-20,
Jirapa District Assembly,2011,RENOVATION OF AREA COUNCILS,other/unknown,,20-Jun,,,,Jirapa District Assembly,,2018-06-20,
Jirapa District Assembly,2011,RENOVATION OF AREA COUNCILS,other/unknown,,20-Jun,,,,Jirapa District Assembly,,2018-06-20,
Jirapa District Assembly,2011,RENOVATION OF AREA COUNCILS,other/unknown,,20-Jun,,,,Jirapa District Assembly,,2018-06-20,
Jirapa District Assembly,2011,CONNECTION OF ELECTRICITY TO POLICE QUARTERS,other/unknown,,20-Jun,,,,Jirapa District Assembly,,2018-06-20,
Jirapa District Assembly,2011,COMPLETION OF POLICE STATION,other/unknown,,20-Jun,,,,Jirapa District Assembly,,2018-06-20,
Jomoro District Assembly,2011,,,,,,,,Jomoro District Assembly,,,
Juaboso District Assembly,2011,,,,,,,,Juaboso District Assembly,,,
Kadjebi District Assembly,2011,PROVISION OF STREET LIGHTS IN ALL MAJOR TOWNS IN THE DISTRICT,igf,,,,,,Kadjebi District Assembly,,,
Kadjebi District Assembly,2011,SPORT IMPROVEMENT OF ACCESS FEEDER ROADS,multiple,,,,,,Kadjebi District Assembly,,,
Kadjebi District Assembly,2011,CONSTRUCTION OF 20 NO BOREHOLES,multiple,,,,,,Kadjebi District Assembly,,,
Kadjebi District Assembly,2011,SUPPORT WASTE MANAGEMENT PROGRAMME,igf,,,,,,Kadjebi District Assembly,,,
Kadjebi District Assembly,2011,CONSTRUCT 3NO 3 UNIT CLASSROOM BLOCK,ddf,,,,,,Kadjebi District Assembly,,,
Kadjebi District Assembly,2011,UPGRADE KADJEBI HEALTH CENTER TO A HOSPITAL (PHASE 1),igf,,,,,,Kadjebi District Assembly,,,
Kadjebi District Assembly,2011,CONSTRUCT 6 UNITS CLASSROOM BLOCKS STAFF COMMON ROOM AND LIBRARY,multiple,,,,,,Kadjebi District Assembly,,,
Kadjebi District Assembly,2011,CONSTRUCTION OF SEMI-DETACHED BUNGALOW,igf,,,,,,Kadjebi District Assembly,,,
Kadjebi District Assembly,2011,CONSTRUCTION OF 2NO CULVERTS AT AMEGATSE &PEPESU,igf,,,,,,Kadjebi District Assembly,,,
Kadjebi District Assembly,2011,EXPANSION OF WATER SYSTEM IN 2 COMMUNITIES AT ASATO& DODO FIE,multiple,,,,,,Kadjebi District Assembly,,,
Kadjebi District Assembly,2011,TO CONSTRUCT MARKET SHEDS AT DODO AMANFROM,igf,,,,,,Kadjebi District Assembly,,,
Kadjebi District Assembly,2011,CONST SEVEN (3) UNIT CLASSROOM BLOCKS OFFICE & STORE,igf,,,,,,Kadjebi District Assembly,,,
Kadjebi District Assembly,2011,CONSTRUCT AN OFFICE AT THE CULTURE VILLAGE SITE,igf,,,,,,Kadjebi District Assembly,,,
Kadjebi District Assembly,2011,EXTENSION OF POWER TO NEWLY DEVELOPED AREAS,multiple,,,,,,Kadjebi District Assembly,,,
Kadjebi District Assembly,2011,CONSTRUCT 2NO 10 SEATER TOILET FACILITY AT DODO AMANFROM AND DAPAA JUNCTION,igf,,,,,,Kadjebi District Assembly,,,
Kadjebi District Assembly,2011,REHABILITATE 2NO3UNIT CLASSROOM,igf,,,,,,Kadjebi District Assembly,,,
Kadjebi District Assembly,2011,EDUCATION ON DOMESTIC VIOLENCE ACT AND VIOLENCE AGAINST GIRLS IN SCHOOLS,other/unknown,,,,,,Kadjebi District Assembly,,,
Kadjebi District Assembly,2011,DEVELOP FOOT PATH TO OBULETEY CAVE CROCODILE POND AND MONKEY SANCTUARY AT ASATO,igf,,,,,,Kadjebi District Assembly,,,
Kadjebi District Assembly,2011,ASSIST FARMERS TO ESTABLISH 2 BLOCK FARMS,multiple,,,,,,Kadjebi District Assembly,,,
Kadjebi District Assembly,2011,REHABILITATE 4 NO INSTITUTIONAL LATRINES,multiple,,,,,,Kadjebi District Assembly,,,
Kadjebi District Assembly,2011,CONSTRUCT 2NO SLAUGHTER HOUSES AND MEAT SHOPS AT DODI-PAPASE AND AHAMANSU,ddf,,,,,,Kadjebi District Assembly,,,
Kadjebi District Assembly,2011,CONSTRUCT 1NO 6 UNIT CLASSROOMS,ddf,,,,,,Kadjebi District Assembly,,,
Kadjebi District Assembly,2011,REHABILITATE 1 NO HEALTH FACILITY,multiple,,,,,,Kadjebi District Assembly,,,
Kadjebi District Assembly,2011,REHABILITATE DISTRICT POLICE STATION AT AHAMANSU,multiple,,,,,,Kadjebi District Assembly,,,
Karaga District Assembly,2011,,,,,,,,Karaga District Assembly,,,
Kassena Nankana East Municipal Assembly,2011,,,,,,,,Kassena Nankana East Municipal Assembly,,,
Kassena Nankana West District Assembly,2011,,,,,,,,Kassena Nankana West District Assembly,,,
Keta Municipal Assembly,2011,,,,,,,,Keta Municipal Assembly,,,
Ketu North District Assembly,2011,,,,,,,,Ketu North District Assembly,,,
Ketu South Municipal Assembly,2011,,,,,,,,Ketu South Municipal Assembly,,,
Kintampo North Municipal Assembly,2011,,,,,,,,Kintampo North Municipal Assembly,,,
Kintampo South District Assembly,2011,,,,,,,,Kintampo South District Assembly,,,
Komenda/Edina/Eguafo/ Abirem Municipal Assembly,2011,,,,,,,,Komenda/Edina/Eguafo/ Abirem Municipal Assembly,,,
Kpandai District Assembly,2011,ESTABLISH BIODIVERSITY GROUPS IN VARIOUS COMMUNITIES TO PROTECT RESOURCES EG COMMUNITY RESOURCE MANAGEMENT AREAS CREMAS,other/unknown,,,,,,Kpandai District Assembly,,,
Kpandai District Assembly,2011,CONSTRUCT 1 NO 3 UNIT CLASSROOM OFFIE & STORE AND FURNITUURE,other/unknown,,,,,,Kpandai District Assembly,,,
Kpandai District Assembly,2011,CONSTRUCT 1 NO 3 UNIT CLASSROOM OFFICE & STORE AND FURNITURE,other/unknown,,,,,,Kpandai District Assembly,,,
Kpandai District Assembly,2011,CONSTRUCT 1 NO 3 UNIT CLASSROOM OFFICE & STORE AND FURNITURE,other/unknown,,,,,,Kpandai District Assembly,,,
Kpandai District Assembly,2011,CONSTRUCT 1 NO 3UNIT CLASSROOM BLOCK WITH ITS ASSESSORIES,other/unknown,,,,,,Kpandai District Assembly,,,
Kpandai District Assembly,2011,CONSTRUCT 1 NO 3 UNIT CLASSROOM BLOCK WITH ITS ACCESSORIES DESTINE PRIMARY,other/unknown,,,,,,Kpandai District Assembly,,,
Kpandai District Assembly,2011,CONSTRUCT 1 NO 3UNIT CLASSROOM BLOCK WITH ITS ACCESSORIES,other/unknown,,,,,,Kpandai District Assembly,,,
Kpandai District Assembly,2011,CONSTRUCT 1 NO 3UNIT CLASSROOM BLOCK WITH ITS ACCESSORIES,other/unknown,,,,,,Kpandai District Assembly,,,
Kpandai District Assembly,2011,CONSTRUCT 1 NO 3UNIT CLASSROOM BLOCK WITH ITS ACCESSORIES,other/unknown,,,,,,Kpandai District Assembly,,,
Kpandai District Assembly,2011,CONSTRUCT 1 NO 3 UNIT CLASSROOM BLOCK WITH ITS ACCESSORIES,other/unknown,,,,,,Kpandai District Assembly,,,
Kpandai District Assembly,2011,CONSTRUCT 1 NO 3 UNIT CLASSROOM BLOCK WITH ITS ACCESSORIES ISSAHKIYA KG,other/unknown,,,,,,Kpandai District Assembly,,,
Kpandai District Assembly,2011,CONSTRUCT AND FURNISH COMMUNITY LIBRARY,other/unknown,,,,,,Kpandai District Assembly,,,
Kpandai District Assembly,2011,CONSTRUCT BOYS DORMITORY SHS,other/unknown,,,,,,Kpandai District Assembly,,,
Kpandai District Assembly,2011,CONSTRUCT 6 UNIT CLASSROOM BLOCK,other/unknown,,,,,,Kpandai District Assembly,,,
Kpandai District Assembly,2011,CONSTRUCT MARKETS STORES AND STALLS,other/unknown,,,,,,Kpandai District Assembly,,,
Kpandai District Assembly,2011,CONSTRUCT 1 NO FARMERS CENTRE CONSISTING OF 2NO OFFICE FERTILIZER STORE OPEN SHED AND DRYING FLOOR,other/unknown,,,,,,Kpandai District Assembly,,,
Kpandai District Assembly,2011,CONSTRUCT 1NO FARMERS CENTRE CONSISTING OF 2NO OFFICE FERTILIZER STORE OPEN SHED AND DRYING FLOOR,other/unknown,,,,,,Kpandai District Assembly,,,
Kpandai District Assembly,2011,ESTABLISH NUTRITIONAL REHABILITATION CENTRES,other/unknown,,,,,,Kpandai District Assembly,,,
Kpandai District Assembly,2011,CONSTRUCT CHPS COMPOUND,other/unknown,,,,,,Kpandai District Assembly,,,
Kpandai District Assembly,2011,RENOVATION AND FURNISHING CHPS COMPOUND,other/unknown,,,,,,Kpandai District Assembly,,,
Kpandai District Assembly,2011,RENOVATE AND FURNISH HEALTH CENTRE,other/unknown,,,,,,Kpandai District Assembly,,,
Kpandai District Assembly,2011,RENOVATE AND FURNISH CHPS COMPOUND,other/unknown,,,,,,Kpandai District Assembly,,,
Kpandai District Assembly,2011,EXTEND ELECTRICITY,other/unknown,,,,,,Kpandai District Assembly,,,
Kpandai District Assembly,2011,EXTEND ELECTRICITY,other/unknown,,,,,,Kpandai District Assembly,,,
Kpandai District Assembly,2011,EXTEND ELECTRICITY,other/unknown,,,,,,Kpandai District Assembly,,,
Kpandai District Assembly,2011,EXTEND ELECTRICITY,other/unknown,,,,,,Kpandai District Assembly,,,
Kpandai District Assembly,2011,EXTEND ELECTRICITY,other/unknown,,,,,,Kpandai District Assembly,,,
Kpandai District Assembly,2011,EXTEND ELECTRICITY,other/unknown,,,,,,Kpandai District Assembly,,,
Kpandai District Assembly,2011,EXTEND ELECTRICITY,other/unknown,,,,,,Kpandai District Assembly,,,
Kpandai District Assembly,2011,EXTEND ELECTRICITY,other/unknown,,,,,,Kpandai District Assembly,,,
Kpandai District Assembly,2011,EXTEND ELECTRICITY,other/unknown,,,,,,Kpandai District Assembly,,,
Kpandai District Assembly,2011,EXTEND ELECTRICITY TO STAFF BUNGALOWS,other/unknown,,,,,,Kpandai District Assembly,,,
Kpandai District Assembly,2011,SPOT IMPROVEMENT 22KM,other/unknown,,,,,,Kpandai District Assembly,,,
Kpandai District Assembly,2011,CONSTRUCT DRAINS,other/unknown,,,,,,Kpandai District Assembly,,,
Kpandai District Assembly,2011,CONSTRUCT DRAINS,other/unknown,,,,,,Kpandai District Assembly,,,
Kpandai District Assembly,2011,SPOT IMPROVEMENT 8.5KM,other/unknown,,,,,,Kpandai District Assembly,,,
Kpandai District Assembly,2011,SPOT IMPROVEMENT 13.6,other/unknown,,,,,,Kpandai District Assembly,,,
Kpandai District Assembly,2011,RESHAPING OF ROAD 7KM,other/unknown,,,,,,Kpandai District Assembly,,,
Kpandai District Assembly,2011,"CONSTRUCT 12,000 HOUSEHOLD LATRINES",other/unknown,,,,,,Kpandai District Assembly,,,
Kpandai District Assembly,2011,CONSTRUCT 60NO 4 SEATER KVIP FOR THE SCHOOLS,other/unknown,,,,,,Kpandai District Assembly,,,
Kpandai District Assembly,2011,CONSTRUCT 12NO 4 SEATER KVIP FOR THE HEALTH FACILITIES,other/unknown,,,,,,Kpandai District Assembly,,,
Kpandai District Assembly,2011,CONSTRUCT SMALL TOWN WATER SYSTEM,other/unknown,,,,,,Kpandai District Assembly,,,
Kpandai District Assembly,2011,DRILL AND CONSTRUCT BOREHOLE,other/unknown,,,,,,Kpandai District Assembly,,,
Kpandai District Assembly,2011,DRILL AND CONSTRUCT BOREHOLE,other/unknown,,,,,,Kpandai District Assembly,,,
Kpandai District Assembly,2011,DRILL AND CONSTRUCT BOREHOLE,other/unknown,,,,,,Kpandai District Assembly,,,
Kpandai District Assembly,2011,DRILL AND CONSTRUCT BOREHOLE,other/unknown,,,,,,Kpandai District Assembly,,,
Kpandai District Assembly,2011,DRILL AND CONSTRUCT BOREHOLE,other/unknown,,,,,,Kpandai District Assembly,,,
Kpandai District Assembly,2011,DRILL AND CONSTRUCT BOREHOLE,other/unknown,,,,,,Kpandai District Assembly,,,
Kpandai District Assembly,2011,DRILL AND CONSTRUCT BOREHOLE,other/unknown,,,,,,Kpandai District Assembly,,,
Kpandai District Assembly,2011,DRILL AND CONSTRUCT BOREHOLE,other/unknown,,,,,,Kpandai District Assembly,,,
Kpandai District Assembly,2011,DRILL AND CONSTRUCT BOREHOLE,other/unknown,,,,,,Kpandai District Assembly,,,
Kpandai District Assembly,2011,DRILL  AND CONSTRUCT BOREHOLE,other/unknown,,,,,,Kpandai District Assembly,,,
Kpandai District Assembly,2011,DRILL AND CONSTRUCT BOREHOLE,other/unknown,,,,,,Kpandai District Assembly,,,
Kpandai District Assembly,2011,DRILL AND CONSTRUCT BOREHOLE,other/unknown,,,,,,Kpandai District Assembly,,,
Kpandai District Assembly,2011,RENOVATE AND FURNISH ONE TOWN COUNCIL AND SIX AREA COUNCILS,other/unknown,,,,,,Kpandai District Assembly,,,
Kpandai District Assembly,2011,CONSTRUCT 1 NO 3 UNIT CLASSROOM BLOCK WITH ITS ACCESSORIES,other/unknown,,,,,,Kpandai District Assembly,,,
Kpandai District Assembly,2011,COMPLETE THE CONSTRUCTION OF 12 ROOM OFFICE ACCOMMODATION,other/unknown,,,,,,Kpandai District Assembly,,,
Kpandai District Assembly,2011,CONSTRUCT TEACHER QUARTERS,other/unknown,,,,,,Kpandai District Assembly,,,
Kpandai District Assembly,2011,CONSTRUCT CHPS COMPOUND,other/unknown,,,,,,Kpandai District Assembly,,,
Kpandai District Assembly,2011,CONSTRUCT KITCHEN AND STORE,other/unknown,,,,,,Kpandai District Assembly,,,
Kpandai District Assembly,2011,COMPLETE THE CONSTRUCT 10 NO STAFF ACCOMMODATION,other/unknown,,,,,,Kpandai District Assembly,,,
Kpando Municipal Assembly,2011,,,,,,,,Kpando Municipal Assembly,,,
Krachi East District Assembly,2011,,,,,,,,Krachi East District Assembly,,,
Krachi West District Assembly,2011,RESHAPING OF EHIAMANKYENE AND OTHERS ROADS (11KM),other gog,,,,,,Krachi West District Assembly,,,
Krachi West District Assembly,2011,SUFACING OF KETE TOWNSHIP ROAD(200),other donor,,,,,,Krachi West District Assembly,,,
Krachi West District Assembly,2011,SPOT IMPROVEMENT OF KOKOSE BEJAMSE ROAD (12KM),other donor,,,,,,Krachi West District Assembly,,,
Krachi West District Assembly,2011,SPOT IMPROVEMENT OF ZONGO MANCHER DINDO ROAD (8KM),other donor,,,,,,Krachi West District Assembly,,,
Krachi West District Assembly,2011,ROUTINE MAINTENANCE OF KRACHI BUYA 69 KM,other gog,,,,,,Krachi West District Assembly,,,
Krachi West District Assembly,2011,RESHAPING OF CHINDERI BORAE NO 2 AND OTHERS,other gog,,,,,,Krachi West District Assembly,,,
Krachi West District Assembly,2011,RESHAPING OF CHINDERI ANYIMANAE AND OTHERS ROADS,other gog,,,,,,Krachi West District Assembly,,,
Krachi West District Assembly,2011,INSTALLATION AND REPAIR OF STREET LIGHT,dacf,,,,,,Krachi West District Assembly,,,
Krachi West District Assembly,2011,CONSTRUCTION OF 6 UNIT CLASSROOM BLK OFFICE AND ANCILLARY UNIT,getfund,,,,,,Krachi West District Assembly,,,
Krachi West District Assembly,2011,CONSTRUCTION OF 6 UNIT CLASSROOM BLOCK OFFICE AND ANCILLARY UNIT,getfund,,,,,,Krachi West District Assembly,,,
Krachi West District Assembly,2011,CONSTRUCTION OF 6 UNIT CLASSROOM BLOCK OFFICE AND ANCILLARY UNIT,getfund,,,,,,Krachi West District Assembly,,,
Krachi West District Assembly,2011,CONSTRUCTION OF 6 UNIT CLASSROOM BLOCK OFFICE AND ANCILLARY UNIT,getfund,,,,,,Krachi West District Assembly,,,
Krachi West District Assembly,2011,REHABILITATION OF 6 UNIT CLASSROOM BLOCK OFFICE AND ANCILLARY UNIT,other donor,,,,,,Krachi West District Assembly,,,
Krachi West District Assembly,2011,CONSTRUCTION OF 3 UNIT PRIMARY CLASSROOM BLOCK OFFICES AND STORE,ddf,,,,,,Krachi West District Assembly,,,
Krachi West District Assembly,2011,CONSTRUCTION OF 3 UNIT PRIMARY CLASSROOM BLOCK OFFICES AND STORE,ddf,,,,,,Krachi West District Assembly,,,
Krachi West District Assembly,2011,CONSTRUCTION OF EXAMINATION CENTRE,other donor,,,,,,Krachi West District Assembly,,,
Krachi West District Assembly,2011,CONSTRUCTION OF 1 NO FERRO CEMENT TANK,other donor,,,,,,Krachi West District Assembly,,,
Krachi West District Assembly,2011,CONSTRUCTION OF 1 NO FERRO CEMENT TANK,other donor,,,,,,Krachi West District Assembly,,,
Krachi West District Assembly,2011,CONSTRUCTION OF 1 NO 6 SEATER KVIP,other donor,,,,,,Krachi West District Assembly,,,
Krachi West District Assembly,2011,CONSTRUCTION OF 1 NO 6 SEATER KVIP,other donor,,,,,,Krachi West District Assembly,,,
Krachi West District Assembly,2011,DISLODGEMENT OF 10 NO KVIP PUBLIC TOILET,dacf,,,,,,Krachi West District Assembly,,,
Krachi West District Assembly,2011,CONSTRUCTION OF 50 NO BOREHOLE,other donor,,,,,,Krachi West District Assembly,,,
Krachi West District Assembly,2011,CONSTRUCTION OF 1 NO 3 UNIT CLASSROOM BLOCK WITH ANCILL FACILITIES AND ACCESS FOR PWDS,getfund,,,,,,Krachi West District Assembly,,,
Krachi West District Assembly,2011,CONSTRUCTION OF 1NO 6 UNIT CLASSROOM BLOCK WITH ANCILL FACILITIES AND ACCESS FOR PWDS,getfund,,,,,,Krachi West District Assembly,,,
Krachi West District Assembly,2011,CONSTRUCTION OF 1NO 6 UNIT CLASSROOM BLOCK WITH ANCILL FACILITIES AND ACCESS FOR PWDS,getfund,,,,,,Krachi West District Assembly,,,
Krachi West District Assembly,2011,CONSTRUCTION OF 1NO 3 UNIT CLASSROOM BLOCK WITH ANCILL FACILITIES AND ACCESS FOR PWDS,getfund,,,,,,Krachi West District Assembly,,,
Krachi West District Assembly,2011,CONSTRUCT ICT CENTRE,dacf,,,,,,Krachi West District Assembly,,,
Krachi West District Assembly,2011,RENOVATION OF 1NO OFFICE BLOCK (A) FOR DISTRICT ASSEMBLY,dacf,,,,,,Krachi West District Assembly,,,
Krachi West District Assembly,2011,RENOVATION OF 1NO OFFICE BLOCK (A) FOR DISTRICT ASSEMBLY,dacf,,,,,,Krachi West District Assembly,,,
Krachi West District Assembly,2011,CONSTRUCTION OF 1NO 3 UNIT CLASSROOM BLOCK WITH ANCILL FACILILITIES AND ACCESS FOR PWDS,getfund,,,,,,Krachi West District Assembly,,,
Krachi West District Assembly,2011,CONSTRUCTION OF 1NO 6 UNIT CLASSROOM BLOCK WITH ANCILL FACILITIES AND ACCESS FOR PWDS,getfund,,,,,,Krachi West District Assembly,,,
Krachi West District Assembly,2011,CONSTRUCTION OF 1NO 6 UNIT CLASSROOM BLOCK WITH ANCILL FACILITIES AND ACCESS FOR PWDS,getfund,,,,,,Krachi West District Assembly,,,
Krachi West District Assembly,2011,CONSTRUCTION OF 1 NO 3 UNIT CLASSROOM BLOCK WITH ANCILL FACILITIES AND ACCESS FOR PKDS,getfund,,,,,,Krachi West District Assembly,,,
Krachi West District Assembly,2011,CONSTRUCT ICT CENTRE,dacf,,,,,,Krachi West District Assembly,,,
Krachi West District Assembly,2011,RENOVATION OF 1NO OFFICE BLOCK (A) FOR DISTRICT ASSEMBLY,dacf,,,,,,Krachi West District Assembly,,,
Krachi West District Assembly,2011,RENOVATION OF 1NO OFFICE BLOCK (A) FOR DISTRICT ASSEMBLY,dacf,,,,,,Krachi West District Assembly,,,
Kumasi Metropolitan Assembly,2011,,,,,,,,Kumasi Metropolitan Assembly,,,
Kwabre East District Assembly,2011,CONSTRUCTION OF STORM DRAIN,dacf,,10/15/2009,,,,Kwabre East District Assembly,,2009-10-15,
Kwabre East District Assembly,2011,CONSTRUCTION OF 1 NO 1200MM DOUBLE PIPE CULVERT,dacf,,12/25/2010,,,,Kwabre East District Assembly,,2010-12-25,
Kwabre East District Assembly,2011,CONSTRUCTION OF 1 NO DOUBLE PIPE CULVERT AND STORM DRAIN,dacf,,12/25/2010,,,,Kwabre East District Assembly,,2010-12-25,
Kwabre East District Assembly,2011,CONSTRUCTION OF 80 NO BOREHOLES,multiple,,,,,,Kwabre East District Assembly,,,
Kwabre East District Assembly,2011,CONSTRUCTION OF 5 NO 6 SEATER & 1 NO 4 SEATER KVIP TOILET,multiple,,9/10/2010,,,,Kwabre East District Assembly,,2010-09-10,
Kwabre East District Assembly,2011,CONSTRUCTION OF 5 NO 6 SEATER & 1 NO 4 SEATER KVIP TOILET,multiple,,9/10/2010,,,,Kwabre East District Assembly,,2010-09-10,
Kwabre East District Assembly,2011,CONSTRUCTION OF 7 NO 6 SEATER KVIP TOILET,multiple,,9/10/2010,,,,Kwabre East District Assembly,,2010-09-10,
Kwabre East District Assembly,2011,CONSTRUCTION OF 6 NO 6 SEATER & 1 NO 4 SEATER KVIP TOILET,multiple,,9/10/2010,,,,Kwabre East District Assembly,,2010-09-10,
Kwabre East District Assembly,2011,CONSTRUCTION OF 7 NO 6 SEATER KVIP TOILET,multiple,,9/10/2010,,,,Kwabre East District Assembly,,2010-09-10,
Kwabre East District Assembly,2011,EVACUATION OF REFUSE,dacf,,9/9/2010,,,,Kwabre East District Assembly,,2010-09-09,
Kwabre East District Assembly,2011,EVACUATION OF REFUSE,dacf,,9/9/2010,,,,Kwabre East District Assembly,,2010-09-09,
Kwabre East District Assembly,2011,CONSTRUCTION OF 1 NO 12 SEATER AQUA PRIVY TOILET,dacf,,12/25/2010,,,,Kwabre East District Assembly,,2010-12-25,
Kwabre East District Assembly,2011,CONSTRUCTION OF 1 NO 12 SEATER WATER CLOSET TOILET,dacf,,12/25/2010,,,,Kwabre East District Assembly,,2010-12-25,
Kwabre East District Assembly,2011,EVACUATION OF REFUSE,dacf,,12/16/2010,,,,Kwabre East District Assembly,,2010-12-16,
Kwabre East District Assembly,2011,CONSTRUCTION OF 1 NO 12 SEAER WATER CLOSET TOILET,ddf,,12/7/2010,,,,Kwabre East District Assembly,,2010-12-07,
Kwabre East District Assembly,2011,COMPLETION OF WEAVING CENTRE,dacf,,10/15/2009,,,,Kwabre East District Assembly,,2009-10-15,
Kwabre East District Assembly,2011,COMPLETION OF WEAVING CENTRE,dacf,,10/15/2009,,,,Kwabre East District Assembly,,2009-10-15,
Kwabre East District Assembly,2011,COMPLETION OF 2 STOREY 12 UNIT CLASSROOM MOCK WITH OFFICE AND STORE,dacf,,10/31/2008,,,,Kwabre East District Assembly,,2008-10-31,
Kwabre East District Assembly,2011,CONSTRUCTION OF 1 NO GROUND FLOOR 2 STOREY 3 UNIT 2 BEDROOM TEACHERS QUARTERS,dacf,,10/15/2009,,,,Kwabre East District Assembly,,2009-10-15,
Kwabre East District Assembly,2011,COMPLETION OF 1 NO 3 UNIT CLASSROOM BLOCK,dacf,,12/25/2010,,,,Kwabre East District Assembly,,2010-12-25,
Kwabre East District Assembly,2011,CONSTRUCTION OF 1 NO 6 UNIT CLASSROOM BLOCK AT HOLY QURAN D/A PRIMARY SCHOOL,dacf,,12/25/2010,,,,Kwabre East District Assembly,,2010-12-25,
Kwabre East District Assembly,2011,CONSTRUCTION OF FENCE WALL AT ICT CENTRE,dacf,,12/25/2010,,,,Kwabre East District Assembly,,2010-12-25,
Kwabre East District Assembly,2011,CONSTRUCTION OF 1 NO 6 UNIT CLASSROOM BLOCK AT NTOASO,ddf,,12/13/2010,,,,Kwabre East District Assembly,,2010-12-13,
Kwabre East District Assembly,2011,CONSTRUCTION OF 1 NO 6 UNIT CLASSROOM BLOCK AT ASASESUA,ddf,,12/10/2010,,,,Kwabre East District Assembly,,2010-12-10,
Kwabre East District Assembly,2011,CONSTRUCTION OF 1 NO 3 UNIT CLASSROOM BLOCK AT NWAMASE,ddf,,12/10/2010,,,,Kwabre East District Assembly,,2010-12-10,
Kwabre East District Assembly,2011,CONVERSION OF CLASSROOM BLOCK INTO A 7 UNIT APARTMENT 2 BEDROOM FOR TEACHERS,other/unknown,,4/20/2010,,,,Kwabre East District Assembly,,2010-04-20,
Kwabre East District Assembly,2011,CONSTRUCTION OF 1 NO 5 UNIT OFFICES FOR PHARMACY DEPARTMENT LABORATORY INTERANCE AND OTHERS AT ABOASO HEALTH CENTRE,ddf,,12/7/2010,,,,Kwabre East District Assembly,,2010-12-07,
Kwaebibirem District Assembly,2011,,,,,,,,Kwaebibirem District Assembly,,,
Kwahu East District Assembly,2011,CONSTRUCTION OF 1 NO 8 SEATER KVIP LATRINE AT OFRAMASE DA PRI,other donor,,Nov-09,,,,Kwahu East District Assembly,,2009-11-01,
Kwahu East District Assembly,2011,CONSTRUCTION OF 1 NO 8 SEATER LATRINE AT OWOROBONG DA PRI,other donor,,Nov-09,,,,Kwahu East District Assembly,,2009-11-01,
Kwahu East District Assembly,2011,DRILLNG AND CONSTRUCTION OF 10 NO BOREHOLES & 5 ADDENDUM,other donor,,Jun-10,,,,Kwahu East District Assembly,,2010-06-01,
Kwahu East District Assembly,2011,CONSTRUCTION OF 1NO 8 SEATER KVIP LATRINE AT ASEMPANEYE DA PRIMARY ADDENDUM,other donor,,Oct-10,,,,Kwahu East District Assembly,,2010-10-01,
Kwahu East District Assembly,2011,SPOT IMPROVEMENT OF ABENE HYEWOHODEN FR PH I (9.00KM),other donor,,Nov-10,,,,Kwahu East District Assembly,,2010-11-01,
Kwahu East District Assembly,2011,SPOT IMPROVEMENT OF ABENE HYEWOHODEN FR PH II 8.5KM,other donor,,Nov-10,,,,Kwahu East District Assembly,,2010-11-01,
Kwahu East District Assembly,2011,RESHAPING OF DADEASE NKWANTANANG FR & OTHER 11 4KM,dacf,,Dec-10,,,,Kwahu East District Assembly,,2010-12-01,
Kwahu East District Assembly,2011,CONSTRUCTION OF 2NO 8 SEATER KVIP LATRINE WITH HAND WISHING FACILITY AT,ddf,,Feb-11,,,,Kwahu East District Assembly,,2011-02-01,
Kwahu East District Assembly,2011,CONSTRUCTION OF 2NO 8 SEATER KVIP LATRINE WITH HAND WISHING FACILITY AT,dacf,,Feb-11,,,,Kwahu East District Assembly,,2011-02-01,
Kwahu East District Assembly,2011,CONSTRUCTION OF 2NO 8 SEATER KVIP LATRINE WITH HAND WISHING FACILITY AT,ddf,,Feb-11,,,,Kwahu East District Assembly,,2011-02-01,
Kwahu East District Assembly,2011,CONSTRUCTION OF 2NO 8 SEATER KVIP LATRINE WITH HAND WASHING,ddf,,Feb-11,,,,Kwahu East District Assembly,,2011-02-01,
Kwahu East District Assembly,2011,CONSTRUCTION OF 1NO 8 SEATER WC,dacf,,Feb-11,,,,Kwahu East District Assembly,,2011-02-01,
Kwahu East District Assembly,2011,SPOT IMPROVEMENT OF AWESASU JN OHEMAA FR 10KM,ddf,,Feb-11,,,,Kwahu East District Assembly,,2011-02-01,
Kwahu East District Assembly,2011,PAVING OF KWAHU TAFO LORRY PARK,ddf,,Mar-11,,,,Kwahu East District Assembly,,2011-03-01,
Kwahu East District Assembly,2011,CONSTRUCTION OF 2NO 10 SEATER VAULT CAMBER,dacf,,Oct-11,,,,Kwahu East District Assembly,,2011-10-01,
Kwahu East District Assembly,2011,CONSTRUCTION OF 2 NO 10 EAER VAULT CAMBER,dacf,,Oct-11,,,,Kwahu East District Assembly,,2011-10-01,
Kwahu East District Assembly,2011,CONSTRUCTION OF 1NO 3 UNIT CLASSROOM BLOCK OFFICE AND STORE AT ADUAMOA RC PRIMARY,ddf,,Aug-10,,,,Kwahu East District Assembly,,2010-08-01,
Kwahu East District Assembly,2011,CONSTRUCTION OF 1NO 3 UNIT CLASSROOM BLOCK OFFICE AND STORE AT ABENE METHODIST PRIMARY,ddf,,Feb-11,,,,Kwahu East District Assembly,,2011-02-01,
Kwahu East District Assembly,2011,CONSTRUCTION OF 1 NO 3 UNIT CLASSROOM BLOCK OFFICE AND STORE AT ANWEAM TOKROM DA PRIMARY SCHOOL,ddf,,Feb-11,,,,Kwahu East District Assembly,,2011-02-01,
Kwahu East District Assembly,2011,CLADDING OF 6 UNIT CLASSROOM BLOCK AT BONKRASE PRESBY PRIMARY,dacf,,Feb-11,,,,Kwahu East District Assembly,,2011-02-01,
Kwahu East District Assembly,2011,CONSTRUCTION OF 3 UNIT CLASSROOM BLOCK OFFICE AND STORE AT TAFO ISLAMIC JHS,dacf,,Feb-11,,,,Kwahu East District Assembly,,2011-02-01,
Kwahu East District Assembly,2011,CONSTRUCTION OF 3 UNIT CLASSROOM BLOCK OFFICE AND STORE AT SUMINAKESE PRESBY PRIMARY,dacf,,Feb-11,,,,Kwahu East District Assembly,,2011-02-01,
Kwahu East District Assembly,2011,CONSTRUCTION OF 3 UNIT CLASSROOM BLOCK OFFICE AND STORE AT TAFO SHS,ddf,,Feb-11,,,,Kwahu East District Assembly,,2011-02-01,
Kwahu East District Assembly,2011,REHABILITATION OF 4 UNIT CLASSROOM BLOCK OFFICE AND STORE,ddf,,Oct-11,,,,Kwahu East District Assembly,,2011-10-01,
Kwahu East District Assembly,2011,CONSTRUCTION OF 3 UNIT CLASSROOM BLOCK OFFICE AND STORE,dacf,,Apr-11,,,,Kwahu East District Assembly,,2011-04-01,
Kwahu East District Assembly,2011,CONSTRUCTION OF 3 UNIT CLASSROOM BLOCK,other donor,,Feb-11,,,,Kwahu East District Assembly,,2011-02-01,
Kwahu East District Assembly,2011,COMPLETION OF DCD RESIDENTIAL ACCOMMODATION AND 3 BEDROOM STAFF QUATERS,dacf,,Aug-11,,,,Kwahu East District Assembly,,2011-08-01,
Kwahu North District Assembly,2011,CONSTRUCTION OF 6 UNIT CLASSROOM BLOCK AT KEDEKOPE,other/unknown,,3/1/2010,,,,Kwahu Afram Plains North District Assembly,,2010-03-01,
Kwahu North District Assembly,2011,CONSTRUCTION OF HEALTH CENTRE AT DODI,other/unknown,,4/1/2010,,,,Kwahu Afram Plains North District Assembly,,2010-04-01,
Kwahu North District Assembly,2011,CONSTRUCTION OF COMMUNITY COMPLEX AT DONKORKROM,other/unknown,,6/1/2010,,,,Kwahu Afram Plains North District Assembly,,2010-06-01,
Kwahu North District Assembly,2011,CONSTRUCTION OF SCHOOL HOSTEL AT TEASE ST FIDELIS,other/unknown,,4/1/2010,,,,Kwahu Afram Plains North District Assembly,,2010-04-01,
Kwahu North District Assembly,2011,CONSTRUCTION OF 6 UNIT CLASSROOM BLOCK OFFICE STORE WITH 10 SEATER KVIP,other/unknown,,7/1/2010,,,,Kwahu Afram Plains North District Assembly,,2010-07-01,
Kwahu North District Assembly,2011,CONSTRUCTION OF JHS BLOCK FOR ST,other/unknown,,8/1/2010,,,,Kwahu Afram Plains North District Assembly,,2010-08-01,
Kwahu North District Assembly,2011,CONSTRUCTION OF JHS AND PRIMARY BLOCK (PHASE 1) GROUND FLOOR OF DISTRICT ASSEMBLY MODEL SCHOOL AT DONKORKROM,other/unknown,,2010,,,,Kwahu Afram Plains North District Assembly,,1905-07-02,
Kwahu North District Assembly,2011,CONSTRUCTION OF 3 STOREY DA OFFICE BLOCK AT DONKORKROM,other/unknown,,2010,,,,Kwahu Afram Plains North District Assembly,,1905-07-02,
Kwahu North District Assembly,2011,REHABILITATION OF STRUCTURE FOR USE AS AREA COUNCIL OFFICE AT SAMANHYIA,other/unknown,,2010,,,,Kwahu Afram Plains North District Assembly,,1905-07-02,
Kwahu North District Assembly,2011,INSTALLATION AND ELECTRIFICATION OF THE 3 STOREY BLOCK,other/unknown,,2010,,,,Kwahu Afram Plains North District Assembly,,1905-07-02,
Kwahu North District Assembly,2011,CONSTRUCTION OF AREA COUNCIL OFFICE AT TEASE,other/unknown,,2/1/2010,,,,Kwahu Afram Plains North District Assembly,,2010-02-01,
Kwahu North District Assembly,2011,CONSTRUCTION OF AREA COUNCIL OFFICE AT DONKORKROM,other/unknown,,8/1/2010,,,,Kwahu Afram Plains North District Assembly,,2010-08-01,
Kwahu North District Assembly,2011,CONSTRUCTION OF 1NO 3 CLASSROOM BLOCK OFFICE AND STORE FOR FAASO BATTOR DA JHS,other/unknown,,7/2/2010,,,,Kwahu Afram Plains North District Assembly,,2010-07-02,
Kwahu North District Assembly,2011,CONSTRUCTION OF 6 UNIT CLASSROOM BLOCK OFFICE STORE AND MOSQUE AT DONKORKROM,other/unknown,,2010,,,,Kwahu Afram Plains North District Assembly,,1905-07-02,
Kwahu North District Assembly,2011,CONST OF 3 UNIT CLASSROOM BLOCK OFFICE & STORE & STAFF COMMON ROOM FOR DA JHS AT EKYE AMANFROM,other/unknown,,5/16/2010,,,,Kwahu Afram Plains North District Assembly,,2010-05-16,
Kwahu North District Assembly,2011,RE GRAVELLING OF MAAME KROBO MARKET,other/unknown,,5/16/2010,,,,Kwahu Afram Plains North District Assembly,,2010-05-16,
Kwahu North District Assembly,2011,CONSTRUCTION OF 3 NO YAM SHED AT MAAME KROBO & 1 AT DONKORKROM,other/unknown,,11/20/2010,,,,Kwahu Afram Plains North District Assembly,,2010-11-20,
Kwahu North District Assembly,2011,COMPLETION OF NO 3 UNIT OFFICE & STORE SCHOOL BLOCK FOR DA PRIMARY AT HWANYASO,other/unknown,,Nov-10,,,,Kwahu Afram Plains North District Assembly,,2010-11-01,
Kwahu North District Assembly,2011,COMPLETION OF 40 NO MKT STALL AT NEW KYIASE,other/unknown,,Dec-10,,,,Kwahu Afram Plains North District Assembly,,2010-12-01,
Kwahu North District Assembly,2011,COMPLETION OF NO 3 UNIT CLASSROOM OFFICE AND STORE FOR D A JHS AT PERSIKA,other/unknown,,Dec-10,,,,Kwahu Afram Plains North District Assembly,,2010-12-01,
Kwahu North District Assembly,2011,REHABILITATION OF CLINIC AT NTONABOMA,other/unknown,,Dec-10,,,,Kwahu Afram Plains North District Assembly,,2010-12-01,
Kwahu North District Assembly,2011,CONSTRUCTION OF INSTITUTIONAL (8 SEATER KVIP) LATRINES WITH HAND WASHING FACILITIES FOR ADIEMBRA RC JHS LOT1,other/unknown,,12/17/2010,,,,Kwahu Afram Plains North District Assembly,,2010-12-17,
Kwahu North District Assembly,2011,CONSTRUCTION OF (8 SEATER KVIP LATRINES WITH HAND WASHING FACILITIES FOR ISLAMIC PRIMARY SCH DKROM LOT 2,other/unknown,,12/17/2010,,,,Kwahu Afram Plains North District Assembly,,2010-12-17,
Kwahu North District Assembly,2011,CONSTRUCTION OF 8 SEATER KVIP LATRINES WITH HAND WASHING FACILITIES FOR TEASE RC JHS LOT 3,other/unknown,,2/16/2010,,,,Kwahu Afram Plains North District Assembly,,2010-02-16,
Kwahu North District Assembly,2011,CONSTRUCTION OF SMALL TOWN WATER SUPPLY FOR MAAME KROBO,other/unknown,,1/27/2010,,,,Kwahu Afram Plains North District Assembly,,2010-01-27,
Kwahu North District Assembly,2011,DRILLING AND CONST OF 10 NO BH IN KWAHU NORTH DISTRICT,other/unknown,,2/2/2010,,,,Kwahu Afram Plains North District Assembly,,2010-02-02,
Kwahu North District Assembly,2011,REHABILITATION AND REPLACEMENT OF HAND PUMPS FOR 20 NO BHS IN KWAHU NORTH DISTRICT,other/unknown,,11/25/2010,,,,Kwahu Afram Plains North District Assembly,,2010-11-25,
Kwahu North District Assembly,2011,HYDRO GEOLOGICAL INVESTIGATION AND DRILLING SUPERVISION OF 10 NO BOREHOLES IN KND,other/unknown,,1/27/2010,,,,Kwahu Afram Plains North District Assembly,,2010-01-27,
Kwahu North District Assembly,2011,CONSTRUCTION SUPERVISION FOR SMALL TOWN WATER SUPPLY SYSTEM AT MAAME KROBO,other/unknown,,1/27/2010,,,,Kwahu Afram Plains North District Assembly,,2010-01-27,
Kwahu North District Assembly,2011,CONSTRUCTION OF 2NO 3 UNIT TEACHERS ACCOMMODATION AT ASANYANSO,other/unknown,,7/16/2010,,,,Kwahu Afram Plains North District Assembly,,2010-07-16,
Kwahu North District Assembly,2011,CONSTRUCTION OF 2 NO 3 UNIT TEACHERS ACCOMMODATION AT KWASI FANTE,other/unknown,,7/16/2010,,,,Kwahu Afram Plains North District Assembly,,2010-07-16,
Kwahu North District Assembly,2011,CONSTRUCTION OF 1 NO KG BLOCK AT ODUMASE,other/unknown,,7/16/2010,,,,Kwahu Afram Plains North District Assembly,,2010-07-16,
Kwahu North District Assembly,2011,CONSTRUCTION OF 1 NO KG BLOCK AT SOMSEI,other/unknown,,7/16/2010,,,,Kwahu Afram Plains North District Assembly,,2010-07-16,
Kwahu North District Assembly,2011,CONSTRUCTION OF 1 NO 6 UNIT PRIMARY SCHOOL BLOCK AT DONKORKROM,other/unknown,,7/16/2010,,,,Kwahu Afram Plains North District Assembly,,2010-07-16,
Kwahu North District Assembly,2011,CONSTRUCTION OF 1 NO 6 UNIT PRIMARY SCH BLOCK AT ANIDZI,other/unknown,,7/16/2010,,,,Kwahu Afram Plains North District Assembly,,2010-07-16,
Kwahu North District Assembly,2011,CONSTRUCTION OF 1 NO 6 UNIT PRIMARY SCH BLOCK AT ATWULAME,other/unknown,,7/16/2010,,,,Kwahu Afram Plains North District Assembly,,2010-07-16,
Kwahu North District Assembly,2011,CONSTRUCTION OF 1 NO 6 UNIT PRIMARY SCH BLOCK AT PERSIKA (DWARF ISLAND),other/unknown,,7/16/2010,,,,Kwahu Afram Plains North District Assembly,,2010-07-16,
Kwahu North District Assembly,2011,CONSTRUCTION OF 1 NO 3 UNIT JHS BLOCK AT NYAKUIKOPE,other/unknown,,7/16/2010,,,,Kwahu Afram Plains North District Assembly,,2010-07-16,
Kwahu North District Assembly,2011,CONSTRUCTION OF 1 NO 3 UNIT JHS BLOCK AT AMANKWA TORNU,other donor,,7/16/2010,,,,Kwahu Afram Plains North District Assembly,,2010-07-16,
Kwahu North District Assembly,2011,CONSTRUCTION OF 1 NO 3 UNIT JHS BLOCK AT TIGIKOPE,other donor,,7/16/2010,,,,Kwahu Afram Plains North District Assembly,,2010-07-16,
Kwahu North District Assembly,2011,SPOT IMPROVEMENT OF DWARF ISLAND ROAD ASUKESE IN FAASO BATTOR ROAD (21.80KM),other donor,,5/25/2010,,,,Kwahu Afram Plains North District Assembly,,2010-05-25,
Kwahu North District Assembly,2011,REHABILITATION OF MAAME KROBO BONKRON ROAD (18.0KM),other donor,,5/25/2010,,,,Kwahu Afram Plains North District Assembly,,2010-05-25,
Kwahu North District Assembly,2011,SPOT IMPROVEMENT OF TEASE OBEMENG PRAPRABEBIDA ROAD 11 50KM,other donor,,6/14/2010,,,,Kwahu Afram Plains North District Assembly,,2010-06-14,
Kwahu North District Assembly,2011,SPOT IMPROVEMENT KORANTENG IDDRISSU AKURA BONDASO ROAD (21.50KM),other donor,,5/25/2010,,,,Kwahu Afram Plains North District Assembly,,2010-05-25,
Kwahu North District Assembly,2011,SPOT IMPROVEMENT OF ABOTANSO KODIDIB KPEDZE ROAD (17.70KM),other donor,,5/25/2010,,,,Kwahu Afram Plains North District Assembly,,2010-05-25,
Kwahu North District Assembly,2011,REHABILITATION OF ASANYANSO NSARIYE MAAME KROBO ROAD (11.50KM),other/unknown,,5/25/2010,,,,Kwahu Afram Plains North District Assembly,,2010-05-25,
Kwahu North District Assembly,2011,SPOT IMPROVEMENT OF MAFIKOPE SUPONG (NEW KYEIASE) ROAD (4.40KM),other/unknown,,6/1/2010,,,,Kwahu Afram Plains North District Assembly,,2010-06-01,
Kwahu North District Assembly,2011,SPOT IMPROVEMENT OF GALLON MEINU SAMANKWAE ROAD (3.50KM),other/unknown,,5/27/2010,,,,Kwahu Afram Plains North District Assembly,,2010-05-27,
Kwahu North District Assembly,2011,REHABILITATION OF GALLON MEINU GADOKOPE ROAD (11.50KM),other/unknown,,6/9/2010,,,,Kwahu Afram Plains North District Assembly,,2010-06-09,
Kwahu North District Assembly,2011,SPOT IMPROVEMENT OF ADUKROM KOFORIDUA ROAD (3.00KM),other/unknown,,5/28/2010,,,,Kwahu Afram Plains North District Assembly,,2010-05-28,
Kwahu North District Assembly,2011,SPOT IMPROVEMENT OF KAYERA ALAVANYO ATIWULAME ROAD (12.50),other/unknown,,5/25/2010,,,,Kwahu Afram Plains North District Assembly,,2010-05-25,
Kwahu North District Assembly,2011,SPOT IMPROVEMENT OF AGYATA KYIRIBAA EZEKYIKOPE ROAD (7.00KM),other/unknown,,6/1/2010,,,,Kwahu Afram Plains North District Assembly,,2010-06-01,
Kwahu North District Assembly,2011,SPOT IMPROVEMENT OF FOSO DIDIDA ROAD (3.00KM),other/unknown,,5/28/2010,,,,Kwahu Afram Plains North District Assembly,,2010-05-28,
Kwahu North District Assembly,2011,CONSTRUCTION OF CROP MARKET AT KWASI FANTE,other/unknown,,6/4/2010,,,,Kwahu Afram Plains North District Assembly,,2010-06-04,
Kwahu North District Assembly,2011,CONSTRUCTION OF CROP MARKET AT FORIFORI,other/unknown,,5/27/2010,,,,Kwahu Afram Plains North District Assembly,,2010-05-27,
Kwahu North District Assembly,2011,CONSTRUCTION OF CROP MARKET AT TEASE,other/unknown,,6/23/2010,,,,Kwahu Afram Plains North District Assembly,,2010-06-23,
Kwahu North District Assembly,2011,CONSTRUCTION OF CROP MARKET AT DOME,other/unknown,,5/27/2010,,,,Kwahu Afram Plains North District Assembly,,2010-05-27,
Kwahu North District Assembly,2011,CONSTRUCTION OF CROP MARKET AT SUPOM,other/unknown,,6/16/2010,,,,Kwahu Afram Plains North District Assembly,,2010-06-16,
Kwahu North District Assembly,2011,CONSTRUCTION OF CATTLE MARKET AND HOLDING AREA AT MAAME KROBO,other/unknown,,6/9/2010,,,,Kwahu Afram Plains North District Assembly,,2010-06-09,
Kwahu North District Assembly,2011,CONSTRUCTION OF SLAUGHTER HOUSE AT MAAME KROBO,other/unknown,,6/4/2010,,,,Kwahu Afram Plains North District Assembly,,2010-06-04,
Kwahu North District Assembly,2011,BOREHOLE DRILLING KWAHU NORTH DISTRICT 20 NO,other/unknown,,5/27/2010,,,,Kwahu Afram Plains North District Assembly,,2010-05-27,
Kwahu North District Assembly,2011,CONSTRUCTION OF GRAINS WAREHOUSE AT MAAME KROBO,other/unknown,,5/26/2010,,,,Kwahu Afram Plains North District Assembly,,2010-05-26,
Kwahu North District Assembly,2011,CONSTRUCTION OF GRAIN WAREHOUSE AT TEASE,other/unknown,,6/4/2010,,,,Kwahu Afram Plains North District Assembly,,2010-06-04,
Kwahu North District Assembly,2011,CONSTRUCTION OF GRAIN WAREHOUSE AT DONKORKROM,other/unknown,,5/28/2010,,,,Kwahu Afram Plains North District Assembly,,2010-05-28,
Kwahu North District Assembly,2011,CONSTRUCTION OF FODDER BANK AT MEM CHEMFRE,other/unknown,,6/17/2010,,,,Kwahu Afram Plains North District Assembly,,2010-06-17,
Kwahu North District Assembly,2011,CONSTRUCTION OF FODDER BANK AT AMANKWA,other/unknown,,5/25/2010,,,,Kwahu Afram Plains North District Assembly,,2010-05-25,
Kwahu North District Assembly,2011,CONSTRUCTION OF FODDER BANK AT WAWASE,other/unknown,,5/25/2010,,,,Kwahu Afram Plains North District Assembly,,2010-05-25,
Kwahu North District Assembly,2011,CONSTRUCTION OF AN EPICENTER AT MEM CHEMFRE (CLINIC 200 SEATER CONFERENCE HALL BANK LIBRARY FOOD BANK 3 BEDROOM NURSES QUARTERS AND 5 SEATER KVIP,other/unknown,,2010,,,,Kwahu Afram Plains North District Assembly,,1905-07-02,
Kwahu North District Assembly,2011,CONSTRUCTION OF AN EPICENTER AT SAKABO NO 1 (CLINIC 200 SEATER CONFERENCE HALL BANK LIBRARY FOOD BANK 3 BEDROOM NURSES QUARTERS AND 5 SEATER KVIP,other/unknown,,2010,,,,Kwahu Afram Plains North District Assembly,,1905-07-02,
Kwahu South District Assembly,2011,,,,,,,,Kwahu South District Assembly,,,
Kwahu West Municipal Assembly,2011,,,,,,,,Kwahu West Municipal Assembly,,,
Lambussie Karni  District Assembly,2011,,,,,,,,Lambussie Karni  District Assembly,,,
Lawra District Assembly,2011,CONSTRUCTION OF A 1 NO DAYCARE CENTER,multiple,,Jan,,,,Lawra  District Assembly,,Jan,
Lawra  District Assembly,2011,CONSTRUCTION OF 1 NO 3 UNIT DAYCARE CENTER,other donor,,Jan,,,,Lawra  District Assembly,,Jan,
Lawra  District Assembly,2011,CONSTRUCTION OF DAYCARE CENTER,other donor,,Jan,,,,Lawra  District Assembly,,Jan,
Lawra  District Assembly,2011,CONSTRUCTION OF 1 NO JHS,other donor,,Jan,,,,Lawra  District Assembly,,Jan,
Lawra  District Assembly,2011,CONSTRUCTION OF 6 UNIT CLASSROOM,other/unknown,,Jan,,,,Lawra  District Assembly,,Jan,
Lawra  District Assembly,2011,CONSTRUCTION OF KINDERGARTEN,other/unknown,,Jan,,,,Lawra  District Assembly,,Jan,
Lawra  District Assembly,2011,CONSTRUCTION OF DAYCARE CENTER,ddf,,Jan,,,,Lawra  District Assembly,,Jan,
Lawra  District Assembly,2011,CONSTRUCTION OF 3 UNIT JHS,ddf,,Jan,,,,Lawra  District Assembly,,Jan,
Lawra  District Assembly,2011,COMPLETION OF ABANDONED PROJECTS (ST ANT VOC),dacf,,Jan,,,,Lawra  District Assembly,,Jan,
Lawra  District Assembly,2011,CONSTRUCTION OF 1NO 3 UNIT DAYCARE CENTER,other donor,,Jan,,,,Lawra  District Assembly,,Jan,
Lawra  District Assembly,2011,CONSTRUCTION OF 1 NO 3 UNIT CLASSROOM BLOCK,other/unknown,,Jan,,,,Lawra  District Assembly,,Jan,
Lawra  District Assembly,2011,CONSTRUCTION OF 1 NO DAY CARE CENTER,multiple,,Jan,,,,Lawra  District Assembly,,Jan,
Lawra  District Assembly,2011,CONSTRUCTION OF 1 NO CHPS COMPOUND,other donor,,Jan,,,,Lawra  District Assembly,,Jan,
Lawra  District Assembly,2011,CONSTRUCTION OF NURSE QUARTERS,ddf,,Jan,,,,Lawra  District Assembly,,Jan,
Lawra  District Assembly,2011,CONSTRUCTION OF CHPS COMPOUND,ddf,,Jan,,,,Lawra  District Assembly,,Jan,
Lawra  District Assembly,2011,CONSTRUCTION OF 1 NO CHPS COMPOUND,other donor,,Jan,,,,Lawra  District Assembly,,Jan,
Lawra  District Assembly,2011,CONSTRUCTION OF MIDWIFERY TRAINING SCHOOL,ddf,,Jan,,,,Lawra  District Assembly,,Jan,
Lawra  District Assembly,2011,CONSTRUCTION OF HEALTH ASSISTANCE TRAINING SCHOOL,ddf,,Jan,,,,Lawra  District Assembly,,Jan,
Lawra  District Assembly,2011,COMPLETION OF THE CONSTRUCTION OF NANDOM HOSPITAL FENCE WALL,ddf,,Jan,,,,Lawra  District Assembly,,Jan,
Lawra  District Assembly,2011,CONSTRUCTION OF 1 NO 2 UNIT BEDROOM BUNGALOW FOR MIDWIFERY TRAINING SCHOOL,ddf,,Jan,,,,Lawra  District Assembly,,Jan,
Lawra  District Assembly,2011,RENOVATION OF 4NO BUNGALOWS,dacf,,Jan,,,,Lawra  District Assembly,,Jan,
Lawra  District Assembly,2011,PROVISION OF TV SET AND SATELLITE DISK TO THE DA GUEST HOUSE,dacf,,Jan,,,,Lawra  District Assembly,,Jan,
Lawra  District Assembly,2011,SERVICING AND EXPANSION OF OFFICE INTERCOM FACILITY,dacf,,Jan,,,,Lawra  District Assembly,,Jan,
Lawra  District Assembly,2011,PROVISION FOR OFFICE CURTAINS FURNITURE AND CONFERENCE ROOM CHAIRS AND OTHERS,dacf,,June,,,,Lawra  District Assembly,,June,
Lawra  District Assembly,2011,CONSTRUCTION OF ABANDONED DA OFFICE COMPLEX,multiple,,jan,,,,Lawra  District Assembly,,jan,
Lawra  District Assembly,2011,CONSTRUCTION OF 1 NO IRRIGATION DAM,multiple,,June,,,,Lawra  District Assembly,,June,
Lawra  District Assembly,2011,SERVICING OF OFFICE COMPUTERS AND OTHER EQUIPMENT,dacf,,Jan,,,,Lawra  District Assembly,,Jan,
Lawra  District Assembly,2011,REHABILITATION OF 2 NO DA PROJECT MONITORING VEHICLES SERVICING OF COMPUTERS AND OFFICE APPLIANCES,dacf,,Jan,,,,Lawra  District Assembly,,Jan,
Lawra  District Assembly,2011,MAINTENANCE OF STREETLIGHTS IN BOTH LAWRA AND NANDOM TOWNSHIPS,dacf,,Jan,,,,Lawra  District Assembly,,Jan,
Lawra  District Assembly,2011,CONSTRUCT 2 UNIT TOILET AND CARRYOUT MINOR REPAIRS FOR TOWN POLICE STATION,dacf,,Aug,,,,Lawra  District Assembly,,Aug,
Lawra  District Assembly,2011,REHABILITATION OF 1 NO ABANDONED STRUCTURE FOR DIVISIONAL POLICE HEADQUARTERS,ddf,,Aug,,,,Lawra  District Assembly,,Aug,
Lawra  District Assembly,2011,REHABILITATION OF MAGISTRATE'S BUNGALOW,ddf,,June,,,,Lawra  District Assembly,,June,
Lawra  District Assembly,2011,COMPLETION OF LAWRA MARKET,dacf,,Jan,,,,Lawra  District Assembly,,Jan,
Lawra  District Assembly,2011,REHABILITATION OF 8 NO BORE HOLES,other donor,,Jan,,,,Lawra  District Assembly,,Jan,
Lawra  District Assembly,2011,DISLODGEMENT OF TOILETS AND SUPPORT FOR OTHER SANITATION,dacf,,Jan,,,,Lawra  District Assembly,,Jan,
Lawra  District Assembly,2011,ACQUISITION OF REFUSE DISPOSAL SITES,dacf,,Jan,,,,Lawra  District Assembly,,Jan,
Lawra  District Assembly,2011,CONSTRUCTION OF 1NO MECHANIZED PIPE SYSTEM,other/unknown,,Jan,,,,Lawra  District Assembly,,Jan,
Lawra  District Assembly,2011,CONSTRUCTION OF 10 SEATER KVIP,ddf,,Jan,,,,Lawra  District Assembly,,Jan,
Lawra  District Assembly,2011,CONSTRUCTION OF 1NO BOREHOLE PUMP,dacf,,Jan,,,,Lawra  District Assembly,,Jan,
Lawra  District Assembly,2011,CONSTRUCTION OF 14 NO BOREHOLES FIXED WITH HAND PUMPS,other donor,,Jan,,,,Lawra  District Assembly,,Jan,
Lawra  District Assembly,2011,CONSTRUCTION OF 15 NO BOREHOLES FIXES WITH HAND PUMPS,other donor,,Jan,,,,Lawra  District Assembly,,Jan,
Lawra  District Assembly,2011,CONSTRUCTION OF KVIP AT NANDOM SEC SCH,ddf,,Jan,,,,Lawra  District Assembly,,Jan,
Lawra  District Assembly,2011,COMPLETION OF 11 NO INSTITUTIONAL LATRINES,other donor,,Jan,,,,Lawra  District Assembly,,Jan,
Lawra  District Assembly,2011,COMPLETION OF 120 NO HOUSE HOLD LATRINES,other donor,,Jan,,,,Lawra  District Assembly,,Jan,
Lawra  District Assembly,2011,CONSTRUCTION OF 200 NO HOUSE HOLD LATRINES,other donor,,Jan,,,,Lawra  District Assembly,,Jan,
Lawra  District Assembly,2011,CONSTRUCTION OF 200 NO HOUSE HOLD LATRINES,ddf,,Jan,,,,Lawra  District Assembly,,Jan,
Lawra  District Assembly,2011,MAINTENANCE OF BABILE STREETLIGHTS,dacf,,Jan,,,,Lawra  District Assembly,,Jan,
Ledzekuku-Krowor Municipal Assembly,2011,CONSTRUCTION A POLYCLINC NUNGUA,other/unknown,,,,,,Ledzekuku-Krowor Municipal Assembly,,,
Ledzekuku-Krowor Municipal Assembly,2011,CONSTRUCTION OF 2 UNIT SEMI DETACHED STAFF BUNGALOW AT NUNGUA,other/unknown,,,,,,Ledzekuku-Krowor Municipal Assembly,,,
Ledzekuku-Krowor Municipal Assembly,2011,ERECTION AND COMPLETION OF 3 STOREY 12 UNIT DORMITORY BLOCK FOR NUNGUA SECONDARY SCHOOL,other/unknown,,,,,,Ledzekuku-Krowor Municipal Assembly,,,
Ledzekuku-Krowor Municipal Assembly,2011,COMPLETION OF 3 STOREY 12 UNIT DORMITORY BLOCK FOR TESHIE PRESBY SECONDARY,other/unknown,,,,,,Ledzekuku-Krowor Municipal Assembly,,,
Ledzekuku-Krowor Municipal Assembly,2011,CONTINUATION AND COMPLETION OF 6 UNIT CLASSROOM BLOCK AT NUNGUA METHODIST SCHOOL,other/unknown,,,,,,Ledzekuku-Krowor Municipal Assembly,,,
Ledzekuku-Krowor Municipal Assembly,2011,CONTINUATION AND COMPLETION OF STAFF COMMON ROOM AND STORE AT NUNGUA METHODIST SCHOOL,other/unknown,,,,,,Ledzekuku-Krowor Municipal Assembly,,,
Ledzekuku-Krowor Municipal Assembly,2011,CONSTRUCTION OF 2 STOREY 8 UNIT OFFICE EXTENSION TO LEKMA NEW OFFICE BLOCK,other/unknown,,,,,,Ledzekuku-Krowor Municipal Assembly,,,
Ledzekuku-Krowor Municipal Assembly,2011,INSTALL SECURITY FIRE ALARM SYSTERM INSTALL AT THE MUNICIPAL CHIEF EXECUTIVE RESIDENCE AND ASSEMBLY HEAD,other/unknown,,,,,,Ledzekuku-Krowor Municipal Assembly,,,
Ledzekuku-Krowor Municipal Assembly,2011,FENCING OF NUNGUA PRESBY,other/unknown,,,,,,Ledzekuku-Krowor Municipal Assembly,,,
Ledzekuku-Krowor Municipal Assembly,2011,CONSTRUCTION 2 NO REVENUE OFFICE AT SPINTEX ROAD AND MARTY TSURU,other/unknown,,,,,,Ledzekuku-Krowor Municipal Assembly,,,
Ledzekuku-Krowor Municipal Assembly,2011,PROVIDE 2NO PRE SCHOOL AT SANGORJOR AND MARTY TSURU,other/unknown,,,,,,Ledzekuku-Krowor Municipal Assembly,,,
Ledzekuku-Krowor Municipal Assembly,2011,SCHOOL STRUCTURE AT TESHIE KROBO,other/unknown,,,,,,Ledzekuku-Krowor Municipal Assembly,,,
Ledzekuku-Krowor Municipal Assembly,2011,CONSTRUCT 6 UNIT CLASSROOM BLOCK AT TESHIE ABOMA SCHOOL,other/unknown,,,,,,Ledzekuku-Krowor Municipal Assembly,,,
Ledzekuku-Krowor Municipal Assembly,2011,INSTALL SECURITY STREET LIGHTS IN THE DARK AREAS IN THE MUNICIPALITY,other/unknown,,,,,,Ledzekuku-Krowor Municipal Assembly,,,
Ledzekuku-Krowor Municipal Assembly,2011,CONTINUATION AND COMPLETION OF 5 SEATER W C AT NUNGUA METHODIST SCHOOL,other/unknown,,,,,,Ledzekuku-Krowor Municipal Assembly,,,
Ledzekuku-Krowor Municipal Assembly,2011,CONSTRUCT 40 SEATER TOILET AT NUNGUA LORRY PARK BY DEC 2011,other/unknown,,,,,,Ledzekuku-Krowor Municipal Assembly,,,
Ledzekuku-Krowor Municipal Assembly,2011,PROVIDE 12 NO JUMBO SIZED WATER STORAGE FACILITIES FOR SELECTED AREAS,other/unknown,,,,,,Ledzekuku-Krowor Municipal Assembly,,,
Ledzekuku-Krowor Municipal Assembly,2011,PROVIDE FURNITURE FOR TESHIE SOUTHERN CLUSTER OF SCHOOLS BY DEC 2011,other/unknown,,,,,,Ledzekuku-Krowor Municipal Assembly,,,
Ledzekuku-Krowor Municipal Assembly,2011,PROVIDE 1000 NO DUAL DESKS FOR LOWER PRIMARY SCHOOLS WITHIN THE MUNICIPALITY DEC 2011,other/unknown,,,,,,Ledzekuku-Krowor Municipal Assembly,,,
Ledzekuku-Krowor Municipal Assembly,2011,CONSTRUCT TRADITIONAL AUTHORITY OFFICE AT NUNGUA,other/unknown,,,,,,Ledzekuku-Krowor Municipal Assembly,,,
Ledzekuku-Krowor Municipal Assembly,2011,DUAL DESKS FOR UPPER PRIMARY SCHOOLS WITHIN THE MUNICIPALITY DEC. 2011,other/unknown,,,,,,Ledzekuku-Krowor Municipal Assembly,,,
Ledzekuku-Krowor Municipal Assembly,2011,MONO-DESKS FOR JUNIOR HIGH SCHOOLS WITHIN THE MUNICAPLITY BY DEC.2011,other/unknown,,,,,,Ledzekuku-Krowor Municipal Assembly,,,
Ledzekuku-Krowor Municipal Assembly,2011,"COMPLETE 8 UNIT CLASSROOM BLOCK AT TESHIE NORTHERN CLUSTER OF SCHOOLS BY DEC, 2011",other/unknown,,,,,,Ledzekuku-Krowor Municipal Assembly,,,
Ledzekuku-Krowor Municipal Assembly,2011,CONSTRUCT 1 NO. 10 SEATER TOILETS AT TESHIE NORTHERN CLUSTER OF SCHOOLS BY DEC. 2011,other/unknown,,,,,,Ledzekuku-Krowor Municipal Assembly,,,
Ledzekuku-Krowor Municipal Assembly,2011,CONSTRUCT ASSEMBLYS OFFICE COMPLEX,other/unknown,,,,,,Ledzekuku-Krowor Municipal Assembly,,,
Lower Manya Krobo Municipal Assembly,2011,ESTABLISH 3NO ONE ACRE DEMONSTRATION PLOTS BY EACH AEA,other/unknown,,,,,,Lower Manya Krobo Municipal Assembly,,,
Lower Manya Krobo Municipal Assembly,2011,ESTABLISH ONE CENTRALIZED PIG DEMONSTRATION IN THE DISTRICT,other/unknown,,,,,,Lower Manya Krobo Municipal Assembly,,,
Lower Manya Krobo Municipal Assembly,2011,RESHAPE 15KM FEEDER ROADS IN FARMING COMMUNITIES,other/unknown,,,,,,Lower Manya Krobo Municipal Assembly,,,
Lower Manya Krobo Municipal Assembly,2011,CONSTRUCT GYEKITI OBELEMANYA FEEDER,other/unknown,,,,,,Lower Manya Krobo Municipal Assembly,,,
Lower Manya Krobo Municipal Assembly,2011,CONSTRUCT 1NO MARKET SHED,other/unknown,,,,,,Lower Manya Krobo Municipal Assembly,,,
Lower Manya Krobo Municipal Assembly,2011,CONSTRUCT 2NO MARKET SHED,other/unknown,,,,,,Lower Manya Krobo Municipal Assembly,,,
Lower Manya Krobo Municipal Assembly,2011,DEVELOP 15 HA FOREST PLANTATIONS,other/unknown,,,,,,Lower Manya Krobo Municipal Assembly,,,
Lower Manya Krobo Municipal Assembly,2011,CARRY OUT ROUTINE MAINTENANCE ON 10KM TOWN ROADS ANNUALLY,other/unknown,,,,,,Lower Manya Krobo Municipal Assembly,,,
Lower Manya Krobo Municipal Assembly,2011,CONSTRUCT FOOT BRIDGE AT AGORMANYA,other/unknown,,,,,,Lower Manya Krobo Municipal Assembly,,,
Lower Manya Krobo Municipal Assembly,2011,EXTENSION OF ELECTRICITY,other/unknown,,,,,,Lower Manya Krobo Municipal Assembly,,,
Lower Manya Krobo Municipal Assembly,2011,REPLACEMENT AND INSTALLATION STREET LIGHTS OBJECTIVE FACILITATE ONGOING INSTITUTIONAL TECHNOLOGICAL AND LEGAL REFORMS UNDER THE LAP TCPD LUPMP IN SUPPORT OF LAND USE PLANNING,other/unknown,,,,,,Lower Manya Krobo Municipal Assembly,,,
Lower Manya Krobo Municipal Assembly,2011,INSTALLATION OF HAND PUMPS ON 10 NO HAND DUG WELL CONSTRUCTED UNDER CBRDP,other/unknown,,,,,,Lower Manya Krobo Municipal Assembly,,,
Lower Manya Krobo Municipal Assembly,2011,REHABILITATE AND CONVERT 4 NO PUBLIC PAN LATRINE TO AQUA PRIVY TOILET,other/unknown,,,,,,Lower Manya Krobo Municipal Assembly,,,
Lower Manya Krobo Municipal Assembly,2011,CONSTRUCT 1NO 12 SEATER WC TOILET,other/unknown,,,,,,Lower Manya Krobo Municipal Assembly,,,
Lower Manya Krobo Municipal Assembly,2011,CONSTRUCT 1 NO 12 SEATER W C TOILET,other/unknown,,,,,,Lower Manya Krobo Municipal Assembly,,,
Lower Manya Krobo Municipal Assembly,2011,CONSTRUCT 1 NO 20 SEATER AQUA PRIVY TOILET,other/unknown,,,,,,Lower Manya Krobo Municipal Assembly,,,
Lower Manya Krobo Municipal Assembly,2011,CONSTRUCT 1NO 20 SEATER AQUA PRIVY TOILET,other/unknown,,,,,,Lower Manya Krobo Municipal Assembly,,,
Lower Manya Krobo Municipal Assembly,2011,CONSTRUCT 1NO 12 SEATER AQUA PRIVY TOILET,other/unknown,,,,,,Lower Manya Krobo Municipal Assembly,,,
Lower Manya Krobo Municipal Assembly,2011,WORKS ON PUBLIC TOILET,other/unknown,,,,,,Lower Manya Krobo Municipal Assembly,,,
Lower Manya Krobo Municipal Assembly,2011,SPRAY FUMIGATE 5 REFUSE SITES,other/unknown,,,,,,Lower Manya Krobo Municipal Assembly,,,
Lower Manya Krobo Municipal Assembly,2011,COMPLETE CONSTRUCTION OF 1 NO 2 UNIT CLASSROOM BLOCK FOR KG,other/unknown,,,,,,Lower Manya Krobo Municipal Assembly,,,
Lower Manya Krobo Municipal Assembly,2011,CONSTRUCT OF 1 NO 2 UNIT CLASSROOM BLOCK FOR KG,other/unknown,,,,,,Lower Manya Krobo Municipal Assembly,,,
Lower Manya Krobo Municipal Assembly,2011,CONSTRUCT OF 1 NO 3 UNIT CLASSROOM BLOCK,other/unknown,,,,,,Lower Manya Krobo Municipal Assembly,,,
Lower Manya Krobo Municipal Assembly,2011,CONSTRUCT OF 1 NO 3 UNIT CLASSROOM BLOCK,other/unknown,,,,,,Lower Manya Krobo Municipal Assembly,,,
Lower Manya Krobo Municipal Assembly,2011,CONSTRUCTION 1 NO 3 UNIT CLASSROOM BLOCKS FOR NUASO ANGLICAN JHS SCHOOLS,other/unknown,,,,,,Lower Manya Krobo Municipal Assembly,,,
Lower Manya Krobo Municipal Assembly,2011,WALLING AND PARTITIONING OF 4 UNIT CLASSROOM,other/unknown,,,,,,Lower Manya Krobo Municipal Assembly,,,
Lower Manya Krobo Municipal Assembly,2011,COMPLETE CONSTRUCTION OF FENCE WALL AROUND,other/unknown,,,,,,Lower Manya Krobo Municipal Assembly,,,
Lower Manya Krobo Municipal Assembly,2011,ODUMASE PRESBY JHS,other/unknown,,,,,,Lower Manya Krobo Municipal Assembly,,,
Lower Manya Krobo Municipal Assembly,2011,COMPLETE CONSTRUCTION OF 1 NO KINDERGARTEN FOR,other/unknown,,,,,,Lower Manya Krobo Municipal Assembly,,,
Lower Manya Krobo Municipal Assembly,2011,LA PRIMARY SCHOOL,other/unknown,,,,,,Lower Manya Krobo Municipal Assembly,,,
Lower Manya Krobo Municipal Assembly,2011,CONSTRUCTION OF 1 NO CANTEEN KITCHEN AND STORE,other/unknown,,,,,,Lower Manya Krobo Municipal Assembly,,,
Lower Manya Krobo Municipal Assembly,2011,COMPLETE CONSTRUCTION OF 2 NO 9 UNIT TEACHERS QUARTERS AT OBORPA EAST AND OBELEMANYA BY END OF DEC 2012,other/unknown,,,,,,Lower Manya Krobo Municipal Assembly,,,
Lower Manya Krobo Municipal Assembly,2011,PAVE AKUSE GOVERNMENT HOSPITAL,other/unknown,,,,,,Lower Manya Krobo Municipal Assembly,,,
Lower Manya Krobo Municipal Assembly,2011,ORGANZIE SCHOOL SPORTING ACTIVITIES,other/unknown,,,,,,Lower Manya Krobo Municipal Assembly,,,
Lower Manya Krobo Municipal Assembly,2011,PROVIDE OFFICE ACCOMMODATION FOR 2 AREA COUNCILS,other/unknown,,,,,,Lower Manya Krobo Municipal Assembly,,,
Lower Manya Krobo Municipal Assembly,2011,PROVIDE AND SERVICES INTERNET CONNECTIVITY FOR DA OFFICES,other/unknown,,,,,,Lower Manya Krobo Municipal Assembly,,,
Lower Manya Krobo Municipal Assembly,2011,COMPLETE LANDSCAPING OF DISTRICT ASSEMBLY PRESMIES,other/unknown,,,,,,Lower Manya Krobo Municipal Assembly,,,
Lower Manya Krobo Municipal Assembly,2011,COMPLETE THE FENCING OF THE DISTRICT ASSEMBLY PREMISES,other/unknown,,,,,,Lower Manya Krobo Municipal Assembly,,,
Lower Manya Krobo Municipal Assembly,2011,COMPLETE THE FENCING OF DCE S RESIDENCY,other/unknown,,,,,,Lower Manya Krobo Municipal Assembly,,,
Lower Manya Krobo Municipal Assembly,2011,REHABILITATE GES DIRECTOR'S BUNGALOW,other/unknown,,,,,,Lower Manya Krobo Municipal Assembly,,,
Lower Manya Krobo Municipal Assembly,2011,REHABILITATE DEO S BUNGALOW,other/unknown,,,,,,Lower Manya Krobo Municipal Assembly,,,
Lower Manya Krobo Municipal Assembly,2011,REHABILITATE PROJECT VEHICLES,other/unknown,,,,,,Lower Manya Krobo Municipal Assembly,,,
Mampong Municipal Assembly,2011,CONSTRUCTION OF 1 NO 6 UNIT CLASSROOM BLOCK WITH OFFICE STORE AND LIBRARY AT BENIM,ddf,,Dec-10,,,,Mampong  Municipal Assembly,,2010-12-01,
Mampong  Municipal Assembly,2011,CONSTRUCTION OF 1 NO 3 UNIT CLASSROOM BLOCK WITH TOILET AT ASAAM,ddf,,Dec-10,,,,Mampong  Municipal Assembly,,2010-12-01,
Mampong  Municipal Assembly,2011,CONSTRUCTION OF 1 NO 16 SEATER AQUA PRIVY TOILET AT NAAMA,ddf,,Dec-10,,,,Mampong  Municipal Assembly,,2010-12-01,
Mampong  Municipal Assembly,2011,CONSTRUCTION OF MEDICAL ASSISTANTS QUARTERS AT KOFIASE,ddf,,Dec-10,,,,Mampong  Municipal Assembly,,2010-12-01,
Mampong  Municipal Assembly,2011,CONSTRUCTION OF 1 NO 6 UNIT CLASSROOM BLOCK WITH OFFICE STORE AND LIBRARY AT AFRAMANO,ddf,,Dec-10,,,,Mampong  Municipal Assembly,,2010-12-01,
Mampong  Municipal Assembly,2011,CONSTRUCTIN OF 1 NO 2 UNIT KG BLOCK WITH OFFICE STORE AND DINING HALL AT KOFIASE DAMASCUS SCHOOL KOFIASE,other donor,,Dec-10,,,,Mampong  Municipal Assembly,,2010-12-01,
Mampong  Municipal Assembly,2011,CONSTRUCTION OF 1 NO 6 UNIT SCHOOL BLOCK WITH OFFICE STORE LIBRARY AND ICT ROOM AT BOSOMKYEKYE,other donor,,Dec-10,,,,Mampong  Municipal Assembly,,2010-12-01,
Mampong  Municipal Assembly,2011,CONSTRUCTION OF 1 NO 3 UNIT CLASSROOM BLOCK WITH 3 SEATER TOILET FACILITY AT WORASO,other donor,,Dec-10,,,,Mampong  Municipal Assembly,,2010-12-01,
Mampong  Municipal Assembly,2011,CONSTRUCTION OF 1 NO 16 SEATER AQUA PRIVY TOILET FACILITY AT ADIDWAN,ddf,,Dec-10,,,,Mampong  Municipal Assembly,,2010-12-01,
Mfantsiman Municipal Assembly,2011,CONST OF 6 UNIT CLASSROOM BLK WITH ANCILLARY FACILITIES FOR AME ZION SCH,getfund,,,,,,Mfantsiman Municipal Assembly,,,
Mfantsiman Municipal Assembly,2011,COMPLETION OF 2NO SEMI DETACHED BEDROOM,other donor,,,,,,Mfantsiman Municipal Assembly,,,
Mfantsiman Municipal Assembly,2011,EXTENSION OF ELECTRICITY TO 4 COMMUNITY CLINICS,dacf,,,,,,Mfantsiman Municipal Assembly,,,
Mfantsiman Municipal Assembly,2011,CONST OF 1NO 2 BEDROOM SEMI DETACHED TEACHERS QUARTERS,other donor,,,,,,Mfantsiman Municipal Assembly,,,
Mfantsiman Municipal Assembly,2011,CONST OF 1NO 10 SEATER VAULT CHAMBER,ddf,,,,,,Mfantsiman Municipal Assembly,,,
Mfantsiman Municipal Assembly,2011,CONST OF 1NO 10 SEATER VAULT,ddf,,,,,,Mfantsiman Municipal Assembly,,,
Mfantsiman Municipal Assembly,2011,CONST OF 1NO 10 SEATER VAULT CHAMBER TOILET,ddf,,,,,,Mfantsiman Municipal Assembly,,,
Mfantsiman Municipal Assembly,2011,CONST OF 1NO 10 SEATER VAULT CHAMBER TOILET,ddf,,,,,,Mfantsiman Municipal Assembly,,,
Mfantsiman Municipal Assembly,2011,CONST OF 1NO 10 SEATER VAULT CHAMBER TOILET,ddf,,,,,,Mfantsiman Municipal Assembly,,,
Mfantsiman Municipal Assembly,2011,CONST OF 1NO 10 SEATER VAULT CHAMBER TOILET,ddf,,,,,,Mfantsiman Municipal Assembly,,,
Mfantsiman Municipal Assembly,2011,CONST OF 1NO 10 SEATER VAULT CHAMBER TOILET,ddf,,,,,,Mfantsiman Municipal Assembly,,,
Mfantsiman Municipal Assembly,2011,CONST OF 1NO SEATER WC TOILET,ddf,,,,,,Mfantsiman Municipal Assembly,,,
Mfantsiman Municipal Assembly,2011,EVACUATION OF REFUSES,ddf,,,,,,Mfantsiman Municipal Assembly,,,
Mfantsiman Municipal Assembly,2011,CONST OF 1NO 10 SEATER VAULT CHAMBER TOILET,ddf,,,,,,Mfantsiman Municipal Assembly,,,
Mfantsiman Municipal Assembly,2011,RESHAPPING OF BAIFIKROM DOMINASE AND OTHER FEEDER ROADS 18 65KM,other gog,,,,,,Mfantsiman Municipal Assembly,,,
Mfantsiman Municipal Assembly,2011,RESHAPING OF EGYAA KUNTU AND OTHER FEEDER ROADS 10 8KM,other gog,,,,,,Mfantsiman Municipal Assembly,,,
Mfantsiman Municipal Assembly,2011,RESHAPING OF ANOKYI KUNTU AND OTHER FEEDER ROADS 10.8KM,other gog,,,,,,Mfantsiman Municipal Assembly,,,
Mfantsiman Municipal Assembly,2011,RESHAPING OF ODUMANU AKROPONG AND OTHER FEEDER ROADS 13.35KM,other gog,,,,,,Mfantsiman Municipal Assembly,,,
Mfantsiman Municipal Assembly,2011,RESHAPING OF NSANFO NSAADZE AND OTHER FEEDER ROADS 12 40KM,other gog,,,,,,Mfantsiman Municipal Assembly,,,
Mfantsiman Municipal Assembly,2011,RESHAPING OF AKRONG KWAAKROM AND OTHER FEEDER ROADS 12.9KM,other gog,,,,,,Mfantsiman Municipal Assembly,,,
Mfantsiman Municipal Assembly,2011,RESHAPING OF ANOMABU NKRAMOFOKROM AND OTHER FEEDER ROADS 16.20KM,other gog,,,,,,Mfantsiman Municipal Assembly,,,
Mfantsiman Municipal Assembly,2011,RESHAPING OF MANKESSIM AWOYAA JUNC AND OTHER FEEDER ROADS 19.70KM,other gog,,,,,,Mfantsiman Municipal Assembly,,,
Mfantsiman Municipal Assembly,2011,RESHAPING OF DOMINASE BADUKROM AND OTHER FEEDER ROADS 12.60KM,other gog,,,,,,Mfantsiman Municipal Assembly,,,
Mfantsiman Municipal Assembly,2011,RESHAPING OF AKWAKROM AMISSAHKROM AND OTHER FEEDER ROADS 19.2KM,other gog,,,,,,Mfantsiman Municipal Assembly,,,
Mfantsiman Municipal Assembly,2011,RESHAPING OF TUAKWA JUNC BETSINGUA AND OTHER FEEDER ROADS 17.5KM,other gog,,,,,,Mfantsiman Municipal Assembly,,,
Mfantsiman Municipal Assembly,2011,RESHAPING OF EYISAM NARKWA AND OTHER FEEDER ROADS 47.5KM,other gog,,,,,,Mfantsiman Municipal Assembly,,,
Mfantsiman Municipal Assembly,2011,SURFACING OF SALTPOND TOWN ROADS PHASE 2 AND MFANTSEMAN SSS 7.6KM,other gog,,,,,,Mfantsiman Municipal Assembly,,,
Mfantsiman Municipal Assembly,2011,CONST OF STEEL BRIDGE OVER RIVER OKYI ON ESHIROW JUNC ESHIROW KWESIGYAN AND OTHER FEEDER ROAD,other/unknown,,,,,,Mfantsiman Municipal Assembly,,,
Mfantsiman Municipal Assembly,2011,SPOT IMPROVEMENT OF NANANOM JUNC RURAL TECHNOLOGY FACILITY FEEDER ROADS AND OTHERS 1.65KM,dacf,,,,,,Mfantsiman Municipal Assembly,,,
Mfantsiman Municipal Assembly,2011,CONST OF 1NO DOUBLE 900MM DIAMETER PIPE CULVERT ON ANKAMU YAMORANSA AWOYAA JUNCTION,other gog,,,,,,Mfantsiman Municipal Assembly,,,
Mfantsiman Municipal Assembly,2011,CONST OF 6 CLASSROOM BLK AT BIRIWA,getfund,,,,,,Mfantsiman Municipal Assembly,,,
Mfantsiman Municipal Assembly,2011,CONST OF JHS AT WAAKROM,getfund,,,,,,Mfantsiman Municipal Assembly,,,
Mfantsiman Municipal Assembly,2011,CONST OF 6 CLASSROOM BLK AT METHODIST PRIMARY YAMORANSA,getfund,,,,,,Mfantsiman Municipal Assembly,,,
Mfantsiman Municipal Assembly,2011,CONST OF 6 CLASSROOM BLK JHS AT ABAKA ASOKWA,getfund,,,,,,Mfantsiman Municipal Assembly,,,
Mfantsiman Municipal Assembly,2011,CONST OF 6 CLASSROOM BLK ANGLICAN PRIMARY AT KWAAKROM,getfund,,,,,,Mfantsiman Municipal Assembly,,,
Mfantsiman Municipal Assembly,2011,CONST OF 6 CLASSROOM BLK JHS AT EKUMFI ANGOW,getfund,,,,,,Mfantsiman Municipal Assembly,,,
Mfantsiman Municipal Assembly,2011,CONST OF 6 CLASSROOM BLK JHS AT EKUMFI EGYANKWA OWUYAA,getfund,,,,,,Mfantsiman Municipal Assembly,,,
Mfantsiman Municipal Assembly,2011,CONST OF 6 CLASSROOM BLK M A PRIMARY AT DOMINASE,getfund,,,,,,Mfantsiman Municipal Assembly,,,
Mfantsiman Municipal Assembly,2011,CONST OF 6 CLASSROOM BLK L A PRIMARY AT ESHIROW,getfund,,,,,,Mfantsiman Municipal Assembly,,,
Mfantsiman Municipal Assembly,2011,CONST OF 6 CLASSROOM BLK RC PRIMARY EDUMAFA,getfund,,,,,,Mfantsiman Municipal Assembly,,,
Mfantsiman Municipal Assembly,2011,CONST OF 6 CLASSROOM BLK RC PRIMARY AT BAIFIKROM,other/unknown,,,,,,Mfantsiman Municipal Assembly,,,
Mfantsiman Municipal Assembly,2011,CONST OF 6 CLASSROOM BLK RC PRIMARY AT OBUADZE,other/unknown,,,,,,Mfantsiman Municipal Assembly,,,
Mfantsiman Municipal Assembly,2011,CONST OF 6 CLASSROOM BLK ISLAMIC PRIMARY AT SRAFAIMMUNA,other/unknown,,,,,,Mfantsiman Municipal Assembly,,,
Mfantsiman Municipal Assembly,2011,CONST OF 6 CLASSROOM BLK AHMADDIYA JHS AT ATTAKWA,other/unknown,,,,,,Mfantsiman Municipal Assembly,,,
Mfantsiman Municipal Assembly,2011,CONST OF 2 CLASSROOM BLK PRIMARY AT BURANOMOA,other/unknown,,,,,,Mfantsiman Municipal Assembly,,,
Mfantsiman Municipal Assembly,2011,CONST OF 3 CLASSROOM BLK ISLAMIC KG AT EDUKUMA,other/unknown,,,,,,Mfantsiman Municipal Assembly,,,
Mfantsiman Municipal Assembly,2011,CONST OF 3 CLASSROOM BLK M A PRIMARY AT OBIDAN POTWABIN,other/unknown,,,,,,Mfantsiman Municipal Assembly,,,
Mfantsiman Municipal Assembly,2011,CONST OF 6 CLASSROOM BLK FOR BISHOP LAMAIRE PRIM JHS BISHOP LAMAIRE ANG SCH,other/unknown,,,,,,Mfantsiman Municipal Assembly,,,
Mfantsiman Municipal Assembly,2011,CONSTRUCTION OF 6 UNIT CLASSROOM BLOCK FOR EKUMPOANO PRIM 2 NO 3 SEATER TOILET,multiple,,,,,,Mfantsiman Municipal Assembly,,,
Mfantsiman Municipal Assembly,2011,CONSTRUCTION OF 6 UNIT CLASSROOM BLOCK FOR HINII PRIM 2 NO 3 SEATER TOILET,multiple,,,,,,Mfantsiman Municipal Assembly,,,
Mfantsiman Municipal Assembly,2011,CONST OF 3 BEDROOM BUNGALOW FOR MUNICIPAL MAGISTRATE,dacf,,,,,,Mfantsiman Municipal Assembly,,,
Mfantsiman Municipal Assembly,2011,CONST OF 3 UNIT CLASS ROOM BLOCK,dacf,,,,,,Mfantsiman Municipal Assembly,,,
Mfantsiman Municipal Assembly,2011,CONST OF 1NO 10 SEATER VAULT CHAMBER TOILET,ddf,,,,,,Mfantsiman Municipal Assembly,,,
Mfantsiman Municipal Assembly,2011,CONST OF 1NO 10 SEATER VAULT CHAMBER TOILET,ddf,,,,,,Mfantsiman Municipal Assembly,,,
Mfantsiman Municipal Assembly,2011,CONST OF 1NO 10 SEATER VAULT CHAMBER TOILET,ddf,,,,,,Mfantsiman Municipal Assembly,,,
Mfantsiman Municipal Assembly,2011,CONST OF 10 NO 10 SEATER VAULT CHAMBER TOILET,ddf,,,,,,Mfantsiman Municipal Assembly,,,
Mfantsiman Municipal Assembly,2011,CONST OF 1NO 10 SEATER VAULT CHAMBER TOILET,ddf,,,,,,Mfantsiman Municipal Assembly,,,
Mfantsiman Municipal Assembly,2011,CONST OF SLAUGHTER HOUSE,ddf,,,,,,Mfantsiman Municipal Assembly,,,
Mfantsiman Municipal Assembly,2011,CONST OF 3 UNIT KG SCHOOL BLOCK,ddf,,,,,,Mfantsiman Municipal Assembly,,,
Mfantsiman Municipal Assembly,2011,COMPLETION OF 2 STOREY BUILDING FOR MCE,dacf,,,,,,Mfantsiman Municipal Assembly,,,
Mfantsiman Municipal Assembly,2011,RECONSTRUCTION OF BIRIWA MKT,other gog,,,,,,Mfantsiman Municipal Assembly,,,
Mfantsiman Municipal Assembly,2011,REGRAVELLING OF MANKESSIM MARKET GROUNDS LORRY PARKS CAPE COAST STATION,other gog,,,,,,Mfantsiman Municipal Assembly,,,
Mfantsiman Municipal Assembly,2011,CONST OF CHPS COMPOUND,other gog,,,,,,Mfantsiman Municipal Assembly,,,
Mfantsiman Municipal Assembly,2011,CONST OF REST STOP,other gog,,,,,,Mfantsiman Municipal Assembly,,,
Mfantsiman Municipal Assembly,2011,RESURFACING OF ESSUEHYIA ARKRA OTHERS 18 91KM FEEDER ROAD,other gog,,,,,,Mfantsiman Municipal Assembly,,,
Mfantsiman Municipal Assembly,2011,RESEALING PARTIAL RECONST OF OTUAM-ESSUEHYIA ROADS 16KM AND OTUAM TOWN ROADS 2KM,other gog,,,,,,Mfantsiman Municipal Assembly,,,
Mfantsiman Municipal Assembly,2011,CONST OF ICT CENTRE,other donor,,,,,,Mfantsiman Municipal Assembly,,,
Mfantsiman Municipal Assembly,2011,CONST OF 6 UNIT CLASSROOM BLK WITH ANCILLARY FACILITIES AT MKS CATH A & B PRI SCH,getfund,,,,,,Mfantsiman Municipal Assembly,,,
Mfantsiman Municipal Assembly,2011,CONST OF 6 UNIT CLASSROOM BLK WITH ANCILLARY FACILITIES AT MANKESSIM METH A & B MA PRIMARY SCHOOL,getfund,,,,,,Mfantsiman Municipal Assembly,,,
Mfantsiman Municipal Assembly,2011,CONST OF 6 UNIT CLASSROOM BLK WITH ANCILLARY FACILITIES AT EK SRAFA MPOANO PRI SCH,getfund,,,,,,Mfantsiman Municipal Assembly,,,
Mfantsiman Municipal Assembly,2011,CONST OF 6 UNIT CLASSROOM BLK WITH ANCILLARY FACILITIES AT AKROPONG PRIMARY SCH,getfund,,,,,,Mfantsiman Municipal Assembly,,,
Mfantsiman Municipal Assembly,2011,CONSTRUCTION OF 3 UNIT LIBRARY AND COMPUTER LABORATORY AT ABEADZE DOMINASE JHS,getfund,,,,,,Mfantsiman Municipal Assembly,,,
Mfantsiman Municipal Assembly,2011,CONSTRUCTION OF 3 UNIT CLASSROOM BLOCK WITH ANCILLARY FACILITIES AT DOMINASE ANGLICAN JHS,getfund,,,,,,Mfantsiman Municipal Assembly,,,
Mfantsiman Municipal Assembly,2011,CONST OF UNIT CLASSROOM BLK FOR ANKAFUL M A PRIMARY ANKAFUL,getfund,,,,,,Mfantsiman Municipal Assembly,,,
Mfantsiman Municipal Assembly,2011,CONSTRUCTION OF 2 UNIT CLASSROOM BLOCK WITH ANCILLARY FACILITIES AT EKUMFI GYINAKOMA KG,getfund,,,,,,Mfantsiman Municipal Assembly,,,
Mfantsiman Municipal Assembly,2011,CONSTRUCTION OF 3 UNIT CLASSROOM BLOCK WITH ANCILLARY FACILITIES AT EKUMFI EYISAM ISLAMIC JHS,getfund,,,,,,Mfantsiman Municipal Assembly,,,
Mfantsiman Municipal Assembly,2011,CONSTRUCTION OF 3 UNIT CLASSROOM BLK WITH ANCILLARY FACILITIES AT EKUMFI NARKWA METH JHS,getfund,,,,,,Mfantsiman Municipal Assembly,,,
Mfantsiman Municipal Assembly,2011,CONSTRUCTION OF NURSES QUARTERS,ddf,,,,,,Mfantsiman Municipal Assembly,,,
Mfantsiman Municipal Assembly,2011,CONSTRUCTION OF CHPS COMPOUND,ddf,,,,,,Mfantsiman Municipal Assembly,,,
Mfantsiman Municipal Assembly,2011,CONSTRUCTION OF INSTITUTIONAL TOILET 16 SEATER WC MKS SNR HIGH TECH SCH,ddf,,,,,,Mfantsiman Municipal Assembly,,,
Mfantsiman Municipal Assembly,2011,CONSTRUCTION OF INSTITUTIONAL 16 SEATER WC TOILET FOR TI AHMADDYYA SNR HIGH SCH,other/unknown,,,,,,Mfantsiman Municipal Assembly,,,
Mfantsiman Municipal Assembly,2011,CONST OF 2NO 12 SEATER VAULT CHAMBER TOILET,ddf,,,,,,Mfantsiman Municipal Assembly,,,
Mfantsiman Municipal Assembly,2011,CONSTRUCTION OF 1NO 10 SEATER VAULT CHAMBER TOILET,ddf,,,,,,Mfantsiman Municipal Assembly,,,
Mfantsiman Municipal Assembly,2011,SPOT IMPROVEMENT AT ANKAFUL FEEDER ROAD,ddf,,,,,,Mfantsiman Municipal Assembly,,,
Mpohor Wassa District Assembly,2011,CONST OF 1NO 6 UNIT C BLK WITH ANCILLARY FACILITIES AT BORKORKROM,dacf,,Apr-11,,,,Wassa East District Assembly,,2011-04-01,
Mpohor Wassa District Assembly,2011,CONSTRUCTION OF 3 NO REFUSE BAYS AT MPOHOR,dacf,,Feb-11,,,,Wassa East District Assembly,,2011-02-01,
Mpohor Wassa District Assembly,2011,COMPLETION OF POLICE POST AT MANSO,dacf,,Feb-11,,,,Wassa East District Assembly,,2011-02-01,
Mpohor Wassa District Assembly,2011,CONSTRUCTION OF 1 NO 6 SEATER SQUATTING WC TOILET AT SEKYERE HEMANG CLINIC,igf,,Mar-10,,,,Wassa East District Assembly,,2010-03-01,
Mpohor Wassa District Assembly,2011,CONSTRUCTION OF 1 NO 16 SEATER VAULT CHAMBER AT DOMPIM NO 1,multiple,,Mar-10,,,,Wassa East District Assembly,,2010-03-01,
Mpohor Wassa District Assembly,2011,CONSTRUCTION OF AREA COUNCIL OFFICE AT ATEIKU,igf,,Feb-11,,,,Wassa East District Assembly,,2011-02-01,
Mpohor Wassa District Assembly,2011,CONSTRUCTION OF AREA COUNCIL OFFICE AT ADUM BANSO,igf,,Feb-11,,,,Wassa East District Assembly,,2011-02-01,
Mpohor Wassa District Assembly,2011,CONSTRUCTION OF AREA COUNCIL OFFICE AT MANSO,igf,,Feb-11,,,,Wassa East District Assembly,,2011-02-01,
Mpohor Wassa District Assembly,2011,UPGRADING OF MPOHOR MARKET PHASE 1 CONSTRUCTION OF TOILET AND BATH,ddf,,Apr-11,,,,Wassa East District Assembly,,2011-04-01,
Mpohor Wassa District Assembly,2011,POTHOLE FILLING AND DRAINAGE WORKS ON DABOASE JUNCTION DABOASE ROAD,ddf,,Apr-11,,,,Wassa East District Assembly,,2011-04-01,
Mpohor Wassa District Assembly,2011,CONSTRUCTION OF DISTRICT MAGISTRATE BUNGALOW AT DABOASE,ddf,,Apr-11,,,,Wassa East District Assembly,,2011-04-01,
Mpohor Wassa District Assembly,2011,CONSTRUCTION OF DISTRICT MAGISTRATE COURT AT DABOASE,ddf,,Apr-11,,,,Wassa East District Assembly,,2011-04-01,
Mpohor Wassa District Assembly,2011,CONSTRUCTION OF COMMUNITY BASED HEALTH PLANNING SERVICE CHIPS AT ENYINABRIM,ddf,,Apr-11,,,,Wassa East District Assembly,,2011-04-01,
Mpohor Wassa District Assembly,2011,CONSTRUCTION OF STAFF CANTEEN AT DABOASE,dacf,,Feb-11,,,,Wassa East District Assembly,,2011-02-01,
Mpohor Wassa District Assembly,2011,CONSTRUCTION OF COMMUNITY BASED HEALTH PLANNING SERVICE CHPS AT S ADIEMBRA,ddf,,Apr-11,,,,Wassa East District Assembly,,2011-04-01,
Mpohor Wassa District Assembly,2011,CONSTRUCTION OF COMMUNITY BASED HEALTH PLANNING SERVICE CHPS CENTRE AT NEW SUBRI,ddf,,Apr-11,,,,Wassa East District Assembly,,2011-04-01,
Mpohor Wassa District Assembly,2011,CONSTRUCTION OF AREA COUNCIL OFFICE BLOCK AT EKUTUASE,igf,,Apr-11,,,,Wassa East District Assembly,,2011-04-01,
Mpohor Wassa District Assembly,2011,CONSTRUCTION OF AREA COUNCIL OFFICE BLOCK AT ENYINABRIM,igf,,Apr-11,,,,Wassa East District Assembly,,2011-04-01,
Mpohor Wassa District Assembly,2011,COMPLETION OF 3 UNIT CLASSROOM BLOCK AT SEKYERE ABROADZEWURAM,dacf,,Apr-11,,,,Wassa East District Assembly,,2011-04-01,
Mpohor Wassa District Assembly,2011,CONSTRUCTION OF 6 CLASSROOM WITH ANCILLARY FACILITIES AT AKOTOSU,getfund,,,,,,Wassa East District Assembly,,,
Mpohor Wassa District Assembly,2011,CONSTRUCTION OF 6 CLASSROOM WITH ANCILLARY FACILITIES AT PRATO NO1,getfund,,,,,,Wassa East District Assembly,,,
Mpohor Wassa District Assembly,2011,CONSTRUCTION OF 6 CLASSROOM WITH ANCILLARY FAC AT DABOASE SEN HIGH SCH,getfund,,,,,,Wassa East District Assembly,,,
Mpohor Wassa District Assembly,2011,CONSTRUCTION OF RESOURCE CENTRE FOR WV AT DABOASE,multiple,,Oct-07,,,,Wassa East District Assembly,,2007-10-01,
Mpohor Wassa District Assembly,2011,CONST OF 1NO 6 UNIT CLASSROOM BLK WITH OFF LIB STAFF RM STORE AND 6 UNIT KVIP 2 URINALS AT SENCHEM,getfund,,Sep-08,,,,Wassa East District Assembly,,2008-09-01,
Mpohor Wassa District Assembly,2011,COMPLETION OF 1 NO 2 STOREY POLICE POST AT ATOBIASE,dacf,,Nov-11,,,,Wassa East District Assembly,,2011-11-01,
Mpohor Wassa District Assembly,2011,COMPLETION OF 1 NO 3 UNIT CLASSROOM BLOCK WITH OFFICE AND STORE AND 4 UNIT KVIP AT KAWANOPADO,dacf,,Nov-06,,,,Wassa East District Assembly,,2006-11-01,
Mpohor Wassa District Assembly,2011,CONSTRUCTION OF HEALTH COMPOUND AT ADANSE,other donor,,Aug-06,,,,Wassa East District Assembly,,2006-08-01,
Mpohor Wassa District Assembly,2011,CONSTRUCTION OF 1 NO 3 UNIT TEACHERS ACC BLOCK AT MPOHOR,multiple,,Oct-07,,,,Wassa East District Assembly,,2007-10-01,
Mpohor Wassa District Assembly,2011,CONSTRUCTION OF 1 NO 3 UNIT TEACHERS ACC BLOCK BOTODWINA,multiple,,Oct-07,,,,Wassa East District Assembly,,2007-10-01,
Mpohor Wassa District Assembly,2011,CONSTRUCTION OF 1 NO 4 UNIT TEACHERS ACC BLK KAWANOPADO,multiple,,Oct-07,,,,Wassa East District Assembly,,2007-10-01,
Mpohor Wassa District Assembly,2011,CONST OF 1 NO 6 UNIT CLASSROOM BLK WITH OFF LIB STAFF RM STORE AND 6 SEATER WC FURN BABOASE,getfund,,Oct-07,,,,Wassa East District Assembly,,2007-10-01,
Mpohor Wassa District Assembly,2011,CONSTRUCTION OF 1 NO 3 UNIT CLASSROOM BLOCK WITH OFFICE AND STORE AND 4 UNIT KVIP AT OSENSO,multiple,,Oct-07,,,,Wassa East District Assembly,,2007-10-01,
Mpohor Wassa District Assembly,2011,CONST OF 1 NO 3 UNIT CL RM BLOCK WITH OFF AND STORE AND 4 UNIT KVIP AT MPOHOR,multiple,,Oct-07,,,,Wassa East District Assembly,,2007-10-01,
Mpohor Wassa District Assembly,2011,CONST OF 1NO 6 UNIT CLASSROOM BLK WITH OFF LIB STAFF RM STORE AND 6 UNIT KVIP 2 URINALS AT BOMBA,multiple,,Nov-07,,,,Wassa East District Assembly,,2007-11-01,
Mpohor Wassa District Assembly,2011,CONST OF 1 NO 6 UNIT CLASSROOM BLK WITH OFF LIB STAFF RM STORE AND 6 UNIT KVIP 2 UNRINALS AT ASRATUASE,multiple,,Nov-07,,,,Wassa East District Assembly,,2007-11-01,
Mpohor Wassa District Assembly,2011,CONST OF 1NO 6 UNIT CLASSROOM BLK WITH OFF LIB STAFF RM STORE AND 6 UNIT KVIP 2 URINALS AT KROFOFROM,multiple,,Oct-07,,,,Wassa East District Assembly,,2007-10-01,
Mpohor Wassa District Assembly,2011,CONST OF 1 NO 6 UNIT CL BLK WITH OFF LIB STAFF RM STORE AND 6 UNIT KVIP 2 URINALS AT SANTIAW,multiple,,Oct-07,,,,Wassa East District Assembly,,2007-10-01,
Mpohor Wassa District Assembly,2011,CONST OF 1 NO 6 UNIT CLASSROOM BLK WITH OFF LIB STAFF RM STORE AND 6 UNIT KVIP 2 URINALS AND 1 NO HAND DUG WELL AT AYIEM,getfund,,Nov-07,,,,Wassa East District Assembly,,2007-11-01,
Mpohor Wassa District Assembly,2011,CONST OF 1NO 6 UNIT CLASSROOM BLK WITH OFF LIB STAFF RM STORE AND 6 UNIT KVIP 2 URINALS AND 1 NO HAND DUG WELL AT K9,getfund,,Nov-07,,,,Wassa East District Assembly,,2007-11-01,
Mpohor Wassa District Assembly,2011,CONST OF 1NO 2 STREAM KINDERGARTEN BLOCK AT DABOASE,getfund,,Sep-08,,,,Wassa East District Assembly,,2008-09-01,
Mpohor Wassa District Assembly,2011,CONSTRUCTION OF MARKET COMPLEX GROUND FLOOR AT DABOASE,multiple,,Nov-08,,,,Wassa East District Assembly,,2008-11-01,
Mpohor Wassa District Assembly,2011,CONST OF 1 NO 6 UNIT CLASSROOM BLK WITH OFF LIB STAFF RM STORE AND 6 UNIT KVIP 2 URINALS AT MPOHOR,getfund,,Sep-08,,,,Wassa East District Assembly,,2008-09-01,
Mpohor Wassa District Assembly,2011,CONST OF 1 NO 6 UNIT CLASSROOM BLK AT ADAADE,getfund,,Aug-08,,,,Wassa East District Assembly,,2008-08-01,
Mpohor Wassa District Assembly,2011,CONST OF 1 NO 6 UNIT CLASSROOM BLK AT EKUTUASE,getfund,,Aug-08,,,,Wassa East District Assembly,,2008-08-01,
Mpohor Wassa District Assembly,2011,CONST OF ADMIN BLOCK AT MPOHOR SENIOR HIGH SCHOOL,getfund,,Jul-08,,,,Wassa East District Assembly,,2008-07-01,
Mpohor Wassa District Assembly,2011,CONST OF 12 UNIT CLASSROOM BLOCK FOR MPOHOR SENIOR HIGH SCHOOL,getfund,,Sep-07,,,,Wassa East District Assembly,,2007-09-01,
Mpohor Wassa District Assembly,2011,REHABILITATION OF DA JHS DABOASE,dacf,,Dec-11,,,,Wassa East District Assembly,,2011-12-01,
Mpohor Wassa District Assembly,2011,CONSTRUCTION OF 3 UNIT CLASSROOM BLOCK AT ANGU WITH ANCILLARY FACILITIES,ddf,,Feb-12,,,,Wassa East District Assembly,,2012-02-01,
Mpohor Wassa District Assembly,2011,CONVERSION OF DINING HALL INTO TEACHERS QUARTERS,dacf,,Nov-11,,,,Wassa East District Assembly,,2011-11-01,
Nadowli District Assembly,2011,CONSTRUCTION OF 3 UNIT CLASSROOM BLOCK WITH ANCILLARY FACILITIES,ddf,,,,,,Nadowli-Kaleo District Assembly,,,
Nadowli  District Assembly,2011,CONSTRUCTION OF 3 UNIT CLASSROOM BLOCK WITH ANCILLARY FACILITIES,ddf,,,,,,Nadowli-Kaleo District Assembly,,,
Nadowli  District Assembly,2011,CONSTRUCTION OF 3 UNIT CLASSROOM BLOCK OFFICE AND STORE,getfund,,,,,,Nadowli-Kaleo District Assembly,,,
Nadowli  District Assembly,2011,CONSTRUCTION OF 1NO 2 UNIT SEMI DETACHED BEDROOM,ddf,,,,,,Nadowli-Kaleo District Assembly,,,
Nadowli  District Assembly,2011,"CONSTRUCTION OF 3 UNIT CLASSROOM BLOCK, OFFICE, STORE, LIBRARY, STAFF COMMON ROOM, 4 SEATER KVIP AND 2 UNIT URINAL",getfund,,,,,,Nadowli-Kaleo District Assembly,,,
Nadowli  District Assembly,2011,"CONSTRUCTION OF 3-4 UNIT CLASSROOM BLOCK, OFFICE, STORE, 4 SEATER KVIP AND 2 UNIT URINAL",getfund,,,,,,Nadowli-Kaleo District Assembly,,,
Nadowli  District Assembly,2011,"CONSTRUCTION OF 3 UNIT CLASSROOM BLOCK, OFFICE STORE, STAFF COMMON ROOM, 4 SEATER KVIP AND 2 UNIT URINAL",getfund,,,,,,Nadowli-Kaleo District Assembly,,,
Nadowli  District Assembly,2011,"CONSTRUCTION OF 3 UNIT CLASSROOM BLOCK, OFFICE/STORE, STAFF COMMON ROOM, 4 SEATER KVIP AND 2 UNIT URINAL",getfund,,,,,,Nadowli-Kaleo District Assembly,,,
Nadowli  District Assembly,2011,"CONSTRUCTION OF 3 UNIT CLASSROOM BLOCK, OFFICE/STORE , STAFF COMMON ROOM 4 SEATER KVIP AND 2 UNIT URINAL",getfund,,,,,,Nadowli-Kaleo District Assembly,,,
Nadowli  District Assembly,2011,"CONSTRUCTION OF 3 UNIT CLASSROOM BLOCK, OFFICE/STORE, STAFF COMMON ROOM 4 SEATER KVIP AND 2 UNIT URINAL",getfund,,,,,,Nadowli-Kaleo District Assembly,,,
Nadowli  District Assembly,2011,CONSTRUCTION OF 1NO 4 UNIT TEACHERS QUARTERS,getfund,,,,,,Nadowli-Kaleo District Assembly,,,
Nadowli  District Assembly,2011,CONSTRUCTION OF 1 NO 3 UNIT LIBRARY BLOCK,getfund,,,,,,Nadowli-Kaleo District Assembly,,,
Nadowli  District Assembly,2011,CONSTRUCTION OF 1 NO 6 UNIT CLASSROOM BLOCK WITH ANCILLARY FACILITIES,getfund,,,,,,Nadowli-Kaleo District Assembly,,,
Nadowli  District Assembly,2011,CONSTRUCTION OF 1NO 3 UNIT CLASSROOM BLOCK WITH ANCILLARY FACILITIES,getfund,,,,,,Nadowli-Kaleo District Assembly,,,
Nadowli  District Assembly,2011,CONSTRUCTION OF 6 UNIT CLASSROOM BLOCK WITH ANCILLARY FACILITIES,getfund,,,,,,Nadowli-Kaleo District Assembly,,,
Nadowli  District Assembly,2011,CONSTRUCTION OF 6 UNIT CLASSROOM BLOCK OFFICE AND STORE,getfund,,,,,,Nadowli-Kaleo District Assembly,,,
Nadowli  District Assembly,2011,CONSTRUCTION OF 2 UNIT DAY CARE CENTRE,getfund,,,,,,Nadowli-Kaleo District Assembly,,,
Nadowli  District Assembly,2011,CONSTRUCTION OF 6 UNIT CLASSROOM BLOCK WITH ANCILLARY FACILITIES,getfund,,,,,,Nadowli-Kaleo District Assembly,,,
Nadowli  District Assembly,2011,"CONSTRUCTION OF 3 UNIT CLASSROOM BLOCK, OFFICE AND STORE, 4 SEATER KVIP AND 2 UNIT URINAL",getfund,,,,,,Nadowli-Kaleo District Assembly,,,
Nadowli  District Assembly,2011,"CONSTRUCTION OF 3 UNIT CLASSROOM BLOCK, OFFICE AND STORE",getfund,,,,,,Nadowli-Kaleo District Assembly,,,
Nadowli  District Assembly,2011,CONSTRUCTION OF NEPAD KITCHEN,ddf,,,,,,Nadowli-Kaleo District Assembly,,,
Nadowli  District Assembly,2011,CONSTRUCTION OF YPOUTH CENTRE,ddf,,,,,,Nadowli-Kaleo District Assembly,,,
Nadowli  District Assembly,2011,"CONSTRUCTION OF 3 UNIT CLASSROOM BLOCK, OFFICE, STORE, 4 SEATER KVIP AND 2 UNIT URINAL",ddf,,,,,,Nadowli-Kaleo District Assembly,,,
Nadowli  District Assembly,2011,CONSTRUCTION OF 1 NO DORMITORY BLOCK,ddf,,,,,,Nadowli-Kaleo District Assembly,,,
Nadowli  District Assembly,2011,CONSTRUCTION OF DINING HALL/KITCHEN BLOCK,getfund,,,,,,Nadowli-Kaleo District Assembly,,,
Nadowli  District Assembly,2011,"CONSTRUCTION OF 6 UNIT CLASSROOM BLOCK, OFFICE, STORE, 4 SEATER KVIP AND 2 UNIT URINAL",getfund,,,,,,Nadowli-Kaleo District Assembly,,,
Nadowli  District Assembly,2011,"CONSTRUCTION OF 3 UNIT CLASSROOM BLOCK, OFFICE, STORE, 4 SEATER KVIP AND 2 UNIT URINAL",getfund,,,,,,Nadowli-Kaleo District Assembly,,,
Nadowli  District Assembly,2011,CONSTRUCTION OF YOUTH CENTRE,ddf,,,,,,Nadowli-Kaleo District Assembly,,,
Nadowli  District Assembly,2011,CONSTRUCTION OF NEPAD KITCHEN,ddf,,,,,,Nadowli-Kaleo District Assembly,,,
Nadowli  District Assembly,2011,CONSTRUCTION OF 2NO 5UNIT MARKET SHED,getfund,,,,,,Nadowli-Kaleo District Assembly,,,
Nadowli  District Assembly,2011,RENOVATION OF 6UNIT CLASSROOM BLOCK WITH OFFICE STORE 3UNIT URINALS AND THE CONSTRUCTION OF 4SEATER KVIP,dacf,,,,,,Nadowli-Kaleo District Assembly,,,
Nadowli  District Assembly,2011,CONSTRUCTION OF 2UNIT BEDROOM SEMI DETACHED TEACHERS QUARTERS,getfund,,,,,,Nadowli-Kaleo District Assembly,,,
Nadowli  District Assembly,2011,CONSTRUCTION OF 6UNIT CLASSROOM BLOCK AND ANCILLARY FACILITIES,getfund,,,,,,Nadowli-Kaleo District Assembly,,,
Nadowli  District Assembly,2011,CONSTRUCTION OF 3UNIT CLASSROOM BLOCK,getfund,,,,,,Nadowli-Kaleo District Assembly,,,
Nadowli  District Assembly,2011,CONSTRUCTION OF 3UNIT DAY CARE CENTER,other/unknown,,,,,,Nadowli-Kaleo District Assembly,,,
Nadowli  District Assembly,2011,RENOVATION OF 3 UNIT CLASSROOM BLOCK WITH OFFICE/STORE,dacf,,,,,,Nadowli-Kaleo District Assembly,,,
Nadowli  District Assembly,2011,RE-ROOFING OF 3 UNIT CLASSROOM BLOCK,dacf,,,,,,Nadowli-Kaleo District Assembly,,,
Nadowli  District Assembly,2011,RENOVATION OF 3 UNIT CLASSROOM BLOCK WITH OFFICE/STORE,dacf,,,,,,Nadowli-Kaleo District Assembly,,,
Nadowli  District Assembly,2011,RO-ROOFING OF A RIPPED OFF 3 UNIT CLASSROOM BLOCK,dacf,,,,,,Nadowli-Kaleo District Assembly,,,
Nadowli  District Assembly,2011,RE-ROOFING OF A RIPPED OFF CLASSROOM BLOCK AT QUEEN OF PEACE SHS,dacf,,,,,,Nadowli-Kaleo District Assembly,,,
Nadowli  District Assembly,2011,RENOVATION OF TEACHERS QUARETERS,other/unknown,,,,,,Nadowli-Kaleo District Assembly,,,
Nadowli  District Assembly,2011,RENOVATION OF AGRIC BUNGALOW BU BU 007,dacf,,,,,,Nadowli-Kaleo District Assembly,,,
Nadowli  District Assembly,2011,CONSTRUCTION OF STORE ROOM OFFICE CONFERENCE HALL AND FENCE WALL COURTYARD,dacf,,,,,,Nadowli-Kaleo District Assembly,,,
Nadowli  District Assembly,2011,CONSTRUCTION OF A MINI PAVILION,dacf,,,,,,Nadowli-Kaleo District Assembly,,,
Nadowli  District Assembly,2011,CONSTRUCTION OF 3BEDROOM SEMI DETACHED STAFF QUARTERS,dacf,,,,,,Nadowli-Kaleo District Assembly,,,
Nadowli  District Assembly,2011,RENOVATION OF AGRIC QUARTERS,dacf,,,,,,Nadowli-Kaleo District Assembly,,,
Nadowli  District Assembly,2011,CONSTRUCTION OF YOUTH CENTRE,dacf,,,,,,Nadowli-Kaleo District Assembly,,,
Nadowli  District Assembly,2011,RENOVATION OF SENIOR STAFF BUNGALOW FOR DFO,dacf,,,,,,Nadowli-Kaleo District Assembly,,,
Nadowli  District Assembly,2011,RENOVATION OF SENIOR STAFF BUNGALOW FOR DPO,dacf,,,,,,Nadowli-Kaleo District Assembly,,,
Nadowli  District Assembly,2011,RENOVATION OF SENIOR STAFF BUNGALOW FOR DDCD,dacf,,,,,,Nadowli-Kaleo District Assembly,,,
Nadowli  District Assembly,2011,CONSTRUCTION OF YOUTH CENTRE,dacf,,,,,,Nadowli-Kaleo District Assembly,,,
Nadowli  District Assembly,2011,CONSTRUCTION OF 1NO 2UNIT BEDROOM SEMI DETACHED QUARTERS,ddf,,,,,,Nadowli-Kaleo District Assembly,,,
Nadowli  District Assembly,2011,RENOVATION OF CHPS COMPOUND,dacf,,,,,,Nadowli-Kaleo District Assembly,,,
Nadowli  District Assembly,2011,CONTRUCTION OF CHPS COMPOUND,other/unknown,,,,,,Nadowli-Kaleo District Assembly,,,
Nadowli  District Assembly,2011,CONSTRUCTION OF CHPS COMPOUND,ddf,,,,,,Nadowli-Kaleo District Assembly,,,
Nadowli  District Assembly,2011,CONSTRUCTION OF SHED,other/unknown,,,,,,Nadowli-Kaleo District Assembly,,,
Nadowli  District Assembly,2011,CONSTRUCTION OF SHED/MAINTENANCE OF CHPS COMPOUND,other/unknown,,,,,,Nadowli-Kaleo District Assembly,,,
Nadowli  District Assembly,2011,CONSTRUCTION OF A CLINIC,dacf,,,,,,Nadowli-Kaleo District Assembly,,,
Nadowli  District Assembly,2011,CONSTRUCTION OF 4 SEATER KVIP,dacf,,,,,,Nadowli-Kaleo District Assembly,,,
Nadowli  District Assembly,2011,CONSTRUCTION OF 10 SEATER WC,ddf,,,,,,Nadowli-Kaleo District Assembly,,,
Nadowli  District Assembly,2011,CONSTRUCTION OF 4 SEATER KVIP AND 2 UNIT URINAL,dacf,,,,,,Nadowli-Kaleo District Assembly,,,
Nadowli  District Assembly,2011,CONSTRUCTION OF 6 SEATER KVIP TOILET,dacf,,,,,,Nadowli-Kaleo District Assembly,,,
Nadowli  District Assembly,2011,CONSTRUCTION OF 4 SEATER AQUA PRIVY TOILET,dacf,,,,,,Nadowli-Kaleo District Assembly,,,
Nadowli  District Assembly,2011,CONSTRUCTION OF A WASHROOM FACILITY,dacf,,,,,,Nadowli-Kaleo District Assembly,,,
Nadowli  District Assembly,2011,CONSTRUCTION OF 4 SEATER KVIP TOILET,dacf,,,,,,Nadowli-Kaleo District Assembly,,,
Nadowli  District Assembly,2011,CONSTRUCTION OF 1 NO 6 SEATER KVIP,ddf,,,,,,Nadowli-Kaleo District Assembly,,,
Nadowli  District Assembly,2011,CONSTRUCTION OF 1 NO 4 SEATER KVIP,ddf,,,,,,Nadowli-Kaleo District Assembly,,,
Nadowli  District Assembly,2011,CONSTRUCTION OF 1 NO 4 SEATER KVIP,ddf,,,,,,Nadowli-Kaleo District Assembly,,,
Nadowli  District Assembly,2011,CONSTRUCTION OF 1 NO 4 SEATER KVIP,ddf,,,,,,Nadowli-Kaleo District Assembly,,,
Nadowli  District Assembly,2011,CONSTRUCTION OF 1 NO 4 SEATER KVIP,ddf,,,,,,Nadowli-Kaleo District Assembly,,,
Nadowli  District Assembly,2011,REHABILITATION OF 6NO BOREHOLES,dacf,,,,,,Nadowli-Kaleo District Assembly,,,
Nadowli  District Assembly,2011,REHABILITATION OF 8NO BOREHOLES,dacf,,,,,,Nadowli-Kaleo District Assembly,,,
Nadowli  District Assembly,2011,CONSTRUCTION OF 1NO 4 SEATER KVIP,ddf,,,,,,Nadowli-Kaleo District Assembly,,,
Nadowli  District Assembly,2011,CONSTRUCTION OF 1NO 4 SEATER KVIP,ddf,,,,,,Nadowli-Kaleo District Assembly,,,
Nadowli  District Assembly,2011,CONSTRUCTION OF 1 NO 4 SEATER KVIP,ddf,,,,,,Nadowli-Kaleo District Assembly,,,
Nadowli  District Assembly,2011,REHABILITATION OF POLICE STATION,dacf,,,,,,Nadowli-Kaleo District Assembly,,,
Nadowli  District Assembly,2011,RENOVATION OF HEALTH CENTRE,other/unknown,,,,,,Nadowli-Kaleo District Assembly,,,
Nadowli  District Assembly,2011,CONSTRUCTION OF A BREAD MILL FACILITY AT THE DISABLED CENTRE,dacf,,,,,,Nadowli-Kaleo District Assembly,,,
Nanumba North District Assembly,2011,,,,,,,,Nanumba North District Assembly,,,
Nanumba South District Assembly,2011,CONSTRUCTION OF 2NO 6 SEATER KVIP TOILET AT POLICE QUARTERS WULENSI,dacf,,4/26/2011,,,,Nanumba South District Assembly,,2011-04-26,
Nanumba South District Assembly,2011,CONSTRUCTION AND FURNISHING OF 1NO 3UNIT CLASSROOM BLOCK OFFICE & STORE 4SEATER KVIP TOILET AND 2UNIT OPEN URINAL AT KWAMEKROM,other donor,,1/8/2011,,,,Nanumba South District Assembly,,2011-01-08,
Nanumba South District Assembly,2011,"CONSTRUCTION AND FURNISHING OF 1 NO 3 UNIT CLASSROOM BLOCK OFFICE & STORE, 4 SEATER KVIP TOILET AND 2 UNIT MONTANAYA",other donor,,8/10/2010,,,,Nanumba South District Assembly,,2010-08-10,
Nanumba South District Assembly,2011,CONSTRUCTION AND FURNISHING OF 1NO 3UNIT CLASSROOM BLOCK OFFICE & STORE 4SEATER KVIP TOILET AND 2UNIT OPEN URINAL AT AGBODITO KOPE,other donor,,1/8/2011,,,,Nanumba South District Assembly,,2011-01-08,
Nanumba South District Assembly,2011,CONSTRUCTION AND FURNISHING OF 1NO 3UNIT CLASSROOM BLOCK OFFICE & STORE 4SEATER KVIP TOILET AND 2 UNIT OPEN URINAL AT NASAMBA,other donor,,1/8/2011,,,,Nanumba South District Assembly,,2011-01-08,
Nanumba South District Assembly,2011,CONSTRUCTION OF 1NO ABATTOIR WULENSI,ddf,,12/16/2010,,,,Nanumba South District Assembly,,2010-12-16,
Nanumba South District Assembly,2011,CONSTRUCTION OF 1 NO COMMUNITY CENTRE AT NAKPAYILI,ddf,,,,,,Nanumba South District Assembly,,,
Nanumba South District Assembly,2011,REHABILITATION OF 1NO 3UNIT CLASSROOM BLOCK OFFICE AND STORE COMMON ROOM AND ANCILLARIES AT NNALDO,ddf,,3/16/2011,,,,Nanumba South District Assembly,,2011-03-16,
Nanumba South District Assembly,2011,REHABILITATION OF 1NO 3UNIT CLASSROOM BLOCK AND ANCILLARIES,ddf,,4/11/2011,,,,Nanumba South District Assembly,,2011-04-11,
Nanumba South District Assembly,2011,REHABILITATION OF 1NO 3UNIT CLASSROOM BLOCK AND ANCILLARIES AT BADULI,ddf,,3/13/2011,,,,Nanumba South District Assembly,,2011-03-13,
Nanumba South District Assembly,2011,CONSTRUCTION OF 1NO 10 SEATER KVIP TOILET AT LUNGNI,other donor,,8/11/2009,,,,Nanumba South District Assembly,,2009-08-11,
Nanumba South District Assembly,2011,CONSTRUCTION OF 1NO 10 SEATER KVIP TOILET AT WULENSI,other donor,,8/11/2009,,,,Nanumba South District Assembly,,2009-08-11,
Nanumba South District Assembly,2011,CONSTRUCTION OF 1NO 2UNIT NURSES QUARTERS AT WULENSI AT KUKUO,other donor,,8/11/2009,,,,Nanumba South District Assembly,,2009-08-11,
Nanumba South District Assembly,2011,CONSTRUCTION OF 1NO 6UNIT CLASSROOM BLOCK AND ANCILLARIES AT NAKPAYILI,other donor,,8/11/2009,,,,Nanumba South District Assembly,,2009-08-11,
Nanumba South District Assembly,2011,CONSTRUCTION OF 1NO 2UNIT NURSES QUARTERS AT NAKPAYILI,other donor,,8/11/2009,,,,Nanumba South District Assembly,,2009-08-11,
Nanumba South District Assembly,2011,COMPLETION OF 1NO 4UNIT BOYS DORMITORY WITH 6SEATER KVIP TOILET AND 6UNIT BATH WULENSI,other donor,,8/11/2009,,,,Nanumba South District Assembly,,2009-08-11,
Nanumba South District Assembly,2011,BOYS DORMITORY WITH 6 SEATER KVIP TOILET AND 6 UNIT BATH WULENSI,other/unknown,,,,,,Nanumba South District Assembly,,,
Nanumba South District Assembly,2011,CONSTRUCTION OF 1NO 10 SEATER KVIP TOILET AT WULENSI,other donor,,8/24/2010,,,,Nanumba South District Assembly,,2010-08-24,
Nanumba South District Assembly,2011,CONSTRUCTION OF 1NO 3 UNIT CLASSROOM BLOCK OFFICE & STORE 4 SEATER KVIP TOILET AND 2 UNIT OPEN URINAL AT CHICHAGI,other donor,,8/11/2009,,,,Nanumba South District Assembly,,2009-08-11,
Nanumba South District Assembly,2011,CONSTRUCTION OF 1NO 3 BEDROOM NURSES QUARTERS AT NAKPAYILI,other donor,,8/24/2010,,,,Nanumba South District Assembly,,2010-08-24,
Nanumba South District Assembly,2011,CONSTRUCTION OF 1NO 10 SEATER TOILET AT MONTANAYA,other donor,,8/24/2010,,,,Nanumba South District Assembly,,2010-08-24,
Nanumba South District Assembly,2011,CONSTRUCTION OF 1NO 3 UNIT CLASSROOM BLOCK OFFICE & STORE 4SEATER STORE 4SEATER KVIP TOILET AND 2 UNIT OPEN URINAL AT WULENSI,other donor,,8/24/2010,,,,Nanumba South District Assembly,,2010-08-24,
Nanumba South District Assembly,2011,CONSTRUCTION OF 1 NO 3 UNIT CLASSROOM BLOCK A 4 SEATER KVIP AND 2 UNIT OPEN URINAL AND FURNITURE,other donor,,5/23/2011,,,,Nanumba South District Assembly,,2011-05-23,
Nanumba South District Assembly,2011,CONSTRUCTION OF A 3UNIT GIRLS DORMITORY WITH UTILITIES AT THE WULENSI SENIOR HIGH SCHOOL,other donor,,5/4/2011,,,,Nanumba South District Assembly,,2011-05-04,
Nanumba South District Assembly,2011,CONSTRUCTION OF 1 NO 3 UNIT CLASSROOM BLOCK A 4 SEASTER KVIP AND 2 UNIT OPEN URINAL AND FURNITURE,other donor,,5/16/2011,,,,Nanumba South District Assembly,,2011-05-16,
Nanumba South District Assembly,2011,CONSTRUCITON AND DRILLING OF 5 NO BOREHOLES FOR,other donor,,7/19/2011,,,,Nanumba South District Assembly,,2011-07-19,
Nanumba South District Assembly,2011,CONSTRUCTION OF A ONE NO 6UNIT CLASSROOM BLOCK OFFICE AND ANCILLARIES,other donor,,7/19/2011,,,,Nanumba South District Assembly,,2011-07-19,
New Juaben Municipal Assembly,2011,DEVELOPMENT OF PRIVATE CAR PARK AT JACKSON PARK,dacf,,6/16/2010,,,,New Juaben Municipal Assembly,,2010-06-16,
New Juaben Municipal Assembly,2011,DEVELOPMENT OF PARKING LOT FOR TAXIS AT THE NORTHERN END OF JACKSON PARK,dacf,,7/20/2010,,,,New Juaben Municipal Assembly,,2010-07-20,
New Juaben Municipal Assembly,2011,CONSTRUCTION OF 6 UNIT CLASSROOM BLOCK WITH ANCILLARY FACILITIES AT APIMPOA ISLAMIC SCHOOL,getfund,,9/11/2010,,,,New Juaben Municipal Assembly,,2010-09-11,
New Juaben Municipal Assembly,2011,CONSTRUCTION OF 6 UNIT CLASSROOM BLOCK WITH ANCILLARY FACILITIES,getfund,,9/11/2010,,,,New Juaben Municipal Assembly,,2010-09-11,
New Juaben Municipal Assembly,2011,CONSTRUCTION OF 2NO DORMITORY BLOCK 2NO 12 UNIT BATH HOUSES AND TOILET BOYA AND GIRLS,getfund,,Jun-10,,,,New Juaben Municipal Assembly,,2010-06-01,
New Juaben Municipal Assembly,2011,CONSTRUCTION 120NO CUBICLES FOR CRAFT AND BEADS MARKET WARE HOUSE 12 SEATER WC TOILET AND 2NO BATHHOUSES,dacf,,7/20/2010,,,,New Juaben Municipal Assembly,,2010-07-20,
New Juaben Municipal Assembly,2011,CONSTRUCTION OF 6 UNIT CLASSROOM BLOCK WITH OFFICE AND STORE,getfund,,8/18/2008,,,,New Juaben Municipal Assembly,,2008-08-18,
New Juaben Municipal Assembly,2011,CONSTRUCTION OF 6 UNIT CLASSROOM BLOCK WITH ANCILLARY FACILITIES AT APIMPOA ISLAMIC SCHOOL,getfund,,10/11/2010,,,,New Juaben Municipal Assembly,,2010-10-11,
New Juaben Municipal Assembly,2011,CONSTRUCTION OF 6 UNIT CLASSROOM BLOCK WITH ANCILLARY FACILITIES AT ST ANNES ANGLICAN PRIMARY SCHOOL,getfund,,10/11/2010,,,,New Juaben Municipal Assembly,,2010-10-11,
New Juaben Municipal Assembly,2011,CONSTRUCTION OF 6 UNIT CLASSROOM BLOCK FOR KOFORIDUA SNR HIGH SCH,getfund,,5/31/2010,,,,New Juaben Municipal Assembly,,2010-05-31,
New Juaben Municipal Assembly,2011,CONSTRUCTION OF 2 NO EARLY CHILDHOOD DEVELOPMENT CENTRE WITH KITCHEN EATING PLACE OFFICE STORE AND WC URINAL AT TROM NYEREE,other donor,,3/10/2009,,,,New Juaben Municipal Assembly,,2009-03-10,
New Juaben Municipal Assembly,2011,CONSTRUCTION OF 3 NO 2 BEDROOM SEMI DETACHED TEACHERS QUARTERS AT JUMAPO ANGLICAN PRIMARY SCHOOL,other donor,,3/10/2009,,,,New Juaben Municipal Assembly,,2009-03-10,
New Juaben Municipal Assembly,2011,CONSTRUCTION OF 30 SEATER ICT CENTRE WITH OFFICE WC TOILET URINAL AND STORE FOR RC SCHOOL COMPLEX AT SRODAI IN KOFORIDUA,other donor,,3/10/2009,,,,New Juaben Municipal Assembly,,2009-03-10,
New Juaben Municipal Assembly,2011,CONSTRUCTION OF 30 SEATER ICT CENTRE WITH OFFICE WC TOILET URINAL AND STORE AT ADWESO TRINITY PRESBY SCHOOL,other donor,,3/10/2009,,,,New Juaben Municipal Assembly,,2009-03-10,
New Juaben Municipal Assembly,2011,CONSTRUCTION OF DRAINS AND 600 METRE SQUARE PAVEMENT AT SLAUGHTER HOUSE,other donor,,3/10/2009,,,,New Juaben Municipal Assembly,,2009-03-10,
New Juaben Municipal Assembly,2011,PAVING 2900 METRE SQUARE AREA AT ZONGO MARKET,other donor,,3/10/2009,,,,New Juaben Municipal Assembly,,2009-03-10,
New Juaben Municipal Assembly,2011,CONSTRUCTION OF 6 UNIT CLASSROOM BLOCK 6 SEATER WC AT ADA KYEREMATENG KOFORIDUA,other donor,,3/10/2009,,,,New Juaben Municipal Assembly,,2009-03-10,
New Juaben Municipal Assembly,2011,CONSTRUCTION OF STORES AT PENTOAWALA,dacf,,Jul-10,,,,New Juaben Municipal Assembly,,2010-07-01,
New Juaben Municipal Assembly,2011,PROVISION OF METAL GATES AND FENCE WALL AND SECURITY POST KOFORIDUA,dacf,,8/13/2010,,,,New Juaben Municipal Assembly,,2010-08-13,
New Juaben Municipal Assembly,2011,CONSTRUCTION OF THREE STOREY BLOCK OF OFFICE AND SOTRES AT PENTOAWALA,dacf,,7/20/2010,,,,New Juaben Municipal Assembly,,2010-07-20,
New Juaben Municipal Assembly,2011,COMPLETION OF THREE STOREY BLOCK OF STORES AND OFFICES BLOCK B PHASE 2A AT CENTRAL MOSQUE AREA KOFORIDUA,dacf,,7/20/2010,,,,New Juaben Municipal Assembly,,2010-07-20,
New Juaben Municipal Assembly,2011,PLASTERING AND THE PROVISION DOORS FOR AME ZION SCHOOL,dacf,,8/31/2010,,,,New Juaben Municipal Assembly,,2010-08-31,
New Juaben Municipal Assembly,2011,MAJOR REHABILITATION OF THE MAIN KOFORIDUA ACCRA LORRY PARK PAVING OF THE LORRY PARK AND CONSTRUCTION OF STATION COMPLEX BLOCK,ddf,,11/16/2010,,,,New Juaben Municipal Assembly,,2010-11-16,
New Juaben Municipal Assembly,2011,CONSTRUCTION OF 12 UNIT CLASSROOM & ADMINISTRATION BLOCK AT THE UNIT SCHOOL FOR THE DEAF,getfund,,1/19/2007,,,,New Juaben Municipal Assembly,,2007-01-19,
New Juaben Municipal Assembly,2011,CONSTRUCTION OF 6 UNIT CLASSROOM BLOCK WITH OFFICE COMMON ROOM STORE AND 2 SEATER,getfund,,8/8/2008,,,,New Juaben Municipal Assembly,,2008-08-08,
New Juaben Municipal Assembly,2011,CONSTRUCTION OF BLOCK OF 8 FLAT FOR UNIT SCHOOL FOR THE DEAF,getfund,,8/15/2008,,,,New Juaben Municipal Assembly,,2008-08-15,
New Juaben Municipal Assembly,2011,CONSTRUCTION OF 1 NO CHILDRENS CLINIC INCLUDING A LABORATORY EMERGENCY WARD STAFF COMMON ROOM REVENUE OFFICE RECORDS ROOM AND OPD AT MUNICIPAL POLYCLINIC,other donor,,,,,,New Juaben Municipal Assembly,,,
New Juaben Municipal Assembly,2011,CONSTRUCTION OF 1NO EARLY CHILDHOOD DEVELOPMENT CENTRE WITH KITCHEN EATING PLACE OFFICE STORE AND WC URINAL AT SARKODIE LA PRIMARY SCHOOL,other donor,,,,,,New Juaben Municipal Assembly,,,
New Juaben Municipal Assembly,2011,CONSTRUCTION OF EARLY CHILDHOOD DEVELOPMENT CENTRE WITH KITCHEN EATING PLACE OFFICE STORE AND WC URINAL AT DENSUANO,other donor,,,,,,New Juaben Municipal Assembly,,,
Nkoranza North District Assembly,2011,,,,,,,,Nkoranza North District Assembly,,,
Nkoranza South District Assembly,2011,,,,,,,,Nkoranza South District Assembly,,,
Nkwanta North District Assembly,2011,,,,,,,,Nkwanta North District Assembly,,,
Nkwanta South District Assembly,2011,,,,,,,,Nkwanta South District Assembly,,,
North Tongu District Assembly,2011,,,,,,,,North Tongu District Assembly,,,
Nzema East Municipal Assembly,2011,,,,,,,,Nzema East Municipal Assembly,,,
Obuasi Municipal Assembly,2011,CONSTRUCTION OF 1NO 3 UNIT CLASROOM BLOCK OFFICE AND SANITARY FACILITY FOR KINDERGARTEN,ddf,,,,,,Obuasi  Municipal Assembly,,,
Obuasi  Municipal Assembly,2011,CONSTRUCTION OF 1NO 3 UNIT CLASSROOM BLOCK OFFICE AND SANITARY FACILITY FOR KINDERGARTEN,ddf,,,,,,Obuasi  Municipal Assembly,,,
Obuasi  Municipal Assembly,2011,CONSTRUCTION OF 1NO 3 UNIT CLASSROOM BLOCK OFFICE AND SANITARY FACILITY FOR KINDERGARTEN,ddf,,,,,,Obuasi  Municipal Assembly,,,
Obuasi  Municipal Assembly,2011,COMPLETION OF 1NO 12 UNIT CLASSROOM BLOCK AND CONSTRUCTION OF 6 SEATER WC TOILET AT ST THOMAS PRIMARY SCHOOL,ddf,,,,,,Obuasi  Municipal Assembly,,,
Obuasi  Municipal Assembly,2011,CONSTRUCTION OF 18 UNIT CLASSROOM BLOCK FOR CKC SENIOR HIGH SCHOOL,getfund,,,,,,Obuasi  Municipal Assembly,,,
Obuasi  Municipal Assembly,2011,CONSTRUCTION OF 5NO BOREHOLES,ddf,,,,,,Obuasi  Municipal Assembly,,,
Obuasi  Municipal Assembly,2011,CONSTRUCTION OF 20 SEATER W/C SEATER,ddf,,,,,,Obuasi  Municipal Assembly,,,
Obuasi  Municipal Assembly,2011,CONSTRUCTION OF 1NO 20 SEATER VAULT CHAMBER PUBLIC TOILET,ddf,,,,,,Obuasi  Municipal Assembly,,,
Obuasi  Municipal Assembly,2011,RENOVATION OF THREE (3) BEDROOM STAFF ACCOMMODATION,dacf,,,,,,Obuasi  Municipal Assembly,,,
Obuasi  Municipal Assembly,2011,CONSTINUATION COMPLETION OF KITCHEN FOR GHANA SCHOOL FEEDING PROGRAMME,ddf,,,,,,Obuasi  Municipal Assembly,,,
Obuasi  Municipal Assembly,2011,CONSTRUCTION OF KITCHEN FOR GHANA SCHOOL FEEDING PROGRAMME,ddf,,,,,,Obuasi  Municipal Assembly,,,
Obuasi  Municipal Assembly,2011,CONSTRUCTION OF KITCHEN FOR GHANA SCHOOL FEEDING PROGRAMME,ddf,,,,,,Obuasi  Municipal Assembly,,,
Obuasi  Municipal Assembly,2011,CONSTRUCTION OF KITCHEN FOR GHANA SCHOOL FEEDING PROGRAMME,ddf,,,,,,Obuasi  Municipal Assembly,,,
Obuasi  Municipal Assembly,2011,CONSTRUCTION OF KITCHEN FOR GHANA SCHOOL FEEDING PROGRAMME,ddf,,,,,,Obuasi  Municipal Assembly,,,
Obuasi  Municipal Assembly,2011,CONSTRUCTION OF 6 SEATER WATER CLOSET TOILET,ddf,,,,,,Obuasi  Municipal Assembly,,,
Obuasi  Municipal Assembly,2011,ROOFING AND PAINTING OF 2 STOREY THREE (3) UNIT CLASSROOM AND FENCE WALL AT ST THOMAS JHS,ddf,,,,,,Obuasi  Municipal Assembly,,,
Offinso Municipal Assembly,2011,COMPLETION OF 1 NO 12 UNIT  C R BLOCK,dacf,4/4/2003,4/18/2003,,,,Offinso  Municipal Assembly,2003-04-04,2003-04-18,
Offinso  Municipal Assembly,2011,REHABILITATION OF 1 NO 4 UNIT CLASSROOM BLOCK,other donor,5/1/2007,5/15/2007,,,,Offinso  Municipal Assembly,2007-05-01,2007-05-15,
Offinso  Municipal Assembly,2011,CONSTRUCTION OF 1 NO 20 SEATER WC TOILET,other gog,4/28/2004,5/12/2004,,,,Offinso  Municipal Assembly,2004-04-28,2004-05-12,
Offinso  Municipal Assembly,2011,CONSTRUCTION OF BS 1 6 C R BLK,dacf,2/20/2007,5/5/2007,,,,Offinso  Municipal Assembly,2007-02-20,2007-05-05,
Offinso  Municipal Assembly,2011,REHAB OF 1 NO 6 UNIT C R BLK WITH OFFICE AND STORE,ddf,6/17/2010,7/8/2010,,,,Offinso  Municipal Assembly,2010-06-17,2010-07-08,
Offinso  Municipal Assembly,2011,CONST OF 1 NO 6 UNIT C R BLK WITH OFFICE AND STORE,ddf,9/16/2010,9/30/2010,,,,Offinso  Municipal Assembly,2010-09-16,2010-09-30,
Offinso  Municipal Assembly,2011,COMPLETION OF COMMUNITY LIBRARY,dacf,3/26/2002,4/9/2002,,,,Offinso  Municipal Assembly,2002-03-26,2002-04-09,
Offinso  Municipal Assembly,2011,CONST OF 1 NO 6 UNIT C R BLK WITH OFFICE AND STORE,ddf,11/3/2010,11/17/2010,,,,Offinso  Municipal Assembly,2010-11-03,2010-11-17,
Offinso  Municipal Assembly,2011,CONST OF 1 NO 3 UNIT C R BLK,other/unknown,11/30/2010,12/14/2010,,,,Offinso  Municipal Assembly,2010-11-30,2010-12-14,
Offinso  Municipal Assembly,2011,CONST OF 1 NO 3 UNIT C R BLK,ddf,12/1/2010,12/15/2010,,,,Offinso  Municipal Assembly,2010-12-01,2010-12-15,
Offinso  Municipal Assembly,2011,CONST OF CHPS COMPOUND,ddf,12/2/2010,12/17/2010,,,,Offinso  Municipal Assembly,2010-12-02,2010-12-17,
Offinso  Municipal Assembly,2011,CONST OF CHPS COMPOUND,ddf,9/24/2010,10/8/2010,,,,Offinso  Municipal Assembly,2010-09-24,2010-10-08,
Offinso  Municipal Assembly,2011,CONST OF 1 NO 20 SEATER WC TOILET,ddf,12/23/2010,1/11/2011,,,,Offinso  Municipal Assembly,2010-12-23,2011-01-11,
Offinso  Municipal Assembly,2011,CONST OF 1 NO 12 SEATER WC TOILET,ddf,6/16/2010,7/1/2010,,,,Offinso  Municipal Assembly,2010-06-16,2010-07-01,
Offinso  Municipal Assembly,2011,MINOR REHAB & EXPANSON CIRCOUT COURT,ddf,7/20/2010,8/3/2010,,,,Offinso  Municipal Assembly,2010-07-20,2010-08-03,
Offinso  Municipal Assembly,2011,CONST OF 1 NO 6 UNIT C R BLK WITH ANCILARY TOILETS,getfund,8/20/2010,9/10/2010,,,,Offinso  Municipal Assembly,2010-08-20,2010-09-10,
Offinso  Municipal Assembly,2011,CONSTRUCTION OF 6 UNIT BEDSITTER TEACHERS QUARTERS,other/unknown,2/4/2004,2/18/2004,,,,Offinso  Municipal Assembly,2004-02-04,2004-02-18,
Offinso  Municipal Assembly,2011,REHABILITATION OF 1 NO 3 UNIT CLASSROOM BLOCK AT METHODIST JHS,other donor,12/2/2009,12/16/2009,,,,Offinso  Municipal Assembly,2009-12-02,2009-12-16,
Offinso  Municipal Assembly,2011,CONSTRUCTION OF 1 NO 6 UNIT CLASSROOM BLOCK,other donor,2/10/2004,2/24/2004,,,,Offinso  Municipal Assembly,2004-02-10,2004-02-24,
Offinso  Municipal Assembly,2011,CONSTRUCTION OF 1 NO 3 UNIT CLASSROOM BLOCK WITH OFFICE AND STORE,other donor,10/4/2007,10/18/2007,,,,Offinso  Municipal Assembly,2007-10-04,2007-10-18,
Offinso  Municipal Assembly,2011,CONSTRUCTION OF 1 NO 3 UNIT CLASSROOM BLOCK WITH OFFICE AND STORE,other donor,10/4/2007,10/18/2007,,,,Offinso  Municipal Assembly,2007-10-04,2007-10-18,
Offinso  Municipal Assembly,2011,DRILLING AND CONSTRUCTION OF ONE BOREHOLE,ddf,4/18/2011,5/2/2011,,,,Offinso  Municipal Assembly,2011-04-18,2011-05-02,
Offinso North District Assembly,2011,TEACHERS QUARTERS,ddf,6/3/2011,,,,,Offinso North District Assembly,2011-06-03,,
Offinso North District Assembly,2011,MARKET,ddf,6/3/2011,,,,,Offinso North District Assembly,2011-06-03,,
Offinso North District Assembly,2011,TEACHERS QUARTERS,ddf,6/3/2011,,,,,Offinso North District Assembly,2011-06-03,,
Offinso North District Assembly,2011,CLASSROOM BLOCK,ddf,6/3/2011,,,,,Offinso North District Assembly,2011-06-03,,
Offinso North District Assembly,2011,"WC TOILET, LATRINES",ddf,6/3/2011,,,,,Offinso North District Assembly,2011-06-03,,
Offinso North District Assembly,2011,CLASSROOM BLOCK,getfund,9/2/2010,,,,,Offinso North District Assembly,2010-09-02,,
Offinso North District Assembly,2011,CLASSROOM BLOCK,getfund,9/1/2010,,,,,Offinso North District Assembly,2010-09-01,,
Offinso North District Assembly,2011,CLASSROOM BLOCK,other donor,10/1/2007,,,,,Offinso North District Assembly,2007-10-01,,
Offinso North District Assembly,2011,CLASSROOM BLOCK,other donor,4/1/2006,,,,,Offinso North District Assembly,2006-04-01,,
Offinso North District Assembly,2011,CLASSROOM BLOCK,other donor,,,,,,Offinso North District Assembly,,,
Offinso North District Assembly,2011,MARKET,other donor,5/1/2007,,,,,Offinso North District Assembly,2007-05-01,,
Offinso North District Assembly,2011,CLASSROOM BLOCK,other donor,9/9/2009,,,,,Offinso North District Assembly,2009-09-09,,
Offinso North District Assembly,2011,CLASSROOM BLOCK,other donor,,,,,,Offinso North District Assembly,,,
Offinso North District Assembly,2011,WC TOILET LATRINES,ddf,12/20/2010,,,,,Offinso North District Assembly,2010-12-20,,
Offinso North District Assembly,2011,TEACHERS QUARTERS,ddf,12/20/2010,,,,,Offinso North District Assembly,2010-12-20,,
Offinso North District Assembly,2011,CLASSROOM BLOCK,ddf,11/11/2010,,,,,Offinso North District Assembly,2010-11-11,,
Offinso North District Assembly,2011,WC TOILET LATRINES,ddf,12/20/2010,,,,,Offinso North District Assembly,2010-12-20,,
Offinso North District Assembly,2011,CLASSROOM BLOCK,ddf,12/20/2010,,,,,Offinso North District Assembly,2010-12-20,,
Offinso North District Assembly,2011,CLASSROOM BLOCK,ddf,12/20/2010,,,,,Offinso North District Assembly,2010-12-20,,
Offinso North District Assembly,2011,TEACHERS QUARTERS,ddf,12/20/2010,,,,,Offinso North District Assembly,2010-12-20,,
Offinso North District Assembly,2011,"CHPS, CLINIC, HEALTH CENTER",ddf,6/2/2011,,,,,Offinso North District Assembly,2011-06-02,,
Offinso North District Assembly,2011,CLASSROOM BLOCK,dacf,4/17/2004,,,,,Offinso North District Assembly,2004-04-17,,
Offinso North District Assembly,2011,CLASSROOM BLOCK,dacf,6/12/2007,,,,,Offinso North District Assembly,2007-06-12,,
Offinso North District Assembly,2011,RESIDENTIAL ACCOMODATION,dacf,7/22/2008,,,,,Offinso North District Assembly,2008-07-22,,
Offinso North District Assembly,2011,RESIDENTIAL ACCOMODATION,dacf,7/22/2008,,,,,Offinso North District Assembly,2008-07-22,,
Offinso North District Assembly,2011,RESIDENTIAL ACCOMODATION,dacf,7/22/2008,,,,,Offinso North District Assembly,2008-07-22,,
Offinso North District Assembly,2011,"CHPS, CLINIC, HEALTH CENTER",other donor,,,,,,Offinso North District Assembly,,,
Offinso North District Assembly,2011,"WC, TOILET, LATRINES",other donor,12/20/2010,,,,,Offinso North District Assembly,2010-12-20,,
Offinso North District Assembly,2011,CLASSROOM BLOCK,ddf,12/2/2009,,,,,Offinso North District Assembly,2009-12-02,,
Offinso North District Assembly,2011,"WC, TOILET, LATRINES",ddf,12/23/2009,,,,,Offinso North District Assembly,2009-12-23,,
Offinso North District Assembly,2011,CLASSROOSM BLOCK,ddf,12/20/2010,,,,,Offinso North District Assembly,2010-12-20,,
Offinso North District Assembly,2011,CLASSROOM BLOCK,ddf,12/20/2010,,,,,Offinso North District Assembly,2010-12-20,,
Offinso North District Assembly,2011,OFFICE BLOCK,dacf,2/3/2011,,,,,Offinso North District Assembly,2011-02-03,,
Offinso North District Assembly,2011,RESIDENTIAL ACCOMODATION,dacf,7/22/2008,,,,,Offinso North District Assembly,2008-07-22,,
Offinso North District Assembly,2011,RESIDENTIAL ACCOMODATION,dacf,7/22/2008,,,,,Offinso North District Assembly,2008-07-22,,
Offinso North District Assembly,2011,CLASSROOM BLOCK,dacf,6/7/2000,,,,,Offinso North District Assembly,2000-06-07,,
Offinso North District Assembly,2011,CLASSROOM BLOCK,getfund,9/1/2010,,,,,Offinso North District Assembly,2010-09-01,,
Offinso North District Assembly,2011,CLASSROOM BLOCK,getfund,9/1/2010,,,,,Offinso North District Assembly,2010-09-01,,
Offinso North District Assembly,2011,CLASSROOM BLOCK,getfund,9/1/2010,,,,,Offinso North District Assembly,2010-09-01,,
Offinso North District Assembly,2011,CONSTRUCTION OF 1NO 6 UNIT CLASSROOM BLOCK WITH ANCILIARY FACILITIES,getfund,9/1/2010,4/15/2011,,,,Offinso North District Assembly,2010-09-01,2011-04-15,
Offinso North District Assembly,2011,CONSTRUCTION OF 1NO 3 UNIT CLASSROOM BLOCK,other donor,10/1/2007,10/15/2007,,,,Offinso North District Assembly,2007-10-01,2007-10-15,
Offinso North District Assembly,2011,CONSTRUCTION OF 1NO 3 UNIT CLASSROOM BLOCK,other donor,4/1/2006,4/15/2006,,,,Offinso North District Assembly,2006-04-01,2006-04-15,
Offinso North District Assembly,2011,REHABILITATION OF 1NO 4 UNIT CLASSROOM BLOCK,other donor,,,,,,Offinso North District Assembly,,,
Offinso North District Assembly,2011,REHABILITATION OF MARKET,other donor,5/1/2007,5/1/2007,,,,Offinso North District Assembly,2007-05-01,2007-05-01,
Offinso North District Assembly,2011,CONSTRUCTION OF 1NO 3 UNIT CLASSROOM BLOCK OFFICE STORE AND SANITARY FACILITIES,other donor,9/9/2009,9/9/2009,,,,Offinso North District Assembly,2009-09-09,2009-09-09,
Offinso North District Assembly,2011,CONSTRUCTION OF 1NO 3 UNIT CLASSROOM BLOCK,other donor,,1/1/2007,,,,Offinso North District Assembly,,2007-01-01,
Offinso North District Assembly,2011,CONSTRUCTION OF 1NO 3 UNIT PAVILION,ddf,12/20/2010,1/20/2010,,,,Offinso North District Assembly,2010-12-20,2010-01-20,
Offinso North District Assembly,2011,CONSTRUCTION OF 1NO 2 UNIT TEACHERS QUARTERS,ddf,12/20/2010,1/20/2011,,,,Offinso North District Assembly,2010-12-20,2011-01-20,
Offinso North District Assembly,2011,CONSTRUCTION OF 1NO 3 UNIT CLASSROOM BLOCK,ddf,11/11/2010,10/15/2010,,,,Offinso North District Assembly,2010-11-11,2010-10-15,
Offinso North District Assembly,2011,CONSTRUCTION OF 2NO 10 SEATER ENYIRO 100,ddf,12/20/2010,1/20/2011,,,,Offinso North District Assembly,2010-12-20,2011-01-20,
Offinso North District Assembly,2011,CONSTRUCTION OF 1NO DORMITORY BLOCK FOR PHYSICALLY CHALLENGE,dacf,4/17/2004,5/1/2004,,,,Offinso North District Assembly,2004-04-17,2004-05-01,
Offinso North District Assembly,2011,REHABILITATION OF 1NO 3 UNIT CLASSROOM BLOCK AT WIAFE AKENTEN JHS,dacf,7/12/2007,7/12/2007,,,,Offinso North District Assembly,2007-07-12,2007-07-12,
Offinso North District Assembly,2011,REHABILITATION OF STREETLIGHTS IN THE DISTRICT,dacf,3/23/2010,4/14/2010,,,,Offinso North District Assembly,2010-03-23,2010-04-14,
Offinso North District Assembly,2011,CONSTRUCTION OF 1NO SENIOR STAFF BUNGALOW A81,dacf,7/22/2008,9/2/2008,,,,Offinso North District Assembly,2008-07-22,2008-09-02,
Offinso North District Assembly,2011,CONSTRUCTION OF 1NO SENIOR STAFF BUNGALOW A49,dacf,7/22/2008,9/2/2008,,,,Offinso North District Assembly,2008-07-22,2008-09-02,
Offinso North District Assembly,2011,CONSTRUCTION OF 1NO SEMI-DETACHED BUNGALOW,dacf,7/22/2008,9/2/2008,,,,Offinso North District Assembly,2008-07-22,2008-09-02,
Offinso North District Assembly,2011,CONSTRUCTION OF CHPS COMPOUND,other donor,,1/1/2007,,,,Offinso North District Assembly,,2007-01-01,
Offinso North District Assembly,2011,CONSTRUCTION OF ICT CENTRE,other donor,1/18/2010,2/1/2010,,,,Offinso North District Assembly,2010-01-18,2010-02-01,
Offinso North District Assembly,2011,CONSTRUCTION OF 2NO 10 SEATER WC TOILET FACILITY AND BOREHOLE WITH OVERBEAD TANK,other donor,12/20/2010,2/1/2010,,,,Offinso North District Assembly,2010-12-20,2010-02-01,
Offinso North District Assembly,2011,REHABILITATION OF 1NO 4 UNIT CLASSROOM BLOCK OFFICE AND STORE AT DA SCHOOL A,ddf,12/2/2009,12/20/2009,,,,Offinso North District Assembly,2009-12-02,2009-12-20,
Offinso North District Assembly,2011,CONSTRUCTION OF WELDED WIRE MESH FENCE WALL AT DA SCHOOL A,ddf,1/18/2010,1/2/2010,,,,Offinso North District Assembly,2010-01-18,2010-01-02,
Offinso North District Assembly,2011,CONSTRUCTION OF 1NO 8 SEATER KVIP TOILET FACILITY AT DA SCHOOL,ddf,12/23/2009,5/19/2010,,,,Offinso North District Assembly,2009-12-23,2010-05-19,
Offinso North District Assembly,2011,REHABILITATION OF DA SCHOOL BLOCK,ddf,12/20/2010,1/20/2011,,,,Offinso North District Assembly,2010-12-20,2011-01-20,
Offinso North District Assembly,2011,CONSTRUCTION OF 1NO 3 UNIT CLASSROOM BLOCK,ddf,12/20/2010,1/20/2011,,,,Offinso North District Assembly,2010-12-20,2011-01-20,
Offinso North District Assembly,2011,CONSTRUCTION OF DISTRICT ADMINISTRATION BLOCK,dacf,2/3/2011,2/17/2011,,,,Offinso North District Assembly,2011-02-03,2011-02-17,
Offinso North District Assembly,2011,CONSTRUCTION OF 1NO SEMI DETACHED STAFF BUNGALOW,dacf,7/22/2008,9/2/2008,,,,Offinso North District Assembly,2008-07-22,2008-09-02,
Offinso North District Assembly,2011,CONSTRUCTION OF 2NO 4 BEDROOM STAFF QUARTERS,dacf,7/22/2008,9/2/2008,,,,Offinso North District Assembly,2008-07-22,2008-09-02,
Offinso North District Assembly,2011,CONSTRUCTION OF 2NO 3 UNIT CLASSROOM BLOCK WITH STORE OFFICE AND LIBRARY AT WIATE ASAMAN,dacf,6/7/2000,6/28/2000,,,,Offinso North District Assembly,2000-06-07,2000-06-28,
Offinso North District Assembly,2011,CONSTRUCTION OF 8S1-6 CLASSROOM BLOCK WITH ANCILARY FACILITIES AT RC,getfund,9/1/2010,4/1/2003,,,,Offinso North District Assembly,2010-09-01,2003-04-01,
Offinso North District Assembly,2011,CONSTRUCTION OF 1NO 6 UNIT CLASSROOM BLOCK WITH ANCILARY FACILITY,getfund,9/1/2010,9/16/2010,,,,Offinso North District Assembly,2010-09-01,2010-09-16,
Offinso North District Assembly,2011,CONSTRUCTION OF 1NO 6 UNIT CLASSROOM BLOCK WITH ANCILARY FACILITIES,getfund,9/1/2010,9/15/2010,,,,Offinso North District Assembly,2010-09-01,2010-09-15,
Offinso North District Assembly,2011,CONSTRUCTION OF MARKET,ddf,6/3/2011,,,,,Offinso North District Assembly,2011-06-03,,
Offinso North District Assembly,2011,REHABILITATION OF TEACHERS QUARTERS,ddf,6/3/2011,,,,,Offinso North District Assembly,2011-06-03,,
Offinso North District Assembly,2011,REHABILITATION OF 1NO 3 UNIT CLASSROOM BLOCK,ddf,6/3/2011,,,,,Offinso North District Assembly,2011-06-03,,
Offinso North District Assembly,2011,CONSTRUCTION OF 1NO 6 UNIT CLASSROOM BLOCK WITH ANCILARY FACILITIES,getfund,9/2/2010,,,,,Offinso North District Assembly,2010-09-02,,
Offinso North District Assembly,2011,CONSTRUCTION 1 STOREY CLASSROOM BLOCK,getfund,9/1/2010,,,,,Offinso North District Assembly,2010-09-01,,
Offinso North District Assembly,2011,CONSTRUCTION 1 STOREY CLASSROOM BLOCK,other donor,10/1/2007,,,,,Offinso North District Assembly,2007-10-01,,
Offinso North District Assembly,2011,CONSTRUCTION OF 1 STOREY CLASSROOM BLOCK,other donor,4/1/2006,,,,,Offinso North District Assembly,2006-04-01,,
Offinso North District Assembly,2011,REHABILITATION/REPAIR 1 STOREY CLASSROOM BLOCK,other donor,,,,,,Offinso North District Assembly,,,
Offinso North District Assembly,2011,REHABILITATION/REPAIR MARKET,other donor,5/1/2007,,,,,Offinso North District Assembly,2007-05-01,,
Offinso North District Assembly,2011,CONSTRUCTION 1 STOREY CLASSROOM BLOCK,other donor,9/9/2009,,,,,Offinso North District Assembly,2009-09-09,,
Offinso North District Assembly,2011,CONSTRUCTION 1 STOREY CLASSROOM BLOCK,other donor,,,,,,Offinso North District Assembly,,,
Offinso North District Assembly,2011,CONSTRUCTION 1 STOREY WC TOILET LATRINES,ddf,12/20/2010,,,,,Offinso North District Assembly,2010-12-20,,
Offinso North District Assembly,2011,CONSTRUCTION 1 STOREY TEACHERS QUARTERS,ddf,12/20/2010,,,,,Offinso North District Assembly,2010-12-20,,
Offinso North District Assembly,2011,CONSTRUCTION 1 STOREY CLASSROOM BLOCK,ddf,11/11/2010,,,,,Offinso North District Assembly,2010-11-11,,
Offinso North District Assembly,2011,CONSTRUCTION 10 SEATER WC TOILET LATRINES,ddf,12/20/2010,,,,,Offinso North District Assembly,2010-12-20,,
Offinso North District Assembly,2011,REHABILITATION/REPAIR 1 STOREY CLASSROOM BLOCK,ddf,12/20/2010,,,,,Offinso North District Assembly,2010-12-20,,
Offinso North District Assembly,2011,CONSTRUCTION 1 STOREY CLASSROOM BLOCK,ddf,12/20/2010,,,,,Offinso North District Assembly,2010-12-20,,
Offinso North District Assembly,2011,CONSTRUCTION 1 STOREY TEACHERS QUARTERS,ddf,12/20/2010,,,,,Offinso North District Assembly,2010-12-20,,
Offinso North District Assembly,2011,CONSTRUCTION 6 UNIT CHPS CLINIC HEALTH CENTER,ddf,6/2/2011,,,,,Offinso North District Assembly,2011-06-02,,
Offinso North District Assembly,2011,CONSTRUCTION 1 STOREY CLASSROOM BLOCK,dacf,4/17/2004,,,,,Offinso North District Assembly,2004-04-17,,
Offinso North District Assembly,2011,REHABILITATION/REPAIR 3 UNIT CLASSROOM BLOCK,dacf,7/12/2007,,,,,Offinso North District Assembly,2007-07-12,,
Offinso North District Assembly,2011,REHABILITATION/REPAIR OTHER,dacf,3/23/2010,,,,,Offinso North District Assembly,2010-03-23,,
Offinso North District Assembly,2011,CONSTRUCTION 4 UNIT RESIDENTIAL ACCOMODATION,dacf,7/22/2008,,,,,Offinso North District Assembly,2008-07-22,,
Offinso North District Assembly,2011,CONSTRUCTION 4 UNIT RESIDENTIAL ACCOMODATION,dacf,7/22/2008,,,,,Offinso North District Assembly,2008-07-22,,
Offinso North District Assembly,2011,CONSTRUCTION 1 STOREY RESIDENTIAL ACCOMODATION,dacf,7/22/2008,,,,,Offinso North District Assembly,2008-07-22,,
Offinso North District Assembly,2011,CONSTRUCTION 1 STOREY CHPS CLINIC HEALTH CENTER,other donor,,,,,,Offinso North District Assembly,,,
Offinso North District Assembly,2011,CONSTRUCTION 10 SEATER WC TOILET LATRINES,other donor,,,,,,Offinso North District Assembly,,,
Offinso North District Assembly,2011,"CONSTRUCTION 10 SEATER WC, TOILET, LATRINES",other donor,12/20/2010,,,,,Offinso North District Assembly,2010-12-20,,
Offinso North District Assembly,2011,REHABILITATION/REPAIR 1 STOREY CLASSROOM BLOCK,ddf,12/2/2009,,,,,Offinso North District Assembly,2009-12-02,,
Offinso North District Assembly,2011,CONSTRUCTION OTHER,ddf,1/18/2010,,,,,Offinso North District Assembly,2010-01-18,,
Offinso North District Assembly,2011,CONSTRUCTION 8 SEATER WC TOILET LATRINES,ddf,12/23/2009,,,,,Offinso North District Assembly,2009-12-23,,
Offinso North District Assembly,2011,REHABILITATION/REPAIR 1 STOREY CLASSROOM BLOCK,ddf,12/20/2010,,,,,Offinso North District Assembly,2010-12-20,,
Offinso North District Assembly,2011,CONSTRUCTION 1 STOREY CLASSROOM BLOCK,ddf,12/20/2010,,,,,Offinso North District Assembly,2010-12-20,,
Offinso North District Assembly,2011,CONSTRUCTION 1 STOREY OFFICE BLOCK,dacf,2/3/2011,,,,,Offinso North District Assembly,2011-02-03,,
Offinso North District Assembly,2011,CONSTRUCTION 1 STOREY RESIDENTIAL ACCOMODATION,dacf,7/22/2008,,,,,Offinso North District Assembly,2008-07-22,,
Offinso North District Assembly,2011,CONSTRUCTION 1 STOREY RESIDENTIAL ACCOMODATION,dacf,7/22/2008,,,,,Offinso North District Assembly,2008-07-22,,
Offinso North District Assembly,2011,CONSTRUCTION 1 STOREY CLASSROOM BLOCK,dacf,6/7/2000,,,,,Offinso North District Assembly,2000-06-07,,
Offinso North District Assembly,2011,CONSTRUCTION 1 STOREY CLASSROOM BLOCK,getfund,9/1/2010,,,,,Offinso North District Assembly,2010-09-01,,
Offinso North District Assembly,2011,CONSTRUCTION 1 STOREY CLASSROOM BLOCK,getfund,9/1/2010,,,,,Offinso North District Assembly,2010-09-01,,
Offinso North District Assembly,2011,CONSTRUCTION 1 STOREY CLASSROOM BLOCK,getfund,9/1/2010,,,,,Offinso North District Assembly,2010-09-01,,
Offinso North District Assembly,2011,REHABILITATION/REPAIR 1 STOREY TEACHERS QUARTERS,ddf,6/3/2011,,,,,Offinso North District Assembly,2011-06-03,,
Offinso North District Assembly,2011,CONSTRUCTION 2 UNIT MARKET,ddf,6/3/2011,,,,,Offinso North District Assembly,2011-06-03,,
Offinso North District Assembly,2011,REHABILITATION/REPAIR 1 STOREY TEACHERS QUARTERS,ddf,6/3/2011,,,,,Offinso North District Assembly,2011-06-03,,
Offinso North District Assembly,2011,REHABILITATION/REPAIR 3 UNIT CLASSROOM BLOCK,ddf,6/3/2011,,,,,Offinso North District Assembly,2011-06-03,,
Offinso North District Assembly,2011,CONSTRUCTION 2 UNIT WC TOILET LATRINES,ddf,6/3/2011,,,,,Offinso North District Assembly,2011-06-03,,
Offinso North District Assembly,2011,CONSTRUCTION 6 UNIT CLASSROOM BLOCK,getfund,9/2/2010,,,,,Offinso North District Assembly,2010-09-02,,
Prestea-Huni Valley District Assembly,2011,CONSTRUCTION OF 1 NO 20 SEATER WATER CLOSET,dacf,3/25/2010,4/20/2010,,,,Prestea-Huni Valley District Assembly,2010-03-25,2010-04-20,
Prestea-Huni Valley District Assembly,2011,DRILLING CONSTRUCTION OF 4NO BOREHOLES IN 4 COMMUNITIES,dacf,3/25/2010,4/20/2010,,,,Prestea-Huni Valley District Assembly,2010-03-25,2010-04-20,
Prestea-Huni Valley District Assembly,2011,CONSTRUCTION OF 3 NO SOLID WASTE HARDSTAND REFUSEBIN AT PRESTEA BOGOSO AND ABOSO,dacf,3/25/2010,4/20/2010,,,,Prestea-Huni Valley District Assembly,2010-03-25,2010-04-20,
Prestea-Huni Valley District Assembly,2011,EXTENSION OF WATER TO,dacf,7/21/2010,8/29/2010,,,,Prestea-Huni Valley District Assembly,2010-07-21,2010-08-29,
Prestea-Huni Valley District Assembly,2011,CONST DRILLING OF 4 NO BOREHOLES,other donor,7/21/2010,8/29/2010,,,,Prestea-Huni Valley District Assembly,2010-07-21,2010-08-29,
Prestea-Huni Valley District Assembly,2011,DRILLING CONSTRUCTION OF 2 NO BOREHOLES IN 4 COMMUNITIES,other/unknown,,,,,,Prestea-Huni Valley District Assembly,,,
Prestea-Huni Valley District Assembly,2011,CONST OF 9NO SEATER W C AND ONE CUBICLEURINAL BAY,igf,4/11/2010,4/20/2010,,,,Prestea-Huni Valley District Assembly,2010-04-11,2010-04-20,
Prestea-Huni Valley District Assembly,2011,GRAVELLING OF TUOBODOM SANITATRY SITE,other/unknown,1/11/2010,1/20/2010,,,,Prestea-Huni Valley District Assembly,2010-01-11,2010-01-20,
Prestea-Huni Valley District Assembly,2011,CONST DRILLING OF 1NO BOREHOLES,igf,4/11/2010,4/11/2010,,,,Prestea-Huni Valley District Assembly,2010-04-11,2010-04-11,
Prestea-Huni Valley District Assembly,2011,REHABILITATION OF AQUA PRIVY TOILET,igf,4/11/2010,4/11/2010,,,,Prestea-Huni Valley District Assembly,2010-04-11,2010-04-11,
Prestea-Huni Valley District Assembly,2011,REHABILITATION OF 19NO BOREHOLES AND 6NO HAND DUG WELLS DISTRICT WIDE 1NO OVERHEAD TANK BOGOSO HEALTH CENTRE,igf,1/17/2011,1/11/2011,,,,Prestea-Huni Valley District Assembly,2011-01-17,2011-01-11,
Prestea-Huni Valley District Assembly,2011,CONSTRUCTION OF 1 NO 3 UNIT CLASSROOM BLOCK AT WASSA NKRAN,dacf,3/25/2011,4/20/2010,,,,Prestea-Huni Valley District Assembly,2011-03-25,2010-04-20,
Prestea-Huni Valley District Assembly,2011,REROOFING AND CONST OF PRESTEA GOLFIELDS SCHOOL PHASE 1,other/unknown,10/11/2010,12/11/2010,,,,Prestea-Huni Valley District Assembly,2010-10-11,2010-12-11,
Prestea-Huni Valley District Assembly,2011,CONSTRUCTION OF 1 NO 6 UNIT CLASSROOM BLOCK WITH URINAL OFFICE AND STORE,dacf,3/25/2010,4/20/2010,,,,Prestea-Huni Valley District Assembly,2010-03-25,2010-04-20,
Prestea-Huni Valley District Assembly,2011,REHABILITATION OF 7NO DAMAGED REFUSE CONTAINERS,igf,5/20/2011,7/20/2011,,,,Prestea-Huni Valley District Assembly,2011-05-20,2011-07-20,
Prestea-Huni Valley District Assembly,2011,RE ROOFING OF 1NO 3 UNIT CLASSROOM BLOCK LIB STORE,dacf,7/21/2010,8/1/2010,,,,Prestea-Huni Valley District Assembly,2010-07-21,2010-08-01,
Prestea-Huni Valley District Assembly,2011,CONSTRUCTION OF 1NO CLASSROOM BLOCK FOR CATHOLIC SCHOOL,igf,,,,,,Prestea-Huni Valley District Assembly,,,
Prestea-Huni Valley District Assembly,2011,RE CONSTRUCTION OF 1 NO 2 UNIT KINDERGATEN CLASSROOM BLOCK,igf,,1/25/2011,,,,Prestea-Huni Valley District Assembly,,2011-01-25,
Prestea-Huni Valley District Assembly,2011,RE CONSTRUCTION OF 1 NO 5 UNITE CLASSROOM BLOCK FOR ABOSO ARABIC SCHOOL,igf,,Apr-11,,,,Prestea-Huni Valley District Assembly,,2011-04-01,
Prestea-Huni Valley District Assembly,2011,CONSTRUCTION OF 1 NO 2 UNIT KINDERGATEN CLASSROOM BLOCK,ddf,1/17/2011,2/9/2011,,,,Prestea-Huni Valley District Assembly,2011-01-17,2011-02-09,
Prestea-Huni Valley District Assembly,2011,CONSTRUCTION OF 1NO 2 UNIT KINDERGATEN CLASSROOM BLOCK,ddf,,,,,,Prestea-Huni Valley District Assembly,,,
Prestea-Huni Valley District Assembly,2011,CONSTRUCTION OF 1NO 3 UNIT CLASSROOM BLOCK,ddf,1/17/2011,2/3/2011,,,,Prestea-Huni Valley District Assembly,2011-01-17,2011-02-03,
Prestea-Huni Valley District Assembly,2011,CONSTRUCTION OF 1NO 3 UNIT CLASSROOM BLOCK,ddf,1/17/2011,2/3/2011,,,,Prestea-Huni Valley District Assembly,2011-01-17,2011-02-03,
Prestea-Huni Valley District Assembly,2011,CONSTRUCTION OF 1NO 3 UNIT CLASSROOM BLOCK,ddf,1/17/2011,2/9/2011,,,,Prestea-Huni Valley District Assembly,2011-01-17,2011-02-09,
Prestea-Huni Valley District Assembly,2011,CONSTRUCTION OF 1NO 3 UNIT CLASSROOM BLOCK,ddf,1/17/2011,2/9/2011,,,,Prestea-Huni Valley District Assembly,2011-01-17,2011-02-09,
Prestea-Huni Valley District Assembly,2011,CONSTRUCTION OF 6 UNIT CLASSROOM BLOCKS WITH ANCILLARY FACILITIES,getfund,12/2/2010,12/20/2010,,,,Prestea-Huni Valley District Assembly,2010-12-02,2010-12-20,
Prestea-Huni Valley District Assembly,2011,CONSTRUCTION OF 1NO 6 UNIT CLASSROOM BLOCK,getfund,12/2/2010,12/20/2010,,,,Prestea-Huni Valley District Assembly,2010-12-02,2010-12-20,
Prestea-Huni Valley District Assembly,2011,CONSTRUCTION OF 1NO 6 UNIT CLASSROOM BLOCK WITH ANCILLARY FACILITIES,getfund,12/2/2010,12/20/2010,,,,Prestea-Huni Valley District Assembly,2010-12-02,2010-12-20,
Prestea-Huni Valley District Assembly,2011,CONSTRUCTION OF 1NO 6 UNIT CLASSROOM BLOCK WITH ANCILLARY FACILITIES,getfund,12/2/2010,12/20/2010,,,,Prestea-Huni Valley District Assembly,2010-12-02,2010-12-20,
Prestea-Huni Valley District Assembly,2011,CONSTRUCTION OF 1NO 6 UNIT CLASSROOM BLOCK WITH ANCILLARY FACILITIES,getfund,12/2/2010,12/20/2010,,,,Prestea-Huni Valley District Assembly,2010-12-02,2010-12-20,
Prestea-Huni Valley District Assembly,2011,CONSTRUCTION OF 6 UNIT CLASSROOM BLOCKS WITH ANCILLARY FACILITIES,getfund,10/14/2011,12/28/2011,,,,Prestea-Huni Valley District Assembly,2011-10-14,2011-12-28,
Prestea-Huni Valley District Assembly,2011,CONSTRUCTION OF 6 UNIT CLASSROOM BLOCKS WITH ANCILLARY FACILITIES,getfund,10/14/2011,12/28/2011,,,,Prestea-Huni Valley District Assembly,2011-10-14,2011-12-28,
Prestea-Huni Valley District Assembly,2011,CONSTRUCTION OF 6 UNIT CLASSROOM BLOCKS WITH ANCILLARY FACILITIES,getfund,10/14/2011,12/28/2011,,,,Prestea-Huni Valley District Assembly,2011-10-14,2011-12-28,
Prestea-Huni Valley District Assembly,2011,CONSTRUCTION OF 1NO 3 UNIT CLASSROOM BLOCK OFFICE AND STORE AT GORDON,multiple,,11/1/2007,,,,Prestea-Huni Valley District Assembly,,2007-11-01,
Prestea-Huni Valley District Assembly,2011,CONST OF 1 NO 3 UNIT CLASSROOM BLOCK OFFICE AT BONSASO,multiple,,11/1/2007,,,,Prestea-Huni Valley District Assembly,,2007-11-01,
Prestea-Huni Valley District Assembly,2011,CONSTRUCTION OF 1NO 3 UNIT CLASSROOM BLOCK OFFICE AND STORE AT ATWEREBOANDA,multiple,,11/1/2007,,,,Prestea-Huni Valley District Assembly,,2007-11-01,
Prestea-Huni Valley District Assembly,2011,CONSTRUCTION OF 1NO 6 UNIT CLASSROOM BLOCK OFFICE AND STORE AT ACHIASE,multiple,,11/1/2007,,,,Prestea-Huni Valley District Assembly,,2007-11-01,
Prestea-Huni Valley District Assembly,2011,CONST OF 6 UNIT CLASSROOM BLOCK AT PIESO,multiple,,11/1/2007,,,,Prestea-Huni Valley District Assembly,,2007-11-01,
Prestea-Huni Valley District Assembly,2011,RE HABILITATION OF 4NO BEDROOM AS CHPS COMPOUND,dacf,7/21/2010,,,,,Prestea-Huni Valley District Assembly,2010-07-21,,
Prestea-Huni Valley District Assembly,2011,CONSTRUCTION OF 1NO CHPS COMPOUND,ddf,1/25/2011,,,,,Prestea-Huni Valley District Assembly,2011-01-25,,
Prestea-Huni Valley District Assembly,2011,REHABILITATION OF 4NO STORE FACILITY AS CHPS COMPOUND,dacf,7/21/2010,,,,,Prestea-Huni Valley District Assembly,2010-07-21,,
Prestea-Huni Valley District Assembly,2011,CONSTRUCTION OF OPEN SHED AND GRAVELLING OF FRONTAGE OF CHIPS COMPOUND,dacf,,,,,,Prestea-Huni Valley District Assembly,,,
Prestea-Huni Valley District Assembly,2011,CONSTRUCTION OF 2 NO MARKET SHED,dacf,3/25/2010,4/20/2010,,,,Prestea-Huni Valley District Assembly,2010-03-25,2010-04-20,
Prestea-Huni Valley District Assembly,2011,CONSTRUCTION OF 2 NO MARKET SHED,dacf,3/25/2010,4/20/2010,,,,Prestea-Huni Valley District Assembly,2010-03-25,2010-04-20,
Prestea-Huni Valley District Assembly,2011,RE CONSTRUCTION OF 7NO BROKEN DOWN WOODEN BRIDGES,igf,7/21/2010,8/12/2008,,,,Prestea-Huni Valley District Assembly,2010-07-21,2008-08-12,
Prestea-Huni Valley District Assembly,2011,REHABILITATION AND CONST OF MEAT SHOP,dacf,10/11/2010,12/11/2010,,,,Prestea-Huni Valley District Assembly,2010-10-11,2010-12-11,
Prestea-Huni Valley District Assembly,2011,REHABILITATION AND CONST OF MEAT SHOP,other/unknown,10/11/2010,12/11/2010,,,,Prestea-Huni Valley District Assembly,2010-10-11,2010-12-11,
Prestea-Huni Valley District Assembly,2011,RE CONSTRUCTION OF 6NO BROKEN DOWN WOODEN BRIDGES,igf,7/21/2010,8/12/2010,,,,Prestea-Huni Valley District Assembly,2010-07-21,2010-08-12,
Prestea-Huni Valley District Assembly,2011,SITE CLEARING AND EARTHWORKS AT PROPOSED NEW CEMETARY,igf,,3/29/2011,,,,Prestea-Huni Valley District Assembly,,2011-03-29,
Prestea-Huni Valley District Assembly,2011,SITE CLEARING AND EARTHWORKS AT OLD CEMETARY AND PROPSED MINI MARKET AREA,igf,,3/28/2011,,,,Prestea-Huni Valley District Assembly,,2011-03-28,
Prestea-Huni Valley District Assembly,2011,CLEAING AND EARTHWORKS AT DCDS BANGALOW,igf,,3/29/2011,,,,Prestea-Huni Valley District Assembly,,2011-03-29,
Prestea-Huni Valley District Assembly,2011,CONSTRUCTION OF 1 NO 4 BEDROOM DETACHED BUNGALOW AT BOGOSO,igf,3/25/2010,4/15/2010,,,,Prestea-Huni Valley District Assembly,2010-03-25,2010-04-15,
Prestea-Huni Valley District Assembly,2011,CONSTRUCTION AND COMPLETION OF 1NO 5 BEDROOM DETACHED BUNGALOW,igf,3/25/2010,4/15/2010,,,,Prestea-Huni Valley District Assembly,2010-03-25,2010-04-15,
Prestea-Huni Valley District Assembly,2011,CONSTRUCTION OF ADMINISTRATION BLK COMPLEX FOR PHDA,igf,3/25/2010,4/15/2010,,,,Prestea-Huni Valley District Assembly,2010-03-25,2010-04-15,
Prestea-Huni Valley District Assembly,2011,CONSTRUCTION AND COMPLETION OF 1NO 3 BEDROOM SEMI DETACHED SENIOR STAFF BUNGALOW,igf,3/25/2010,4/15/2010,,,,Prestea-Huni Valley District Assembly,2010-03-25,2010-04-15,
Prestea-Huni Valley District Assembly,2011,CONSTRUCTION & COMPLETION OF 1NO 3 BEDROOM SEMI DETARCHED SENIOR STAFF BUNGALOW,igf,3/25/2010,4/15/2010,,,,Prestea-Huni Valley District Assembly,2010-03-25,2010-04-15,
Prestea-Huni Valley District Assembly,2011,CONSTRUCTION & COMPLETION OF 1NO 3 BEDROOM SEMI DETARCHED SENIOR STAFF BUNGALOW,igf,3/25/2010,4/15/2010,,,,Prestea-Huni Valley District Assembly,2010-03-25,2010-04-15,
Prestea-Huni Valley District Assembly,2011,CONSTRUCTION & COMPLETION OF 1NO 3 BEDROOM SEMI DETARCHED SENIOR STAFF BUNGALOW,igf,3/25/2010,4/15/2010,,,,Prestea-Huni Valley District Assembly,2010-03-25,2010-04-15,
Prestea-Huni Valley District Assembly,2011,CONSTRUCTION OF 6UNIT GUEST HOUES FOR PHDA,igf,3/25/2010,4/15/2010,,,,Prestea-Huni Valley District Assembly,2010-03-25,2010-04-15,
Pru District Assembly,2011,CULTIVATION OF 5 ACRES OF MANGO NURSERY AND MANGO ORCHARD,other/unknown,,,,,,Pru District Assembly,,,
Pru District Assembly,2011,CULTIVATION OF 5 ACRES OF MANGO NURSERY AND MANGO ORCHARD,other/unknown,,,,,,Pru District Assembly,,,
Pru District Assembly,2011,CULTIVATION OF 5 ACRES OF MANGO NURSERY AND MANGO ORCHARD,other/unknown,,,,,,Pru District Assembly,,,
Pru District Assembly,2011,CULTIVATION OF 5 ACRES OF MANGO NURSERY AND MANGO ORCHARD,other/unknown,,,,,,Pru District Assembly,,,
Pru District Assembly,2011,CULTIVATION OF 5 ACRES OF MANGO NURSERY AND MANGO ORCHARD,other/unknown,,,,,,Pru District Assembly,,,
Pru District Assembly,2011,CULTIVATE ABOUT 100HA OF LAND UNDER THE NATIONAL AFFORESTATION PROGRAMME OF NYEP IN THE DISTRICT,other/unknown,,,,,,Pru District Assembly,,,
Pru District Assembly,2011,COMPLETE CONSTRUCITON AND TARRING OF 2.5KM YEJI TOWN ROADS,other/unknown,,,,,,Pru District Assembly,,,
Pru District Assembly,2011,CONSTRUCTION OF ACCESS ROAD AND LEVELLING OF LORRY PARK,other/unknown,,,,,,Pru District Assembly,,,
Pru District Assembly,2011,EXTEND ELECTRICITY/STREET LIGHTS IN COMMUNITIES,other/unknown,,,,,,Pru District Assembly,,,
Pru District Assembly,2011,COMPLETION OF STREET LIGHTING PROJECT,other/unknown,,,,,,Pru District Assembly,,,
Pru District Assembly,2011,ENSURE REGULAR DISTILLING OF DRAINS,other/unknown,,,,,,Pru District Assembly,,,
Pru District Assembly,2011,FACILITY & SUPPORT RESTORATION OF THE BROKEN DOWN PARAMBO/SAWABA WATER SYSTEM,other/unknown,,,,,,Pru District Assembly,,,
Pru District Assembly,2011,FACILITY & SUPPORT DRILLING OF 32NO AFD FUNDED BOREHOLES,other/unknown,,,,,,Pru District Assembly,,,
Pru District Assembly,2011,ACQUIRE AND DEVELOP FINAL SOLID/LIQUID WASTE DISPOSAL SITE,other/unknown,,,,,,Pru District Assembly,,,
Pru District Assembly,2011,ENSURE DAILY COLLECTION AND DISPOSAL OF SOLID WASTE (WASTE MANAGEMENT SERVICES),other/unknown,,,,,,Pru District Assembly,,,
Pru District Assembly,2011,PROVISION OF 4 REFUSE CONTAINERS,other/unknown,,,,,,Pru District Assembly,,,
Pru District Assembly,2011,EVACUATION OF REFUSE HEAPS,other/unknown,,,,,,Pru District Assembly,,,
Pru District Assembly,2011,CONSTRUCTION OF 1NO. 10-SEATER ACQUA PRIVY TOILET,other/unknown,,,,,,Pru District Assembly,,,
Pru District Assembly,2011,COMPLETION OF 1NO. SLAUGHTER HOUSE,other/unknown,,,,,,Pru District Assembly,,,
Pru District Assembly,2011,COMPLETION OF 1NO. COMMUNITY LIBRARY AT YEJI,other/unknown,,,,,,Pru District Assembly,,,
Pru District Assembly,2011,CONST. OF 1NO. COMMUNITY LIBRARY,other/unknown,,,,,,Pru District Assembly,,,
Pru District Assembly,2011,CONST. OF 1NO. 6-UNIT CLASSROOM BLOCK WITH ANCILLARY FACILITIES ABEASE R/C SCHOOL,other/unknown,,,,,,Pru District Assembly,,,
Pru District Assembly,2011,CONST. OF 15 PAVILIONS IN 15 COMMUNITIES,other/unknown,,,,,,Pru District Assembly,,,
Pru District Assembly,2011,"PROVIDE 1,500 DUAL DECKS TO BASIC SCHOOLS IN THE DISTRICT",other/unknown,,,,,,Pru District Assembly,,,
Pru District Assembly,2011,PROVIDE TLMS TO SCHOOLS AT ALL LEVELS,other/unknown,,,,,,Pru District Assembly,,,
Pru District Assembly,2011,PROVIDE 500 SCHOOL UNIFORM TO NEEDY PUPILS,other/unknown,,,,,,Pru District Assembly,,,
Pru District Assembly,2011,SUSTAIN THE EXISTING NON FORMAL CLASSES,other/unknown,,,,,,Pru District Assembly,,,
Pru District Assembly,2011,FORM NEW NON FORMAL CLASSES,other/unknown,,,,,,Pru District Assembly,,,
Pru District Assembly,2011,COMPLETE CONST. OF 1NO. 6-UNITS CLASSROOM BLOKS FOR SCHOOLS UNDER TREE AT PRANG,other/unknown,,,,,,Pru District Assembly,,,
Pru District Assembly,2011,COMPLETE CONST. OF 1NO. 6-UNITS CLASSROOM BLOKS FOR SCHOOLS UNDER TREE AT PRANG,other/unknown,,,,,,Pru District Assembly,,,
Pru District Assembly,2011,COMPLETE CONST. OF 3NO. 6-UNITS CLASSROOM BLOCKS FOR SCHOOLS UNDER TREE AT ADJARAJA D/A PRIMARY,other/unknown,,,,,,Pru District Assembly,,,
Pru District Assembly,2011,COMPLETION OF 1NO.6-UNIT CLASSROOM BLOCK AT BRONIKROM DA PRIMARY,other/unknown,,,,,,Pru District Assembly,,,
Pru District Assembly,2011,REHABILITATION OF 1 NO. 6-UNIT  DILAPIDATED CLASSROOM BLOCKS WITH DISABILITY FRIENDLY FACILITIES AT SAWABA DA PRIMARY,other/unknown,,,,,,Pru District Assembly,,,
Pru District Assembly,2011,REHABILITATION OF 1NO. 4-UNIT DILAPIDATED CLASSROOM BLOCK AND STORE WITH DISABILITY FRIENDLY FACILITIES AT KAMANPA DA PRIMARY,other/unknown,,,,,,Pru District Assembly,,,
Pru District Assembly,2011,REHABILITATION OF 1 NO. 3-UNIT DILAPIDATED CLASSROOM BLOCK WITH DISABILITY FRIENDLY FACILITIES AT PRANG DA JHS,other/unknown,,,,,,Pru District Assembly,,,
Pru District Assembly,2011,"REHABILITATION OF 1 NO,3-UNIT DILAPIDATED CLASSROOM BLOCK WITH DISBILITY FRIENDLY FACILITIES AT ABEASE PESBY JSH",other/unknown,,,,,,Pru District Assembly,,,
Pru District Assembly,2011,CONST. OF 1NO.6UNITS CLASSROOM BLOCKS FOR SCHOOLS UNDER TREE AT DAMAN-NKWANTA,other/unknown,,,,,,Pru District Assembly,,,
Pru District Assembly,2011,CONST. OF 1 NO. 6-UNIT CLASSROOM BLOCKS FOR SCHOOLS UNDER TREE AT ABEASE,other/unknown,,,,,,Pru District Assembly,,,
Pru District Assembly,2011,CONST. OF 1NO 6-UNIT CLASSROOM BLOCKS FOR SCHOOLS UNDER TREE AT KOJO BOFFOUR,other/unknown,,,,,,Pru District Assembly,,,
Pru District Assembly,2011,"CONST. OF 1NO. 6-UNIT CLASSROOM BLOCKS FOR SCHOOLS UNDER TREE AT DAN-NUIFAWA,PRIM.SCH,PRANG",other/unknown,,,,,,Pru District Assembly,,,
Pru District Assembly,2011,REHABILITATION OF DILAPIDATED 1NO. TECHNICAL BLOCK AT YEJI SEC/TECH,other/unknown,,,,,,Pru District Assembly,,,
Pru District Assembly,2011,"DRILL 7 BOREHOLES IN 7 BASIC SCHOOLS AT CHEREMBO D/A PRIM, NCHAMBA D/A PRIM,P.P. PRIM/JHS,YEJI, PRANG D.A PRIM, PARAMBO D/A PRIM,BOBRE D/A PRIM & SAWABA D/A PRIM",other/unknown,,,,,,Pru District Assembly,,,
Pru District Assembly,2011,COMPLETE 1NO. OFFICE ACCOMMODATION FOR THE DIST. MUTUAL HEALTH INSURANCE SCHEME AT YEJI,other/unknown,,,,,,Pru District Assembly,,,
Pru District Assembly,2011,COMPLETION OF 1NO. CHIPS COMPOUNDS AT AVORKOPE,other/unknown,,,,,,Pru District Assembly,,,
Pru District Assembly,2011,OPERATIONALISATION OF 2NO. CHIPS COMPOUNDS AT NCHAMBA & KAMANPA,other/unknown,,,,,,Pru District Assembly,,,
Pru District Assembly,2011,CONST. 1NO. SEMI-DETACHED NURSES' QUARTERS AT ZABRAMA,other/unknown,,,,,,Pru District Assembly,,,
Pru District Assembly,2011,INAUGURATE THE AREA COUNCILS (ACS) AND UNIT COMMITTEES,other/unknown,,,,,,Pru District Assembly,,,
Pru District Assembly,2011,OPERATIONALISATION OF AREA COUNCILS,other/unknown,,,,,,Pru District Assembly,,,
Pru District Assembly,2011,CONST/COMPLETE OFFICE COMPLEX FOR THE DA,other/unknown,,,,,,Pru District Assembly,,,
Pru District Assembly,2011,CONST. 1NO. 3-BEDROOM SEMI-DATACHED STAFF QUARTERS FOR DA,other/unknown,,,,,,Pru District Assembly,,,
Pru District Assembly,2011,REHABILITATION OF 4 DA QUARTERS,other/unknown,,,,,,Pru District Assembly,,,
Pru District Assembly,2011,COMPLETION OF 1NO. 3-BEDROOM SEMI-DETACHED STAFF QUARTERS,other/unknown,,,,,,Pru District Assembly,,,
Pru District Assembly,2011,COMPLETION OF 1NO. 2-BEDROOM SEMI-DETACHED STAFF QUARTERS,other/unknown,,,,,,Pru District Assembly,,,
Pru District Assembly,2011,COMPLETION OF REHABILITATION OF 1NO. 4 TERRANCE BEDSITTER FOR STAFF AT YEJI,other/unknown,,,,,,Pru District Assembly,,,
Pru District Assembly,2011,FENCING OF DCE'S BUNGALOW AT YEJI,other/unknown,,,,,,Pru District Assembly,,,
Pru District Assembly,2011,CONST. 1NO. 3-BEDROOM TRANSIT QUARTERS AT PRANG,other/unknown,,,,,,Pru District Assembly,,,
Pru District Assembly,2011,CONST. A DISTRICT COURT BUILDING FOR ADMINISTRATION OF JUSTICE,other/unknown,,,,,,Pru District Assembly,,,
Pru District Assembly,2011,COMPLETE REHABILITATION AND OPERATIONALISATION OF ABEASE POLICE STATION,other/unknown,,,,,,Pru District Assembly,,,
Saboba District Assembly,2011,,,,,,,,Saboba District Assembly,,,
Savelugu-Nanton Municipal Assembly,2011,,,,,,,,Savelugu-Nanton Municipal Assembly,,,
Sawla-Tuna-Kalba District Assembly,2011,,,,,,,,Sawla-Tuna-Kalba District Assembly,,,
Sefwi-Wiawso District Assembly,2011,CONSTRUCTION AND COMPLETION OF 1NO 3 UNIT CLASSROOM BLOCK WITH OFFICE STORE STAFF COMMON ROOM LIBRARY AND 2 UNIT PRE SCHOOL CLASSROOM BLOCK WITH OFFICE STORE AND SLEEPING ROOM,ddf,,1/21/2011,,,,Sefwi-Wiawso District Assembly,,2011-01-21,
Sefwi-Wiawso District Assembly,2011,CONSTRUCTION AND COMPLETION OF 1NO 2 UNIT PRE SCHOOL CLASSROOM BLOCK WITH OFFICE STORE AND SLEEPING ROOM,ddf,,1/21/2011,,,,Sefwi-Wiawso District Assembly,,2011-01-21,
Sefwi-Wiawso District Assembly,2011,CONSTRUCTION AND COMPLETION OF 1NO MEAT SHOP AT SEFWI WIAWSO MARKET,ddf,,1/21/2011,,,,Sefwi-Wiawso District Assembly,,2011-01-21,
Sefwi-Wiawso District Assembly,2011,CONSTRUCTION AND COMPLETION OF 1NO 2 UNIT PRE SCHOOL CLASSROOM BLOCK WITH OFFICE STORE AND SLEEPING ROOM,ddf,,1/21/2011,,,,Sefwi-Wiawso District Assembly,,2011-01-21,
Sefwi-Wiawso District Assembly,2011,RESHAPING OF SELECTED ROADS AT ADIEMBRA AND OTHER COMMUNITIES,ddf,,1/21/2011,,,,Sefwi-Wiawso District Assembly,,2011-01-21,
Sefwi-Wiawso District Assembly,2011,SMALL TOWN WATER AND SANITATION PROGRAMME,other donor,,2003/2004,,,,Sefwi-Wiawso District Assembly,,2003/2004,
Sefwi-Wiawso District Assembly,2011,INLAND VALLEY RICE DEV PROJECT,other gog,,,,,,Sefwi-Wiawso District Assembly,,,
Sefwi Akontombra District Assembly,2011,CONSTRUCTION OF 16 AND 20 UNIT OPEN MARKET SHED,dacf,,2/10/2008,,,,Sefwi Akontombra District Assembly,,2008-02-10,
Sefwi Akontombra District Assembly,2011,CONSTRUCTION OF 1NO EXECUTIVE GUEST HOUSE,dacf,,2/10/2008,,,,Sefwi Akontombra District Assembly,,2008-02-10,
Sefwi Akontombra District Assembly,2011,CONSTRUCTION OF 3NO 12UNIT OPEN MARKET SHED,dacf,,2/10/2008,,,,Sefwi Akontombra District Assembly,,2008-02-10,
Sefwi Akontombra District Assembly,2011,"CONSTRUCTION OF 3 UNIT CLASSROOM BLOCK WITH OFFICE, STORE AND STAFF AND STAFF COMMON ROOM",dacf,,,,,,Sefwi Akontombra District Assembly,,,
Sefwi Akontombra District Assembly,2011,"CONSTRUCTION OF 3 UNIT CLASSROOM BLOCK WITH OFFICE, STORE AND STAFF COMMON ROOM",dacf,,,,,,Sefwi Akontombra District Assembly,,,
Sefwi Akontombra District Assembly,2011,"CONSTRUCTION OF 1 NO 6 UNIT CLASSROOM BLOCK WITH OFFICE, STORE AND STAFF COMMON ROOM",dacf,,4/15/2010,,,,Sefwi Akontombra District Assembly,,2010-04-15,
Sefwi Akontombra District Assembly,2011,CONSTRUCTION OF 1 NO 6 UNIT OFFICE ACCOMMODATION BLOCK WITH TOILET FACILITIES,dacf,,4/15/2010,,,,Sefwi Akontombra District Assembly,,2010-04-15,
Sefwi Akontombra District Assembly,2011,CONSTRUCTION OF DCDS BUNGALOW,dacf,,2/10/2008,,,,Sefwi Akontombra District Assembly,,2008-02-10,
Sefwi Akontombra District Assembly,2011,CONSTRUCTION OF DCDS BUNGALOW,dacf,,2/10/2008,,,,Sefwi Akontombra District Assembly,,2008-02-10,
Sefwi Akontombra District Assembly,2011,EXPANSION OF ELECTRICITY NETWORK,dacf,,2/10/2008,,,,Sefwi Akontombra District Assembly,,2008-02-10,
Sefwi Akontombra District Assembly,2011,EXPANSION OF ELECTRICITY NETWORK,dacf,,2/10/2008,,,,Sefwi Akontombra District Assembly,,2008-02-10,
Sefwi Akontombra District Assembly,2011,"CONSTRUCTION OF 3 UNIT CLASSROOM BLOCK WITH OFFICE, STORE AND STAFF COMMON ROOM",dacf,,,,,,Sefwi Akontombra District Assembly,,,
Sefwi Akontombra District Assembly,2011,CONSTRUCTION OF 1NO 2UNIT CLASSROOM BLOCK,dacf,,11/15/2010,,,,Sefwi Akontombra District Assembly,,2010-11-15,
Sefwi Akontombra District Assembly,2011,CONSTRUCTION OF 1NO 6UNIT CLASSROOM BLOKC WITH ANCI FACILIT,getfund,,,,,,Sefwi Akontombra District Assembly,,,
Sefwi Akontombra District Assembly,2011,CONSTRUCTION OF 1NO 6UNIT CLASSROOM BLOCK WITH ANCL FACILIT,getfund,,,,,,Sefwi Akontombra District Assembly,,,
Sefwi Akontombra District Assembly,2011,CONSTRUCTION OF 1NO 6UNIT CLASSROOM BLOCK WITH ANCI FACILIT,getfund,,,,,,Sefwi Akontombra District Assembly,,,
Sefwi Akontombra District Assembly,2011,CONSTRUCTION OF 1NO 6UNIT CLASSROOM BLOCK WITH ANCILLARY FACILITIES,getfund,,6/22/2010,,,,Sefwi Akontombra District Assembly,,2010-06-22,
Sefwi Akontombra District Assembly,2011,CONSTRUCTION OF 1NO ADMINISTRATION BLOCK WITH ANCI FACILIT,getfund,,,,,,Sefwi Akontombra District Assembly,,,
Sefwi Akontombra District Assembly,2011,CONSTRUCTION OF 1NO 6UNIT CLASSROOM BLOCK,multiple,,,,,,Sefwi Akontombra District Assembly,,,
Sefwi Akontombra District Assembly,2011,CONSTRUCTION OF 1NO 6UNIT CLASSROOM BLOCK,multiple,,,,,,Sefwi Akontombra District Assembly,,,
Sefwi Akontombra District Assembly,2011,CONSTRUCTION OF 2NO 3UNIT TEACHERS QIARTERS,multiple,,,,,,Sefwi Akontombra District Assembly,,,
Sefwi Akontombra District Assembly,2011,CONSTRUCTION OF 2NO 3UNIT TEACHERS QUARTERS,multiple,,,,,,Sefwi Akontombra District Assembly,,,
Sefwi Akontombra District Assembly,2011,CONSTRUCTION OF 120 NO HOUSEHOLD LATRINES,multiple,,Aug-08,,,,Sefwi Akontombra District Assembly,,2008-08-01,
Sefwi Akontombra District Assembly,2011,CONSTRUCTION OF 5NO INSTITUTIONAL LATRINES,multiple,,Aug-08,,,,Sefwi Akontombra District Assembly,,2008-08-01,
Sefwi Akontombra District Assembly,2011,CONSTRUCTION OF 1NO 6UNIT CLASSROOM BLOKC,multiple,,,,,,Sefwi Akontombra District Assembly,,,
Sefwi Akontombra District Assembly,2011,CONSTRUCTION OF 1NO 3UNIT CLASSROOM BLOCK WITH ANCI FACILITIES,ddf,,3/8/2011,,,,Sefwi Akontombra District Assembly,,2011-03-08,
Sefwi Akontombra District Assembly,2011,CONSTRUCTION OF 1NO 3UNIT CLASSROOM BLOCK WITH ANCI FACILITIES,ddf,,3/8/2011,,,,Sefwi Akontombra District Assembly,,2011-03-08,
Sefwi Akontombra District Assembly,2011,CONSTRUCTION OF 1NO 3UNIT CLASSROOM BLOCK WITH ANCI. FACILITIES,ddf,,3/8/2011,,,,Sefwi Akontombra District Assembly,,2011-03-08,
Sefwi Akontombra District Assembly,2011,CONSTRUCTION OF 1NO 3UNIT CLASSROOM BLOCK WITH ANCI. FACILITIES,ddf,,3/8/2011,,,,Sefwi Akontombra District Assembly,,2011-03-08,
Sefwi Akontombra District Assembly,2011,CONSTRUCTION OF 1NO WEST AFRICA EXAMINATION DEPOT,ddf,,3/8/2011,,,,Sefwi Akontombra District Assembly,,2011-03-08,
Sefwi Akontombra District Assembly,2011,CONSTRUCTION OF MEAT SHOP AND URINAL,ddf,,3/8/2011,,,,Sefwi Akontombra District Assembly,,2011-03-08,
Sefwi Akontombra District Assembly,2011,CONSTRUCTION OF 1NO DISTRICT POLICE STATION,ddf,,3/8/2011,,,,Sefwi Akontombra District Assembly,,2011-03-08,
Sefwi Akontombra District Assembly,2011,CONSTRUCTION OF 1NO 2 UNIT CLASSROOM BLOCK,other donor,,Feb-08,,,,Sefwi Akontombra District Assembly,,2008-02-01,
Sefwi Akontombra District Assembly,2011,CONSTRUCTION OF 1 NO 3 UNIT CLASSROOM BLOCK,other donor,,9/29/2009,,,,Sefwi Akontombra District Assembly,,2009-09-29,
Sefwi Akontombra District Assembly,2011,CONSTRUCTION OF 2NO 6 UNIT SEATER KVIP WITH,other donor,,9/29/2009,,,,Sefwi Akontombra District Assembly,,2009-09-29,
Sekondi-Takoradi Metropolitan Assembly,2011,CONSTRUCTION OF FABRICATION LABORATORY,dacf,,11/10/2006,,,,Sekondi-Takoradi Metropolitan Assembly,,2006-11-10,
Sekondi-Takoradi Metropolitan Assembly,2011,COMPLETION OF 6 UNIT CLASSROOM BLOCK AT NKOTOMPO,dacf,,1/14/2009,,,,Sekondi-Takoradi Metropolitan Assembly,,2009-01-14,
Sekondi-Takoradi Metropolitan Assembly,2011,2 STOREY DORMITORY BLOCK TWIN CITY SPECIAL SCHOOL ESSIPON,getfund,,2/15/2007,,,,Sekondi-Takoradi Metropolitan Assembly,,2007-02-15,
Sekondi-Takoradi Metropolitan Assembly,2011,CONSTRUCTION OF 6 UNIT CLASSROOM BLOCK WITH ANCILLARY FACILITIES AT MAJOR CROMWELL SEKONDI,getfund,,1/7/2008,,,,Sekondi-Takoradi Metropolitan Assembly,,2008-01-07,
Sekondi-Takoradi Metropolitan Assembly,2011,CONTINUATION AND COMPLETION OF ST PAULS CATHOLIC J H S SEKONDI,getfund,,1/7/2008,,,,Sekondi-Takoradi Metropolitan Assembly,,2008-01-07,
Sekondi-Takoradi Metropolitan Assembly,2011,CONTINUATION AND COMPLETION OF PRESBYTERIAN J H S SEKONDI,getfund,,1/7/2008,,,,Sekondi-Takoradi Metropolitan Assembly,,2008-01-07,
Sekondi-Takoradi Metropolitan Assembly,2011,CONSTRUCTION OF 6 UNIT CLASSROOM BLOCK WITH ANCILLARY FACILITIES AT BRONIKROM,getfund,,1/14/2008,,,,Sekondi-Takoradi Metropolitan Assembly,,2008-01-14,
Sekondi-Takoradi Metropolitan Assembly,2011,CONSTRUCTION OF METRO HEALTH ADMINISTRATION BLOCK SEKONDI PH I,dacf,,10/2/2006,,,,Sekondi-Takoradi Metropolitan Assembly,,2006-10-02,
Sekondi-Takoradi Metropolitan Assembly,2011,CONSTRUCTION OF 1 NO 4 UNIT TEACHERS ACCOMODATION BLOCK ASSESCO J H S,dacf,,1/5/2008,,,,Sekondi-Takoradi Metropolitan Assembly,,2008-01-05,
Sekondi-Takoradi Metropolitan Assembly,2011,RECONSTRUCTION OF TAKORADI MARKET BURNT AREA,dacf,,12/26/2007,,,,Sekondi-Takoradi Metropolitan Assembly,,2007-12-26,
Sekondi-Takoradi Metropolitan Assembly,2011,CONSTRUCTION OF FENCE WALL AT TWIN CITY SPECIAL SCHOOL SEKONDI,getfund,,1/12/2009,,,,Sekondi-Takoradi Metropolitan Assembly,,2009-01-12,
Sekondi-Takoradi Metropolitan Assembly,2011,CONSTRUCTION OF DRAINAGE SYSTEM AT TWIN CITY SPECIAL SCHOOL SEKONDI,getfund,,1/12/2009,,,,Sekondi-Takoradi Metropolitan Assembly,,2009-01-12,
Sekondi-Takoradi Metropolitan Assembly,2011,RENOVATION OF METRO CHIEF EXECUTIVE RESIDENCE,dacf,,6/24/2009,,,,Sekondi-Takoradi Metropolitan Assembly,,2009-06-24,
